source,title,description,author,publishedAt,url,sentimentScore,neg,neu,pos,compound
NBC News,Feinstein is retiring. Here's who else we're waiting to hear from,"California Democratic Sen. Dianne Feinstein ended months of speculation Tuesday, announcing she wouldn't run for re-election.",Ben Kamisar and Bridget Bowman,2023-02-14 20:06:13+00:00,https://www.nbcnews.com/meet-the-press/meetthepressblog/feinstein-retiring-else-waiting-hear-rcna70639,0.0,0.0,1.0,0.0,0.0
NBC News,Biden removes top Capitol administrator after report alleging abuse of power,"President Biden has fired Architect of the Capitol J. Brett Blanton, a White House official told NBC News on Monday, in the wake of an inspector general report.",Frank Thorp V and Haley Talbot and Dareh Gregorian and Sally Bronston,2023-02-13 20:47:51+00:00,https://www.nbcnews.com/politics/congress/biden-removes-architect-capitol-j-brett-blanton-post-rcna70460,-1.0,0.323,0.538,0.138,-0.5267
NBC News,New Jersey state senator says he's leaving GOP to join Democrats,"New Jersey state Sen. Samuel Thompson, 87, said Monday he’s leaving the Republican Party and plans to seek re-election this year as a Democrat.",The Associated Press,2023-02-14 03:25:04+00:00,https://www.nbcnews.com/politics/politics-news/new-jersey-state-senator-says-leaving-gop-join-democrats-rcna70525,1.0,0.0,0.804,0.196,0.296
NBC News,Ron DeSantis to address a powerful police union in Chicago,Florida Gov. Ron DeSantis is expected to make a trip up to Illinois on Monday to speak before local law enforcement.,Natasha Korecki and Henry J. Gomez,2023-02-17 03:11:40+00:00,https://www.nbcnews.com/politics/2024-election/ron-desantis-address-powerful-police-union-chicago-rcna71134,1.0,0.0,0.682,0.318,0.4215
NBC News,"DOJ tells Matt Gaetz that he won’t be charged in sex trafficking probe, his lawyers say",WASHINGTON — The Justice Department is ending its sex trafficking investigation into Rep.,Ryan Nobles and Garrett Haake and Julia Ainsley and Tom Winter and Rebecca Shabad,2023-02-15 18:30:47+00:00,https://www.nbcnews.com/politics/congress/doj-decides-not-charge-rep-matt-gaetz-sex-trafficking-investigation-rcna70839,1.0,0.0,0.863,0.137,0.1511
NBC News,"In a deeply divided Washington, shooting down UFOs is scrambling partisan battle lines",President Joe Biden's decision to shoot down a Chinese spy balloon and other unidentified flying objects has scrambled the typically clear partisan battle lines in Washington.,Alex Seitz-Wald,2023-02-14 21:38:29+00:00,https://www.nbcnews.com/politics/joe-biden/biden-washington-shooting-flying-objects-spy-balloon-partisanship-rcna70092,-1.0,0.224,0.776,0.0,-0.3818
NBC News,Inside the failed negotiations for Biden’s Super Bowl interview on Fox,WASHINGTON — President Joe Biden’s decision to break the recent tradition of sitting for an interview with the news network broadcasting the Super Bowl came after a series of discussions between Fox and White House officials.,Peter Nicholas and Sally Bronston and Carol E. Lee,2023-02-11 22:30:39+00:00,https://www.nbcnews.com/politics/joe-biden/failed-negotiations-bidens-super-bowl-interview-fox-rcna70148,1.0,0.25,0.455,0.295,0.1531
NBC News,How many Chinese spy balloons did we miss and when did they start flying above the U.S.?,The number of confirmed Chinese spy balloon flights over the United States will likely go up as analysts review past sightings of unidentified objects in the sky.,Dan De Luce and Ken Dilanian,2023-02-16 19:51:58+00:00,https://www.nbcnews.com/politics/national-security/how-many-chinese-spy-ballons-flew-over-us-rcna71021,-1.0,0.167,0.833,0.0,-0.1531
NBC News,Justice Department in DC takes over corruption probe of Texas Attorney General Paxton,Justice Department officials in Washington have taken over the corruption investigation into Texas Attorney General Ken Paxton.,The Associated Press,2023-02-17 02:27:18+00:00,https://www.nbcnews.com/politics/justice-department/justice-department-taking-texas-ag-paxton-corruption-probe-rcna71135,1.0,0.0,0.726,0.274,0.5267
NBC News,"The U.S. and Iran are holding indirect talks on a possible prisoner exchange, sources say","The Biden administration is holding indirect discussions with Iran on a possible prisoner exchange to secure release of U.S. citizens, with the help of Qatar and the U.K.",Dan De Luce and Abigail Williams,2023-02-15 11:30:00+00:00,https://www.nbcnews.com/politics/national-security/us-iran-indirect-talks-prisoner-exchange-uk-qatar-rcna70645,-1.0,0.259,0.741,0.0,-0.5423
NBC News,'A serious committee': Lawmakers have high bipartisan hopes for China panel as tensions rise,The House's new select committee on China could be one of the few areas of bipartisan cooperation in a Congress full of partisan bickering.,Scott Wong,2023-02-12 12:00:00+00:00,https://www.nbcnews.com/politics/congress/-serious-committee-lawmakers-high-bipartisan-hopes-china-panel-tension-rcna70109,-1.0,0.29,0.507,0.203,-0.0516
NBC News,U.S. Republicans target transgender youth health care in legislative push,"Republican legislators across the United States have escalated a campaign to ban certain health care for transgender youths, in some cases seeking to charge parents and doctors with child abuse if they provide treatment.",Reuters,2023-02-16 16:08:53+00:00,https://www.nbcnews.com/nbc-out/out-news/us-republicans-target-transgender-youth-health-care-legislative-push-rcna70988,1.0,0.0,0.714,0.286,0.4939
NBC News,Special counsel seeks testimony from Trump lawyer as prosecutors allege evidence of crime,The special counsel investigating Trump’s handling of classified documents is seeking to compel a lawyer for the former president to testify before a grand jury.,Ken Dilanian,2023-02-15 01:29:55+00:00,https://www.nbcnews.com/politics/justice-department/special-counsel-seeks-testimony-trump-lawyer-prosecutors-allege-eviden-rcna70711,-1.0,0.246,0.563,0.19,-0.2023
NBC News,South Carolina GOP divided as Nikki Haley and Tim Scott look to run in 2024,"South Carolina Republicans are keeping an open mind as two of their ""favorite children"" — former Gov. Nikki Haley and Sen. Tim Scott — eye 2024 campaigns.",Allan Smith,2023-02-14 12:30:00+00:00,https://www.nbcnews.com/politics/2024-election/south-carolina-gop-split-nikki-haley-tim-scott-eye-2024-bids-rcna69416,0.0,0.0,1.0,0.0,0.0
NBC News,John Bolton to be briefed on spy balloons this week,John Bolton says he will be briefed on Wednesday following revelations that Chinese surveillance balloons were deployed during Trump's administration.,"Isabelle Schmeler, Rupa Palla",2023-02-13 22:30:52+00:00,https://www.nbcnews.com/meet-the-press/meetthepressblog/john-bolton-briefed-spy-balloons-week-rcna70489,0.0,0.0,1.0,0.0,0.0
NBC News,Eyes on 2024: GOP lawmakers take sides in presidential primary,"Now that there's another GOP presidential hopeful in the race, and a handful of others clearly signaling their intentions, Republican lawmakers are continuing to pick their favorites for their party's nomination.","Ben Kamisar, Bridget Bowman",2023-02-16 15:51:00+00:00,https://www.nbcnews.com/meet-the-press/meetthepressblog/eyes-2024-gop-lawmakers-take-sides-presidential-primary-rcna70959,0.0,0.0,1.0,0.0,0.0
Newsweek,The 'Sleeper Charge' Threatening Donald Trump,"Trump raised millions to fight a ""stolen"" election, but most of the funds went to his PAC, which is legally prohibited from spending money for that reason.",Katherine Fung,2023-02-17 16:38:25+00:00,https://www.newsweek.com/sleeper-charge-threatening-donald-trump-1782069,-1.0,0.405,0.595,0.0,-0.5267
Newsweek,Donald Trump Jr. Says He 'Lived Off' Gas Station Sushi,Trump Jr. said he was cut off from his family when he lived in Colorado after college.,Lauren Giella,2023-02-17 22:13:11+00:00,https://www.newsweek.com/donald-trump-jr-says-lived-off-gas-station-sushi-1782145,0.0,0.0,1.0,0.0,0.0
Newsweek,Donald Trump Indictment Looms as Georgia Bombshell Set to Drop,A report from the special grand jury investigating alleged criminal attempts to overturn 2020 election results will be made public soon.,Ewan Palmer,2023-02-15 14:02:48+00:00,https://www.newsweek.com/trump-georgia-grand-jury-report-indictment-1781410,-1.0,0.381,0.619,0.0,-0.4019
Newsweek,Donald Trump Loses Top Ally to Nikki Haley,"""It's time for a reset and a new chapter in national Republican politics,"" Representative Ralph Norman said in his endorsement of Trump's 2024 opponent.",Katherine Fung,2023-02-15 15:26:09+00:00,https://www.newsweek.com/donald-trump-loses-top-ally-nikki-haley-1781435,-1.0,0.253,0.549,0.198,-0.128
Newsweek,Donald Trump Jr. Shares Russia Theory About U.S. Train Derailments,"A major train derailment in East Palestine, Ohio, earlier this month released toxic chemicals into the air and water.",Darragh Roche,2023-02-17 14:46:18+00:00,https://www.newsweek.com/donald-trump-jr-shares-russia-theory-about-american-train-derailments-1782004,1.0,0.0,0.804,0.196,0.296
Newsweek,Jack Smith Tightens the Screws on Donald Trump,The special counsel is ramping up classified documents probe by seeking further testimony from former president's lawyer.,Ewan Palmer,2023-02-15 10:01:54+00:00,https://www.newsweek.com/trump-classified-documents-jack-smith-lawyer-1781323,-1.0,0.286,0.714,0.0,-0.25
Newsweek,Donald Trump Embraces Voting Measure He Dismissed as Fraudulent,"In a fundraising email, Trump told supporters his campaign would be launching an initiative in states where Democrats had allegedly been ""cheating the system.""",Nick Reynolds,2023-02-13 20:05:38+00:00,https://www.newsweek.com/donald-trump-embraces-voting-mail-measure-he-dismissed-fraudulent-1780920,-1.0,0.314,0.686,0.0,-0.4939
Newsweek,Is Donald Trump to Blame for Ohio Train Derailment?,"The Trump administration rescinded key safety legislation that could have lessened the severity of the accident, according to one insider.",James Bickerton,2023-02-14 15:58:38+00:00,https://www.newsweek.com/donald-trump-blame-ohio-train-derailment-1781163,-1.0,0.286,0.714,0.0,-0.34
Newsweek,Republicans 'Need a Woman' on 2024 Ticket: GOP Rep.,"Former President Donald Trump told Newsweek he wishes Haley ""luck.""",Nick Mordowanec,2023-02-14 21:56:18+00:00,https://www.newsweek.com/republicans-need-woman-2024-ticket-gop-rep-1781275,0.0,0.0,1.0,0.0,0.0
Newsweek,DOJ 'Seriously Considering' Charges Against Donald Trump: Legal Analyst,Barbara McQuade speaks to Newsweek after Trump's former VP Mike Pence was subpoenaed as part of January 6 investigation.,Ewan Palmer,2023-02-13 12:31:38+00:00,https://www.newsweek.com/doj-considering-charges-against-donald-trump-mike-pence-1780795,-1.0,0.336,0.531,0.133,-0.3182
Newsweek,FBI Investigation Into Donald Trump Reaches 'Big Turning Point',Prosecutors are trying to force a Trump lawyer to give additional testimony to a grand jury investigating the classified materials found at Mar-a-Lago.,Ewan Palmer,2023-02-15 16:52:38+00:00,https://www.newsweek.com/trump-lawyer-classified-documents-fbi-1781474,1.0,0.0,0.87,0.13,0.0516
Newsweek,Mary Trump Wonders if Nikki Haley Has 'Back Room Deal' With Donald Trump,"Donald Trump's niece also said that ""there's literally no point to"" Haley's presidential bid if she cannot differentiate herself from the former president.",Thomas Kika,2023-02-18 20:34:38+00:00,https://www.newsweek.com/mary-trump-wonders-if-nikki-haley-has-back-room-deal-donald-trump-1782208,0.0,0.0,1.0,0.0,0.0
Newsweek,Donald Trump's Lawyer Mocked Over Bizarre Document Folder Excuse,"Timothy Parlatore told CNN that Trump was using a folder marked ""Classified Evening Summary"" to block the light from his bedside phone.",Ewan Palmer,2023-02-13 11:20:19+00:00,https://www.newsweek.com/trump-classified-folder-telephone-light-timothy-parlatore-1780765,-1.0,0.387,0.504,0.109,-0.5106
Newsweek,How Joe Biden's Physical Compares to Donald Trump's,President Biden will visit the Walter Reed Medical Center for a routine medical examination on Thursday.,James Bickerton,2023-02-16 16:45:45+00:00,https://www.newsweek.com/how-joe-bidens-physical-compares-donald-trumps-1781809,0.0,0.0,1.0,0.0,0.0
Newsweek,Supreme Court Reconsiders Case to Reinstate Trump,The lawsuit by Utah man Raland Brunson is challenging the 2020 presidential election results and calling for the reinstatement of Donald Trump.,Fatma Khaled,2023-02-17 23:18:11+00:00,https://www.newsweek.com/supreme-court-reconsiders-case-reinstate-trump-1782150,1.0,0.0,0.581,0.419,0.5574
Newsweek,Donald Trump Jr. Says People Confuse Impassioned Speech for Drug Problem,"Trump Jr. said the media covers him differently than it covers Hunter Biden and accused Biden of have ""liberal privilege.""",Lauren Giella,2023-02-14 21:22:47+00:00,https://www.newsweek.com/donald-trump-jr-says-people-confuse-impassioned-speech-drug-problem-1781260,-1.0,0.365,0.635,0.0,-0.5574
Newsweek,Joe Biden Has Handed Donald Trump a Huge Win With Ohio Response,Former President Donald Trump will visit East Palestine next week and has called for those affected to receive help.,Darragh Roche,2023-02-18 16:32:16+00:00,https://www.newsweek.com/joe-biden-has-handed-donald-trump-huge-win-ohio-response-1782185,1.0,0.0,0.596,0.404,0.7269
Newsweek,Marjorie Taylor Greene Recalls Jan 6 Disbelief: 'Those Aren't Our People',"The Georgia congresswoman discussed the Capitol riot during an appearance on Donald Trump Jr.'s ""Triggered"" podcast.",Ewan Palmer,2023-02-17 09:44:17+00:00,https://www.newsweek.com/marjorie-taylor-greene-jan6-antifa-trumpjr-triggered-1781909,0.0,0.0,1.0,0.0,0.0
Newsweek,Donald Trump Says It Would Be 'Inappropriate' to Call DeSantis 'Meatball',Trump has previously denied spending time working on a nickname for the Florida governor who's seen as a potential rival.,Darragh Roche,2023-02-18 10:36:46+00:00,https://www.newsweek.com/donald-trump-says-it-would-inappropriate-call-ron-desantis-meatball-1782161,0.0,0.0,1.0,0.0,0.0
Newsweek,Nikki Haley Highlights Donald Trump's Failings in 2024 Campaign Launch Video,"The former South Carolina governor noted how Republicans have ""lost the popular vote in seven out of the last eight presidential elections.""",Ewan Palmer,2023-02-14 12:36:35+00:00,https://www.newsweek.com/nikki-haley-2024-video-trump-south-carolina-1781073,-1.0,0.262,0.738,0.0,-0.4939
Newsweek,Donald Trump's Attempt to Stop Mike Pence Testifying is Doomed to Fail,"""The smart money says he [Trump] will be unsuccessful here. Executive privilege won't be enough to keep Mike Pence from testifying,"" said former federal prosecutor Joyce Vance.",Ewan Palmer,2023-02-14 09:12:06+00:00,https://www.newsweek.com/trump-executive-privilege-mike-pence-jan6-subpoena-1780979,-1.0,0.623,0.377,0.0,-0.872
Newsweek,Mary Trump Calls Biden's SOTU Speech the 'Best Ever Given by a President',"Donald Trump's niece also accused Republicans of ""disrespect"" after Biden was heckled.",Anders Anglesey,2023-02-12 16:17:17+00:00,https://www.newsweek.com/mary-trump-calls-bidens-sou-speech-best-ever-given-president-1780657,1.0,0.0,0.682,0.318,0.6369
Newsweek,Video of Donald Trump 'Crashing' Wedding to Speak With Bride Goes Viral,The former president has previously appeared at weddings at his properties and has gone as far as to give speeches.,Gerrard Kaonga,2023-02-13 12:18:58+00:00,https://www.newsweek.com/donald-trump-gatecrashing-wedding-speak-bride-viral-video-1780762,0.0,0.0,1.0,0.0,0.0
Newsweek,Donald Trump Could Be Indicted for These 10 Crimes in Georgia,"Parts of a report from a special grand jury on Trump's 2020 elections are set to be made public, but not sections specifying charging recommendations.",Ewan Palmer,2023-02-16 13:23:38+00:00,https://www.newsweek.com/donald-trump-possible-charges-crimes-georgia-1781705,0.0,0.0,1.0,0.0,0.0
Newsweek,Donald Trump Could Lose to Nikki Haley in This Scenario: Dershowitz,"""Look, it's so clear what's going to happen,"" Alan Dershowitz, Trump's former attorney, said on Tuesday. ""The polls are fairly, fairly strong.""",Kaitlin Lewis,2023-02-15 02:43:52+00:00,https://www.newsweek.com/donald-trump-could-lose-nikki-haley-this-scenario-alan-dershowitz-comments-1781295,-1.0,0.252,0.748,0.0,-0.4019
Newsweek,Why Donald Trump Will Be Delighted Nikki Haley Is Running Against Him,"The former president will hope there are more GOP primary candidates as that may take votes away from his potential main rival, Florida Governor Ron DeSantis.",Ewan Palmer,2023-02-16 11:37:51+00:00,https://www.newsweek.com/trump-nikki-haley-gop-primary-2024-desantis-1781650,1.0,0.0,0.769,0.231,0.5106
Newsweek,Donald Trump Rushes To Praise Mike Pence After Special Counsel Subpoena,"The former president described Pence as an ""honorable"" man and said his former vice president was ""very decent.""",Darragh Roche,2023-02-11 09:55:41+00:00,https://www.newsweek.com/donald-trump-rushes-praise-mike-pence-after-special-counsel-subpoena-1780554,1.0,0.0,0.588,0.412,0.743
Newsweek,Donald Trump Jr. Sparks Fury After Calling John Fetterman a 'Vegetable',Fetterman checked himself into a hospital on Wednesday to receive treatment for depression.,Darragh Roche,2023-02-17 11:33:13+00:00,https://www.newsweek.com/donald-trump-jr-fury-john-fetterman-vegetable-senate-1781923,-1.0,0.291,0.709,0.0,-0.5719
Newsweek,Donald Trump Rages at Jack Smith as FBI Investigations Close In,The special counsel has made recent aggressive progress into the January 6 and classified documents probes into the former president.,Ewan Palmer,2023-02-16 09:09:19+00:00,https://www.newsweek.com/trump-special-counsel-jack-smith-fbi-investigations-1781592,-1.0,0.279,0.721,0.0,-0.4767
Newsweek,Mike Pence Drops Strongest Hint Yet About Joining 2024 Race,The former vice president praised Nikki Haley during an event in Iowa while suggesting he may also challenge Donald Trump for the GOP nomination.,Jon Jackson,2023-02-16 18:28:58+00:00,https://www.newsweek.com/mike-pence-drops-strongest-hint-yet-about-joining-2024-presidential-race-1781831,1.0,0.0,0.756,0.244,0.4404
Newsweek,"Donald Trump Has 'Hit the Panic Button,' His Former Lawyer Says","Michael Cohen described Trump's handling of classified documents as ""the true danger to our national security"" as the DOJ investigations heat up.",Andrew Stanton,2023-02-11 22:43:59+00:00,https://www.newsweek.com/donald-trump-has-hit-panic-button-his-former-lawyer-says-1780611,-1.0,0.268,0.732,0.0,-0.5106
Newsweek,MAGA Goes Into Meltdown Over Super Bowl,"Former president Donald Trump said Rihanna's halftime performance was an ""EPIC FAIL"" and ""without question, the single worst Halftime Show"" in Super Bowl history.",Ewan Palmer,2023-02-13 09:43:55+00:00,https://www.newsweek.com/superbowl-rihanna-halftime-show-trump-maga-1780725,1.0,0.0,0.606,0.394,0.5994
Newsweek,Republicans Are on a Crash Course With Trump With No Off-Ramp | Opinion,"Nikki Haley's entrance into the 2024 race this week gives Donald Trump his first, but likely not last, opponent. And she, along with likely candidates Ron DeSantis, Mike Pence, Mike Pompeo, Tim Scott, and the elite donor class within the Republican Party, wan…",Doug Gordon,2023-02-15 16:32:33+00:00,https://www.newsweek.com/republicans-are-crash-course-trump-no-off-ramp-opinion-1781484,-1.0,0.38,0.62,0.0,-0.5994
Newsweek,Ohio Residents Say It's 'Absurd' to Blame Donald Trump for Train Derailment,Transportation Secretary Pete Buttigieg insinuated that the former president's administration had contributed to the incident.,Aleks Phillips,2023-02-16 13:38:15+00:00,https://www.newsweek.com/ohio-east-palestine-residents-absurd-blame-donald-trump-train-derailment-1781696,-1.0,0.211,0.789,0.0,-0.34
Newsweek,Trump's Attorney Finally Gets Win Amid String of Embarrassments,A judge in Wisconsin was scolded by a state judicial oversight panel after a complaint accused her of being hostile to Donald Trump's lawyers.,Katherine Fung,2023-02-13 16:42:30+00:00,https://www.newsweek.com/trumps-attorney-finally-gets-win-amid-string-embarrassments-1780848,1.0,0.216,0.48,0.304,0.2732
Newsweek,Ivanka Trump Accused of Trying to Bring Low-Rise Back: 'Just No',The former senior White House adviser and daughter of Donald caused a stir when she showed off her cowgirl-inspired look on Instagram.,Ryan Smith,2023-02-16 17:19:24+00:00,https://www.newsweek.com/ivanka-trump-accused-trying-bring-low-rise-back-instagram-fashion-1781804,-1.0,0.386,0.614,0.0,-0.5267
Newsweek,Trump Would 'Incriminate Himself' if He Testifies Truthfully: Kirschner,Proud Boys' leaders want to subpoena Trump to testify in the trial in which the group is facing seditious conspiracy charges related to the Capitol riot.,Fatma Khaled,2023-02-18 16:01:34+00:00,https://www.newsweek.com/trump-would-incriminate-himself-if-he-testifies-truthfully-kirschner-1782190,1.0,0.0,0.707,0.293,0.4404
Newsweek,Mike Pence Documents Discovery Could Spell Trouble for Trump: Kirschner,"""Let's not lose sight of the fact that no judge has ever issued a search warrant for Joe Biden's property or for Mike Pence's property,"" Glenn Kirschner said.",Khaleda Rahman,2023-02-12 17:01:24+00:00,https://www.newsweek.com/mike-pence-documents-discovery-trouble-trump-kirschner-1780655,-1.0,0.252,0.748,0.0,-0.4019
Newsweek,Trump Rips on Rihanna's Super Bowl Performance: 'Worst in History',"Trump took to social media to attack Rihanna's Super Bowl halftime show, describing it as an ""EPIC FAIL.""",Andrew Stanton,2023-02-13 03:11:25+00:00,https://www.newsweek.com/trump-rips-rihannas-super-bowl-performance-worst-history-1780704,-1.0,0.293,0.429,0.279,-0.0516
Newsweek,Mike Pence Has 'Sharply Incriminating' Testimony About Trump: Kirschner,"The former president attempted to ""enlist Mike Pence as a co-conspirator in his criminal scheme,"" the former federal prosecutor said.",Jason Lemon,2023-02-11 16:04:05+00:00,https://www.newsweek.com/mike-pence-has-sharply-incriminating-testimony-about-trump-kirschner-1780580,0.0,0.0,1.0,0.0,0.0
Newsweek,Ann Coulter Slams Trump as 'Profoundly Stupid',"The right-wing pundit said she was willing to forgive the former president for anything, except immigration.",Anna Commander,2023-02-18 21:45:07+00:00,https://www.newsweek.com/ann-coulter-slams-trump-profoundly-stupid-1782210,-1.0,0.405,0.595,0.0,-0.5267
Newsweek,How Trump and DeSantis Would Fare in 2024 Match-Ups,"The former president and the Florida governor are the two favorites for the next GOP primaries, leading to possible face-off against Joe Biden.",Ewan Palmer,2023-02-15 12:11:46+00:00,https://www.newsweek.com/trump-desantis-2024-polls-joe-biden-1781365,0.0,0.0,1.0,0.0,0.0
Newsweek,George Soros Praise for Ron DeSantis Rattles Trump Supporters,"Soros said Trump's ""narcissism has turned into a disease,"" and predicted he will lose the 2024 Republican presidential nomination to Governor DeSantis.",James Bickerton,2023-02-17 15:49:40+00:00,https://www.newsweek.com/george-soros-praise-ron-desantis-rattles-trump-supporters-1782064,1.0,0.0,0.48,0.52,0.7579
Newsweek,Trump's Attorney Gears Up for Fight That Could Doom Trump,"The former president's attorney is lawyering up, which may indicate the DOJ is looking for direct evidence to indict Trump on obstruction charges.",Lauren Giella,2023-02-17 16:59:03+00:00,https://www.newsweek.com/trumps-attorney-gears-fight-that-could-doom-trump-1782089,-1.0,0.431,0.569,0.0,-0.6486
Newsweek,Read Georgia Grand Jury Report on Trump Investigation,Parts of the grand jury report investigating 2020 election interference were released as possible criminal indictments loom.,Lauren Giella,2023-02-16 16:15:08+00:00,https://www.newsweek.com/read-georgia-grand-jury-report-trump-investigation-1781771,1.0,0.0,0.667,0.333,0.4588
Newsweek,'Writing on the Wall' for Trump as Fulton County Readies Release of Records,"Last month, Fulton County District Attorney Fani Willis said an indictment of Trump could be ""imminent.""",Lauren Giella,2023-02-13 18:45:02+00:00,https://www.newsweek.com/donald-trump-fulton-county-georgia-readies-release-records-grand-jury-1780902,0.0,0.0,1.0,0.0,0.0
Newsweek,Nikki Haley Unable to Answer How She's Different From Trump in Interview,Haley side stepped Sean Hannity's question on her differences to the former president while trying to highlight why it was important to have new leadership.,Gerrard Kaonga,2023-02-16 09:57:48+00:00,https://www.newsweek.com/nikki-haley-donald-trump-interview-sean-hannity-how-she-different-1781595,0.0,0.0,1.0,0.0,0.0
Newsweek,Republican National Committee Tries To Back Trump Into a Corner,"""Trump won't commit to supporting the Republican nominee, and I won't commit to supporting him,"" former Maryland Governor Larry Hogan said.",Fatma Khaled,2023-02-17 17:35:45+00:00,https://www.newsweek.com/republican-national-committee-tries-back-trump-corner-1782102,0.0,0.0,1.0,0.0,0.0
Newsweek,Trump Special Counsel Gives Him Another Thing to Worry About,"Manhattan DA Alvin Bragg's efforts to investigate Trump is ""a zigzag-like path,"" but he may need to zoom in soon, a former federal prosecutor says.",Katherine Fung,2023-02-15 20:21:23+00:00,https://www.newsweek.com/trump-special-counsel-gives-him-another-thing-worry-about-1781542,-1.0,0.23,0.556,0.214,-0.0516
Newsweek,Two Biggest Takeaways From Trump Grand Jury Report,Fulton County District Attorney Fani Willis could have just what she needs to bring indictments regarding alleged efforts to overturn the 2020 election.,Nick Reynolds,2023-02-16 17:19:03+00:00,https://www.newsweek.com/donald-trump-fulton-county-grand-jury-report-two-biggest-takeaways-1781817,1.0,0.0,0.7,0.3,0.4588
Newsweek,Grand Jury Report Is 'Bad Omen' for Trump: Ex-Prosecutor,"""No widespread fraud took place in the Georgia 2020 presidential election that could result in overturning that election,"" said the special grand jury's report.",Matthew Impelli,2023-02-16 19:31:58+00:00,https://www.newsweek.com/grand-jury-report-bad-omen-donald-trump-ex-prosecutor-andrew-weissmann-1781850,-1.0,0.28,0.48,0.24,-0.128
