source,title,description,author,publishedAt,url,sentimentScore,neg,neu,pos,compound
Fortune,Architect of the Capitol fired after scathing report alleges a series of 'ethical' violations including letting his family use his government car,"An inspector general report released last year found “administrative, ethical and policy violations” by Brett Blanton, a Trump-era appointee.","Lisa Mascaro, Colleen Long, The Associated Press",2023-02-13 20:34:32+00:00,https://fortune.com/2023/02/13/architect-of-the-capitol-fired-biden-car-misuse-family-january-6-riot/,-1.0,0.314,0.538,0.148,-0.5719
Fortune,Trump gets first major 2024 challenger as Nikki Haley declares run for president on Twitter,"The former Trump official said two years ago that she wouldn’t run but now sees a need for ""generational change.""","Meg Kinnard, The Associated Press",2023-02-14 14:53:10+00:00,https://fortune.com/2023/02/14/nikki-haley-is-running-for-president-2024-running-donald-trump-south-carolina-un-ambassador/,1.0,0.0,0.88,0.12,0.128
Fortune,Controversial Trump World Bank pick who questioned climate science is stepping down early,The anti-poverty lender said David Malpass would be leaving by June 30. His five-year term was due to expire in April 2024.,The Associated Press,2023-02-16 11:34:26+00:00,https://fortune.com/2023/02/16/trump-world-bank-president-david-malpass-questioned-climate-science-stepping-down/,-1.0,0.286,0.714,0.0,-0.296
Fortune,"All those spy balloons have had only a 'limited' benefit for China, White House claims","“It was operating during the previous administration, but they did not detect it. We detected it. We tracked it,” said the NSC's John Kirby.","Akayla Gardner, Josh Wingrove, Bloomberg",2023-02-13 21:01:28+00:00,https://fortune.com/2023/02/13/china-spy-balloons-limited-benefit-white-house-national-security-council/,1.0,0.16,0.588,0.252,0.2732
Fortune,'Weak ratings make good journalists do bad things': Fox News panic over Trump's loss doing bad numbers laid bare in court,"Rupert Murdoch himself wrote Fox News CEO that Trump's loss meant they were ""getting creamed by CNN. Guess our viewers don't want to watch it.""","David Bauder, The Associated Press",2023-02-18 17:35:23+00:00,https://fortune.com/2023/02/18/fox-news-dominion-lawsuit-donald-trump-2020-loss-bad-ratings-rupert-murdoch/,-1.0,0.527,0.374,0.099,-0.9118
Fortune,"'May the best woman win,' Nikki Haley says as she calls for rejection of 'identity politics'","One identity Haley rejects is age: ""“America is not past its prime. It’s just that our politicians are past theirs.”","Meg Kinnard, Michelle L. Price, The Associated Press",2023-02-15 21:49:20+00:00,https://fortune.com/2023/02/15/nikki-haley-launches-presidential-campaign-identity-politics-generational-change-best-woman-win/,1.0,0.179,0.41,0.41,0.6705
Fortune,"IRS head nominee commits to not increasing tax audits on those making less than $400,000",President Joe Biden nominated Daniel Werfel to steer the Internal Revenue Service as it receives a massive funding boost.,"Fatima Hussein, The Associated Press",2023-02-15 11:55:20+00:00,https://fortune.com/2023/02/15/irs-commissioner-nominee-daniel-werfel-commits-no-increase-tax-audits-under-400000/,1.0,0.0,0.891,0.109,0.0258
Fortune,Biden to name Fed Vice Chair Lael Brainard as new head of National Economic Council: source,Brainard was on the NEC in the Clinton administration and worked at Treasury during Obama's tenure.,"Christopher Rugaber, Josh Boak, The Associated Press",2023-02-14 17:02:08+00:00,https://fortune.com/2023/02/14/who-is-lael-brainard-national-economic-council-fed-vice-chair-joe-biden-brian-deese/,0.0,0.0,1.0,0.0,0.0
Fortune,A year of high-profile anti-Semitism takes a huge toll on U.S. Jews: 4 in 10 now feel less secure,A hostage taking at a Texas synagogue and Kanye West's anti-Semitic comments added to the anxiety.,The Associated Press,2023-02-13 18:41:22+00:00,https://fortune.com/2023/02/13/antisemitism-worries-rising-u-s-jews-survey-kanye-west-trump-meeting-texas-synagogue-hostages/,1.0,0.0,0.694,0.306,0.5279
Fortune,Social media's reaction to the ballooning UFO carnage shows that the internet doesn't trust the government,"""This story has created a playground for people interested in speculating or stirring the pot for their own reasons.""","David Klepper, The Associated Press",2023-02-14 15:09:09+00:00,https://fortune.com/2023/02/14/ufos-balloons-social-media-conspiracy-theories-distrust-government-internet/,-1.0,0.213,0.787,0.0,-0.4023
Fortune,"Republican regulator rips Lina Khan in 'noisy exit,' accuses 'hipster antitrust' boss of breaking the law by having opinions on Mark Zuckerberg",Khan once wrote that Zuckerberg should never be allowed to make another acquisition. Now we know the strength of internal dissent over that.,Tristan Bove,2023-02-15 21:56:31+00:00,https://fortune.com/2023/02/15/ftc-christine-wilson-commissioner-republican-resigns-lina-khan-disregard-rule-of-law/,-1.0,0.227,0.773,0.0,-0.4767
Fortune,GOP kicks off probe into COVID's origins by sending letter to Dr. Fauci and promising to hold U.S. officials 'that took part in any sort cover-up accountable',"Many scientists, including Fauci, say they still believe the virus most likely emerged in nature and jumped from animals to humans.","Farnoush Amiri, Nomaan Merchant, The Associated Press",2023-02-14 00:06:39+00:00,https://fortune.com/2023/02/13/gop-covid-probe-fauci-wuhan-china-lab-leak-natiure-animals/,1.0,0.0,0.863,0.137,0.4019
Fortune,ChatGPT creator: AI will be a 'force for economic empowerment' and not a job killer—plus make a lot of people rich,"Sam Altman predicts AI will be ""the greatest force for economic empowerment and a lot of people getting rich.""",Christiaan Hetzner,2023-02-14 18:46:39+00:00,https://fortune.com/2023/02/14/chatgpt-sam-altman-force-economic-development-lot-of-people-rich-elon-musk-ai-robots/,1.0,0.0,0.753,0.247,0.5574
Fortune,"Joe Biden says 3 UFOs shot down after Chinese spy balloon were benign, but expresses no regret for destroying them",The president has asked for new rules for dealing with any future unknown aerial objects.,"Zeke Miller, Chris Megerian, The Associated Press",2023-02-16 21:42:28+00:00,https://fortune.com/2023/02/16/joe-biden-ufos-china-spy-balloon-rules/,-1.0,0.362,0.508,0.13,-0.6249
Fortune,The Supreme Court is about to hear case that could change the internet as we know it,"A Supreme Court hearing next week could shine a light on how Congress could clamp down on tech, and the future of free speech online.",Tristan Bove,2023-02-18 11:30:00+00:00,https://fortune.com/2023/02/18/section-230-supreme-court-case-gonzalez-v-google-free-speech-online/,1.0,0.0,0.69,0.31,0.5574
Fox News,Evening Edition: Nikki Haley’s Presidential Run Officially Begins,"Nikki Haley, former United Nations Ambassador and Governor of South Carolina, held her first presidential campaign event in downtown Charleston. She made it official that she will be challenging her old boss, Donald Trump, for the nomination. FOX’s John Sauci…",John Toldi,2023-02-15 23:01:14+00:00,https://radio.foxnews.com/2023/02/15/evening-edition-nikki-haleys-presidential-run-officially-begins/,0.0,0.0,1.0,0.0,0.0
Fox News,"Extra: Hunter Biden’s Laptop, The Steele Dossier, And Media Bias","Weeks before the 2020 presidential election, Twitter and most news outlets suppressed the New York Post’s reporting of suspicious contents found on Hunter Biden’s laptop. At the time, they falsely dismissed it as “Russian misinformation.” Supporters of Presid…",Matthew Pascarella,2023-02-12 23:00:29+00:00,https://radio.foxnews.com/2023/02/12/extra-hunter-bidens-laptop-the-steele-dossier-and-media-bias/,-1.0,0.135,0.865,0.0,-0.1027
Fox News,From Washington: Nikki Haley Makes Her Case For The White House,"With former U.S. Ambassador to the United Nations, Nikki Haley announcing her candidacy for the presidency, she is the first Republican primary challenger to former President Donald Trump. The former South Carolina Governor laid out her case for the White Hou…",Dylan Hunt,2023-02-18 10:00:54+00:00,https://radio.foxnews.com/2023/02/18/from-washington-nikki-haley-makes-her-case-for-the-white-house/,0.0,0.0,1.0,0.0,0.0
Fox News,"Vivek Ramaswamy, conservative challenger of 'woke' ESG business practices, considering White House bid: report","Businessman and author Vivek Ramaswamy is reportedly looking into running for president in 2024, joining a field that currently only features former President Donald Trump.",Ronn Blitzer,2023-02-13 14:04:11+00:00,https://www.foxnews.com/politics/vivek-ramaswamy-conservative-challenger-woke-esg-business-practices-considering-white-house-bid-report,1.0,0.0,0.889,0.111,0.128
Fox News,George Soros predicts 'Democratic landslide' in 2024 if Trump and DeSantis 'slug it out',"George Soros called Florida Gov. Ron DeSantis ""ruthless and ambitious"" and said he hopes former President Donald Trump loses the 2024 GOP presidential nomination.",Chris Pandolfo,2023-02-17 13:04:58+00:00,https://www.foxnews.com/politics/george-soros-predicts-democratic-landslide-2024-trump-desantis-slug-out,0.0,0.0,1.0,0.0,0.0
Fox News,Nikki Haley leaps into 2024 GOP presidential primary at packed campaign rally,"Former South Carolina Gov. Nikki Haley formally kicks off her 2024 Republican presidential campaign, joining former President Donald Trump as the only major GOP contenders in the race","Paul Steinhauser, Thomas Phippen",2023-02-15 16:46:48+00:00,https://www.foxnews.com/politics/nikki-haley-leaps-2024-gop-presidential-primary-campaign-rally,0.0,0.0,1.0,0.0,0.0
Fox News,DeSantis slightly edges Trump as preferred leader of Republican Party: Poll,"Florida Gov. Ron DeSantis slightly edges out former President Donald Trump as the preferred leader of the GOP, according to Republicans questioned in a new national poll.","Paul Steinhauser, Andrew Murray",2023-02-15 14:03:51+00:00,https://www.foxnews.com/politics/desantis-slightly-edges-trump-preferred-leader-republican-party-poll,1.0,0.0,0.748,0.252,0.4019
Fox News,Comedians react to Trump’s alleged new nickname for DeSantis: ‘So dumb and accurate’,"Comedians Stephen Colbert and Jimmy Kimmel were delighted by reports former President Donald Trump has coined a new, food-related nickname for Florida Gov. Ron DeSantis.",Jeffrey Clark,2023-02-15 14:30:55+00:00,https://www.foxnews.com/media/comedians-react-trumps-alleged-new-nickname-desantis-so-dumb-accurate,-1.0,0.26,0.58,0.16,-0.3384
Fox News,"Trump, Biden, turn up the volume on DeSantis as Florida governor’s 2024 stature rises","Republican Gov. Ron DeSantis of Florida is increasingly taking income fire from possible rivals in the 2024 White House race, including President Biden and Donald Trump",Paul Steinhauser,2023-02-12 11:00:23+00:00,https://www.foxnews.com/politics/trump-biden-turn-up-volume-desantis-florida-governors-2024-stature-rises,0.0,0.0,1.0,0.0,0.0
Fox News,"Vivek Ramaswamy, conservative challenger of 'woke' ESG business practices, considering White House bid","Businessman and author Vivek Ramaswamy is reportedly looking into running for president in 2024, joining a field that currently only features former President Donald Trump.",Ronn Blitzer,2023-02-13 14:04:11+00:00,https://www.foxnews.com/politics/vivek-ramaswamy-conservative-challenger-woke-esg-business-practices-considering-white-house-bid,1.0,0.0,0.88,0.12,0.128
Fox News,"Trump edges DeSantis in Republican primary matchup, Biden remains largely unpopular with voters: Poll","A new poll shows former President Donald Trump edging Florida Gov. Ron DeSantis in a hypothetical GOP presidential primary, while President Biden's approval rating remains underwater.",Brandon Gillespie,2023-02-16 17:07:07+00:00,https://www.foxnews.com/politics/trump-edges-desantis-republican-primary-matchup-biden-unpopular-voters-poll,0.0,0.0,1.0,0.0,0.0
Fox News,White House hits Trump admin for failing to find China's spy craft program: 'They did not detect it',"President Biden's administration says China's surveillance balloon program was operating during former President Donald Trump's administration, but ""they did not detect it.""",Anders Hagstrom,2023-02-13 19:49:10+00:00,https://www.foxnews.com/politics/white-house-hits-trump-admin-failing-detect-chinas-spy-craft-program-they-did-not-detect-it,-1.0,0.216,0.784,0.0,-0.5106
Fox News,Bill Maher urges DeSantis 'wait' 'til Trump is 'dead... politically' to run for president,"HBO host Bill Maher suggested to Florida Gov. Ron DeSantis that he sit out the 2024 election cycle to avoid having a ""bloody"" battle with former President Donald Trump.",Joseph Wulfsohn,2023-02-11 05:07:14+00:00,https://www.foxnews.com/media/bill-maher-urges-desantis-wait-til-trump-dead-politically-run-president,-1.0,0.301,0.699,0.0,-0.6486
Fox News,"Trump team turns over laptop, additional classified documents months after infamous Mar-a-Lago raid",Former President Donald Trump's legal team has handed over additional materials with classified markings to the Justice Department including a former aide's laptop.,Lawrence Richard,2023-02-11 06:33:51+00:00,https://www.foxnews.com/politics/trump-team-laptop-additional-classified-documents-infamous-mar-a-lago-raid,0.0,0.0,1.0,0.0,0.0
Fox News,Ohio train derailment: JD Vance on trip to East Palestine calls on Biden to 'stop blaming Donald Trump',"Sen. JD Vance, R-Ohio, told President Biden to stop blaming Donald Trump for the East Palestine derailment and also challenged EPA administrator Michael Regan to drink the tap water.","Danielle Wallace, Lucas Tomlinson",2023-02-16 18:09:18+00:00,https://www.foxnews.com/politics/ohio-train-derailment-jd-vance-trip-east-palestine-calls-biden-stop-blaming-donald-trump,-1.0,0.31,0.69,0.0,-0.6597
Fox News,"Trump's in, Haley's getting in – How about DeSantis? Pence? Others? How large a GOP 2024 field will we see?","Former President Donald Trump is in the 2024 GOP White House race, and Nikki Haley's expected to announce her candidacy on Wednesday. But how large will the Republican field get?",Paul Steinhauser,2023-02-13 22:55:26+00:00,https://www.foxnews.com/politics/trump-haley-desantis-pence-others-how-large-gop-2024-field-will-see,0.0,0.0,1.0,0.0,0.0
Fox News,"Trump tops DeSantis in fresh 2024 GOP presidential primary poll, other potential candidates in single digits",Former President Donald Trump leads a field of actual and potential Republican presidential contenders in a new national poll looking at the growing but still hypothetical 2024 GOP race,"Paul Steinhauser, Andrew Murray",2023-02-14 21:28:10+00:00,https://www.foxnews.com/politics/trump-tops-desantis-fresh-2024-gop-presidential-primary-poll-potential-candidates-single-digits,1.0,0.0,0.663,0.337,0.6808
Fox News,Haley's presidential announcement may open the flood gates in the 2024 GOP nomination race,"Former President Donald Trump is the only major Republican to launch a White House campaign, but Nikki Haley’s entry into the race could open the flood gates for other GOP contenders",Paul Steinhauser,2023-02-12 10:00:35+00:00,https://www.foxnews.com/politics/haleys-presidential-announcement-may-open-flood-gates-2024-gop-nomination-race,0.0,0.0,1.0,0.0,0.0
Fox News,MONEY TALKS: Rumored presidential hopefuls with the most cash in the bank,"Former President Donald Trump remains the only announced GOP candidate in the race for the White House, though Nikki Haley is expected to formally launch her campaign next week.",Sophia Slacik,2023-02-11 22:00:28+00:00,https://www.foxnews.com/politics/money-talks-rumored-presidential-hopefuls-most-cash-bank,0.0,0.0,1.0,0.0,0.0
Fox News,"Parts of Trump Georgia grand jury report are released, suggesting possible witness perjury","A special grand jury in Fulton County, Georgia, is recommending that prosecutors pursue criminal charges against witnesses accused of committing perjury during their investigation into Donald Trump's actions during the 2020 presidential election.",Chris Pandolfo,2023-02-16 16:44:42+00:00,https://www.foxnews.com/politics/parts-trump-georgia-grand-jury-report-released-suggesting-possible-witness-perjury,1.0,0.195,0.604,0.201,0.0258
Fox News,"Trump will 'alienate' much of his MAGA base if he attacks Ron DeSantis, says Marc Thiessen",Washington Post columnist Marc Thiessen says former President Trump’s attacks on Florida Gov. Ron DeSantis could lose him support in 2024.,Fox News Staff,2023-02-16 21:00:01+00:00,https://www.foxnews.com/media/trump-alienate-maga-base-attacks-ron-desantis-marc-thiessen,-1.0,0.225,0.775,0.0,-0.4404
Fox News,Ron Klain tells Biden doubters they 'better have a d--n good answer' for who can beat Trump,"Ron Klain, who until recently served as White House chief of staff, challenged those who do not think President Biden should run in 2024 to find a stronger candidate.",Ronn Blitzer,2023-02-14 15:04:57+00:00,https://www.foxnews.com/politics/ron-klain-tells-biden-doubters-they-better-have-damn-good-answer-who-can-beat-trump,1.0,0.143,0.497,0.36,0.5423
Fox News,Ron DeSantis compared to murderous warlord in scathing column: 'Genghis Khan of social issues',"A Vanity Fair columnist likened Florida Gov. Ron DeSantis to one of history's most infamous mass murderers, the founder of the Mongolian Empire, Genghis Khan.",Jeffrey Clark,2023-02-17 11:48:59+00:00,https://www.foxnews.com/media/ron-desantis-compared-murderous-warlord-scathing-column-genghis-khan-social-issues,-1.0,0.296,0.704,0.0,-0.6369
Fox News,Nikki Haley endorsed by top Trump ally Ralph Norman who says GOP needs 'new leadership',Top Trump ally Freedom Caucus member Rep. Ralph Norman is endorsing Nikki Haley for president.,Kelly Laco,2023-02-15 11:00:33+00:00,https://www.foxnews.com/politics/nikki-haley-endorsed-top-trump-ally-ralph-norman-says-gop-needs-new-leadership,1.0,0.0,0.743,0.257,0.4215
Fox News,DNC mocks Nikki Haley's presidential campaign announcement: 'Everyone get your popcorn',"The Democratic National Committee slammed Nikki Haley after launching an official 2024 presidential campaign, suggesting GOP tension as she takes on Trump for the nomination.",Aubrie Spady,2023-02-14 16:12:21+00:00,https://www.foxnews.com/politics/dnc-mocks-nikki-haleys-presidential-campaign-announcement-everyone-get-your-popcorn,-1.0,0.25,0.75,0.0,-0.4588
Fox News,Rep. Nancy Mace slams Mary Trump for 'racist AF tweet' about Nikki Haley,"Rep. Nancy Mace on Wednesday lambasted former President Trump's niece, Mary Trump, for what she described as a racist tweet about 2024 presidential candidate Nikki Haley.",Aaron Kliegman,2023-02-15 20:02:17+00:00,https://www.foxnews.com/politics/nancy-mace-slams-mary-trump-racist-tweet-nikki-haley,-1.0,0.286,0.714,0.0,-0.6124
Fox News,Georgia Rep. Marjorie Taylor Greene calls Nikki Haley ‘Bush in heels’ as former governor enters 2024 race,"Rep. Marjorie Taylor Green, R-Ga., on Monday slammed 2024 presidential candidate Nikki Haley as ""Bush in heels"" for her more traditional Republican leanings.",Bradford Betz,2023-02-16 02:32:55+00:00,https://www.foxnews.com/politics/georgia-marjorie-taylor-greene-calls-nikki-haley-bush-heels-former-governor-2024,0.0,0.0,1.0,0.0,0.0
Fox News,Pence hints at 2024 presidential bid: Nikki Haley 'may have more company soon',"Former Vice President Mike Pence told reporters in Iowa on Thursday that former U.S. ambassador to the U.N. Nikki Haley ""may have more company soon"" in the 2024 presidential race.",Julia Musto,2023-02-17 15:46:57+00:00,https://www.foxnews.com/politics/pence-hints-2024-presidential-bid-nikki-haley-may-have-more-company,0.0,0.0,1.0,0.0,0.0
Fox News,RNC weighs requiring loyalty pledge from every 2024 GOP candidate to support eventual Republican nominee,The Republican National Committee is considering requiring all Republican presidential hopefuls to pledge their support for the party’s eventual nominee before making the debate stage,Paul Steinhauser,2023-02-18 13:00:54+00:00,https://www.foxnews.com/politics/rnc-weighs-requiring-loyalty-pledge-every-2024-gop-candidate-support-eventual-republican-nominee,1.0,0.0,0.64,0.36,0.7351
Fox News,"Trump used classified folder as bedroom lamp shade 'so he could sleep at night,' attorney says",Trump's attorney admitted to the former president using an empty manilla folder labeled 'classified' as a lamp shade next to his bed.,Aubrie Spady,2023-02-13 19:15:55+00:00,https://www.foxnews.com/politics/trump-used-classified-folder-bedroom-lamp-shade-could-sleep-night-attorney-says,0.0,0.0,1.0,0.0,0.0
Fox News,"Georgia judge OKs only partial release of Trump special grand jury report, citing 'very limited due process'",Part of the Fulton County special grand jury's report into whether Trump or allies broke state law in pushing to overturn the 2020 election results to be released.,Danielle Wallace,2023-02-13 20:04:21+00:00,https://www.foxnews.com/us/georgia-judge-oks-only-partial-release-trump-special-grand-jury-report-citing-very-limited-due-process,1.0,0.102,0.591,0.306,0.5859
Fox News,Mike Pence's former adviser says DOJ subpoena acts as 'security blanket' for ex-VP's possible 2024 run,"A former aide to Mike Pence said the Justice Department's subpoena acts as a ""security blanket"" ahead of 2024, working as ""political top cover"" if he wants to testify against Trump.",Danielle Wallace,2023-02-12 13:15:20+00:00,https://www.foxnews.com/politics/mike-pences-former-adviser-doj-subpoena-acts-security-blanket-ex-vps-possible-2024-run,1.0,0.0,0.844,0.156,0.34
Fox News,Liberal Wisconsin Supreme Court justice defiant despite judicial rebuke over Trump racism accusation,Wisconsin Supreme Court Justice Jill Karofsky is raising issues with a judicial oversight commission's warning for her to conduct herself in a more neutral manner.,Timothy Nerozzi,2023-02-11 16:33:37+00:00,https://www.foxnews.com/politics/liberal-wisconsin-supreme-court-justice-defiant-judicial-rebuke-trump-racism-accusation,-1.0,0.364,0.318,0.318,-0.0
Fox News,Nikki Haley's 2024 presidential bid receives mixed reactions,"Nikki Haley's officially entered the 2024 presidential race, receiving mixed reactions from individuals across the political spectrum.",Aubrie Spady,2023-02-14 19:56:15+00:00,https://www.foxnews.com/politics/nikki-haleys-2024-presidential-bid-receives-mixed-reactions,0.0,0.0,1.0,0.0,0.0
Fox News,July trial set in Jan. 6 case for Michigan ex-candidate for governor,A July trial has been set in the Jan. 6 case against a Michigan ex-candidate for governor. The former candidate is being charged with misdemeanors for his presence at the Jan. 6 riot.,Associated Press,2023-02-15 21:46:53+00:00,https://www.foxnews.com/politics/july-trial-set-jan-6-case-michigan-ex-candidate-governor,0.0,0.0,1.0,0.0,0.0
Fox News,DeSantis laughs off question about his 2024 presidential plans: 'Wouldn't you like to know',Florida Gov. Ron DeSantis offered a blunt response Tuesday when he was asked whether he would be running for president in 2024.,Kyle Morris,2023-02-14 18:27:27+00:00,https://www.foxnews.com/politics/desantis-laughs-question-2024-presidential-plans-wouldnt-you-like-know,1.0,0.171,0.569,0.26,0.2709
Fox News,Pence rips 'two-tiered justice system' as he fights Biden DOJ subpoena,"Former Vice President Mike Pence ripped what he called the ""two-tiered justice system"" in the U.S., arguing that Republicans and Democrats are being held to different standards.",Brandon Gillespie,2023-02-16 21:04:25+00:00,https://www.foxnews.com/politics/pence-rips-two-tiered-justice-system-fights-biden-doj-subpoena,1.0,0.206,0.534,0.26,0.1779
Fox News,Biden and Trump converge - Why left and right sound similar on Social Security,"While conservatives believe President Biden is hijacking the MAGA agenda, the reality is that there’s a convergence between right and left on some issues.",Howard Kurtz,2023-02-14 08:05:36+00:00,https://www.foxnews.com/shows/media-buzz/biden-trump-converge-left-right-sound-similar-social-security,1.0,0.0,0.789,0.211,0.34
Fox News,"Haley slams old candidates, but faces tough challenge as ex-Trump official","On paper, Nikki Haley should be a formidable contender for the presidency. However, she may be running for the nomination of a Republican Party of the past.",Howard Kurtz,2023-02-16 08:09:40+00:00,https://www.foxnews.com/shows/media-buzz/haley-slams-old-candidates-faces-tough-challenge-trump-official,-1.0,0.153,0.714,0.133,-0.0516
Fox News,Ron DeSantis and his family kick off Florida state fair in Tampa: Photos,"Republican Florida Gov. Ron DeSantis kicked off the state fair with his family, enjoying rides, games and snacks with his wife, youngest daughter and son.",Brandon Gillespie,2023-02-11 18:46:19+00:00,https://www.foxnews.com/politics/ron-desantis-family-kick-off-florida-state-fair-tampa-photos,1.0,0.0,0.777,0.223,0.3182
Fox News,"As Haley launches her 2024 campaign, a potential GOP primary collision with Tim Scott awaits","As former South Carolina Gov. Nikki Haley jumps into the 2024 Republican presidential race, she faces a potential home state obstacle in Sen. Tim Scott",Paul Steinhauser,2023-02-15 08:00:03+00:00,https://www.foxnews.com/politics/as-haley-launches-2024-campaign-potential-gop-primary-collision-tim-scott-awaits,-1.0,0.181,0.725,0.094,-0.296
Fox News,Mike Pence to fight DOJ special counsel subpoena on Trump's efforts to overturn 2020 election results,Former Vice President Mike Pence is expected to challenge DOJ Special Counsel Jack Smith’s subpoena for testimony on Trump’s efforts to overturn Biden’s 2020 win.,"Danielle Wallace, David Spunt, Jake Gibson",2023-02-14 14:44:58+00:00,https://www.foxnews.com/politics/mike-pence-fight-doj-special-counsel-subpoena-trumps-efforts-overturn-2020-election-results,1.0,0.16,0.675,0.166,0.0258
