source,title,description,author,publishedAt,url,sentimentScore,neg,neu,pos,compound
ABC News,FBI searches Mike Pence's Indiana home in documents probe,The FBI is conducting a consensual search of former Vice President Mike Pence's home in Indiana Friday.,"Katherine Faulders, Luke Barr",2023-02-10 16:40:50+00:00,https://abcnews.go.com/Politics/fbi-searches-former-vice-president-mike-pences-indiana/story?id=97031584,0.0,0.0,1.0,0.0,0.0
ABC News,Pence group to run ads in Iowa against school trans policies,Former Vice President Mike Pence is stepping up his outreach in Iowa ahead of a possible 2024 presidential campaign,THOMAS BEAUMONT Associated Press,2023-02-09 15:39:23+00:00,https://abcnews.go.com/Politics/wireStory/pence-group-run-ads-iowa-school-trans-policies-97005469,0.0,0.0,1.0,0.0,0.0
ABC News,AP source: FBI is searching Indiana home of former Vice President Mike Pence as part of classified records probe,AP source: FBI is searching Indiana home of former Vice President Mike Pence as part of classified records probe,The Associated Press,2023-02-10 16:38:29+00:00,https://abcnews.go.com/Politics/wireStory/ap-source-fbi-searching-indiana-home-former-vice-97033350,0.0,0.0,1.0,0.0,0.0
ABC News,AP source: Pence subpoenaed by special counsel probing Trump,Former Vice President Mike Pence has been subpoenaed by the special counsel overseeing investigations into efforts by former President Donald Trump and his allies to overturn the results of the 2020 election,STEVE PEOPLES and ERIC TUCKER Associated Press,2023-02-10 01:24:06+00:00,https://abcnews.go.com/Politics/wireStory/ap-source-pence-subpoenaed-special-counsel-probing-trump-97021696,1.0,0.0,0.722,0.278,0.4019
ABC News,Pence subpoena could set up fight over executive privilege,The subpoena to former Vice President Mike Pence is a milestone moment in a Justice Department special counsel investigation,ERIC TUCKER and JILL COLVIN Associated Press,2023-02-11 05:39:21+00:00,https://abcnews.go.com/Politics/wireStory/pence-subpoena-set-fight-executive-privilege-97051371,-1.0,0.257,0.495,0.248,-0.0258
ABC News,FBI searching Pence home as part of classified docs probe,The FBI is searching former Vice President Mike Pence’s Indiana home as part of a classified records probe,JILL COLVIN and ERIC TUCKER Associated Press,2023-02-10 17:09:07+00:00,https://abcnews.go.com/Politics/wireStory/fbi-searching-pence-home-part-classified-docs-probe-97034643,0.0,0.0,1.0,0.0,0.0
ABC News,"How they compare: Trump, Biden, Pence classified documents","There are plenty of similarities — but also a major difference — among the classified-records situations of President Joe Biden, former President Donald Trump and Trump's vice president, Mike Pence",MEG KINNARD Associated Press,2023-02-10 21:09:25+00:00,https://abcnews.go.com/Politics/wireStory/compare-trump-biden-pence-classified-documents-97043010,0.0,0.0,1.0,0.0,0.0
ABC News,AP source: Trump team turns over items marked as classified,Lawyers for former President Donald Trump have in recent months turned over to federal investigators additional documents with classified markings as well as a laptop belonging to a Trump aide,ERIC TUCKER Associated Press,2023-02-11 01:09:28+00:00,https://abcnews.go.com/Politics/wireStory/ap-source-trump-team-turns-items-marked-classified-97047948,0.0,0.0,1.0,0.0,0.0
ABC News,US officials offer Congress briefing on Trump documents,The Biden administration has offered to brief congressional leaders on its investigation into the classified documents found at former President Donald Trump’s Florida residence,"NOMAAN MERCHANT, MICHAEL BALSAMO, and ERIC TUCKER Associated Press",2023-02-05 19:09:17+00:00,https://abcnews.go.com/Politics/wireStory/us-officials-offer-congress-briefing-trump-documents-96906618,0.0,0.0,1.0,0.0,0.0
ABC News,Conservative groups look beyond Trump for 2024 GOP nominee,Two major conservative groups have signaled they are open to supporting someone other than Donald Trump in the 2024 race for the White House,MICHELLE L. PRICE Associated Press,2023-02-07 20:54:32+00:00,https://abcnews.go.com/Politics/wireStory/conservative-groups-trump-2024-gop-nominee-96958905,0.0,0.0,1.0,0.0,0.0
ABC News,Election skeptics slow to get sweeping changes in GOP states,Republicans in some heavily conservative states won their campaigns for secretary of state last year after claiming they'd make major changes aimed at keeping fraud out of elections,"TOM DAVIES, CHRISTINA A. CASSIDY and MEAD GRUVER Associated Press",2023-02-05 12:54:02+00:00,https://abcnews.go.com/Politics/wireStory/election-skeptics-slow-sweeping-gop-states-96902579,-1.0,0.167,0.833,0.0,-0.1027
ABC News,Rioter who menaced officer with Confederate flag gets prison,A Delaware man who threatened a Black police officer with a pole attached to a Confederate battle flag as he stormed the U.S. Capitol has been sentenced to three years in prison,MICHAEL KUNZELMAN Associated Press,2023-02-09 20:39:08+00:00,https://abcnews.go.com/Politics/wireStory/rioter-menaced-officer-confederate-flag-gets-prison-97013816,-1.0,0.545,0.455,0.0,-0.7184
ABC News,"Archives wanted Boston Biden docs, not believed classified","As the National Archives became aware of classified documents in President Joe Biden’s old office at a Washington think tank, Archives officials were also interested in papers that had been shipped to a law office in Boston by the president’s personal ...",COLLEEN LONG and SEUNG MIN KIM The Associated Press,2023-02-10 23:54:40+00:00,https://abcnews.go.com/Politics/wireStory/archives-wanted-boston-biden-docs-believed-classified-97047129,0.0,0.0,1.0,0.0,0.0
ABC News,Schools become flashpoint for Republicans eyeing White House,Former President Donald Trump has called for parents to elect and fire school principals,MICHELLE L. PRICE Associated Press,2023-02-11 05:54:26+00:00,https://abcnews.go.com/Politics/wireStory/schools-become-flashpoint-republicans-eyeing-white-house-97051283,0.0,0.0,1.0,0.0,0.0
ABC News,Mike Pence subpoenaed by special counsel overseeing Trump probes: Sources,Mike Pence subpoenaed by special counsel overseeing Trump probes: Sourcesgo.com,Katherine Faulders,2023-02-09 23:03:05+00:00,https://abcnews.go.com/US/mike-pence-subpoenaed-special-counsel-overseeing-trump-probes/story?id=97018886,1.0,0.0,0.748,0.252,0.4019
ABC News,"Trump team turns over item marked classified to DOJ, sources say","Trump team turns over item marked classified to DOJ, sources saygo.com",Katherine Faulders,2023-02-10 22:17:00+00:00,https://abcnews.go.com/US/trump-team-turns-item-marked-classified-doj-sources/story?id=97038100,0.0,0.0,1.0,0.0,0.0
Al Jazeera English,Ex-vice president Pence subpoenaed in special counsel probe: AP,An anonymous source tells Associated Press that Pence has been subpoenaed in ongoing investigations into Donald Trump.,Al Jazeera,2023-02-10 01:14:52+00:00,https://www.aljazeera.com/news/2023/2/10/ex-vice-president-pence-subpoenaed-in-special-counsel-probe-ap,1.0,0.0,0.722,0.278,0.4019
Al Jazeera English,FBI searches former US VP Pence’s home for classified documents,The raid comes several weeks after Pence and his legal team turned over classified documents to the FBI.,Al Jazeera,2023-02-10 18:56:21+00:00,https://www.aljazeera.com/news/2023/2/10/fbi-searches-former-us-vp-pences-home-for-classified-files,0.0,0.0,1.0,0.0,0.0
Associated Press,Subpoena could set up fight over privilege...,"Subpoena could set up fight over privilege...

 
 
 
 (First column, 8th story, link)

 

 

 
 Related stories:Could Pence turn on The Don? How Ford finally broke with Nixon...
Ex-President's Jan. 6 Immunity Claims Leave DOJ Torn...
Bickering bogs down…",Eric Tucker,2023-02-11 17:46:37+00:00,https://apnews.com/article/politics-michael-pence-disaster-planning-and-response-district-of-columbia-donald-trump-58ce3d93baf0c4e1a9567c4a563b658f,-1.0,0.321,0.37,0.309,-0.0258
Associated Press,TRUMP TURNS OVER MORE 'CLASSIFIED',"WASHINGTON (AP) — Lawyers for former President Donald Trump have in recent months turned over to federal investigators additional documents with classified markings as well as a laptop belonging to a Trump aide, a person familiar with the situation said Frida…",Eric Tucker,2023-02-11 01:49:44+00:00,https://apnews.com/article/politics-united-states-government-indiana-donald-trump-laptops-91b5b16807b533b3ff27e9303aef38ae,0.0,0.0,1.0,0.0,0.0
Associated Press,AP source: Pence subpoenaed by special counsel probing Trump,Former Vice President Mike Pence has been subpoenaed by the special counsel overseeing investigations into efforts by former President Donald Trump and his allies to overturn the results of the 2020 election. That's according to a person with direct knowledge…,By STEVE PEOPLES and ERIC TUCKER - Associated Press,2023-02-10 01:16:00+00:00,https://apnews.com/866034edd3ce3dfbc722b31a3d0e465f,1.0,0.0,0.722,0.278,0.4019
Associated Press,New classified document found in FBI search of Pence home,The FBI has discovered an additional document with classified markings at former Vice President Mike Pence’s Indiana home. The FBI search on Friday followed the discovery by his lawyers last month of sensitive government documents there. Pence adviser Devin O…,By JILL COLVIN and ERIC TUCKER - Associated Press,2023-02-10 20:20:58+00:00,https://apnews.com/7b3bfba7cdd8d9d8fd828045ab3208e6,0.0,0.0,1.0,0.0,0.0
Associated Press,Conservative groups look beyond Trump for 2024 GOP nominee,Two major conservative groups have signaled they are open to supporting someone other than Donald Trump in the 2024 race for the White House. Club for Growth President David McIntosh says his group has invited a half dozen potential Republican…,By MICHELLE L. PRICE - Associated Press,2023-02-07 20:41:38+00:00,https://apnews.com/200055deeb8f91d9bbbb16882110332d,0.0,0.0,1.0,0.0,0.0
Associated Press,"US officials offer Congress briefing on Trump, Biden papers",The Biden administration has offered to brief congressional leaders on its investigation into the classified documents found in the private possession of President Joe Biden and former President Donald Trump. That's according to people familiar with the matte…,"By NOMAAN MERCHANT, MICHAEL BALSAMO, and ERIC TUCKER - Associated Press",2023-02-05 21:27:00+00:00,https://apnews.com/d6ce5c8f83a3cec3307f0f9f8311b8d7,0.0,0.0,1.0,0.0,0.0
Associated Press,Schools become flashpoint for Republicans eyeing White House,"Former President Donald Trump has called for parents to elect and fire school principals. Florida Gov. Ron DeSantis has banned instruction on sexual orientation and gender identity in kindergarten through third grade. And Nikki Haley, the former United Nation…",By MICHELLE L. PRICE - Associated Press,2023-02-11 05:30:19+00:00,https://apnews.com/c65049b0c64206996dd1bea4cee65b81,0.0,0.0,1.0,0.0,0.0
BBC News,Mike Pence summoned to testify in criminal probe of Trump,The subpoena is reportedly linked to Mr Trump's bid to overturn his defeat in the 2020 election.,https://www.facebook.com/bbcnews,2023-02-10 03:49:58+00:00,https://www.bbc.co.uk/news/world-us-canada-64591939,-1.0,0.362,0.638,0.0,-0.5267
BBC News,Federal agents search Mike Pence's home - reports,People familiar with the matter tell US media the search is consensual.,https://www.facebook.com/bbcnews,2023-02-10 17:06:59+00:00,https://www.bbc.co.uk/news/world-us-canada-64499785,0.0,0.0,1.0,0.0,0.0
Bloomberg,FBI Agents Search Pence’s Home For Classified Documents,"FBI agents searched the Indiana home of Mike Pence on Friday for classified documents the former vice president identified last month, according to a person familiar with the matter.","Chris Strohm, Mark Niquette",2023-02-10 16:43:59+00:00,https://www.bloomberg.com/news/articles/2023-02-10/fbi-searches-private-home-of-pence-for-classified-documents,0.0,0.0,1.0,0.0,0.0
Bloomberg,"Pence, Ex-National Security Advisor Subpoenaed by Trump Special Counsel",Former Vice President Mike Pence and former National Security Advisor Robert O’Brien have been subpoenaed in the special counsel investigations of Donald Trump and his allies.,Zoe Tillman,2023-02-10 00:00:19+00:00,https://www.bloomberg.com/news/articles/2023-02-09/trump-s-national-security-advisor-robert-o-brien-supoenaed,1.0,0.0,0.541,0.459,0.6249
Bloomberg,Is DeSantis Running for President? Latest News,"Governor Ron DeSantis is actively preparing a run for president in 2024, even as he delays a formal announcement to keep Republican voters’ attention on his aggressively conservative record in Florida, according to people familiar with the plans.",Nancy Cook,2023-02-10 22:48:43+00:00,https://www.bloomberg.com/news/articles/2023-02-10/desantis-preps-2024-bid-behind-scenes-while-waiting-to-declare,0.0,0.0,1.0,0.0,0.0
Breitbart News,FBI Search Mike Pence's Indiana Home for Classified Documents,"The Federal Bureau of Investigation (FBI) searched the Indiana home of former Vice President Mike Pence to search for more classified documents on Friday, according to multiple reports.","Jacob Bliss, Jacob Bliss",2023-02-10 18:39:55+00:00,https://www.breitbart.com/politics/2023/02/10/fbi-search-mike-pences-indiana-home-classified-documents/,0.0,0.0,1.0,0.0,0.0
Breitbart News,FBI Finds Another Classified Document During Search of Mike Pence’s Home,"The FBI found another classified document on Friday during a search of former Vice President Mike Pence’s Indiana home, Pence’s spokesman announced.","Jordan Dixon-Hamilton, Jordan Dixon-Hamilton",2023-02-10 23:34:27+00:00,https://www.breitbart.com/politics/2023/02/10/fbi-finds-another-classified-document-during-search-of-mike-pences-home/,0.0,0.0,1.0,0.0,0.0
Breitbart News,Poll: Donald Trump Double Digits Ahead of Potential GOP Challengers,"Former President Donald Trump is ahead of his potential 2024 Republican challengers by double digits, a Tuesday Morning Consult survey found.","Hannah Bleau, Hannah Bleau",2023-02-08 21:07:55+00:00,https://www.breitbart.com/politics/2023/02/08/poll-donald-trump-double-digits-ahead-of-potential-gop-challengers/,1.0,0.0,0.851,0.149,0.1027
Breitbart News,Poll: Trump Boasts Highest Favorability in Hypothetical 2024 Republican Field,"Former President Donald Trump boasts the highest favorability in a hypothetical 2024 Republican presidential primary, a Morning Consult survey released this week found.","Hannah Bleau, Hannah Bleau",2023-02-10 19:07:53+00:00,https://www.breitbart.com/2024-election/2023/02/10/poll-trump-boasts-highest-favorability-hypothetical-2024-republican-field/,0.0,0.0,1.0,0.0,0.0
Breitbart News,Poll: Trump Takes Lead over Biden on Eve of State of the Union Address,"Former President Donald Trump, a Republican, has taken a lead over current President Joe Biden, a Democrat, on the eve of the latter’s planned State of the Union address this week in Congress, a poll shows.","Matthew Boyle, Matthew Boyle",2023-02-05 17:49:43+00:00,https://www.breitbart.com/politics/2023/02/05/poll-trump-takes-lead-biden-eve-state-union-address/,0.0,0.0,1.0,0.0,0.0
Breitbart News,Arizona's Kari Lake Endorses Donald Trump for President,"Arizona Republican Kari Lake endorsed former President Donald J. Trump for president while speaking in Iowa on Friday.  Lake, who was the Republican nominee in Arizona’s gubernatorial race last year, made her announcement during a meet-and-greet event hosted …","Nick Gilbertson, Nick Gilbertson",2023-02-11 00:10:55+00:00,https://www.breitbart.com/politics/2023/02/10/arizonas-kari-lake-endorses-donald-trump-for-president/,1.0,0.0,0.714,0.286,0.34
Breitbart News,Report: Lawmakers to Get Joe Biden Doc Scandal Briefing Without Access to Classified Materials,Congressional lawmakers will reportedly receive a briefing from Biden administration officials on President Joe Biden's classified document scandal as soon as this week after weeks of stonewalling.,"Wendell Husebø, Wendell Husebø",2023-02-06 17:11:28+00:00,https://www.breitbart.com/politics/2023/02/06/report-lawmakers-to-get-joe-biden-doc-scandal-briefing-without-access-to-classified-materials/,-1.0,0.209,0.791,0.0,-0.4404
Breitbart News,Report: Special Counsel Investigating Donald Trump Subpoenaed Mike Pence,"Special Counsel Jack Smith, who is spearheading an investigation into former President Donald Trump, reportedly subpoenaed former Vice President Mike Pence on Thursday.","Jordan Dixon-Hamilton, Jordan Dixon-Hamilton",2023-02-10 02:10:29+00:00,https://www.breitbart.com/politics/2023/02/09/report-special-counsel-investigating-donald-trump-subpoenaed-mike-pence/,1.0,0.0,0.748,0.252,0.4019
Breitbart News,Poll: Donald Trump Dominates 2024 Republican Primary Poll,"Former President Donald Trump is up double digits in the latest 2024 Republican primary poll, released by Premise Data.","Hannah Bleau, Hannah Bleau",2023-02-09 17:58:07+00:00,https://www.breitbart.com/politics/2023/02/09/donald-trump-dominates-2024-republican-primary-poll/,1.0,0.0,0.854,0.146,0.0516
Breitbart News,Turkey Strikes Syrian Kurds as Earthquake Recovery Continues,"Turkish forces bomb Kurdish positions in Syria the day after a devastating earthquake, allegedly in retaliation for a Kurdish rocket attack.",John Hayward,2023-02-07 21:37:16+00:00,https://www.breitbart.com/middle-east/2023/02/07/turkey-strikes-syrian-kurds-earthquake-recovery-continues/,-1.0,0.294,0.706,0.0,-0.3612
Business Insider,"Mike Pence was subpoenaed by a special DOJ counsel leading investigations into Trump, per reports","It is unclear which federal investigation Pence was subpoenaed for on Thursday, according to a report from ABC News.","aharoun@insider.com (Azmi Haroun,Lloyd Lee,Charles R. Davis)",2023-02-09 23:32:52+00:00,https://www.businessinsider.com/mike-pence-was-subpoenaed-by-doj-trump-probe-2023-2,1.0,0.0,0.787,0.213,0.4019
Business Insider,CBS News pressed Sen. Ted Cruz on why he's running for reelection after he introduced a bill limiting senators to 2 terms in office: 'Why aren't you holding yourself to that standard?',"""If and when it passes, I will happily, happily comply. I've never said I'm going to unilaterally comply,"" Cruz told CBS of running for a third term.",insider@insider.com (John L. Dorman),2023-02-05 18:20:49+00:00,https://www.businessinsider.com/cruz-seeks-third-senate-term-backs-two-term-constitutional-amendment-2023-2,0.0,0.0,1.0,0.0,0.0
Business Insider,Indiana's Senate race will show the depths of the fault lines within the GOP. Early signs show it's still Trump's party.,"In the GOP of yesteryear, Mitch Daniels would've been a shoo-in for the Senate. His decision to skip the race leaves the GOP with some big questions.",insider@insider.com (John L. Dorman),2023-02-04 20:09:26+00:00,https://www.businessinsider.com/mitch-daniels-indiana-republicans-banks-holcomb-2024-senate-trump-2023-2,0.0,0.147,0.707,0.147,0.0
Business Insider,Jason Miller returns as Trump advisor for campaign struggling to generate much excitement compared to 2016,"Jason Miller, who left Trump's team in 2021 to become CEO of Gettr, has joined the former president's so-far underwhelming 2024 campaign.",jzitser@businessinsider.com (Joshua Zitser),2023-02-10 14:27:28+00:00,https://www.businessinsider.com/jason-miller-returns-advisor-struggling-trump-campaign-2024-2023-2,1.0,0.175,0.625,0.2,0.1027
Business Insider,"A Trump lawyer said a current aide's laptop turned in to federal investigators contained copy of a classified folder, report says","Former President Donald Trump's team turned over the laptop as well as a folder with classification markings that were discovered last month, reports say.",hgetahun@insider.com (Hannah Getahun),2023-02-11 07:45:13+00:00,https://www.businessinsider.com/trump-aide-laptop-copies-of-classified-docs-report-says-2023-2,0.0,0.0,1.0,0.0,0.0
CBS News,Trump special counsel subpoenas former Vice President Mike Pence,"Special counsel Jack Smith was appointed to oversee the Justice Department's criminal investigation into Trump. CBS News political director Fin Gomez joins John Dickerson on ""Prime Time"" with the latest.",CBS News,2023-02-10 01:02:06+00:00,https://www.cbsnews.com/video/trump-special-counsel-subpoenas-former-vice-president-mike-pence/,1.0,0.0,0.748,0.252,0.4019
CBS News,FBI conducts search of Mike Pence’s home for classified documents,"The FBI conducted an exhaustive five-hour search of the Indiana home of former Vice President Mike Pence. The search for classified documents follows reports that Justice Department special counsel Jack Smith, investigating former President Trump's efforts to…",CBS News,2023-02-11 13:19:06+00:00,https://www.cbsnews.com/video/fbi-conducts-search-of-mike-pences-home-for-classified-documents/,0.0,0.0,1.0,0.0,0.0
CBS News,Pence subpoenaed by special counsel in Trump probes,"Former Vice President Mike Pence has been subpoenaed by the special counsel looking into former President Donald Trump's handling of classified documents and his efforts to overturn the results of the 2020 election, sources tell CBS News.",CBS News,2023-02-09 23:49:06+00:00,https://www.cbsnews.com/video/pence-subpoenaed-by-special-counsel-in-trump-probes/,1.0,0.0,0.649,0.351,0.4019
CBS News,2/9: CBS News Prime Time,"John Dickerson reports on relief efforts as the death toll rises to 20,000 in the Turkey-Syria earthquakes, a subpoena issued for former Vice President Mike Pence, and Nicaragua's release of political prisoners to the U.S.",CBS News,2023-02-10 02:19:14+00:00,https://www.cbsnews.com/video/020923-cbs-news-prime-time/,0.0,0.0,1.0,0.0,0.0
CBS News,What the subpoena of former Vice President Mike Pence by the special counsel investigating Trump could mean,CBS News has confirmed that former Vice President Mike Pence has been subpoenaed as part of the Justice Department's investigations into former President Donald Trump. Pence was contacted by the department in November to discuss Trump's alleged efforts to ove…,CBS News,2023-02-10 14:50:59+00:00,https://www.cbsnews.com/video/how-significant-is-the-subpoena-for-former-vice-president-mike-pence/,1.0,0.0,0.816,0.184,0.4019
CBS News,FBI searches Mike Pence's home in Indiana for classified documents,"The FBI conducted a consensual search for classified documents Friday at former Vice President Mike Pence's home in Carmel, Indiana, CBS News has confirmed. The search comes on the heels of CBS News learning that Pence has been subpoenaed as part of the Justi…",CBS News,2023-02-10 17:48:14+00:00,https://www.cbsnews.com/video/fbi-searches-mike-pences-home-in-indiana-for-classified-documents/,0.0,0.0,1.0,0.0,0.0
CBS News,"Pence subpoenaed by special counsel investigating Trump, sources say",Special counsel Jack Smith was appointed in November to oversee the Justice Department's criminal investigation into Trump.,,2023-02-10 00:24:00+00:00,https://www.cbsnews.com/news/mike-pence-subpoenaed-special-counsel-jack-smith/,1.0,0.0,0.722,0.278,0.4019
CBS News,Pence postpones South Carolina trip because daughter is in labor,"He had planned to visit the state Monday, where former Gov. Nikki Haley is expected to announce her run for the presidency.",Aaron Navarro,2023-02-06 16:28:05+00:00,https://www.cbsnews.com/news/pence-postpones-south-carolina-trip-because-daughter-is-in-labor/,-1.0,0.259,0.741,0.0,-0.2732
CBS News,FBI finds additional document with classified markings in search of Pence's home,"In a search Friday, the FBI discovered additional documents in former Vice President Mike Pence's Indiana home, one of which had classified markings, according to a Pence official. CBS News chief election and campaign correspondent Robert Costa examined the l…",CBS News,2023-02-11 03:33:06+00:00,https://www.cbsnews.com/video/fbi-finds-additional-classified-documents-in-former-vice-president-mike-pences-home/,0.0,0.0,1.0,0.0,0.0
CBS News,FBI searches Pence's Indiana home for classified records,"The FBI conducted a scheduled search of former Vice President Mike Pence's Indiana home, looking for any potentially classified material. Meanwhile, the special counsel investigating former President Donald Trump's effort to overturn the 2020 election wants t…",CBS News,2023-02-10 23:59:23+00:00,https://www.cbsnews.com/video/fbi-searches-pences-indiana-home-for-classified-records/,0.0,0.0,1.0,0.0,0.0
CBS News,Pence's home being searched by FBI,"Documents marked as classified were found at the vice president's home in Carmel, Ind., in January.","Andres Triay, Kathryn Watson, Robert Legare",2023-02-10 17:03:06+00:00,https://www.cbsnews.com/news/pences-home-being-searched-fbi/,0.0,0.0,1.0,0.0,0.0
CBS News,"Trump, potential 2024 GOP contenders respond to Biden's State of the Union","Their responses offered an early preview of how they might run against Biden, their likely opponent in 2024.",Aaron Navarro,2023-02-08 05:38:16+00:00,https://www.cbsnews.com/news/trump-response-biden-state-of-the-union/,0.0,0.0,1.0,0.0,0.0
CBS News,Trump leads GOP 2024 primary field narrowly in poll of conservatives,"But in a head-to-head matchup between Trump and DeSantis, DeSantis has more support, according to a new poll by the conservative group Club for Growth Action.",Aaron Navarro,2023-02-07 02:13:45+00:00,https://www.cbsnews.com/news/trump-desantis-opinion-poll-club-for-growth-2023-02-06/,0.0,0.0,1.0,0.0,0.0
CBS News,Koch-funded group plans to oppose Trump's 2024 campaign,Americans for Prosperity has sat out the past couple of GOP presidential cycles.,Fin Gómez,2023-02-06 02:51:00+00:00,https://www.cbsnews.com/news/charles-koch-opposing-donald-trump-2024-election-americans-for-prosperity/,0.0,0.0,1.0,0.0,0.0
