source,title,description,author,publishedAt,url,sentimentScore,neg,neu,pos,compound
CNN,Koch network plans to back a Republican -- other than Trump -- in the 2024 presidential primary,The deep-pocketed network associated with billionaire Charles Koch is preparing to throw its money and weight behind a single Republican candidate in the 2024 presidential primary -- in a move that could significantly reshape the GOP field.,Fredreka Schouten,2023-02-05 12:32:53+00:00,https://www.cnn.com/2023/02/05/politics/koch-network-republican-primary-2024/index.html,0.0,0.0,1.0,0.0,0.0
CNN,Former Pence chief of staff: FBI search of Pence home for any more classified material 'not too far off',"Marc Short, a former chief of staff to Mike Pence, suggested Wednesday that an FBI search of the former vice president's home for any additional classified materials is ""not too far off into the future.""",Hannah Rabinowitz,2023-02-09 00:15:17+00:00,https://www.cnn.com/2023/02/08/politics/fbi-search-pence-indiana-home-marc-short/index.html,0.0,0.0,1.0,0.0,0.0
CNN,Second Trump attorney met with Mar-A-Lago probe grand jury in recent weeks,"Trump attorney Christina Bobb appeared before a federal grand jury in Washington, DC, in recent weeks in connection with the investigation into former President Donald Trump's handling of classified documents, two sources have told CNN.","Evan Perez, Kristen Holmes",2023-02-11 23:55:20+00:00,https://www.cnn.com/2023/02/11/politics/christina-bobb-trump-mar-a-lago-grand-jury/index.html,1.0,0.0,0.75,0.25,0.4588
CNN,Can any Republican beat Trump or DeSantis in 2024?,"Polls show the 2024 Republican primary is a contest between former President Donald Trump, Florida Gov. Ron DeSantis and everybody else. The ""everybody else"" group includes candidates such as former UN Ambassador Nikki Haley, who look like they're itching to …",Harry Enten,2023-02-05 17:16:17+00:00,https://www.cnn.com/2023/02/05/politics/republican-primary-2024-trump-desantis-haley/index.html,0.0,0.0,1.0,0.0,0.0
CNN,"5 things to know for February 10: Ukraine, Earthquake, Capitol riot, Vaccines, Meta",Here's what else you need to know to Get Up to Speed and On with Your Day.,Alexandra Meeks,2023-02-10 11:45:43+00:00,https://www.cnn.com/2023/02/10/us/five-things-february-10-trnd/index.html,-1.0,0.286,0.714,0.0,-0.5574
CNN,Pence subpoenaed by special counsel investigating Trump | CNN Politics,"Former Vice President Mike Pence has been subpoenaed by the special counsel investigating Donald Trump and his role in January 6, 2021, a source familiar with the matter told CNN.",Kaitlan Collins,2023-02-09 23:30:22+00:00,https://www.cnn.com/2023/02/09/politics/pence-subpoena-special-counsel-january-6/index.html,1.0,0.0,0.722,0.278,0.4019
CNN,FBI conducting search of former Vice President Mike Pence's home | CNN Politics,"The FBI is currently conducting a search of former Vice President Mike Pence's home in Indiana, a source familiar with the situation told CNN.","Evan Perez, Katelyn Polantz, Jeremy Herb, Chandelis Duster",2023-02-10 16:19:04+00:00,https://www.cnn.com/2023/02/10/politics/mike-pence-house-fbi-search/index.html,0.0,0.0,1.0,0.0,0.0
Fox News,Former Vice President Mike Pence subpoenaed by special counsel overseeing Trump investigations,"Former Vice President Mike Pence has been subpoenaed in connection with investigations into former President Donald Trump, a source confirmed to Fox News.","Louis Casiano, David Spunt, Bill Mears",2023-02-10 01:54:51+00:00,https://www.foxnews.com/politics/former-vice-president-mike-pence-subpoenaed-special-counsel-overseeing-trump-investigations,1.0,0.0,0.787,0.213,0.4019
Fox News,"FBI searches Mike Pence Indiana home amid classified document investigation, sources say","FBI investigators arrived at the Carmel, Indiana residence of former Vice President Mike Pence Friday amid the ongoing classified documents investigation.","David Spunt, Timothy Nerozzi, Madison Scarpino",2023-02-10 17:03:43+00:00,https://www.foxnews.com/politics/fbi-searches-mike-pence-indiana-home-classified-document-investigation,0.0,0.0,1.0,0.0,0.0
Fox News,"House Republicans to get briefing on Biden, Trump, Pence classified documents this week","Congress will receive a briefing on the contents of classified material found at the homes of President Biden, frmr. President Trump and fmr. Vice President Pence this week.",Anders Hagstrom,2023-02-05 17:50:23+00:00,https://www.foxnews.com/politics/house-republicans-get-briefing-biden-trump-pence-classified-documents-week,0.0,0.0,1.0,0.0,0.0
Fox News,"Pence FBI search lasted 5 hours, recovered one additional classified doc","The FBI search of former Vice President Pence's Indiana home lasted five hours and resulted in one document with classified markings and six additional pages, not marked classified.",Kelly Laco,2023-02-10 19:44:31+00:00,https://www.foxnews.com/politics/pence-fbi-search-lasted-5-hours-recovered-one-additional-classified-doc,0.0,0.0,1.0,0.0,0.0
Fox News,Schiff urges Pence to 'cooperate fully' on special counsel subpoena after skipping J6 Committee,"Rep. Adam Schiff, who sat on the House Select Committee to Investigate the January 6th Attack on the United States Capitol, said Pence should ""cooperate fully"" with a subpoena.",Kelly Laco,2023-02-10 20:41:32+00:00,https://www.foxnews.com/politics/schiff-urges-pence-cooperate-fully-special-counsel-subpoena-skipping-j6-committee,1.0,0.0,0.77,0.23,0.4576
Fox News,Republican Gov. Chris Sununu issues bold prediction about Trump's 2024 chances: 'He can't get it done',"Former President Donald Trump doesn't have what it takes to beat President Biden in the 2024 presidential race, Republican New Hampshire Gov. Chris Sununu said Sunday.",Anders Hagstrom,2023-02-05 18:35:48+00:00,https://www.foxnews.com/politics/republican-gov-chris-sununu-issues-bold-prediction-trumps-2024-chances-cant-get-done,1.0,0.0,0.732,0.268,0.5267
Fox News,Trump calls Pence a 'very honorable man' after Special Counsel Jack Smith subpoena,EXCLUSIVE: Former President Trump called former Vice President Pence a “very honorable man” after Special Counsel Jack Smith subpoenaed him as part of his investigation into the Jan. 6 Capitol riot and into Trump’s handling of classified documents after leavi…,Brooke Singman,2023-02-10 20:49:29+00:00,https://www.foxnews.com/politics/trump-calls-pence-a-very-honorable-man,1.0,0.0,0.563,0.437,0.7351
Fox News,2024 GOP hopefuls take shots at Biden’s SOTU: ‘America deserves better’,"Likely GOP contenders for the 2024 presidential election slammed President Joe Biden's State of the Union speech Tuesday night, which was roundly opposed by Republicans.",Aubrie Spady,2023-02-08 04:29:53+00:00,https://www.foxnews.com/politics/2024-gop-hopefuls-take-shots-bidens-sotu-america-deserves-better,1.0,0.0,0.756,0.244,0.4404
Fox News,"Biden tells PBS he's 'not at liberty' to discuss classified documents scandal, suggests his staff is to blame",President Biden was finally asked about the ongoing classified document scandal plaguing the White House in his first interview since the controversy broke last month.,Joseph Wulfsohn,2023-02-09 01:00:46+00:00,https://www.foxnews.com/media/biden-tells-pbs-hes-not-at-liberty-discuss-classified-documents-scandal,-1.0,0.299,0.508,0.192,-0.2263
Fox News,MONEY TALKS: Rumored presidential hopefuls with the most cash in the bank,"Former President Donald Trump remains the only announced GOP candidate in the race for the White House, though Nikki Haley is expected to formally launch her campaign next week.",Sophia Slacik,2023-02-11 22:00:28+00:00,https://www.foxnews.com/politics/money-talks-rumored-presidential-hopefuls-most-cash-bank,0.0,0.0,1.0,0.0,0.0
Fox News,"Over 100 groups back Manchin, GOP plan to block Biden’s ‘woke’ ESG investing rule","More than 100 conservative groups are urging Congress to roll back Biden's ""politically inappropriate"" and ""financially irresponsible"" ESG investment rule.",Kelly Laco,2023-02-07 12:00:19+00:00,https://www.foxnews.com/politics/over-100-groups-back-manchin-gop-plan-block-bidens-woke-esg-investing-rule,-1.0,0.195,0.805,0.0,-0.4404
Fox News,"DeSantis tied with Trump, everyone else far behind in fresh 2024 GOP presidential primary poll",Florida Gov. Ron DeSantis and former President Donald Trump are tied with the rest of the potential field of Republican presidential contenders far behind in a new national 2024 poll,Paul Steinhauser,2023-02-09 16:26:47+00:00,https://www.foxnews.com/politics/desantis-tied-trump-everyone-else-far-behind-2024-gop-presidential-primary-poll,1.0,0.0,0.839,0.161,0.3182
Fox News,McCarthy says he won't repeat Pelosi 'theatrics' and rip up Biden’s SOTU speech,House Speaker Kevin McCarthy said Tuesday he won't rip up President Biden's State of the Union address the way Nancy Pelosi ripped up President Trump's in 2020.,Peter Kasperowicz,2023-02-07 14:41:52+00:00,https://www.foxnews.com/politics/mccarthy-wont-rip-up-bidens-sotu-speech-repeat-pelosis-theatrics-trump,0.0,0.0,1.0,0.0,0.0
Fox News,"Trump team turns over laptop, additional classified documents months after infamous Mar-a-Lago raid",Former President Donald Trump's legal team has handed over additional materials with classified markings to the Justice Department including a former aide's laptop.,Lawrence Richard,2023-02-11 06:33:51+00:00,https://www.foxnews.com/politics/trump-team-laptop-additional-classified-documents-infamous-mar-a-lago-raid,0.0,0.0,1.0,0.0,0.0
Fox News,Nikki Haley teases expected 2024 announcement in fiery video: ‘Where will you stand?’,Nikki Haley is teasing what is expected to be a 2024 White House run next week with a new teaser video that cites her past as a leader at the U.N. and as governor.,Adam Shaw,2023-02-08 11:00:58+00:00,https://www.foxnews.com/politics/nikki-haley-teases-expected-2024-announcement-in-fiery-video-where-will-you-stand,-1.0,0.365,0.635,0.0,-0.5574
Fox News,"Nikki Haley not to be ‘underestimated’ in bid for president, former South Carolina GOP officials say","As Nikki Haley begins a 2024 campaign for the GOP primary, South Carolina Republican insiders say her personal campaigning style and career achievements will win over voters across America",Kyle Morris,2023-02-11 20:12:47+00:00,https://www.foxnews.com/politics/nikki-haley-not-to-be-underestimated-in-bid-for-president-former-south-carolina-gop-officials-say,-1.0,0.174,0.826,0.0,-0.2732
Fox News,"First on Fox: Noem to deliver high-profile speeches in DC, sparking more 2024 speculation",First on Fox: Republican Gov. Kristi Noem of South Dakota is headed to the nation’s capital next week to deliver three policy speeches that are sure to grab 2024 attention,Paul Steinhauser,2023-02-08 11:00:49+00:00,https://www.foxnews.com/politics/first-on-fox-noem-deliver-high-profile-speeches-dc-sparking-2024-speculation,0.0,0.0,1.0,0.0,0.0
Fox News,"'Fox News Sunday' on February 5, 2022","This week, 'Fox News Sunday' welcomed Sen. Tom Cotton, White House Chief Economist Jared Bernstein, and more to discuss this week's top political news.",Fox News Staff,2023-02-05 19:15:19+00:00,https://www.foxnews.com/transcript/fox-news-sunday-february-5-2022,0.0,0.0,1.0,0.0,0.0
MSNBC,Trump's election fraud schemers keep getting caught lying — on tape,Wisconsin Trump tapes from Associated Press confirm President Donald Trump election officials knew the 'big lie' was fake. And pressured Mike Pence anyway.,Charlie Sykes,2023-02-05 11:00:00+00:00,https://www.msnbc.com/opinion/msnbc-opinion/wisconsin-trump-tapes-associated-press-confirm-big-lie-rcna69094,-1.0,0.507,0.493,0.0,-0.802
MSNBC,Jack Smith should win any executive privilege fight over Pence subpoena,Pence and Trump could try to block the former vice president from complying with the special counsel’s Jan. 6 investigation. Any such attempt should fail.,Jordan Rubin,2023-02-10 19:01:50+00:00,https://www.msnbc.com/deadline-white-house/deadline-legal-blog/pence-subpoena-jack-smith-executive-privilege-rcna70073,1.0,0.187,0.36,0.453,0.5719
MSNBC,"Following special counsel subpoena, Pence has a decision to make",Mike Pence is one of the most important witnesses about one of the most important scandals in American history. But will he comply with a federal subpoena?,Steve Benen,2023-02-10 13:00:25+00:00,https://www.msnbc.com/rachel-maddow-show/maddowblog/special-counsel-subpoena-pence-decision-make-rcna70057,1.0,0.0,0.69,0.31,0.4019
MSNBC,The GOP's 2024 race to the bottom has already begun,"Donald Trump and Ron DeSantis are leading the Republican Party ahead of the 2024 election on education, critical race theory, and transgender youth, sadly.",Hayes Brown,2023-02-04 11:00:00+00:00,https://www.msnbc.com/opinion/msnbc-opinion/trump-desantis-compete-lead-rights-culture-wars-rcna69015,0.0,0.0,1.0,0.0,0.0
NBC News,Trump lawyers expected to fight Pence subpoena on executive privilege grounds,"Lawyers for former President Donald Trump are expected to fight the special counsel's subpoena of former Vice President Mike Pence on executive privilege grounds, according to a source familiar with the Trump legal team’s discussions.",Garrett Haake and Minyvonne Burke,2023-02-11 20:21:30+00:00,https://www.nbcnews.com/politics/politics-news/trump-lawyers-expected-fight-pence-subpoena-executive-privilege-ground-rcna70245,-1.0,0.215,0.579,0.207,-0.0258
NBC News,Pence group to run ads in Iowa against school trans policies,Former Vice President Mike Pence is stepping up outreach in Iowa by rallying conservatives against transgender policies in schools.,Associated Press,2023-02-09 19:16:16+00:00,https://www.nbcnews.com/nbc-out/out-politics-and-policy/pence-group-run-ads-iowa-school-trans-policies-rcna69955,0.0,0.0,1.0,0.0,0.0
NBC News,Pence subpoenaed by special counsel leading Trump investigations,"Former Vice President Mike Pence has been subpoenaed by the special counsel investigating former President Donald Trump, according to a source familiar with the matter.",Kristen Welker,2023-02-09 23:54:04+00:00,https://www.nbcnews.com/politics/justice-department/pence-subpoenaed-special-counsel-leading-trump-investigations-rcna70031,1.0,0.0,0.69,0.31,0.4019
NBC News,FBI searching Mike Pence's home for classified documents,"The FBI was searching former Vice President Mike Pence's Indiana home for any classified documents that might be in the house, a senior law-enforcement official told NBC News.",Michael Kosnar and Dareh Gregorian,2023-02-10 16:33:15+00:00,https://www.nbcnews.com/politics/justice-department/fbi-searching-mike-pences-home-classified-documents-rcna70112,0.0,0.0,1.0,0.0,0.0
NBC News,White House to update top Republicans on recovered classified documents,"Biden administration officials are offering top congressional leaders a briefing on classified documents found in the possession of President Joe Biden former President Donald Trump, and former Vice President Mike Pence, two sources familiar with discussions …",Dennis Romero and Dennis Romero and Julie Tsirkin,2023-02-06 03:55:03+00:00,https://www.nbcnews.com/politics/politics-news/white-house-update-top-republicans-recovered-classified-files-rcna69223,1.0,0.0,0.795,0.205,0.2023
NBC News,FBI to search Pence's Indiana home for more classified documents,"The FBI is expected to search former Vice President Mike Pence’s Indiana home for classified documents in a matter of days, three law enforcement officials told NBC News.",Sarah Fitzpatrick and Michael Kosnar and Julia Ainsley and Summer Concepcion,2023-02-06 16:21:31+00:00,https://www.nbcnews.com/politics/politics-news/fbi-search-pences-indiana-home-classified-documents-rcna68838,0.0,0.0,1.0,0.0,0.0
NBC News,Trump's legal team turned over folder with classified markings to Justice Department,"Donald Trump’s legal team recently turned over a folder bearing classified markings to the Justice Department that was found at the former president's Mar-a-Lago resort in Florida, a senior law enforcement official told NBC News.",Zoë Richards and Michael Kosnar,2023-02-11 21:25:08+00:00,https://www.nbcnews.com/politics/donald-trump/trumps-legal-team-turned-folder-classified-markings-justice-department-rcna70204,1.0,0.0,0.588,0.412,0.5994
NBC News,Former national security adviser Robert O'Brien subpoenaed special counsel in Trump probes,Special Counsel Jack Smith has subpoenaed former Trump national security adviser Robert O'Brien as part of his probes into the former president.,Carol E. Lee and Dareh Gregorian,2023-02-10 19:49:29+00:00,https://www.nbcnews.com/politics/justice-department/former-national-security-adviser-robert-obrien-subpoenaed-special-coun-rcna70150,1.0,0.0,0.638,0.362,0.6249
NBC News,New Hampshire Gov. Chris Sununu takes a major step toward running for president,"New Hampshire Gov. Chris Sununu has taken his most significant step yet in exploring a White House bid, launching a national political organization.",Natasha Korecki and Jonathan Allen,2023-02-08 20:36:41+00:00,https://www.nbcnews.com/politics/2024-election/gov-chris-sununu-takes-major-step-running-president-rcna69751,0.0,0.0,1.0,0.0,0.0
NBC News,Koch network draws early battle lines against Trump in 2024,"The conservative political network founded by the billionaire Koch brothers, has already picked a side for '24, and it's a candidate other than Trump.","Chuck Todd, Mark Murray, Ben Kamisar, Bridget Bowman, Alexandra Marquez",2023-02-06 13:37:45+00:00,https://www.nbcnews.com/meet-the-press/first-read/koch-network-draws-early-battle-lines-trump-2024-rcna69279,-1.0,0.271,0.729,0.0,-0.3818
Newsweek,Mike Pence Subpoena Shows Trump Investigation Reaching 'Climax': Kirschner,"Comparing the Trump insurrection investigation to an action adventure movie, legal analyst Glenn Kirschner said it ""feels like we've now entered the car chase phase.""",Ewan Palmer,2023-02-10 09:08:18+00:00,https://www.newsweek.com/mike-pence-subpoena-trump-jan6-1780313,1.0,0.0,0.816,0.184,0.2023
Newsweek,Mike Pence Has 'Sharply Incriminating' Testimony About Trump: Kirschner,"The former president attempted to ""enlist Mike Pence as a co-conspirator in his criminal scheme,"" the former federal prosecutor said.",Jason Lemon,2023-02-11 16:04:05+00:00,https://www.newsweek.com/mike-pence-has-sharply-incriminating-testimony-about-trump-kirschner-1780580,0.0,0.0,1.0,0.0,0.0
Newsweek,Mike Pence Is 'Essential Witness' for Trump Prosecution: Ex-U.S. Attorney,"Special Counsel Jack Smith subpoenaed Pence on Thursday, requesting documents and testimony related to the January 6, 2021, Capitol riot.",Fatma Khaled,2023-02-10 19:25:01+00:00,https://www.newsweek.com/mike-pence-essential-witness-trump-prosecution-ex-us-attorney-1780514,-1.0,0.286,0.714,0.0,-0.4939
Newsweek,Donald Trump Rushes To Praise Mike Pence After Special Counsel Subpoena,"The former president described Pence as an ""honorable"" man and said his former vice president was ""very decent.""",Darragh Roche,2023-02-11 09:55:41+00:00,https://www.newsweek.com/donald-trump-rushes-praise-mike-pence-after-special-counsel-subpoena-1780554,1.0,0.0,0.588,0.412,0.743
Newsweek,Pence Subpoena Gives Him a Pass on Looking Like a Trump Traitor,The former vice president was subpoenaed by the special counsel investigating Trump's actions on January 6.,Kaitlin Lewis,2023-02-10 02:30:29+00:00,https://www.newsweek.com/pence-subpoena-gives-him-pass-looking-like-trump-traitor-1780286,1.0,0.0,0.762,0.238,0.3612
Newsweek,Trump Responds to Meme Saying He's the 'Savior of Western Civilization',"The former president thanked the person who posted the meme and wrote that ""we have a long way to go.""",Darragh Roche,2023-02-10 12:31:40+00:00,https://www.newsweek.com/trump-meme-savior-western-civilization-1780370,0.0,0.0,1.0,0.0,0.0
Newsweek,"Donald Trump Has 'Hit the Panic Button,' His Former Lawyer Says","Michael Cohen described Trump's handling of classified documents as ""the true danger to our national security"" as the DOJ investigations heat up.",Andrew Stanton,2023-02-11 22:43:59+00:00,https://www.newsweek.com/donald-trump-has-hit-panic-button-his-former-lawyer-says-1780611,-1.0,0.268,0.732,0.0,-0.5106
Newsweek,Trump Rages Over Being Left Out of Conservative Event,"Trump slammed the Club for Growth as ""an assemblage of political misfits, globalists, and losers"" after the group left him off their annual guest list.",Katherine Fung,2023-02-07 19:29:41+00:00,https://www.newsweek.com/trump-rages-left-out-conservative-event-1779604,-1.0,0.307,0.693,0.0,-0.4767
Newsweek,Trump Lashes Out as a Powerful Network of Donors Disappears,"Trump denounced ""globalists"" while insisting that he did not want donations from a group led by conservative billionaire Charles Koch.",Aila Slisco,2023-02-09 23:41:08+00:00,https://www.newsweek.com/donald-trump-lashes-out-powerful-network-donors-disappears-1780275,1.0,0.235,0.49,0.275,0.1027
Newsweek,Jamie Raskin Predicts Donald Trump's 'Almost Inevitable' Indictment,"Raskin said that Trump, whom he called ""a one-man crime wave,"" was culpable for at least one of the criminal charges that he may be facing.",Aila Slisco,2023-02-04 00:14:55+00:00,https://www.newsweek.com/jamie-raskin-predicts-donald-trump-indictment-interview-comments-1778930,0.0,0.0,1.0,0.0,0.0
Newsweek,Taylor Swift's Reaction to Jill Biden's Grammy Appearance Goes Viral,Taylor Swift's indifferent reaction to the appearance of the first lady of the United States at the 2023 Grammy Awards was discussed on social media.,Jamie Burton,2023-02-06 09:20:20+00:00,https://www.newsweek.com/taylor-swift-reaction-jill-biden-grammy-appearance-goes-viral-1779103,0.0,0.0,1.0,0.0,0.0
Newsweek,Trump Envisions What 'Joe Biden's America' Looked Like From Spy Balloon,"In his latest political ad, the former president speculated what America could have looked like from the Chinese spy device that passed over the U.S. last week.",Kaitlin Lewis,2023-02-07 05:55:06+00:00,https://www.newsweek.com/trump-envisions-what-joe-bidens-america-looked-like-spy-balloon-1779368,1.0,0.0,0.8,0.2,0.3612
Newsweek,Ron DeSantis and the Path to GOP Victory in 2024 | Opinion,The idea of a Donald Trump-vs-Ron DeSantis GOP primary showdown is already getting major media play.,Scott Morefield,2023-02-08 11:00:01+00:00,https://www.newsweek.com/ron-desantis-path-gop-victory-2024-opinion-1779303,0.0,0.0,1.0,0.0,0.0
Newsweek,Secret Chinese Spy Balloon Under Donald Trump Passed Through These States,Officials said Chinese balloons travelled into U.S. airspace on at least three occasions during the Trump presidency and once previously during Biden's tenure.,Aleks Phillips,2023-02-07 10:04:04+00:00,https://www.newsweek.com/chinese-spy-balloons-donald-trump-presidency-joe-biden-national-security-1779407,0.0,0.0,1.0,0.0,0.0
Newsweek,Donald Trump and Joe Biden Finally Agree on Something,"Trump is looking to outflank his opponents on cuts to entitlement spending like Medicare and Social Security, knifing his political rivals in the process.",Nick Reynolds,2023-02-10 15:44:25+00:00,https://www.newsweek.com/donald-trump-joe-biden-finally-agree-something-1780446,1.0,0.0,0.706,0.294,0.3612
Newsweek,"Following State Of The Union, Dems Push Biden To Launch Reelection Bid","""He should move as quickly as possible,"" a Democratic strategist told Newsweek. """"I think Biden's going to be very tough to beat.""",Daniel Bush,2023-02-09 17:03:28+00:00,https://www.newsweek.com/following-state-union-dems-push-biden-launch-reelection-bid-1779993,0.0,0.0,1.0,0.0,0.0
Newsweek,Trump's First 2024 Challenger Targets His Greatest Asset,"""Trump, in all due deference, is a real estate builder of large buildings,"" Steve Laffey told Newsweek. ""If we need to build some buildings, we'll call him.""",Katherine Fung,2023-02-10 17:38:44+00:00,https://www.newsweek.com/donald-trump-steve-laffey-2024-challenger-targets-greatest-asset-1780477,1.0,0.0,0.379,0.621,0.802
Reuters,FBI searching Pence’s home in classified documents probe -Justice Dept official,"Published by Reuters By Sarah N. Lynch WASHINGTON (Reuters) – The FBI on Friday conducted a consensual search at the Indianapolis residence of former Vice President Mike Pence, after classified documents were discovered at his house last month, a Justice Depa…",Towleroad,2023-02-10 19:55:28+00:00,"http://rmb.reuters.com/rmd/rss/item/tag:reuters.com,2023:newsml_KBN2UK1HW:5?channel=FES376",1.0,0.0,0.726,0.274,0.5267
Reuters,FBI searching Pence's home in classified documents probe -source,"The FBI on Friday conducted a consensual search at the Indianapolis residence of former Vice President Mike Pence, after classified documents were discovered at his house last month, a person familiar with the matter told Reuters.",,2023-02-10 16:40:34+00:00,https://www.reuters.com/world/us/fbi-searching-pences-home-classified-documents-probe-source-2023-02-10/,0.0,0.0,1.0,0.0,0.0
Reuters,"Former VP Pence, ex-Trump official subpoenaed in special counsel probes - reports",Former U.S. Vice President Mike Pence and former national security adviser Robert O'Brien have been subpoenaed by the special counsel leading probes into classified documents found at former President Donald Trump's Mar-a-Lago residence and efforts to overtur…,,2023-02-10 01:08:52+00:00,https://www.reuters.com/legal/trumps-former-national-security-adviser-subpoenaed-special-counsel-probes-cnn-2023-02-09/,1.0,0.0,0.769,0.231,0.4019
RT,Pence subpoenaed in Trump probe – media,Former US Vice President Mike Pence has reportedly received a legal summons to testify in a criminal investigation into Donald Trump Read Full Article at RT.com,RT,2023-02-10 15:23:26+00:00,https://www.rt.com/news/571299-us-pence-trump-subpoena/,0.0,0.0,1.0,0.0,0.0
RT,FBI raids former US vice-president’s home,"Mike Pence’s Indiana home was searched for any more classified documents, after he said some were found amid Joe Biden’s paper scandal Read Full Article at RT.com",RT,2023-02-10 18:03:21+00:00,https://www.rt.com/news/571306-mike-pence-fbi-classified/,0.0,0.0,1.0,0.0,0.0
