source,title,description,author,publishedAt,url,sentimentScore,neg,neu,pos,compound
Fox News,"DeSantis, Florida Republican leaders to consider expanding migrant flight program during special session","Florida Gov. Ron DeSantis and the state GOP called a special session to consider a bill creating the ""Unauthorized Alien Transport Program"" months after the Martha's Vineyard flights.",Danielle Wallace,2023-02-06 13:04:46+00:00,https://www.foxnews.com/politics/desantis-florida-republican-leaders-consider-expanding-migrant-flight-program-special-session,1.0,0.0,0.787,0.213,0.4019
Fox News,Liberals falsely attack DeSantis using Associated Press fact-check that vindicates him: 'Authoritarianism',Left-wing activists and figures attacked Gov. Ron DeSantis for allegedly “mandating menstrual cycle details” by using an Associated Press fact-check that debunks the claim.,Lindsay Kornick,2023-02-05 21:30:03+00:00,https://www.foxnews.com/media/liberals-falsely-attack-desantis-using-associated-press-fact-check-vindicates,-1.0,0.226,0.584,0.19,-0.128
Fox News,Democratic Rep. Maxwell Frost says Florida's proposed permitless carry law is 'fascism',"Freshman Rep. Maxwell Frost, D-Fla., said that constitutional carry is ""fascism,"" while bashing Florida Governor Ron DeSantis for 2024 election rumors.",Aubrie Spady,2023-02-08 16:00:44+00:00,https://www.foxnews.com/politics/democratic-rep-maxwell-frost-says-florida-proposed-permitless-gun-carry-law-fascism,0.0,0.0,1.0,0.0,0.0
Fox News,Ron DeSantis files legal complaint against Orlando foundation for allegedly sexualizing kids with drag show,"The DeSantis administration filed a formal legal complaint against an Orlando venue for illegally exposing young children to ""lewd activity"" during a Christmas drag show.",Gabriel Hays,2023-02-04 00:00:55+00:00,https://www.foxnews.com/media/ron-desantis-files-legal-complaint-against-orlando-foundation-allegedly-sexualizing-kids-drag-show,-1.0,0.281,0.616,0.103,-0.3818
Fox News,Ron DeSantis and his family kick off Florida state fair in Tampa: Photos,"Republican Florida Gov. Ron DeSantis kicked off the state fair with his family, enjoying rides, games and snacks with his wife, youngest daughter and son.",Brandon Gillespie,2023-02-11 18:46:19+00:00,https://www.foxnews.com/politics/ron-desantis-family-kick-off-florida-state-fair-tampa-photos,1.0,0.0,0.777,0.223,0.3182
Fox News,Miami Black leaders apologize to Gov. Ron DeSantis after a member called him racist,Black leaders in Miami apologized to Florida Gov. Ron DeSantis after one of its members called him a racist in response to his actions related to content in schools.,Patrick Hauf,2023-02-05 16:52:25+00:00,https://www.foxnews.com/politics/miami-black-leaders-apologize-gov-ron-desantis-member-called-him-racist,-1.0,0.299,0.597,0.104,-0.5574
Fox News,DeSantis' office rips 'The View' host for her 'dishonest and incorrect' claim he's 'erasing' Black history,"Alyssa Farah Griffin falsely claimed that Gov. Ron DeSantis, R-Fla., has banned the teaching of slavery and the Civil War on ""The View"" Thursday.",Joseph Wulfsohn,2023-02-10 11:30:04+00:00,https://www.foxnews.com/media/desantis-office-rips-view-host-dishonest-incorrect-claim-erasing-black-history,-1.0,0.236,0.764,0.0,-0.5719
Fox News,'The View' host admits she was wrong to claim DeSantis is ‘erasing’ Black history,"Alyssa Farah Griffin took to Twitter and acknowledged she ""got tripped up"" about Florida Gov. Ron DeSantis' opposition to the AP African American History course.",Joseph Wulfsohn,2023-02-10 19:00:00+00:00,https://www.foxnews.com/media/the-view-host-admits-wrong-claim-desantis-erasing-black-history,-1.0,0.233,0.602,0.165,-0.2263
Fox News,DeSantis and Trump top Biden in potential 2024 showdown in battleground Nevada: poll,Republican Florida Gov. Ron DeSantis and former President Trump both top President Biden in the key western swing state of Nevada in hypothetical 2024 election matchups.,Andrew Murray,2023-02-10 16:34:53+00:00,https://www.foxnews.com/politics/desantis-trump-top-biden-potential-2024-showdowns-battleground-nevada-poll,-1.0,0.216,0.64,0.144,-0.2263
Fox News,"DeSantis tied with Trump, everyone else far behind in fresh 2024 GOP presidential primary poll",Florida Gov. Ron DeSantis and former President Donald Trump are tied with the rest of the potential field of Republican presidential contenders far behind in a new national 2024 poll,Paul Steinhauser,2023-02-09 16:26:47+00:00,https://www.foxnews.com/politics/desantis-tied-trump-everyone-else-far-behind-2024-gop-presidential-primary-poll,1.0,0.0,0.839,0.161,0.3182
Fox News,Bill Maher urges DeSantis 'wait' 'til Trump is 'dead... politically' to run for president,"HBO host Bill Maher suggested to Florida Gov. Ron DeSantis that he sit out the 2024 election cycle to avoid having a ""bloody"" battle with former President Donald Trump.",Joseph Wulfsohn,2023-02-11 05:07:14+00:00,https://www.foxnews.com/media/bill-maher-urges-desantis-wait-til-trump-dead-politically-run-president,-1.0,0.301,0.699,0.0,-0.6486
Fox News,"GOP insiders warn Nikki Haley lacks support, will have to 'prove' herself as 2024 presidential field expands","While some GOP strategists warn against underestimating Nikki Haley, others say she lacks a constituency and has a lot of work to do to ""prove"" herself in the 2024 presidential race.",Kyle Morris,2023-02-06 11:00:42+00:00,https://www.foxnews.com/politics/gop-insiders-warn-nikki-haley-lacks-support-prove-herself-2024-presidential-field-expands,1.0,0.097,0.621,0.283,0.4019
Fox News,"Conservatives react to Disney layoffs, say company 'will sink unless it returns to its traditional roots'","Conservatives on Twitter reacted to Disney planning to slash 7,000 jobs, pointing to the company's stances on social issues as a possible reason for its struggles.","Joe Silverstein, Lindsay Kornick",2023-02-09 12:27:08+00:00,https://www.foxnews.com/media/conservatives-react-disney-layoffs-say-company-will-sink-unless-returns-traditional-roots,0.0,0.0,1.0,0.0,0.0
Fox News,Republican Gov. Chris Sununu issues bold prediction about Trump's 2024 chances: 'He can't get it done',"Former President Donald Trump doesn't have what it takes to beat President Biden in the 2024 presidential race, Republican New Hampshire Gov. Chris Sununu said Sunday.",Anders Hagstrom,2023-02-05 18:35:48+00:00,https://www.foxnews.com/politics/republican-gov-chris-sununu-issues-bold-prediction-trumps-2024-chances-cant-get-done,1.0,0.0,0.732,0.268,0.5267
Fox News,Florida Dem credits DeSantis with giving GOP 'burst of energy' while her party needs a 'come to Jesus moment',"Democratic Rep. Sheila Cherfilus-McCormick praised two Republican leaders for changing their party and inspiring the electorate, calling for local Florida Dems to do the same.",Alexander Hall,2023-02-10 23:45:33+00:00,https://www.foxnews.com/media/florida-dem-credits-desantis-giving-gop-burst-energy-party-needs-jesus-moment,1.0,0.0,0.481,0.519,0.8271
Fox News,Florida lawmakers approve relocating migrants to sanctuary states,"A Florida bill will allow the state to transport migrants to other states, similar to when migrants were taken to Martha's Vineyard last year.",Louis Casiano,2023-02-11 00:46:54+00:00,https://www.foxnews.com/politics/florida-lawmakers-approve-relocating-migrants-sanctuary-states,0.0,0.0,1.0,0.0,0.0
Fox News,"Senate candidate Mandela Barnes, who lost, called 'almost-winner' in mocked Axios report: 'So, a loser?'","Axios labeled failed Wisconsin Democratic candidate Mandela Barnes the ""almost winner"" of last November's election, spurring Twitter users to mock the outlet.",Kristine Parks,2023-02-07 19:57:58+00:00,https://www.foxnews.com/media/senate-candidate-mandela-barnes-lost-called-almost-winner-mocked-axios-report-loser,-1.0,0.48,0.52,0.0,-0.807
Fox News,Trump-supporting billionaire battles Disney CEO Bob Iger over control of the company: report,"A board battle is brewing at Disney, as billionaire investor and Trump supporter Nelson Peltz is taking aim at the company’s returning CEO, Bob Iger.",Jeffrey Clark,2023-02-08 11:47:12+00:00,https://www.foxnews.com/media/trump-supporting-billionaire-battles-disney-ceo-bob-iger-control-company-report,-1.0,0.224,0.776,0.0,-0.3818
Fox News,Woke Grammys show 'culture wars are over and the left won' Joy Reid claims as she revels in 'total defeat',"MSNBC host Joy Reid praised the Grammy Awards on Monday as a representation of diversity, equity and imagined ""heads exploding in red states"" in her monologue.",Lindsay Kornick,2023-02-07 02:45:23+00:00,https://www.foxnews.com/media/woke-grammys-show-culture-wars-left-won-joy-reid-claims-revels-total-defeat,-1.0,0.34,0.464,0.196,-0.4215
Fox News,"Biden mocked for saying 'every time I hear' POTUS 'I look around and say where the hell is he?': 'Me too, Joe'",President Joe Biden was mocked Friday on Twitter for suggesting that he does not know that he is the President of the United States during a speech at the White House.,Joe Silverstein,2023-02-10 21:50:43+00:00,https://www.foxnews.com/media/biden-mocked-saying-every-time-hear-potus-look-around-hell-joe,-1.0,0.385,0.615,0.0,-0.7845
Fox News,Florida high school board walks back form mandating female athletes share detailed menstrual history,The Florida High School Athletic Association voted 14-2 to remove questions pertaining to menstrual information from health forms for female athletes.,Taylor Penley,2023-02-09 23:00:37+00:00,https://www.foxnews.com/media/florida-high-school-board-form-mandating-female-athletes-share-detailed-menstrual-history,1.0,0.0,0.855,0.145,0.296
Fox News,"Coffee shop named 'Woke' defended after receiving backlash, boycott calls: 'It's disgusting'","A diner in Coventry, Conn., called Woke Breakfast & Coffee received online hate and boycott calls from critics who thought it espoused a political message.",Cortney O'Brien,2023-02-05 13:30:57+00:00,https://www.foxnews.com/media/coffee-shop-named-woke-defended-receiving-backlash-boycott-calls-its-disgusting,-1.0,0.388,0.612,0.0,-0.6908
Fox News,Billionaire Koch network to oppose Trump in 2024,"The billionaire-backed, influential Koch network will oppose former President Trump in the 2024 presidential election, according to a memo released Sunday.",Patrick Hauf,2023-02-06 16:21:33+00:00,https://www.foxnews.com/politics/billionaire-koch-network-oppose-trump-2024,0.0,0.0,1.0,0.0,0.0
Fox News,MONEY TALKS: Rumored presidential hopefuls with the most cash in the bank,"Former President Donald Trump remains the only announced GOP candidate in the race for the White House, though Nikki Haley is expected to formally launch her campaign next week.",Sophia Slacik,2023-02-11 22:00:28+00:00,https://www.foxnews.com/politics/money-talks-rumored-presidential-hopefuls-most-cash-bank,0.0,0.0,1.0,0.0,0.0
Fox News,Lincoln Project mocked for posting Biden victory lap about China spy balloon: It's down 'just like inflation',The Lincoln Project was ridiculed on Twitter for a tweet praising President Biden for taking down the Chinese balloon “just like inflation” on Saturday.,Lindsay Kornick,2023-02-06 00:30:24+00:00,https://www.foxnews.com/media/lincoln-project-mocked-posting-biden-victory-lap-china-spy-balloon-like-inflation,1.0,0.146,0.696,0.158,0.0516
Fox News,NH GOP Gov. Sununu says Trump would lose to Biden in 2024,Republican New Hampshire Gov. Chris Sununu said that former President Donald Trump would be unable to defeat President Biden in an election rematch in 2024.,Patrick Hauf,2023-02-05 18:45:51+00:00,https://www.foxnews.com/politics/nh-gop-gov-sununu-trump-lose-biden-2024,1.0,0.185,0.547,0.269,0.3034
Fox News,Fauci obliterated by critics for charging up to $100k for speaking engagements: 'The audacity of this man',"Critics tore into Dr. Anthony Fauci for charging up to $100,000 for keynote speaking engagements since retiring from his position as director of NIAID.",Yael Halon,2023-02-06 12:00:31+00:00,https://www.foxnews.com/media/fauci-obliterated-critics-charging-100k-speaking-engagements-audacity-man,-1.0,0.381,0.504,0.115,-0.5719
Fox News,Chris Hayes annihilated on Twitter for stating he doesn't care about Chinese spy balloon,Twitter users blasted MSNBC anchor Chris Hayes after he tweeted that he didn't care much about a Chinese spy balloon floating in U.S. airspace.,Gabriel Hays,2023-02-04 20:05:19+00:00,https://www.foxnews.com/media/chris-hayes-annihilated-twitter-stating-doesnt-care-about-chinese-spy-balloon,-1.0,0.226,0.774,0.0,-0.3875
Fox News,Conservatives preempt Biden’s SOTU speech criticizing his leadership: 'The State of the Union = DETERIORATING’,Conservatives preempted President Biden's State of the Union address on Tuesday with their own thoughts on the state of the United States.,Joe Silverstein,2023-02-07 21:30:51+00:00,https://www.foxnews.com/media/conservatives-preempt-bidens-sotu-speech-criticizing-leadership-state-union-deteriorating,-1.0,0.2,0.8,0.0,-0.3612
Fox News,"Rep. Clyburn expects positive response to Biden's reelection bid, despite negative poll ratings",Rep. James Clyburn said Sunday he expects the U.S. will respond positively to President Biden's candidacy despite staggering poll numbers showing Americans' dissatisfaction.,Haley Chi-Sing,2023-02-05 19:19:45+00:00,https://www.foxnews.com/politics/rep-clyburn-expects-positive-response-bidens-reelection-bid-despite-negative-poll-ratings,1.0,0.0,0.602,0.398,0.7648
Fox News,"The state of the union is not strong and Biden should step aside in 2024, voters tell 'Fox & Friends'","A panel of Republican, Democratic and moderate voters voiced concerns about the country and President Biden's fitness for office on ""Fox & Friends"" Tuesday.",Amy Nelson,2023-02-07 19:00:03+00:00,https://www.foxnews.com/media/state-union-strong-biden-should-step-aside-2024-voters-tell-fox-friends,1.0,0.0,0.61,0.39,0.7506
Fox News,"Gigi Sohn's FCC nomination is in trouble because of her radical views, being gay has nothing to do with it","LGBT groups say that Gigi Sohn, President Biden's nominee for a seat on the FCC, is in a tough confirmation fight because she's gay. We say that her qualifications, views are the reason.",Charles Moran,2023-02-10 11:00:45+00:00,https://www.foxnews.com/opinion/gigi-sohns-fcc-nomination-trouble-because-radical-views-being-gay-nothing,-1.0,0.252,0.748,0.0,-0.4019
Fox News,Florida State University has been seized by the DEI bureaucracy,"The DEI ideology that is ""diversity, equity and inclusion"" has burrowed into Florida State University. This ideology pervades almost every department and the institution.",Christopher Rufo,2023-02-06 18:52:18+00:00,https://www.foxnews.com/opinion/florida-state-university-seized-dei-bureaucracy,0.0,0.0,1.0,0.0,0.0
Fox News,Nikki Haley teases expected 2024 announcement in fiery video: ‘Where will you stand?’,Nikki Haley is teasing what is expected to be a 2024 White House run next week with a new teaser video that cites her past as a leader at the U.N. and as governor.,Adam Shaw,2023-02-08 11:00:58+00:00,https://www.foxnews.com/politics/nikki-haley-teases-expected-2024-announcement-in-fiery-video-where-will-you-stand,-1.0,0.365,0.635,0.0,-0.5574
Fox News,"Nikki Haley not to be ‘underestimated’ in bid for president, former South Carolina GOP officials say","As Nikki Haley begins a 2024 campaign for the GOP primary, South Carolina Republican insiders say her personal campaigning style and career achievements will win over voters across America",Kyle Morris,2023-02-11 20:12:47+00:00,https://www.foxnews.com/politics/nikki-haley-not-to-be-underestimated-in-bid-for-president-former-south-carolina-gop-officials-say,-1.0,0.174,0.826,0.0,-0.2732
Fox News,The endgame for University of South Florida's radical racial reeducation plan,The University of South Florida's sprawling diversity bureaucracy has adopted a left-wing ideology that creeps into the entire academy. What we uncovered is very troubling.,Christopher Rufo,2023-02-10 17:40:55+00:00,https://www.foxnews.com/opinion/endgame-university-south-florida-radical-racial-reeducation-plan,0.0,0.0,1.0,0.0,0.0
MSNBC,Charge from DeSantis’ elections office leads to partial acquittal,Gov. Ron DeSantis’ election crimes office arrested 20 Floridians. Most of the prosecutions haven't gone especially well.,Steve Benen,2023-02-09 17:46:02+00:00,https://www.msnbc.com/rachel-maddow-show/maddowblog/charge-desantis-elections-office-leads-partial-acquittal-rcna69934,0.0,0.0,1.0,0.0,0.0
MSNBC,"The feud between Trump, DeSantis is already taking an ugly turn","Donald Trump offensive against Ron DeSantis began months ago in an underwhelming way. Now, the former president is taking matters in an ugly new direction.",Steve Benen,2023-02-08 17:34:45+00:00,https://www.msnbc.com/rachel-maddow-show/maddowblog/feud-trump-desantis-already-taking-ugly-turn-rcna69743,-1.0,0.487,0.513,0.0,-0.6908
MSNBC,Trump is the latest Republican to avoid his most notable success,"Ahead of their national campaigns, Mitt Romney, Marco Rubio, and Donald Trump couldn't brag about their biggest victories. The GOP base wouldn't allow it.",Steve Benen,2023-02-06 17:57:02+00:00,https://www.msnbc.com/rachel-maddow-show/maddowblog/trump-latest-republican-avoid-notable-success-rcna69345,1.0,0.222,0.404,0.374,0.3612
MSNBC,This Sarah Huckabee Sanders subtext should be very concerning — for Republicans,"Sarah Sanders' Republican State of the Union response contrasted with Biden's speech, which focused on the economy, social security, police and assault weapons.",James Downie,2023-02-08 15:51:05+00:00,https://www.msnbc.com/opinion/msnbc-opinion/sarah-sanders-republican-state-union-response-was-dark-rcna69637,0.0,0.0,1.0,0.0,0.0
MSNBC,The GOP's 2024 race to the bottom has already begun,"Donald Trump and Ron DeSantis are leading the Republican Party ahead of the 2024 election on education, critical race theory, and transgender youth, sadly.",Hayes Brown,2023-02-04 11:00:00+00:00,https://www.msnbc.com/opinion/msnbc-opinion/trump-desantis-compete-lead-rights-culture-wars-rcna69015,0.0,0.0,1.0,0.0,0.0
NBC News,Florida to place leadership of Disney's special operating district under DeSantis' control,"Florida lawmakers have approved a bill that makes changes to Disney's Reedy Creek Special Improvement District, including replacing its board of supervisors.",Rob Wile,2023-02-10 19:41:38+00:00,https://www.nbcnews.com/business/business-news/disney-reedy-creek-under-florida-state-control-rcna69485,1.0,0.0,0.748,0.252,0.4019
NBC News,Trump escalates his attacks on Ron DeSantis as a 2024 clash brews,"Former President Donald Trump is branding Florida Gov. Ron DeSantis as a RINO and raising questions about his past — efforts DeSantis describes as a ""smear.""",Henry J. Gomez and Adam Edelman,2023-02-09 02:07:30+00:00,https://www.nbcnews.com/politics/2024-election/trump-escalates-attacks-ron-desantis-2024-clash-brews-rcna69712,-1.0,0.293,0.707,0.0,-0.4404
NBC News,DeSantis tries to revoke Orlando Philharmonic's liquor license over drag show,Florida Gov. Ron DeSantis filed a complaint against the Orlando Philharmonic Plaza Foundation over a Christmas drag show.,Jo Yurcaba,2023-02-07 19:52:44+00:00,https://www.nbcnews.com/nbc-out/out-politics-and-policy/desantis-tries-revoke-orlando-philharmonics-liquor-license-drag-show-rcna69522,-1.0,0.192,0.808,0.0,-0.2263
NBC News,Florida to consider expanding DeSantis' migrant flight program in special session,The Florida Legislature is set to consider expanding Gov. Ron DeSantis' program that was used to fly dozens of migrants from Texas to Martha’s Vineyard.,Zoë Richards,2023-02-04 00:31:30+00:00,https://www.nbcnews.com/politics/immigration/florida-consider-expanding-desantis-migrant-flight-program-rcna69100,1.0,0.0,0.748,0.252,0.4019
NBC News,DeSantis skips White House event as he and Biden draw 2024 battle lines,Florida Gov. Ron DeSantis skipped an event at the White House Friday as he and President Joe Biden draw battle lines ahead of the 2024 presidential election.,Peter Nicholas and Mike Memoli and Carol E. Lee and Ali Vitali,2023-02-10 22:08:07+00:00,https://www.nbcnews.com/politics/2024-election/desantis-skips-white-house-event-biden-draw-2024-battle-lines-rcna70181,-1.0,0.224,0.776,0.0,-0.3818
NBC News,Trump frustrated with a powerful conservative group after its outreach to Ron DeSantis,"Donald Trump is frustrated with conservative group Turning Point USA and founder Charlie Kirk after outreach to Gov. Ron DeSantis, say people close to Trump.",Allan Smith and Vaughn Hillyard,2023-02-10 16:39:07+00:00,https://www.nbcnews.com/politics/2024-election/trump-frustrated-conservative-group-turning-point-usa-rcna69564,1.0,0.256,0.376,0.368,0.128
NBC News,Florida Legislature expands Ron DeSantis' program to fly migrants to blue states,Florida lawmakers passed a bill Friday expanding a program used to fly migrants to Democratic-led cities and states.,Adam Edelman and Amanda Terkel and Zoë Richards,2023-02-10 16:25:47+00:00,https://www.nbcnews.com/politics/politics-news/florida-legislature-expands-ron-desantis-program-fly-migrants-blue-sta-rcna69747,1.0,0.0,0.865,0.135,0.1027
NBC News,Biden heads to Trump and DeSantis' backyard after clashing with Republicans on entitlements,"President Joe Biden heads to Florida on Thursday, taking his post-State of the Union roadshow directly to the epicenter of the Republican Party.",Ginger Gibson,2023-02-09 12:09:47+00:00,https://www.nbcnews.com/politics/white-house/biden-heads-trump-desantis-backyard-clashing-republicans-entitlements-rcna69729,0.0,0.0,1.0,0.0,0.0
NBC News,Afro Latino scholars and activists slam Gov. DeSantis' dissection of AP African American studies,Afro Latino educators say.Florida's rejection of AP African American studies undermines student learning in a multicultural world and the history of Black Latinos.,Suzanne Gamboa,2023-02-04 11:00:00+00:00,https://www.nbcnews.com/news/latino/afro-latinos-desantis-black-ap-studies-rcna69036,-1.0,0.191,0.809,0.0,-0.3818
NBC News,Frustrated Florida parents resolve to teach Black history to their kids,"Florida's banning of books on race, racism and LBGTQ issues and its rejection of an AP African American Studies course has caused an uproar among Black parents.",Curtis Bunn,2023-02-09 18:18:41+00:00,https://www.nbcnews.com/news/nbcblk/parents-florida-inspired-teach-black-history-kids-ap-course-banned-rcna69769,-1.0,0.283,0.5,0.217,-0.2023
NBC News,New Hampshire Gov. Chris Sununu takes a major step toward running for president,"New Hampshire Gov. Chris Sununu has taken his most significant step yet in exploring a White House bid, launching a national political organization.",Natasha Korecki and Jonathan Allen,2023-02-08 20:36:41+00:00,https://www.nbcnews.com/politics/2024-election/gov-chris-sununu-takes-major-step-running-president-rcna69751,0.0,0.0,1.0,0.0,0.0
NBC News,Roberto Clemente book removed from Florida public schools pending review over discrimination references,A book about late Afro-Puerto Rican MLB legend Roberto Clemente can't be found in the shelves of public school libraries in Florida's Duval County these days.,Nicole Acevedo,2023-02-10 23:45:04+00:00,https://www.nbcnews.com/news/latino/roberto-clemente-book-removed-florida-public-schools-rcna70081,0.0,0.0,1.0,0.0,0.0
NBC News,Gloves off: Conservatives fight the NHL in a culture war clash,The National Hockey League finds itself on thin ice with some conservatives as a new target in the U.S. culture war.,Allan Smith,2023-02-04 15:05:21+00:00,https://www.nbcnews.com/politics/politics-news/nhl-conservatives-face-culture-war-clash-rcna67087,-1.0,0.565,0.435,0.0,-0.7579
NBC News,Koch network draws early battle lines against Trump in 2024,"The conservative political network founded by the billionaire Koch brothers, has already picked a side for '24, and it's a candidate other than Trump.","Chuck Todd, Mark Murray, Ben Kamisar, Bridget Bowman, Alexandra Marquez",2023-02-06 13:37:45+00:00,https://www.nbcnews.com/meet-the-press/first-read/koch-network-draws-early-battle-lines-trump-2024-rcna69279,-1.0,0.271,0.729,0.0,-0.3818
Newsweek,Ron DeSantis Praises Lawyer Suing Trump's Biggest Allies,"""DeSantis hosting Dominion lawyer Libby Locke! He is showing his true colors!"" MyPillow CEO Mike Lindell said.",Matthew Impelli,2023-02-07 17:46:54+00:00,https://www.newsweek.com/ron-desantis-praises-lawyer-suing-trump-allies-1779594,1.0,0.183,0.522,0.296,0.3182
Newsweek,Trump Amplifies Rumor About Ron DeSantis and High School Girls,"On Tuesday, the former president shared images allegedly depicting the governor with underaged girls at a high school party.",Katherine Fung,2023-02-08 19:05:40+00:00,https://www.newsweek.com/trump-amplifies-rumor-ron-desantis-high-school-girls-1779918,0.0,0.0,1.0,0.0,0.0
Newsweek,Ron DeSantis and the Path to GOP Victory in 2024 | Opinion,The idea of a Donald Trump-vs-Ron DeSantis GOP primary showdown is already getting major media play.,Scott Morefield,2023-02-08 11:00:01+00:00,https://www.newsweek.com/ron-desantis-path-gop-victory-2024-opinion-1779303,0.0,0.0,1.0,0.0,0.0
Newsweek,'Unhinged' Mike Lindell Rant Targets DeSantis Election Results,"""You just as well should endorse Donald Trump right now and save face,"" the MyPillow CEO said to Florida Governor Ron DeSantis.",Nick Mordowanec,2023-02-08 20:21:32+00:00,https://www.newsweek.com/mike-lindell-pushes-election-deniers-against-florida-governor-ron-desantis-1779945,-1.0,0.255,0.745,0.0,-0.34
Newsweek,Trump's Connection to Jeffrey Epstein Explained by Roger Stone,Talk about Trump's ties to Epstein reemerged this week after the ex-president reshared a Truth Social post accusing Governor Ron DeSantis of grooming minors.,Andrew Stanton,2023-02-11 17:51:42+00:00,https://www.newsweek.com/trumps-connection-jeffrey-epstein-explained-roger-stone-1780590,0.0,0.0,1.0,0.0,0.0
