source,title,description,author,publishedAt,url,sentimentScore,neg,neu,pos,compound
Newsweek,Ron DeSantis Accused of 'Massive Capitulation' to Disney Over Reedy Creek,The Florida governor hopes to limit the company's powers over the land its resort occupies. But conservatives have said a new bill does not go far enough.,Aleks Phillips,2023-02-07 14:48:08+00:00,https://www.newsweek.com/ron-desantis-accused-massive-capitulation-disney-reedy-creek-florida-1779516,-1.0,0.216,0.784,0.0,-0.296
Newsweek,Trump Shares DeSantis 'Grooming' Accusation Just as Governor Defends Him,"Trump shared a meme accusing his potential 2024 GOP rival DeSantis of ""grooming high school girls with alcohol as a teacher"" on Tuesday.",Aila Slisco,2023-02-08 00:22:56+00:00,https://www.newsweek.com/donald-trump-shares-ron-desantis-grooming-accusation-meme-governor-defends-him-1779639,1.0,0.179,0.625,0.196,0.0516
Newsweek,DeSantis Preferred to Trump by Nearly Every Key GOP Demographic–2024 Poll,"The Florida governor has not confirmed his intentions to run for president, but GOP voters already back him over Trump in a Monmouth survey of 566 Republicans.",Ewan Palmer,2023-02-10 10:49:40+00:00,https://www.newsweek.com/trump-desantis-president-2024-poll-monmouth-1780349,0.0,0.0,1.0,0.0,0.0
Newsweek,Trump Responds to Meme Saying He's the 'Savior of Western Civilization',"The former president thanked the person who posted the meme and wrote that ""we have a long way to go.""",Darragh Roche,2023-02-10 12:31:40+00:00,https://www.newsweek.com/trump-meme-savior-western-civilization-1780370,0.0,0.0,1.0,0.0,0.0
Newsweek,Trump Rages Over Being Left Out of Conservative Event,"Trump slammed the Club for Growth as ""an assemblage of political misfits, globalists, and losers"" after the group left him off their annual guest list.",Katherine Fung,2023-02-07 19:29:41+00:00,https://www.newsweek.com/trump-rages-left-out-conservative-event-1779604,-1.0,0.307,0.693,0.0,-0.4767
Newsweek,Donald Trump Finds Himself Financially Outgunned Before Primary Battle,The former president has lost the support of billionaire Charles Koch and other top megadonors who want a different GOP presidential candidate in 2024.,Ewan Palmer,2023-02-06 13:00:17+00:00,https://www.newsweek.com/trump-gop-donaors-charles-koch-2024-1779174,-1.0,0.245,0.755,0.0,-0.3818
Newsweek,Is America Ready for a Female Republican President? | Opinion,"Haley does something the Left has hounded conservatives for failing to do, and that's represent the underrepresented.",Nicole Russell,2023-02-07 11:00:01+00:00,https://www.newsweek.com/america-ready-female-republican-president-opinion-1778916,1.0,0.0,0.706,0.294,0.3612
Newsweek,Trump Envisions What 'Joe Biden's America' Looked Like From Spy Balloon,"In his latest political ad, the former president speculated what America could have looked like from the Chinese spy device that passed over the U.S. last week.",Kaitlin Lewis,2023-02-07 05:55:06+00:00,https://www.newsweek.com/trump-envisions-what-joe-bidens-america-looked-like-spy-balloon-1779368,1.0,0.0,0.8,0.2,0.3612
Newsweek,Trump Lashes Out as a Powerful Network of Donors Disappears,"Trump denounced ""globalists"" while insisting that he did not want donations from a group led by conservative billionaire Charles Koch.",Aila Slisco,2023-02-09 23:41:08+00:00,https://www.newsweek.com/donald-trump-lashes-out-powerful-network-donors-disappears-1780275,1.0,0.235,0.49,0.275,0.1027
Newsweek,Joe Biden's Chances of Winning in 2024 Boosted After State of the Union,A leading bookmaker told Newsweek that Biden is now favored to win in 2024 over Donald Trump.,James Bickerton,2023-02-09 12:45:15+00:00,https://www.newsweek.com/joe-biden-chances-winning-2024-after-state-union-1780104,1.0,0.0,0.438,0.562,0.7717
Newsweek,Donald Trump and Joe Biden Finally Agree on Something,"Trump is looking to outflank his opponents on cuts to entitlement spending like Medicare and Social Security, knifing his political rivals in the process.",Nick Reynolds,2023-02-10 15:44:25+00:00,https://www.newsweek.com/donald-trump-joe-biden-finally-agree-something-1780446,1.0,0.0,0.706,0.294,0.3612
Newsweek,Can GOP's Culture War Gamble Help it Win in 2024?,"Republicans are doubling down on the culture wars ahead of 2024 presidential primaries in the hope an ""anti-woke"" message will resonate in mainstream America.",Paul Bond,2023-02-09 19:52:51+00:00,https://www.newsweek.com/can-gops-culture-war-gamble-help-it-win-2024-1775914,1.0,0.253,0.325,0.422,0.3818
Newsweek,Republicans' Big Hopes For Attacking Joe Biden Spectacularly Unraveled,Democrats on the new House subcommittee grilled witnesses and questioned the purpose of the panel's probe.,Darragh Roche,2023-02-10 11:24:35+00:00,https://www.newsweek.com/republicans-big-hopes-attacking-joe-biden-spectacularly-unraveled-1780321,-1.0,0.234,0.547,0.219,-0.0516
Newsweek,Biden 2024 Win Would Dissatisfy More Voters Than Trump Reelection: Poll,"Democrats and Republicans are pining for alternative candidates to run for president in 2024, according to a new polling data.",Andrew Stanton,2023-02-05 17:31:57+00:00,https://www.newsweek.com/biden-2024-win-would-dissatisfy-more-voters-trump-reelection-poll-1779045,1.0,0.2,0.562,0.237,0.1531
Newsweek,"Following State Of The Union, Dems Push Biden To Launch Reelection Bid","""He should move as quickly as possible,"" a Democratic strategist told Newsweek. """"I think Biden's going to be very tough to beat.""",Daniel Bush,2023-02-09 17:03:28+00:00,https://www.newsweek.com/following-state-union-dems-push-biden-launch-reelection-bid-1779993,0.0,0.0,1.0,0.0,0.0
Newsweek,Taking the Long View: Viktor Orbán and Realpolitik | Opinion,"Orbán's frank discussion of the war in Ukraine reflected a deep, nuanced, and historically informed understanding of Russian behavior, motivations, and tactics.",Alvino-Mario Fantini,2023-02-07 11:00:01+00:00,https://www.newsweek.com/taking-long-view-viktor-orban-realpolitik-opinion-1779228,0.0,0.0,1.0,0.0,0.0
Newsweek,"Mississippi Republicans Want Separate Police Force for White, Black Areas",Large swaths of the Blackest city in the U.S. could soon be covered by a separate justice system appointed by predominantly White officials.,Nick Reynolds,2023-02-10 22:59:41+00:00,https://www.newsweek.com/mississippi-republicans-want-separate-police-force-white-black-areas-1780541,1.0,0.0,0.86,0.14,0.0772
Newsweek,Trump's First 2024 Challenger Targets His Greatest Asset,"""Trump, in all due deference, is a real estate builder of large buildings,"" Steve Laffey told Newsweek. ""If we need to build some buildings, we'll call him.""",Katherine Fung,2023-02-10 17:38:44+00:00,https://www.newsweek.com/donald-trump-steve-laffey-2024-challenger-targets-greatest-asset-1780477,1.0,0.0,0.379,0.621,0.802
Reuters,"DeSantis seeks wins on guns, abortion before facing Trump in 2024","Published by Reuters By James Oliphant TALLAHASSEE, Fla. (Reuters) -When a newly elected Florida legislator endorsed a bill allowing residents to carry a concealed firearm without a permit, he was both demonstrating his fealty to Ron DeSantis and helping to b…",Towleroad,2023-02-11 17:48:05+00:00,"http://rmb.reuters.com/rmd/rss/item/tag:reuters.com,2023:newsml_KBN2UK0UE:3?channel=FES376",1.0,0.0,0.654,0.346,0.5719
Reuters,Florida governor assumes control over Disney district board,"Published by Reuters By Dawn Chmielewski (Reuters) – Florida lawmakers granted Governor Ron DeSantis effective control of the board that oversees development in and around Walt Disney Co’s central Florida theme parks, escalating the Republican’s battle with t…",Towleroad,2023-02-10 19:20:06+00:00,"http://rmb.reuters.com/rmd/rss/item/tag:reuters.com,2023:newsml_KBN2UK1QC:2?channel=FES376",0.0,0.0,1.0,0.0,0.0
Reuters,New Hampshire Governor Sununu 'definitely thinking' about White House run | Reuters,"Republican New Hampshire Governor Chris Sununu said on Sunday he is considering running for U.S. president in 2024, adding that he believes Donald Trump would lose to Democratic President Joe Biden if the former president secures his party's nomination.",,2023-02-05 16:47:14+00:00,https://www.reuters.com/world/us/new-hampshire-governor-sununu-definitely-thinking-about-white-house-run-2023-02-05/,1.0,0.0,0.769,0.231,0.4019
Reuters,Florida lawmakers give DeSantis authority to relocate migrants anywhere in U.S.,"Florida's legislature on Friday voted to give Governor Ron DeSantis the power to relocate migrants anywhere in the United States, expanding a controversial initiative the Republican used last year to fly migrants from Texas to Massachusetts.",,2023-02-10 16:46:45+00:00,https://www.reuters.com/world/us/florida-lawmakers-give-desantis-authority-relocate-migrants-anywhere-us-2023-02-10/,1.0,0.0,0.86,0.14,0.0772
Reuters,"Before facing Trump in 2024, DeSantis seeks wins on guns, abortion","When a newly elected Florida legislator endorsed a bill allowing residents to carry a concealed firearm without a permit, he was both demonstrating his fealty to Ron DeSantis and helping to burnish the governor's conservative credentials for a possible White …",,2023-02-10 11:07:53+00:00,https://www.reuters.com/world/us/before-facing-trump-2024-desantis-seeks-wins-guns-abortion-2023-02-10/,1.0,0.0,0.684,0.316,0.5719
Reuters,Florida governor assumes control over Disney district board,"Florida lawmakers granted Governor Ron DeSantis effective control of the board that oversees development in and around Walt Disney Co's <a href=""https://www.reuters.com/companies/DIS.N"" target=""_blank"">(DIS.N)</a> central Florida theme parks, escalating the R…",,2023-02-10 18:50:57+00:00,https://www.reuters.com/business/media-telecom/florida-governor-assumes-control-over-disney-district-board-2023-02-10/,0.0,0.0,1.0,0.0,0.0
Reuters,Abortion battles in U.S. state capitols to watch in 2023,Battles over abortion are heating up in state capitol buildings across the United States as lawmakers wrestle with how much to restrict or expand abortion access after the U.S. Supreme Court overturned Roe v. Wade last year.,,2023-02-09 11:19:52+00:00,https://www.reuters.com/world/us/abortion-battles-us-state-capitols-watch-2023-2023-02-09/,-1.0,0.302,0.698,0.0,-0.3818
RT,Trump trails a popular governor in 2024 Republican race,Poll shows Florida Governor Ron DeSantis leading former US President Donald Trump in race for the 2024 Republican presidential nomination Read Full Article at RT.com,RT,2023-02-08 22:38:06+00:00,https://www.rt.com/news/571202-desantis-leads-trump-2024-poll/,1.0,0.0,0.682,0.318,0.4215
RT,Top Republican donors issue hint over 2024 presidential race – memo,"Americans for Prosperity wants to “help” voters “move on” in 2024, a message to staff and affiliates claims Read Full Article at RT.com",RT,2023-02-06 16:15:13+00:00,https://www.rt.com/news/571053-koch-network-considers-alternative-trump/,1.0,0.0,0.816,0.184,0.2023
The American Conservative,Sheriff DeSantis & The New Right-Populism,"Florida governor pioneering the next conservatism. The Left's narrative blinders makes it unable to see what's coming
The post Sheriff DeSantis & The New Right-Populism appeared first on The American Conservative.",Rod Dreher,2023-02-09 17:16:28+00:00,https://www.theamericanconservative.com/sheriff-desantis-the-new-right-populism/,0.0,0.0,1.0,0.0,0.0
The American Conservative,The Born Loser,"Nikki Haley is going to lose. She knows she’s going to lose. That doesn’t mean it won’t be fun to watch.
The post The Born Loser appeared first on The American Conservative.",Declan Leary,2023-02-04 05:05:00+00:00,https://www.theamericanconservative.com/the-born-loser/,-1.0,0.63,0.37,0.0,-0.5267
The American Conservative,Protecting the Vulnerable,"Crisis pregnancy centers need more than another grant program; they need the full protection of the law.
The post Protecting the Vulnerable appeared first on The American Conservative.",Carmel Richardson,2023-02-10 05:03:00+00:00,https://www.theamericanconservative.com/protecting-the-vulnerable/,-1.0,0.655,0.345,0.0,-0.2263
The Hill,Trump rips Club for Growth after he wasn’t invited to donor retreat,"Former President Donald Trump lashed out on Tuesday against the Club for Growth, a leading conservative group, after he was left off the guest list of its...",Max Greenwood,2023-02-07 20:28:31+00:00,https://thehill.com/homenews/campaign/3847759-trump-rips-club-for-growth-after-he-wasnt-invited-to-donor-retreat/,1.0,0.156,0.589,0.255,0.2519
The Hill,Eight Republicans who could challenge Trump in 2024,The possibility of a crowded GOP presidential primary in 2024 has grown likelier in recent days following reports that former U.S. Ambassador to the U.N...,Caroline Vakil,2023-02-04 11:00:00+00:00,https://thehill.com/homenews/campaign/3842885-eight-republicans-who-could-challenge-trump-in-2024/,1.0,0.0,0.794,0.206,0.0772
The Wall Street Journal,Florida Lawmakers Move to Take Over DISNEY's Special-Tax District...,"If approved, bill would give Gov. Ron DeSantis the power to appoint members to oversee the district, instead of eliminating it, as governor had pledged",Robbie Whelan,2023-02-06 21:58:38+00:00,https://www.wsj.com/articles/florida-lawmakers-move-to-take-over-disneys-special-tax-district-11675717239,0.0,0.0,1.0,0.0,0.0
The Washington Post,Sarah Huckabee Sanders’s strange ‘woke’ rant reveals a big GOP problem,How Gov. Sarah Huckabee Sanders showed the limits of reactionary culture-warring.,"Paul Waldman, Greg Sargent",2023-02-08 20:34:29+00:00,https://www.washingtonpost.com/opinions/2023/02/08/sarah-huckabee-sanders-sotu-response-biden-woke-ron-desantis/,-1.0,0.496,0.504,0.0,-0.7096
The Washington Post,"Sorry, Republicans, no one should trust your word on Social Security",Republicans are livid over Biden's criticism and say we should believe what they say. But actions will speak louder than words.,Paul Waldman,2023-02-10 20:47:55+00:00,https://www.washingtonpost.com/opinions/2023/02/10/republicans-social-security-medicare/,1.0,0.118,0.364,0.518,0.6597
The Washington Post,"If not Biden, then who?",Democrats are even less sold on Biden running again than Republicans are on Trump. But it matters that the party lacks any potential rival akin to DeSantis.,Aaron Blake,2023-02-08 19:58:44+00:00,https://www.washingtonpost.com/politics/2023/02/08/democrats-biden-alternatives-2024/,0.0,0.0,1.0,0.0,0.0
The Washington Post,"When Republicans rant about ‘socialism,’ remember the Affordable Care Act",The lowest uninsured rate ever is something to celebrate.,Jennifer Rubin,2023-02-05 15:00:00+00:00,https://www.washingtonpost.com/opinions/2023/02/05/aca-health-insurance-coverage-republicans-socialism/,1.0,0.207,0.517,0.276,0.2023
The Washington Post,Biden’s economic success may reset the 2024 race,A still-humming economy puts Biden in the driver's seat for reelection.,Jennifer Rubin,2023-02-06 12:45:00+00:00,https://www.washingtonpost.com/opinions/2023/02/06/biden-economic-success-2024/,1.0,0.0,0.619,0.381,0.5719
The Washington Post,GOP hopefuls’ past positions on Social Security loom over 2024 primary,"Donald Trump is going after Ron DeSantis and other potential GOP rivals, seizing on the same divisions over federal spending President Biden is seeking to exploit.",Isaac Arnsdorf,2023-02-09 10:00:00+00:00,https://www.washingtonpost.com/politics/2023/02/09/trump-desantis-biden-social-security-medicare/,1.0,0.168,0.619,0.212,0.128
The Washington Post,"DeSantis wanted to ban guns at event, but not to be blamed, emails show","Tampa officials received a request to ban guns at Florida Gov. Ron DeSantis's election night party, a city official said in emails.",Beth Reinhard,2023-02-10 17:26:54+00:00,https://www.washingtonpost.com/politics/2023/02/10/desantis-campaign-emails-gun-free-event/,-1.0,0.528,0.472,0.0,-0.7717
The Washington Post,"Biden targets top Florida Republicans DeSantis, Scott over health care in Tampa stop",President Biden took aim at two of Florida’s most prominent Republicans — Gov. Ron DeSantis and Sen. Rick Scott — as he visited the state Thursday to pitch his economic agenda while vowing vowed to protect the programs crucial to seniors and the poor — Medica…,John Wagner,2023-02-09 19:54:23+00:00,https://www.washingtonpost.com/politics/2023/02/09/biden-florida-republicans-medicare-social-security/,1.0,0.145,0.526,0.329,0.4215
The Washington Post,The two questions that will decide DeSantis’s likely 2024 bid,Can DeSantis survive the imminent onslaught of attacks? Can he keep the non-Trump lane to himself?,Philip Bump,2023-02-09 19:00:06+00:00,https://www.washingtonpost.com/politics/2023/02/09/trump-desantis-republicans-2024/,0.0,0.0,1.0,0.0,0.0
The Washington Post,Charlie Kirk’s right-wing empire loses a key asset: Students for Trump,The split shows how Turning Point USA and its affiliates are wrestling with their identity as parts of the GOP seek out a Trump alternative.,Isaac Stanley-Becker,2023-02-08 11:00:21+00:00,https://www.washingtonpost.com/politics/2023/02/08/charlie-kirk-students-for-trump/,1.0,0.195,0.593,0.212,0.0516
The Washington Post,"Democratic governors, seeing rising threats, look beyond their borders",Democratic state leaders see a federal government hamstrung to protect rights and see red-state governors pushing to restrict those rights.,Dan Balz,2023-02-11 20:26:22+00:00,https://www.washingtonpost.com/politics/2023/02/11/democrats-republicans-culture-wars/,-1.0,0.286,0.714,0.0,-0.4215
The Washington Post,Florida details months of complaints about AP African American studies course,"Florida’s education department had been privately complaining to the College Board for months about a new Advanced Placement African American Studies course before it released revisions that critics saw as a caving to political pressure, according to a timeli…",Laura Meckler,2023-02-09 20:35:52+00:00,https://www.washingtonpost.com/education/2023/02/09/florida-ap-african-american-studies-complaints-college-board/,-1.0,0.252,0.748,0.0,-0.4019
The Washington Post,Trump plays catch-up with GOP rivals on fights over race and gender in schools,"Some conservatives say they see Trump as a latecomer on this front, where state-level leaders wield more power and his record as president was thinner by comparison.",Hannah Knowles,2023-02-10 10:00:00+00:00,https://www.washingtonpost.com/politics/2023/02/10/trump-schools-desantis-youngkin-gender-race-2024/,-1.0,0.231,0.598,0.171,-0.1779
The Washington Post,Republican leaders deploy the First Amendment against the First Amendment,"In a pair of events this week, Republican officials used the First Amendment as a pretext for advocating restrictions to its freedoms.",Philip Bump,2023-02-09 16:26:27+00:00,https://www.washingtonpost.com/politics/2023/02/09/first-amendment-media-republicans-desantis-twitter/,0.0,0.0,1.0,0.0,0.0
The Washington Post,Fla. woman forced to fly to D.C. for abortion returns for State of the Union,Anabely Lopes was 15 weeks pregnant last year when doctors told her that her fetus had a fatal birth defect that would result in death within days of birth.,Timothy Bella,2023-02-07 16:10:28+00:00,https://www.washingtonpost.com/politics/2023/02/07/state-of-union-abortion-florida-anabely-lopes/,-1.0,0.273,0.727,0.0,-0.4588
The Washington Post,Biden and Scott clash over Social Security as president visits Florida,The president and the GOP senator sharpen their debate over the popular program as Biden heads to Scott's home state of Florida.,Toluse Olorunnipa,2023-02-09 20:16:59+00:00,https://www.washingtonpost.com/politics/2023/02/09/biden-scott-florida-social-security/,1.0,0.0,0.745,0.255,0.34
Time,How Biden Got Republicans To Run Away From Their History of Pushing Social Security and Medicare Cuts,"The GOP has bristled at Biden's attacks, but leading conservatives have pushed such cuts for decades, including Paul Ryan and Ron DeSantis.",Eric Cortellessa,2023-02-10 22:54:49+00:00,https://time.com/6254832/republicans-sunset-social-security-medicare/,1.0,0.125,0.739,0.136,0.0516
Time,What to Know About the GOP Bill That’s Putting Millions Toward Florida’s Migrant Relocation Program,Florida Governor Ron DeSantis is expected to pass a state bill that would allow Florida to transport migrants anywhere in the country.,Anisha Kohli,2023-02-11 21:44:56+00:00,https://time.com/6254895/florida-migrant-relocation-desantis/,0.0,0.0,1.0,0.0,0.0
Time,7 Things That Would Fix Immigration in the U.S.,"Democrats need to go on offense to win on immigration, write John Austin and Steve Tobocman.",John Austin and Steve Tobocman,2023-02-07 17:48:41+00:00,https://time.com/6253531/how-to-fix-immigration-us/,0.0,0.0,1.0,0.0,0.0
USA Today,College Board CEO asked to resign over AP African American Studies curriculum,"Groups cite a number of missteps over the last decade by College Board CEO David Coleman, including a current fight over AP African American Studies.","USA TODAY, Alia Wong and Nirvi Shah, USA TODAY",2023-02-11 01:14:31+00:00,https://www.usatoday.com/story/news/education/2023/02/10/ap-african-american-studies-fight-prompts-calls-college-board-ceos-ouster/11228877002/,-1.0,0.211,0.789,0.0,-0.34
USA Today,"The ignorance is the point. Kids books about Hank Aaron, Roberto Clemente get censored | Opinion","If politicians, school officials and parents think kids books about Hank Aaron and Roberto Clemente need to be censored, we're in serious trouble.","USA TODAY, Nancy Armour, USA TODAY",2023-02-11 12:18:25+00:00,https://www.usatoday.com/story/sports/columnist/nancy-armour/2023/02/11/hank-aaron-roberto-clemente-books-right-wing-culture-war-florida/11231247002/,-1.0,0.291,0.709,0.0,-0.4767
USA Today,Florida lawmakers approve Gov. Ron DeSantis' expanded migrant relocation program,The bill sets aside $10 million for Florida to hire contractors to travel the nation to find undocumented immigrants and ship them elsewhere.,"USA TODAY NETWORK, Douglas Soule, USA TODAY NETWORK",2023-02-10 19:10:01+00:00,https://www.usatoday.com/story/news/nation/2023/02/10/desantis-new-migrant-relocation-program-passes-florida-legislature/11229616002/,0.0,0.0,1.0,0.0,0.0
USA Today,Why are colleges offering up more DEI degrees? Demand for diversity expertise is growing.,"As controversy surrounding DEI initiatives mounts, at least a half-dozen U.S. colleges currently or will soon offer degree programs in the field.","USA TODAY, Alia Wong",2023-02-06 10:00:31+00:00,https://www.usatoday.com/story/news/education/2023/02/06/dei-diversity-equity-inclusion-programs-growing/11155271002/,1.0,0.147,0.686,0.167,0.0516
USA Today,"Spy balloon deepens political divide, deadly earthquake in Syria and Turkey: 5 Things podcast","Downed Chinese spy balloon deepens rift ahead of Biden's SOTU, deadly 7.8 magnitude earthquake strikes near Turkey-Syria border: 5 Things podcast","USA TODAY, Taylor Wilson, USA TODAY",2023-02-06 12:45:06+00:00,https://www.usatoday.com/story/news/nation/2023/02/06/spy-ballon-politicized-grammy-highlights-5-things-podcast/11195160002/,0.0,0.0,1.0,0.0,0.0
USA Today,Will Nikki Haley 2024 presidential race benefit Republican Party – or Donald Trump?,"Should Nikki Haley run for president? Polls show in a Donald Trump vs. Ron DeSantis presidential race, DeSantis wins. Add a rival and Trump leads.","USA TODAY, Ingrid Jacques, USA TODAY",2023-02-07 09:00:05+00:00,https://www.usatoday.com/restricted/?return=https%3A%2F%2Fwww.usatoday.com%2Fstory%2Fopinion%2Fcolumnist%2F2023%2F02%2F07%2Fnikki-haley-running-president-benefit-trump%2F11172550002%2F,1.0,0.0,0.612,0.388,0.6908
USA Today,"Sarah Huckabee Sanders attacks 'woke fantasies,' signals GOP is ready to move past Trump","Sanders, the youngest sitting governor, called for a generational change in leadership while also pushing back against Biden's liberal agenda.","USA TODAY, Ingrid Jacques, USA TODAY",2023-02-08 16:10:20+00:00,https://www.usatoday.com/story/opinion/columnist/2023/02/08/sarah-huckabee-sanders-state-union-rebuttal-among-best/11210690002/,-1.0,0.188,0.649,0.162,-0.1027
USA Today,"In Republican response to Biden's State of the Union, a vow to block the president's agenda","GOP leaders pledged to fight Biden over State of the Union topics like the debt ceiling, China, inflation, immigration, and other 2024 issues.","USA TODAY, David Jackson, USA TODAY",2023-02-08 04:53:03+00:00,https://www.usatoday.com/story/news/politics/2023/02/07/republicans-state-union-response/11150800002/,-1.0,0.244,0.756,0.0,-0.4404
Vice News,What it's Like When Ron DeSantis Takes Over Your College,Students at Florida’s tiny New College are alarmed by Gov. Ron DeSantis’ hostile takeover—and worry who his next targets will be.,"Cameron Joseph, Paul Blest, Leah Feiger, chloe angyal",2023-02-08 12:00:00+00:00,https://www.vice.com/en/article/5d37g3/ron-desantis-new-college-christopher-rufo,1.0,0.0,0.762,0.238,0.3612
Vice News,Judges Denied a 14-Year-Old’s Request for an Abortion. Twice.,"In a new report about minors denied abortions in Florida, judges evidently deemed one kid too shy to be mature enough for an abortion, and another too curt.","Carter Sherman, Leah Feiger",2023-02-09 12:00:00+00:00,https://www.vice.com/en/article/7k8gxq/judges-denied-14-year-old-abortion,-1.0,0.367,0.633,0.0,-0.4404
Vice News,GOP Megadonors Are Coming for Trump,"The Club for Growth and Koch network, two of the most powerful groups on the right, are both coming for Trump.","Cameron Joseph, Leah Feiger",2023-02-07 17:14:22+00:00,https://www.vice.com/en/article/5d37ba/trump-koch-network-club-for-growth-megadonors,0.0,0.0,1.0,0.0,0.0
