source,title,description,author,publishedAt,url,sentimentScore,neg,neu,pos,compound
Breitbart News,"Exclusive -- Vice Chair of FL GOP Christian Ziegler: Only 17,000 of the Net 1 Million Moving to the State Registered Democrat","Christian Ziegler, the vice chair of the Republican Party of Florida, who is running for the chairmanship, told Breitbart News Saturday about the successes the Sunshine State has seen over the past four years, noting that Republicans are in a strong position …","Hannah Bleau, Hannah Bleau",2023-02-04 19:40:44+00:00,https://www.breitbart.com/radio/2023/02/04/vice-chair-of-fl-gop-christian-ziegler-17000-net-1-million-moving-state-registered-democrat/,1.0,0.0,0.903,0.097,0.128
Breitbart News,Marine Veteran’s Service Dog that Inspired the PAWS Act Takes ‘Last Flight’ Home,"A service dog named Kaya, whose legacy will forever be intertwined with the federal legislation she helped pass, made the final trip of an impressive career on Southwest Airlines last week.","Michael Foster, Michael Foster",2023-02-10 01:51:31+00:00,https://www.breitbart.com/health/2023/02/09/marine-veterans-service-dog-that-inspired-the-paws-act-takes-last-flight-home/,1.0,0.0,0.758,0.242,0.4939
Breitbart News,Democrat Rep: Florida's Push to be 26th Constitutional Carry State Is 'Fascism',"Rep. Maxwell Frost (D-FL) says Republicans' push to make the Sunshine State the 26th constitutional carry state is ""fascism.""","AWR Hawkins, AWR Hawkins",2023-02-08 15:59:07+00:00,https://www.breitbart.com/2nd-amendment/2023/02/08/democrat-rep-floridas-push-to-be-26th-constitutional-carry-state-is-fascism/,0.0,0.0,1.0,0.0,0.0
Breitbart News,Major Jewish Leaders Representing Millions of Jewish Americans Call on AT&T to 'Reconsider' Decision to Remove Newsmax,"Nearly two dozen key Jewish community leaders from across the United States, representing millions of Jewish Americans, called for global telecommunications giant AT&T to “reconsider” its recent move to cancel Newsmax from its network lineup, citing the conse…",Joshua Klein,2023-02-10 19:32:56+00:00,https://www.breitbart.com/politics/2023/02/10/major-jewish-leaders-representing-millions-of-jewish-americans-call-on-att-to-reconsider-decision-to-remove-newsmax/,0.0,0.0,1.0,0.0,0.0
Breitbart News,Ron DeSantis Is About to End Disney's Unprecedented Power over the Magic Kingdom,"Disney’s government in Florida has been the envy of any private business, with its unprecedented powers in deciding what to build and how to build it at the Walt Disney World Resort, issuing bonds and holding the ability to build its own nuclear plant if it w…",Breitbart News,2023-02-08 12:41:37+00:00,https://www.breitbart.com/entertainment/2023/02/08/ron-desantis-is-about-to-end-disneys-unprecedented-power-over-the-magic-kingdom/,0.0,0.0,1.0,0.0,0.0
Breitbart News,"Report: Disney Facing Bloodbath as Thousands of Layoffs, Budget Cuts Loom","The Walt Disney Co. went woke and now it is paying the consequences, with employees bracing for a bloodbath.",David Ng,2023-02-08 13:08:35+00:00,https://www.breitbart.com/entertainment/2023/02/08/report-disney-facing-bloodbath-as-thousands-layoffs-and-other-budget-cuts-loom/,-1.0,0.369,0.631,0.0,-0.4767
Business Insider,"Chris Sununu boasts about beating Ron DeSantis in a conservative ranking: 'Sorry, Ron.'","Sununu, a potential 2024 presidential candidate, also appeared to take a swipe at DeSantis' war with Disney.",ngaudiano@insider.com (Nicole Gaudiano),2023-02-09 21:14:10+00:00,https://www.businessinsider.com/chris-sununu-boasts-about-beating-ron-desantis-in-conservative-ranking-2023-2,-1.0,0.35,0.65,0.0,-0.5106
Business Insider,DeSantis says he won't fight with Trump over Truth Social photos with high schoolers: 'I don't spend my time trying to smear other Republicans',"""I spend my time delivering results for the people of Florida and fighting against Joe Biden,"" DeSantis said during a press conference on Wednesday.",kleonard@insider.com (Kimberly Leonard),2023-02-08 17:19:57+00:00,https://www.businessinsider.com/desantis-says-he-wont-fight-trump-over-high-schoolers-photos-2023-2,-1.0,0.227,0.662,0.111,-0.3134
Business Insider,"Disney's strategy to win its battle with DeSantis is to just wait until he runs for president, says a top Florida Democrat","The Republican governor called the legislature back to Tallahassee on Monday for a special session, in part to settle the Disney dispute.",kleonard@insider.com (Kimberly Leonard),2023-02-06 20:33:08+00:00,https://www.businessinsider.com/disney-will-drag-out-desantis-feud-until-he-leaves-office-democrat-says-2023-2,1.0,0.151,0.523,0.326,0.4588
Business Insider,Florida legislators want to give DeSantis another $10 million to keep shipping migrants across the country,The bill would expand DeSantis' immigration program that he previously used to move migrants from Texas to Martha's Vineyard in September.,cpanella@insider.com (Chris Panella),2023-02-08 18:52:05+00:00,https://www.businessinsider.com/florida-gop-legislators-desantis-10-million-ship-migrants-country-2023-2,1.0,0.0,0.902,0.098,0.0772
Business Insider,Missouri bill aims to outdo Florida's 'Don't Say Gay' by banning school staff from discussing sexual orientation with students,A new bill would stop school staff being able to talk about sexual orientation and gender identity with students without their parents' consent.,sbaker@businessinsider.com (Sinéad Baker),2023-02-09 15:29:54+00:00,https://www.businessinsider.com/missouri-proposing-own-dont-say-gay-bill-even-harsher-florida-2023-2,0.0,0.0,1.0,0.0,0.0
Business Insider,CBS News pressed Sen. Ted Cruz on why he's running for reelection after he introduced a bill limiting senators to 2 terms in office: 'Why aren't you holding yourself to that standard?',"""If and when it passes, I will happily, happily comply. I've never said I'm going to unilaterally comply,"" Cruz told CBS of running for a third term.",insider@insider.com (John L. Dorman),2023-02-05 18:20:49+00:00,https://www.businessinsider.com/cruz-seeks-third-senate-term-backs-two-term-constitutional-amendment-2023-2,0.0,0.0,1.0,0.0,0.0
Business Insider,Jason Miller returns as Trump advisor for campaign struggling to generate much excitement compared to 2016,"Jason Miller, who left Trump's team in 2021 to become CEO of Gettr, has joined the former president's so-far underwhelming 2024 campaign.",jzitser@businessinsider.com (Joshua Zitser),2023-02-10 14:27:28+00:00,https://www.businessinsider.com/jason-miller-returns-advisor-struggling-trump-campaign-2024-2023-2,1.0,0.175,0.625,0.2,0.1027
Business Insider,Biden doubles down on needling Republicans over proposed Social Security and Medicare cuts: 'I'm your nightmare',"The president also called out Florida Gov. Ron DeSantis for refusing to expand Medicaid to more than 800,000 Floridians with low incomes.","kleonard@insider.com (Kimberly Leonard,Warren Rojas)",2023-02-09 21:17:37+00:00,https://www.businessinsider.com/biden-leans-into-attacking-gop-on-medicare-and-social-security-pre-2024-2023-2,1.0,0.162,0.662,0.176,0.0516
Business Insider,How a photo of DeSantis allegedly partying with high schoolers enflamed a bitter rivalry between Trump and the Florida governor,"Donald Trump launched an extraordinary attack on his rumored 2024 rival Ron DeSantis, sharing a post accusing him of being a ""groomer.""",tporter@businessinsider.com (Tom Porter),2023-02-08 16:30:58+00:00,https://www.businessinsider.com/photo-allegedly-desantis-partying-enflamed-trump-2024-rival-2023-2,-1.0,0.171,0.671,0.159,-0.0516
Business Insider,Trump shares photos of DeSantis alleging he partied and drank with high school girls when he was a teacher,"Trump, who is known for nasty smears against his opponents, has ramped up his attacks against the the governor.",kleonard@insider.com (Kimberly Leonard),2023-02-08 00:30:28+00:00,https://www.businessinsider.com/trump-shares-photos-of-desantis-alleging-partied-with-high-schoolers-2023-2,1.0,0.0,0.662,0.338,0.5574
Business Insider,DeSantis echoes Trump in latest offense against the media after taunting the former president during live TV roundtable,The governor has asked the legislature to alter free speech laws in Florida that could make it easier to sue news outlets.,kleonard@insider.com (Kimberly Leonard),2023-02-07 20:28:05+00:00,https://www.businessinsider.com/desantis-echoes-taunts-trump-live-tv-roundtable-free-speech-laws-2023-2,-1.0,0.154,0.846,0.0,-0.25
CBS News,Trump leads GOP 2024 primary field narrowly in poll of conservatives,"But in a head-to-head matchup between Trump and DeSantis, DeSantis has more support, according to a new poll by the conservative group Club for Growth Action.",Aaron Navarro,2023-02-07 02:13:45+00:00,https://www.cbsnews.com/news/trump-desantis-opinion-poll-club-for-growth-2023-02-06/,0.0,0.0,1.0,0.0,0.0
CBS News,Florida won't ask high school athletes about menstrual history after criticism,"Questions about athletes' menstrual history will no longer appear on medical forms Florida high school students are required to fill out before participating in sports, though the new form will still ask athletes for their sex assigned at birth, rather than j…",,2023-02-10 18:46:54+00:00,https://www.cbsnews.com/news/florida-cuts-questions-teenagers-menstrual-cycles-high-school-athletics-forms/,-1.0,0.266,0.734,0.0,-0.4404
CBS News,"Trump, potential 2024 GOP contenders respond to Biden's State of the Union","Their responses offered an early preview of how they might run against Biden, their likely opponent in 2024.",Aaron Navarro,2023-02-08 05:38:16+00:00,https://www.cbsnews.com/news/trump-response-biden-state-of-the-union/,0.0,0.0,1.0,0.0,0.0
CBS News,Teenagers denied abortions because of Florida judges' subjective decisions: Report,People under 18 must have parental consent to obtain abortion care in the state. Those who can't obtain such consent have to go through the court system.,Kerry Breen,2023-02-09 20:30:54+00:00,https://www.cbsnews.com/news/teenagers-denied-abortions-by-florida-judges-report/,-1.0,0.293,0.707,0.0,-0.4404
CNN,DeSantis push for more control of Disney special district gets approval from Florida legislature,"Florida lawmakers on Friday gave final approval to a proposal to give Gov. Ron DeSantis more control over the future of Disney's Orlando-area theme parks, the latest escalation in the Republican leader's feud with the entertainment giant.",Steve Contorno,2023-02-10 18:43:19+00:00,https://www.cnn.com/2023/02/10/politics/disney-ron-desantis-reedy-creek-florida/index.html,1.0,0.0,0.58,0.42,0.7003
CNN,Biden heads to rival-rich Florida ready to push Republicans on Social Security and Medicare,"President Joe Biden will embark Thursday on the next leg of his post-State of the Union tour with a visit to the former swing state of Florida, home to an emerging Republican foil and two potential GOP challengers in a 2024 campaign.","Priscilla Alvarez, Steve Contorno",2023-02-09 11:00:11+00:00,https://www.cnn.com/2023/02/09/politics/joe-biden-tampa/index.html,1.0,0.0,0.62,0.38,0.5994
CNN,Koch network plans to back a Republican -- other than Trump -- in the 2024 presidential primary,The deep-pocketed network associated with billionaire Charles Koch is preparing to throw its money and weight behind a single Republican candidate in the 2024 presidential primary -- in a move that could significantly reshape the GOP field.,Fredreka Schouten,2023-02-05 12:32:53+00:00,https://www.cnn.com/2023/02/05/politics/koch-network-republican-primary-2024/index.html,0.0,0.0,1.0,0.0,0.0
CNN,Black history observance began as a single week. It's time for a full season,"""Nearly 50 years ago, political leaders thought Black history was so important to the national identity that they quadrupled the time formally set aside for it,"" writes Jemar Tisby, and now, a Republican governor dismisses its educational value altogether.",Opinion by Jemar Tisby,2023-02-10 15:48:16+00:00,https://www.cnn.com/2023/02/10/opinions/black-history-more-than-a-month-tisby/index.html,0.0,0.0,1.0,0.0,0.0
CNN,The Grammys prove that LGBTQ artists are no longer on the sidelines,The 65th annual Grammy Awards brought some needed joy to our current cultural climate. Happiness was at full tilt — from the celebration of 50 years of hip-hop to emotional speeches from Lizzo and others to Beyoncé making history as the most-decorated Grammy-…,Clay Cane,2023-02-07 13:54:47+00:00,https://www.cnn.com/2023/02/07/opinions/grammys-2023-lgbtq-sam-smith-kim-petras-cane-ctrp/index.html,0.0,0.0,1.0,0.0,0.0
CNN,Here's what keeps Jerome Powell up at night and interest rates high,"Federal Reserve Chairman Jerome Powell threw markets into a tizzy on Tuesday as he spoke about the economy alongside his former boss, Carlyle Group co-founder David Rubenstein, at the Economic Club of Washington.","Nicole Goodkind, CNN",2023-02-08 12:51:32+00:00,https://www.cnn.com/2023/02/08/investing/premarket-stocks-trading/index.html,1.0,0.0,0.7,0.3,0.4588
CNN,Disney has bigger problems than Ron DeSantis,Disney has found itself in the middle of a culture war battle that could end up transferring Disney World's governance to a board appointed by Florida Gov. Ron DeSantis. And that may be the least of Disney's problems.,Chris Isidore,2023-02-07 19:06:51+00:00,https://www.cnn.com/2023/02/07/investing/disney-earnings-bob-iger-preview/index.html,-1.0,0.403,0.597,0.0,-0.4019
CNN,Ron DeSantis once expressed support for privatizing Social Security and Medicare giving his rivals an opening,"Florida Gov. Ron DeSantis expressed support for privatizing Medicare and Social Security during his first campaign for Congress in 2012, giving political rivals who have pledged to protect the programs an opening to attack him ahead of DeSantis' expected run …","Andrew Kaczynski, Em Steck",2023-02-09 21:49:01+00:00,https://www.cnn.com/2023/02/09/politics/kfile-ron-desantis-privatize-social-security-medicare/index.html,1.0,0.0,0.516,0.484,0.7579
CNN,DeSantis says Florida requires African American history. Advocates say the state is failing that mandate,"Facing accusations of whitewashing history after his administration blocked a new Black studies course for high-achieving high schoolers, Gov. Ron DeSantis has countered that Florida students already must learn about the triumphs and plight of African America…",Steve Contorno,2023-02-05 11:00:51+00:00,https://www.cnn.com/2023/02/05/politics/desantis-florida-ap-history/index.html,-1.0,0.231,0.769,0.0,-0.5106
CNN,Florida lawmakers to vote on plan to give DeSantis new power over Disney,Florida lawmakers are expected to vote Thursday on a proposal to give Gov. Ron DeSantis new power over the state's most iconic theme parks amid his ongoing feud with Disney.,Steve Contorno,2023-02-09 15:21:36+00:00,https://www.cnn.com/2023/02/09/politics/ron-desantis-florida-disney-bill/index.html,0.0,0.0,1.0,0.0,0.0
CNN,Can any Republican beat Trump or DeSantis in 2024?,"Polls show the 2024 Republican primary is a contest between former President Donald Trump, Florida Gov. Ron DeSantis and everybody else. The ""everybody else"" group includes candidates such as former UN Ambassador Nikki Haley, who look like they're itching to …",Harry Enten,2023-02-05 17:16:17+00:00,https://www.cnn.com/2023/02/05/politics/republican-primary-2024-trump-desantis-haley/index.html,0.0,0.0,1.0,0.0,0.0
CNN,Florida lawmakers vote to back expansion of DeSantis' migrant relocation plan,"Florida lawmakers on Friday approved an expansion of Gov. Ron DeSantis' controversial program to relocate migrants, giving the Republican leader authority to transport individuals from anywhere in the country.",Steve Contorno,2023-02-10 16:26:03+00:00,https://www.cnn.com/2023/02/10/politics/migrant-relocation-florida-ron-desantis-expansion/index.html,0.0,0.0,1.0,0.0,0.0
CNN,DeSantis appointees would oversee Disney's theme parks under bill to revamp Reedy Creek,"A bill to wind down Disney's special governing powers in Central Florida would put the company's Orlando-area theme parks under the oversight of a board that will be hand-picked by Gov. Ron DeSantis, giving the Republican executive new authority over the stat…",Steve Contorno,2023-02-06 23:23:59+00:00,https://www.cnn.com/2023/02/06/politics/desantis-disney-reedy-creek-bill/index.html,0.0,0.0,1.0,0.0,0.0
CNN,Opinion: Biden doesn't throw away his shot,"At first, the enormous balloon, carrying a smaller substructure roughly the length of three city buses, seemed to symbolize America's wide-open vulnerability to what the Pentagon described as surveillance from a rising power. But it also gave President Joe Bi…",Richard Galant,2023-02-05 13:26:59+00:00,https://www.cnn.com/2023/02/05/opinions/chinese-balloon-opinion-column-galant/index.html,0.0,0.0,1.0,0.0,0.0
CNN,Why Biden shouldn't dismiss his negative poll numbers,"President Joe Biden says he's not ready to make a decision on whether to run for reelection. He did, however, dismiss polls that have cast a negative light on his 2024 chances, telling Telemundo, ""Do you know any polling that's accurate these days?""",Harry Enten,2023-02-10 19:09:32+00:00,https://www.cnn.com/2023/02/10/politics/polling-election-2024-biden-trump/index.html,1.0,0.0,0.667,0.333,0.4585
CNN,Opinion: Americans deserve more than a Biden-Trump rematch,Patrick T. Brown writes a 2024 presidential election that features another slugfest between President Joe Biden and former President Donald Trump -- rather than a scrappy fight between up-and-coming politicians with energy and enthusiasm -- would be doing the…,Patrick T. Brown,2023-02-09 16:48:17+00:00,https://www.cnn.com/2023/02/09/opinions/biden-trump-america-deserves-more-brown/index.html,0.0,0.0,1.0,0.0,0.0
CNN,Florida officials discussed AP African American Studies course with College Board for months before initial rejection,"The testing organization behind a new advanced high school class in African American studies met several times and exchanged emails over the past year with Florida officials to discuss the course, the state Education Department said, amid a roiling national d…",Nicole Chavez,2023-02-10 12:28:53+00:00,https://www.cnn.com/2023/02/10/us/florida-african-american-ap/index.html,-1.0,0.226,0.774,0.0,-0.5423
CNN,"Kaya, a service dog who helped her owner advocate for PTSD treatment and veterans' health, has died","Kaya, a service dog who served as a beloved ambassador for PTSD treatment and veterans' health, has died, according to her owner.",Zoe Sottile,2023-02-11 20:12:17+00:00,https://www.cnn.com/2023/02/11/us/kaya-ptsd-service-dog-death-trnd/index.html,-1.0,0.265,0.735,0.0,-0.5574
CNN,Florida lawmakers vote to give GOP-appointed state prosecutor jurisdiction over election and voting matters,"Florida's statewide prosecutor will have new power to go after people for election-related crimes under a bill now headed to Gov. Ron DeSantis' desk. The bill is a top priority for the Republican governor, who last year approved the creation of a controversia…",Steve Contorno,2023-02-10 16:39:48+00:00,https://www.cnn.com/2023/02/10/politics/election-crimes-florida-lawmakers-desantis/index.html,1.0,0.0,0.901,0.099,0.0258
CNN,Republicans elevate 'parental rights' as top issue while looking to outflank each other heading into 2024,"Republican presidential hopefuls have begun casting themselves as impassioned defenders of ""parental rights,"" turning schoolbooks and curricula, doctors' offices, and sports leagues into a new political battleground as they work to distinguish themselves ahea…","Gabby Orr, Steve Contorno",2023-02-04 14:09:30+00:00,https://www.cnn.com/2023/02/04/politics/republicans-2024-parental-rights-trump-desantis/index.html,1.0,0.0,0.833,0.167,0.2023
CNN,Biden says he's not ready to make 2024 decision,"President Joe Biden said Thursday he's simply not ready to decide whether to run for reelection, even as he dismissed polls showing a majority of Democrats want another candidate in 2024.","Kevin Liptak, CNN",2023-02-10 01:24:53+00:00,https://www.cnn.com/2023/02/09/politics/2024-joe-biden-reelection/index.html,1.0,0.0,0.706,0.294,0.3612
CNN,"Start your week smart: Spy balloon, Ukraine, Chile, Pervez Musharraf, LeBron James",Here's what you need to know to Start Your Week Smart.,Andrew Torgan,2023-02-05 13:55:04+00:00,https://www.cnn.com/2023/02/05/us/five-things-february-5-trnd/index.html,1.0,0.0,0.787,0.213,0.4019
CNN,How one question from Joe Biden explains his feud with Rick Scott,"As Marine One lifted off from the South Lawn of the White House, President Joe Biden had a last-minute question for his aides seated nearby.",Phil Mattingly,2023-02-10 05:00:59+00:00,https://www.cnn.com/2023/02/10/politics/biden-florida-rick-scott/index.html,-1.0,0.231,0.769,0.0,-0.34
Fortune,Florida is holding a special legislative session to fully strip Disney of self-governing status and expand migrant relocation,"At the request of Gov. Ron DeSantis, the Republican-dominated statehouse approved legislation in April to eliminate Disney's Reedy Creek government.","Anthony Izaguirre, The Associated Press",2023-02-06 13:37:37+00:00,https://fortune.com/2023/02/06/florida-disney-world-reedy-creek-special-legislative-session-republicans-ron-desantis/,1.0,0.0,0.688,0.312,0.6124
Fortune,Disney has had unprecedented power over the Magic Kingdom for decades and Ron DeSantis is about to take it from them,"“What kind of control is preferable? Control by a private business or corporation, or control by appointed officials, appointed by governor of the state?""","Mike Schneider, The Associated Press",2023-02-07 20:48:12+00:00,https://fortune.com/2023/02/07/disney-magic-kingdom-florida-ron-desantis-new-bill-reedy-creek-improvement-district/,0.0,0.0,1.0,0.0,0.0
Fortune,Florida Gov. DeSantis just scored a big victory in his war against Disney over its opposition to 'Don't say gay' law,A board appointed by the governor would oversee the government services it provides in the company's sprawling properties in Florida.,"Anthony Izaguirre, The Associated Press",2023-02-10 19:42:22+00:00,https://fortune.com/2023/02/10/florida-desantis-disney-control-disney-disneyworld/,-1.0,0.245,0.755,0.0,-0.5994
Fortune,Girls in Florida may not have to disclose their menstrual histories to play high school sports after all,A vote on Thursday will decide whether to remove questions that force student-athletes to share details about their menstruation cycles.,"Mike Schneider, The Associated Press",2023-02-09 00:03:44+00:00,https://fortune.com/2023/02/08/florida-girls-high-school-sports-menstrual-cycle-questions/,1.0,0.0,0.789,0.211,0.34
Fortune,Florida will no longer ask students 'humiliating' and 'invasive' menstrual questions to participate in school sports,"Answering the questions was previously optional, but an advisory committee recently recommended that it be mandatory, sparking the firestorm of criticism.","Mike Schneider, The Associated Press",2023-02-10 00:02:38+00:00,https://fortune.com/2023/02/09/florida-high-school-students-menstrual-questions-sports-transgender/,-1.0,0.18,0.82,0.0,-0.296
Fortune,"Middle managers embrace wokeness because it increases their influence and job security, new paper says","Nicolai Foss of Copenhagen Business School and Peter Klein of Baylor University warn that ""woke"" culture could be costing companies.",Will Daniel,2023-02-08 22:21:57+00:00,https://fortune.com/2023/02/08/middle-managers-wokeness-woke-increases-influence-job-security/,1.0,0.0,0.657,0.343,0.5719
Fortune,‘We can’t pay our bills with magic’: Disney World unions reject contract proposal,Disney workers face cost-of-living hikes in housing and other expenses in central Florida.,"Mike Schneider, The Associated Press",2023-02-05 00:03:49+00:00,https://fortune.com/2023/02/04/disney-world-unions-reject-contract-proposal-cannot-pay-our-bills-with-magic/,-1.0,0.208,0.693,0.1,-0.3408
Fox News,DeSantis touts Florida as Republican edge over Democrats grows: 'Freedom is here to stay',"In a tweet on Tuesday afternoon, Governor Ron DeSantis announced that Republicans outnumber Democrats in Florida by 400,000 voters.",Sarah Rumpf,2023-02-08 00:56:13+00:00,https://www.foxnews.com/politics/desantis-touts-florida-republicans-edge-over-democrats-grows-freedom-here-stay,1.0,0.089,0.569,0.341,0.6249
Fox News,"DeSantis school policies have taken us back to slave era, ‘1865 all over again’: MSNBC guest","MSNBC guest panelist John Hope Bryant claimed that Gov. Ron DeSantis, R-Fla., has brought ""1865"" back with his public school curriculum policies.",Gabriel Hays,2023-02-04 17:32:24+00:00,https://www.foxnews.com/media/desantis-school-policies-have-taken-back-slave-era-1865-over-again-msnbc-guest,0.0,0.0,1.0,0.0,0.0
Fox News,"Ron DeSantis scores education win, media deals him the 'racist' card for it","Florida Gov. Ron DeSantis pressured the College Board to tone down their proposed Advanced Placement curriculum, and CNN drew predictable reactions.",Tim Graham,2023-02-08 11:00:51+00:00,https://www.foxnews.com/opinion/ron-desantis-scores-education-win-media-deals-racist-card,-1.0,0.27,0.473,0.257,-0.0516
Fox News,'FASCISM': Florida Dem lashes out at DeSantis for targeting group that hosted 'Drag Queen Christmas' with kids,"Florida Democrat Rep. Maxwell Frost takes aim at Florida Gov. Ron Desantis over his complaint against the insitution that hosted a ""Drag Queen Christmas"" event and invited children.",Kyle Morris,2023-02-04 15:08:32+00:00,https://www.foxnews.com/politics/fascism-florida-dem-lashes-desantis-targeting-group-hosted-drag-queen-christmas-kids,-1.0,0.147,0.853,0.0,-0.2263
