source,title,description,author,publishedAt,url,sentimentScore,neg,neu,pos,compound
Fox News,Philadelphia Inquirer calls Ron DeSantis receiving local prestigious award 'a step backwards',The Philadelphia Inquirer published an editorial Wednesday that criticized the Union League of Philadelphia's decision to award Florida Gov. Ron DeSantis with their gold medal.,Joe Silverstein,2023-01-26 01:00:26+00:00,https://www.foxnews.com/media/philadelphia-inquirer-calls-ron-desantis-receiving-local-prestigious-award-step-backwards,1.0,0.0,0.741,0.259,0.5423
Fox News,"Twitter users dunk on Rep. Adam Schiff after he is booted from Intelligence Committee: 'Lying, leaking clown'",Twitter users across the platform slammed Rep. Adam Schiff of California after he was booted from the Intelligence Committee by Speaker Kevin McCarthy.,Alexander Hall,2023-01-25 10:30:25+00:00,https://www.foxnews.com/media/twitter-users-dunk-rep-adam-schiff-booted-intelligence-committee-lying-leaking-clown,-1.0,0.206,0.606,0.188,-0.0772
Fox News,CNN labels Adam Schiff a Republican during rare clash on Russia collusion: 'That turned out not to be true',"Rep. Adam Schiff, D-Calif., was mistakenly labeled a Republican while facing questions regarding his removal from the House Intelligence Committee on CNN Sunday.",Lindsay Kornick,2023-01-30 22:30:48+00:00,https://www.foxnews.com/media/cnn-labels-adam-schiff-republican-rare-clash-russia-collusion-turned-true,1.0,0.0,0.797,0.203,0.4215
Fox News,Adam Schiff campaign selling $12 pin of cartoon Schiff rolling up his sleeves,"Rep. Adam Schiff's Senate campaign is selling a range of merchandise, including an enamel pin that shows a cartoon Schiff rolling up his sleeves and a retro Schiff T-shirt.",Peter Kasperowicz,2023-01-28 13:00:05+00:00,https://www.foxnews.com/politics/adam-schiff-campaign-selling-12-pin-cartoon-schiff-rolling-up-sleeves,0.0,0.0,1.0,0.0,0.0
Fox News,Schiff hit with ethics complaint one day into Senate campaign for using Trump impeachment video,The Foundation for Accountability and Civic Trust on Friday filed a complaint requesting the Office of Congressional Ethics investigate Rep. Adam Schiff for alleged violations.,Aaron Kliegman,2023-01-27 18:11:39+00:00,https://www.foxnews.com/politics/schiff-hit-ethics-complaint-one-day-senate-campaign-trump-impeachment-video,-1.0,0.167,0.833,0.0,-0.296
Fox News,"Obama, Clinton offices say all classified documents went to National Archives",The offices of former Presidents Barack Obama and Bill Clinton say they turned over all classified materials to the National Archives at the end of their presidencies.,Sarah Rumpf,2023-01-25 21:35:45+00:00,https://www.foxnews.com/politics/obama-clinton-offices-say-all-classified-documents-went-national-archives,0.0,0.0,1.0,0.0,0.0
Fox News,Rep. Matt Gaetz introduces 'PENCIL' resolution barring Adam Schiff from accessing classified information,Florida Rep. Matt Gaetz introduced a resolution on Thursday that would bar California Rep. Adam Schiff from accessing classified information.,Matteo Cina,2023-01-27 01:56:51+00:00,https://www.foxnews.com/politics/rep-matt-gaetz-introduces-pencil-resolution-barring-adam-schiff-from-accessing-classified-information,0.0,0.0,1.0,0.0,0.0
Fox News,"National Archives silent as disparity between its handling of Biden, Trump documents fuels questions","The National Archives has kept silent since lawyers for President Biden revealed he had classified documents in his possession for years, but the agency sounded the alarm on Trump.",Joseph Wulfsohn,2023-01-25 07:00:20+00:00,https://www.foxnews.com/media/national-archives-silent-disparity-between-handling-biden-trump-documents-fuels-questions,0.0,0.0,1.0,0.0,0.0
Fox News,Courting DeSantis: These groups are trying to convince Florida’s governor to run for president,Outside political groups trying to convince Ron DeSantis to campaign for president in 2024 are a sign of the Florida GOP governor's sizable grassroots support should he run.,Paul Steinhauser,2023-01-30 16:45:25+00:00,https://www.foxnews.com/politics/courting-desantis-these-groups-trying-convince-floridas-governor-run-president,1.0,0.0,0.818,0.182,0.25
Fox News,"Biden classified documents: 57% of Americans disapprove of White House handling, as stonewalling continues",A new poll finds that more than two-thirds of Americans disapprove of how the White House has handled President Joe Biden's classified documents controversy.,Chris Pandolfo,2023-01-25 15:19:00+00:00,https://www.foxnews.com/politics/biden-classified-documents-57-americans-disapprove-white-house-handling-stonewalling-continues,0.0,0.0,1.0,0.0,0.0
Fox News,Schiff gets roasted after posting TikTok video about losing committee spot: ‘China is laughing at us’,"Twitter users roasted Rep. Adam Schiff, D-Calif., for complaining that he no longer had access to classified information — on an app tied to the Chinese government.",Jeffrey Clark,2023-01-26 11:11:45+00:00,https://www.foxnews.com/media/schiff-gets-roasted-posting-tiktok-video-losing-committee-spot-china-laughing-at-us,1.0,0.165,0.633,0.203,0.1531
Fox News,National Archives blows off Republican oversight request for info on Biden classified documents,The National Archives failed to produce documents detailing its communications with President Biden's lawyers and the DOJ regarding Biden's mishandling of classified documents.,Anders Hagstrom,2023-01-25 13:21:27+00:00,https://www.foxnews.com/politics/national-archives-blows-republican-oversight-request-info-biden-classified-documents,0.0,0.0,1.0,0.0,0.0
Fox News,"Road-building, logging restrictions reinstated for Alaska’s Tongass National Forest",The U.S. is reinstating road-building and logging restrictions on the country’s largest national forest Tongass National Forest located in Alaska.,Associated Press,2023-01-26 12:18:50+00:00,https://www.foxnews.com/us/road-building-logging-restrictions-reinstated-alaskas-tongass-national-forest,0.0,0.0,1.0,0.0,0.0
Fox News,These 4 senators are the most likely to lose their seats in 2024,A top non-partisan political handicapper predicts Democrats face a serious challenge holding on to four crucial Senate seats as they attempt to protect their razor-thin majority in 2024,"Andrew Murray, Paul Steinhauser",2023-01-30 22:14:11+00:00,https://www.foxnews.com/politics/these-4-democrat-senators-most-likely-lose-their-seats-2024,-1.0,0.351,0.649,0.0,-0.4019
Fox News,CA Rep. Swalwell offers cryptic warning after getting booted from House Intel: 'more time on our hands',"Three House Democrats responded to House Speaker Kevin McCarthy's decision to not reappoint them to committees they historically served on, claiming it was political vengeance.",Greg Wehner,2023-01-25 22:36:17+00:00,https://www.foxnews.com/politics/ca-rep-swalwell-cryptic-warning-booted-house-intel-time-on-our-hands,-1.0,0.179,0.821,0.0,-0.34
Fox News,White House: Biden takes classified info 'very seriously' as more docs turn up: 'searched their sock drawer',"The White House reiterated that President Biden takes classified information ""very seriously"" on Monday after the latest batch of documents were discovered at his home in Wilmington, Delaware.",Paul Best,2023-01-23 22:15:17+00:00,https://www.foxnews.com/politics/white-house-biden-takes-classified-info-very-seriously-more-docs-turn-up-searched-sock-drawer,-1.0,0.134,0.866,0.0,-0.1779
Fox News,Brazil's former President Bolsonaro applies for U.S. tourist visa: reports,Former Brazilian President Jair Bolsonaro has applied for a six-month tourist visa in the United States to clear his head and take time off before deciding his next steps.,Greg Wehner,2023-01-30 22:40:11+00:00,https://www.foxnews.com/world/brazils-former-president-bolsonaro-applies-u-s-tourist-visa-reports,0.0,0.0,1.0,0.0,0.0
Fox News,Stefanik says ‘abuse and weaponization’ of Biden federal agencies must be ‘rooted out’ by GOP in majority,"Elise Stefanik says the government “has a responsibility to serve the American people — not go after them"" and the new House Subcommittee on Weaponization will do important work.",Brooke Singman,2023-01-25 21:17:36+00:00,https://www.foxnews.com/politics/stefanik-says-abuse-weaponization-biden-federal-agencies-must-be-rooted-out-gop-majority,-1.0,0.296,0.704,0.0,-0.6369
Fox News,Harmeet Dhillon says Republicans ignore grassroots base at their 'peril',"Harmeet Dhillon, after an unsuccessful bid to unseat RNC chair Ronna McDaniel, warns Republicans they ignore the grassroots base ‘at our peril’","Paul Steinhauser, Lee Ross",2023-01-28 01:27:20+00:00,https://www.foxnews.com/politics/harmeet-dhillon-says-republicans-ignore-grassroots-base-peril,-1.0,0.464,0.536,0.0,-0.6369
Fox News,Warren says GOP has been trying to 'smear' Rep. Omar for years amid move to remove her from key committee,"U.S. Sen. Elizabeth Warren defended her Democratic colleague Rep. Ilhan Omar, D-Minnesota amid a push to remove her from House Foreign Affairs Committee.",Louis Casiano,2023-01-30 23:38:53+00:00,https://www.foxnews.com/politics/warren-gop-ilhan-omar-remove-committee,-1.0,0.172,0.828,0.0,-0.3612
Fox News,4 Oath Keepers convicted of seditious conspiracy for roles in Jan. 6 riot,"Four members of the Oath Keepers were convicted of seditious conspiracy Monday for their roles in the Jan. 6, 2021 attack on the U.S. Capitol.",Associated Press,2023-01-24 01:39:13+00:00,https://www.foxnews.com/us/4-oath-keepers-convicted-seditious-conspiracy-roles-jan-6-riot,-1.0,0.66,0.34,0.0,-0.8658
Fox News,Fact-checkers target Biden over 'false and misleading' statements about the economy,Fact-checkers are sounding the alarm following President Biden's recent speech in Virginia regarding the economic progress his administration has made.,Kyle Morris,2023-01-28 19:06:26+00:00,https://www.foxnews.com/politics/fact-checkers-target-biden-misleading-false-statements-economy,-1.0,0.31,0.69,0.0,-0.4019
Fox News,"From Ron Klain to Jeff Zients, why Biden’s new staff chief will be far less visible","President Biden will name Jeff Zients chief of staff, replacing Ron Klain. Though an important post, there's little doubt most people would be able to name many prior chiefs of staff.",Howard Kurtz,2023-01-24 08:04:44+00:00,https://www.foxnews.com/shows/media-buzz/ron-klain-jeff-zients-why-bidens-new-staff-chief-far-less-visible,0.0,0.0,1.0,0.0,0.0
Fox News,Biden's documents scandal is now DC's hottest guessing game: Who's sabotaging the president?,Joe Biden was on a roll after the midterms. His approval numbers were rising and it looked like a 2024 presidential run would be announced. So who leaked about the classified documents?,Liz Peek,2023-01-24 09:00:38+00:00,https://www.foxnews.com/opinion/bidens-documents-scandal-now-dcs-hottest-guessing-game-whos-sabotaging-president,-1.0,0.244,0.756,0.0,-0.4404
Fox News,Could President Biden's classified documents scandal evolve into a counter-espionage case?,RealClearInvestigations reporter Paul Sperry takes a look at the classified documents case against President Biden and why it could delve into something bigger.,Fox News Staff,2023-01-26 11:00:34+00:00,https://www.foxnews.com/media/could-president-bidens-classified-documents-scandal-evolve-counter-espionage-case,-1.0,0.266,0.734,0.0,-0.4404
Fox News,Omar blasts GOP's 'Islamophobia' amid committee removal bid: ‘They’re not OK’ with Muslims ‘having a voice’,"Rep. Ilhan Omar said Republicans are ""OK with Islamophobia"" and antisemitism within their own ranks after House Speaker Kevin McCarthy moved to eject her from her committee.",Jessica Chasmar,2023-01-29 16:31:44+00:00,https://www.foxnews.com/politics/omar-blasts-gops-islamophobia-committee-removal-bid-theyre-not-ok-muslims-having-voice,1.0,0.0,0.789,0.211,0.4466
Fox News,"Ilhan Omar says McCarthy leaving her off Africa subcommittee is 'racist, xenophobic'",House Rep. Ilhan Omar has issued another statement condemning House Speaker Kevin McCarthy has he continues to reject her appointment to the Foreign Affairs Committee.,Lawrence Richard,2023-01-27 05:27:43+00:00,https://www.foxnews.com/politics/ilhan-omar-mccarthy-leaving-off-africa-subcommittee-racist-xenophobic,-1.0,0.333,0.667,0.0,-0.6124
Fox News,Biden's Parole Program: Migrant families rush Miami airport after GOP lawsuit,"Hundreds of migrants flew into the Miami International Airport from Cuba, Nicaragua, Venezuela, and Haiti—fearing the Biden admin's immigration program could end after a lawsuit.",Caroline Elliott,2023-01-28 08:51:32+00:00,https://www.foxnews.com/us/bidens-parole-program-migrant-families-rush-miami-airport-after-gop-lawsuit,-1.0,0.174,0.826,0.0,-0.2263
Fox News,TUCKER CARLSON: Hunter Biden email may point to core of classified documents scandal,Fox News host Tucker Carlson discusses how Hunter Biden and Ukraine could be tied to President Biden's alleged mishandling of classified documents on 'Tucker Carlson Tonight.',Tucker Carlson,2023-01-25 03:26:34+00:00,https://www.foxnews.com/opinion/tucker-carlson-hunter-biden-email-point-core-classified-documents-scandal,-1.0,0.225,0.775,0.0,-0.4404
Fox News,Biden's FCC nominee sits on board of group that opposes anti-sex trafficking efforts,"Gigi Sohn, President Biden's nominee for the Federal Communications Commission, serves on the board of directors for a group that has opposed efforts to combat online sex trafficking.",Thomas Catenacci,2023-01-26 10:00:16+00:00,https://www.foxnews.com/politics/bidens-fcc-nominee-sits-board-group-opposes-anti-sex-trafficking-efforts,0.0,0.0,1.0,0.0,0.0
Fox News,Matt Taibbi says the Left's source for Russian disinformation bots were accounts of 'real Americans',"Matt Taibbi joined ""One Nation with Brian Kilmeade"" to reveal details behind the Russian disinformation bot narrative, saying it involved ""very few Russians"" if at all.",Christopher Lopez,2023-01-29 05:05:49+00:00,https://www.foxnews.com/media/lefts-source-russian-bots-real-americans-fraud-matt-taibbi,0.0,0.0,1.0,0.0,0.0
Fox News,NBC News boss can prove she’s more than a ‘figurehead’ by revealing truth behind retracted Paul Pelosi report,Incoming NBC News boss Rebecca Blumenstein has a chance to provide transparency about Miguel Almaguer’s infamous Paul Pelosi report was retracted by the previous regime.,Brian Flood,2023-01-26 09:00:24+00:00,https://www.foxnews.com/media/nbc-news-boss-can-prove-shes-more-than-figurehead-by-revealing-truth-behind-retracted-paul-pelosi-report,1.0,0.0,0.839,0.161,0.3182
Fox News,"NYT writer says AIPAC, Jewish groups using 'power and influence' to stop US from being tough on Israel","New York Times columnist Tom Friedman said AIPAC and Jewish groups have done the ""bidding"" of Israeli leaders and used their ""power and influence"" to stop presidents from being tough on Israel.",Aaron Kliegman,2023-01-25 21:19:06+00:00,https://www.foxnews.com/politics/nyt-writer-aipac-jewish-groups-power-influence-stop-us-tough-israel,-1.0,0.252,0.748,0.0,-0.4019
Fox News,"GOP brawl: The competitive, combustible, bitter battle for Republican National Committee chair",The battle between RNC Chair Ronna McDaniel and top challenger Harmeet Dhillon has turned combative ahead of Friday's election to steer the GOP the next.,"Paul Steinhauser, Lee Ross",2023-01-26 07:00:17+00:00,https://www.foxnews.com/politics/gop-brawl-competitive-combustible-bitter-battle-republican-national-committee-chair,-1.0,0.358,0.53,0.113,-0.5719
Fox News,"On this day in history, Jan. 24, 2003, Department of Homeland Security established as Cabinet agency","The Department of Homeland Security began operation on this day in history, Jan. 24, 2003. It was first established as a White House office in the immediate aftermath of the 9/11 attacks.",Kerry Byrne,2023-01-24 05:02:04+00:00,https://www.foxnews.com/lifestyle/this-day-history-jan-24-2003-department-homeland-security-established-cabinet,1.0,0.0,0.821,0.179,0.34
Fox News,NJ man gets over 6 years for assaulting Capitol officer who later died,"Julian Khater of New Jersey was sentenced to more than six years in prison for assaulting several Capitol police officers during the Jan. 6, 2021 attack.",Associated Press,2023-01-28 01:26:51+00:00,https://www.foxnews.com/us/nj-man-gets-over-6-years-assaulting-capitol-officer-later-died,-1.0,0.496,0.504,0.0,-0.7845
Fox News,"I was an FBI Special Agent and if Biden won't fix a bureau in crisis, it will be destroyed","The FBI is in crisis. If we don’t fix it now, we risk irrevocably breaking the greatest law enforcement agency in the world – and America’s trust in this invaluable institution.",Michael Rogers,2023-01-27 07:00:48+00:00,https://www.foxnews.com/opinion/fbi-special-agent-biden-fix-bureau-crisis-destroyed,1.0,0.211,0.395,0.394,0.4203
Fox News,"FLASHBACK: Biden praised debt ceiling talks as VP, said it was 'great honor' to negotiate with GOP","President Biden, during his tenure as vice president, applauded negotiations surrounding the debt ceiling and how members of Congress should work together to reach “certain compromises.”",Kyle Morris,2023-01-24 16:40:47+00:00,https://www.foxnews.com/politics/flashback-biden-praised-debt-ceiling-talks-vp-said-great-honor-negotiate-gop,1.0,0.119,0.381,0.5,0.8402
Fox News,"Greedy pharma firms rip off Americans while Pfizer, Moderna swim in profits","Greedy pharma firms rip off Americans while Pfizer, Moderna swim in profits. 5 firms totaled $80 billion in profits, but millions can’t afford medicine.",Bernie Sanders,2023-01-23 07:00:35+00:00,https://www.foxnews.com/opinion/greedy-pharma-firms-rip-off-americans-while-pfizer-moderna-swim-profits,1.0,0.189,0.574,0.238,0.1531
Fox News,"'Fox News Sunday' on January 22, 2022","This week, 'Fox News Sunday' welcomed Rep. Brian Fitzpatrick, R-Penn., Rep. Josh Gottheimer, D-N.J., and more to discuss the latest political news.",Fox News Staff,2023-01-25 17:34:04+00:00,https://www.foxnews.com/transcript/fox-news-sunday-january-22-2022,0.0,0.0,1.0,0.0,0.0
Fox News,TUCKER CARLSON: Antifa is the armed militia of the Democratic Party and is back in force,Fox News host Tucker Carlson weighs in on violent protests in Atlanta following the police killing of an activist on 'Tucker Carlson Tonight.',Tucker Carlson,2023-01-24 03:58:45+00:00,https://www.foxnews.com/opinion/tucker-carlson-antifa-armed-militia-democratic-party-back-in-force,1.0,0.0,0.748,0.252,0.4019
Fox News,"European 'Christian state' faces criticism for banning woke lessons, immigration laws: 'Will of the people'","The European Commission decided to approve further budget cuts to Hungary, this time impacting universities over concerns of academic freedom from political interference.",Peter Aitken,2023-01-30 17:00:20+00:00,https://www.foxnews.com/world/european-christian-state-faces-criticism-banning-woke-lessons-immigration-laws-will-people,-1.0,0.209,0.791,0.0,-0.4404
Fox News,"House Speaker McCarthy rejects Jeffries' demand to reappoint Schiff, Swalwell to Intelligence Committee","House Speaker Kevin McCarthy, a Republican, rejected Democratic leader Hakeem Jeffries' demands to appoint Democrats Adam Schiff and Eric Swalwell to the Intelligence Committee.",Greg Wehner | Fox News,2023-01-25 02:04:35+00:00,https://www.foxnews.com/politics/house-speaker-mccarthy-rejects-jeffries-demand-reappoint-schiff-swalwell-intelligence-committee,-1.0,0.297,0.506,0.196,-0.1531
Fox News,Obama office won’t say whether it will conduct a search for classified documents,Former President Obama's office declined to comment on whether it is searching for classified documents at his residences after documents were found in other former officials' homes.,Patrick Hauf | Fox News,2023-01-24 20:20:55+00:00,https://www.foxnews.com/politics/obama-office-wont-say-conduct-search-classified-documents,0.0,0.0,1.0,0.0,0.0
Fox News,Retired top FBI counterintelligence agent who led Trump-Russia probe arrested for own ties to Russian oligarch,"Charles McGonigal, once Special Agent in Charge of FBI NY's Counterintelligence Division, charged with money laundering, breaking US sanctions against Russia oligarch Oleg Deripaska.",Danielle Wallace | Fox News,2023-01-23 18:00:05+00:00,https://www.foxnews.com/politics/retired-top-fbi-counterintelligence-agent-led-trump-russia-probe-arrested-own-ties-russian-oligarch,-1.0,0.208,0.671,0.121,-0.3182
Fox News,Rep. Ilhan Omar pressed on old comments: 'Wasn't aware' there were 'tropes about Jews and money',"Democratic Rep. Ilhan Omar said Sunday she was not ""aware"" that there were tropes about ""Jews and money"" during an appearance on CNN's ""State of the Union.""",Hanna Panreck | Fox News,2023-01-29 19:00:24+00:00,https://www.foxnews.com/media/rep-ilhan-omar-pressed-old-comments-wasnt-aware-tropes-jews-money,0.0,0.0,1.0,0.0,0.0
Fox News,"Schiff, Whitehouse slam Meta for decision to allow Trump back on Facebook, Instagram: ‘Inexplicable’","Top Democrats are demanding Meta provide answers on why it reinstated former President Trump to Facebook and Instagram, calling the decision “inexplicable.”",Brooke Singman | Fox News,2023-01-30 20:06:59+00:00,https://www.foxnews.com/politics/schiff-whitehouse-slam-meta-decision-allow-trump-back-facebook-instagram-inexplicable,-1.0,0.193,0.667,0.141,-0.1779
Fox News,Ronna McDaniel wins re-election to an unprecedented fourth term chairing the Republican National Committee,"Republican National Committee chair Ronna McDaniel won re-election on Friday, bringing to an end nearly two months of barbs and accusations amid a major fight for the future of the GOP.",Paul Steinhauser | Fox News,2023-01-27 20:20:51+00:00,https://www.foxnews.com/politics/ronna-mcdaniel-wins-re-election-unprecedented-fourth-term-chairing-republican-national-committee,1.0,0.0,0.73,0.27,0.5719
MSNBC,"Facebook, Instagram to reinstate Donald Trump. Thumbs down.","Met announced Facebook and Instagram will allow former President Donald Trump to return to the platforms in the coming weeks, ending a two-year suspension.",Ja'han Jones,2023-01-25 22:03:15+00:00,https://www.msnbc.com/the-reidout/reidout-blog/trump-facebook-instagram-meta-rcna67509,0.0,0.0,1.0,0.0,0.0
MSNBC,Facebook throws Trump a financial lifeline,"Donald Trump will soon regain access to his Facebook and Instagram accounts, giving his 2024 campaign more fundraising opportunities after a lackluster start.",Hayes Brown,2023-01-27 11:00:00+00:00,https://www.msnbc.com/opinion/msnbc-opinion/facebook-giving-trump-2024-financial-boost-needs-rcna67687,0.0,0.0,1.0,0.0,0.0
MSNBC,List of Trump criminal investigations gets unexpectedly longer,John Durham's investigation into Donald Trump's suspected financial crimes adds to the list of criminal investigations surrounding the former president.,Steve Benen,2023-01-27 14:34:59+00:00,https://www.msnbc.com/rachel-maddow-show/maddowblog/list-trump-criminal-investigations-gets-unexpectedly-longer-rcna67827,-1.0,0.362,0.638,0.0,-0.5267
MSNBC,"Differences between Biden, Trump docs stories become more obvious","As Joe Biden invites Justice Department investigators into his home without a warrant, we're reminded of the kind of steps Donald Trump refused to take.",Steve Benen,2023-01-23 13:40:24+00:00,https://www.msnbc.com/rachel-maddow-show/maddowblog/differences-biden-trump-docs-stories-become-obvious-rcna66929,0.0,0.0,1.0,0.0,0.0
MSNBC,"Trump slams U.S. military, says armed forces ‘can’t fight or win’",Donald Trump insisted the United States’ armed forces are incapable of fighting or winning. It's an odd part of a larger Republican offensive.,Steve Benen,2023-01-30 16:03:28+00:00,https://www.msnbc.com/rachel-maddow-show/maddowblog/trump-slams-us-military-says-armed-forces-cant-fight-win-rcna68167,-1.0,0.232,0.604,0.165,-0.2235
MSNBC,DeSantis’ death penalty remarks suggest he’d continue Trump’s execution spree,"Florida Gov. Ron DeSantis wants to make it easier to execute people, suggesting he'd continue the execution spree Donald Trump began during his presidency.",Jordan Rubin,2023-01-25 23:09:55+00:00,https://www.msnbc.com/deadline-white-house/deadline-legal-blog/desantis-death-penalty-trump-rcna67423,-1.0,0.463,0.537,0.0,-0.7845
MSNBC,The rocky marriage between Trump and evangelicals won't lead to a separation,Roughly half of white evangelicals believe Donald Trump should be the Republican nominee for president in 2024 and half prefer someone else.,Sarah Posner,2023-01-25 17:12:14+00:00,https://www.msnbc.com/opinion/msnbc-opinion/trump-evangelical-voters-arent-yet-rcna67198,0.0,0.0,1.0,0.0,0.0
MSNBC,How Trump attorney Drew Findling's past could be key in Georgia probe,"Drew Findling, a defense attorney for Donald Trump, has worked with several high-profile rappers — which could come in use for the former president in Georgia.",Ja'han Jones,2023-01-24 20:24:37+00:00,https://www.msnbc.com/the-reidout/reidout-blog/drew-findling-trump-georgia-probe-rcna67179,0.0,0.0,1.0,0.0,0.0
MSNBC,The problem with Trump’s imagined ‘peace deal’ in Ukraine,"Donald Trump thinks it would be ""easy"" for him to end the war in Ukraine in one day. Just don't ask him how he'd pull this off.",Steve Benen,2023-01-30 13:50:52+00:00,https://www.msnbc.com/rachel-maddow-show/maddowblog/problem-trumps-imagined-peace-deal-ukraine-rcna68144,1.0,0.241,0.446,0.312,0.2023
MSNBC,Trump shows us how the MAGA right wants to weaponize schools,Donald Trump's education policy rollout targeting doubles as an attempt to out-MAGA Florida Gov. Ron DeSantis on issues like critical race theory.,Zeeshan Aleem,2023-01-28 11:00:00+00:00,https://www.msnbc.com/opinion/msnbc-opinion/trump-education-policy-desantis-2024-rcna67534,0.0,0.0,1.0,0.0,0.0
