source,title,description,author,publishedAt,url,sentimentScore,neg,neu,pos,compound
Newsweek,Trump Says He Could End Russia's War 'Within 24 Hours' of Negotiation,"Trump said on Thursday that ending the Russia-Ukraine war was ""so easy to do"" and would happen ""within 24 hours"" using his negotiation skills.",Aila Slisco,2023-01-27 02:18:07+00:00,https://www.newsweek.com/trump-says-he-could-end-russias-war-within-24-hours-negotiation-1776959,-1.0,0.281,0.719,0.0,-0.5994
Newsweek,"Trump Financial Crimes Investigation Was 'Buried,' Kirschner Says","During the Trump-Russia probe, Trump's team looked into suspected financial dealings that involved the former president based on a tip from Italian officials.",Fatma Khaled,2023-01-27 17:12:57+00:00,https://www.newsweek.com/trump-financial-crimes-investigation-was-buried-kirschner-says-1777163,0.0,0.0,1.0,0.0,0.0
Newsweek,"As Trump Heads to New Hampshire, Republicans Say He's a 'Distraction'","A former supporter in New Hampshire said the former president gives people ""headaches"" and that they are ""tired of the drama.""",Anna Skinner,2023-01-27 19:11:16+00:00,https://www.newsweek.com/trump-heads-new-hampshire-republicans-say-hes-distraction-1777201,-1.0,0.245,0.755,0.0,-0.3818
Newsweek,Trump Will 'Fold Like a House of Cards' to Avoid Prison: Kirschner,"""He's going to be desperate to strike whatever kind of deals he can strike to minimize his exposure, ultimately, to prison,"" Glenn Kirschner said.",Fatma Khaled,2023-01-29 15:00:10+00:00,https://www.newsweek.com/trump-will-fold-like-house-cards-avoid-prison-kirschner-1777343,-1.0,0.393,0.429,0.179,-0.4588
Newsweek,Trump Responds to Paul Pelosi Attack Video,"The former president previously called the violent attack on Pelosi ""a terrible thing.""",Thomas Kika,2023-01-28 19:49:00+00:00,https://www.newsweek.com/trump-responds-paul-pelosi-attack-video-1777296,-1.0,0.383,0.617,0.0,-0.4767
Newsweek,Trump's Lawyers Argue Trump Organization Does Not Exist,"""While the shorthand 'Trump Organization' is utilized by Defendants for branding and business purposes, no entity as such exists for legal purposes,"" a filing read.",Zoe Strozewski,2023-01-27 18:49:20+00:00,https://www.newsweek.com/trumps-lawyers-argue-trump-organization-does-not-exist-1777199,-1.0,0.255,0.745,0.0,-0.34
Newsweek,Trump Feverishly Defends 'Perfect Calls' as Georgia Decision Looms,A judge will hear arguments Tuesday about whether to publicly release a special report that could include recommendations for criminal charges against Trump.,Anna Skinner,2023-01-24 16:10:47+00:00,https://www.newsweek.com/trump-feverishly-defends-perfect-calls-georgia-decision-looms-1776189,1.0,0.142,0.531,0.327,0.4767
Newsweek,"Trump's Facebook, Instagram Reinstatements Denounced as Win for 'Extremism'","Noah Bookbinder, president and CEO of Citizens for Responsibility and Ethics in Washington, called lifting the bans ""beyond unacceptable.""",Aila Slisco,2023-01-26 05:23:30+00:00,https://www.newsweek.com/trumps-facebook-instagram-reinstatements-denounced-win-extremism-1776662,1.0,0.0,0.612,0.388,0.5859
Newsweek,Trump Complains Allen Weisselberg Only in Jail for 'Not Paying Small Tax',"""I've got a 75 year old man, who has NEVER been in trouble before, sitting in PRISON…while drug dealers & murderers freely roam the sidewalks,"" Trump posted.",Nick Mordowanec,2023-01-23 21:17:20+00:00,https://www.newsweek.com/donald-trump-complains-allen-weisselberg-only-jail-not-paying-small-tax-truth-social-1775909,-1.0,0.224,0.776,0.0,-0.3818
Newsweek,Republicans Reelect Chair Ronna McDaniel Despite GOP's Election Losses,"""McDaniel has held the position by the grace of Donald Trump's support,"" one political scientist told Newsweek.",Fatma Khaled,2023-01-27 22:24:36+00:00,https://www.newsweek.com/republicans-reelect-ronna-mcdaniel-despite-gop-election-performance-1777222,1.0,0.0,0.78,0.22,0.3089
Newsweek,Trump Ally Peter Navarro Appeals for Cash as He Bemoans Democrat 'Lawfare',"""My legal bills just broke half a million bucks & I face a long road ahead,"" Navarro tweeted on Monday, asking supporters for financial help.",Matthew Impelli,2023-01-30 17:31:26+00:00,https://www.newsweek.com/trump-ally-peter-navarro-appeals-cash-he-bemoans-democrat-lawfare-1777613,0.0,0.0,1.0,0.0,0.0
Newsweek,Video of Trump Being Prayed for at South Carolina Eatery Viewed 1.9M Times,The former president made an unannounced stop at a burger shop following an event launching his 2024 campaign in the state.,Thomas Kika,2023-01-29 15:59:00+00:00,https://www.newsweek.com/video-trump-being-prayed-south-carolina-eatery-viewed-19m-times-1777346,0.0,0.0,1.0,0.0,0.0
Newsweek,Fani Willis Gave 'Direct' Hint That Trump Indictment is Coming: Kirschner,The former president is facing an investigation into his alleged involvement in tampering with the 2020 presidential election in Georgia.,Anna Skinner,2023-01-25 16:24:54+00:00,https://www.newsweek.com/fani-willis-gave-direct-hint-that-trump-indictment-coming-kirschner-1776544,0.0,0.0,1.0,0.0,0.0
Newsweek,Charles McGonigal's Role in Trump-Russia Investigation,The former top FBI official charged with providing services to a sanctioned Russian oligarch was instrumental in Robert Mueller launching a 2016 election probe.,Ewan Palmer,2023-01-24 12:29:46+00:00,https://www.newsweek.com/charles-mcgonigal-trump-russia-2016-investigation-muller-1776049,0.0,0.0,1.0,0.0,0.0
Newsweek,Trump Blasts Charles McGonigal After Arrest: 'Rot In Hell',The former FBI official was involved in the investigation of the former president's ties to Russia amid the 2016 election.,Ewan Palmer,2023-01-24 10:03:54+00:00,https://www.newsweek.com/trump-charles-mcgonigal-russia-arrest-sanctions-1775988,-1.0,0.5,0.5,0.0,-0.7906
Newsweek,Jim Jordan Confronted With Trump Campaign's Link to Russian Oligarch,"The GOP lawmaker recently urged Democrats to join Republicans in a newly formed subcommittee tasked to investigate the ""weaponization"" of the federal agencies.",Fatma Khaled,2023-01-29 17:24:49+00:00,https://www.newsweek.com/jim-jordan-confronted-trump-campaigns-link-russian-oligarch-1777355,-1.0,0.184,0.816,0.0,-0.2023
Newsweek,Former Trump Lawyer Faces Disbarment for False 2020 Election Claims,"John Eastman, who advised former President Trump, is facing nearly a dozen disciplinary charges relating to false statements he made about the 2020 election.",Kaitlin Lewis,2023-01-26 23:32:24+00:00,https://www.newsweek.com/former-trump-lawyer-john-eastman-faces-disbarment-false-2020-election-claims-1776955,0.0,0.0,1.0,0.0,0.0
Newsweek,Trump Says He Could Solve Ukraine War 'in 24 Hours',"The former president also said on Saturday that it was his personality that ""kept us out of war.""",Anna Commander,2023-01-28 20:16:28+00:00,https://www.newsweek.com/trump-says-he-could-solve-ukraine-war-24-hours-1777298,-1.0,0.307,0.551,0.142,-0.4767
Newsweek,"Spurious Biden, Trump Claims Swirl Around Monterey Park Shooting Suspect","Little information has been released about Huu Canh Tran, the alleged shooter, spawning rumors online.",Tom Norton,2023-01-24 16:29:33+00:00,https://www.newsweek.com/spurious-biden-trump-claims-swirl-around-monterey-park-shooting-suspect-1776187,-1.0,0.196,0.804,0.0,-0.296
Newsweek,"Trump Likely to Face Trial 'One Year' After Indictment, Kirschner Predicts","""The defense attorney will forever try to file motions to continue to push it further and further down the road,"" Kirschner said.",Fatma Khaled,2023-01-26 14:55:31+00:00,https://www.newsweek.com/trump-likely-face-trial-one-year-after-indictment-kirschner-predicts-1776831,0.0,0.0,1.0,0.0,0.0
Newsweek,Everything Trump Has Said About Elaine Chao as She Finally Fires Back,"Chao, the former transportation secretary under Trump, released a statement to Politico on Wednesday addressing the repeated attacks from her former boss.",Kaitlin Lewis,2023-01-26 02:58:36+00:00,https://www.newsweek.com/everything-trump-has-said-about-elaine-chao-she-finally-fires-back-1776666,0.0,0.0,1.0,0.0,0.0
Newsweek,Trump Loses Access to Millions of Viewers Ahead of First Campaign Rally,"Newsmax is often the only place on cable to view Trump rallies, netting them millions of viewers. How many will need to go elsewhere?",Nick Reynolds,2023-01-25 20:07:16+00:00,https://www.newsweek.com/trump-loses-access-millions-viewers-first-campaign-rally-1776631,-1.0,0.223,0.777,0.0,-0.3182
Newsweek,Bannon Points to DeSantis' 'Great Reception' at NFL Game Amid Trump Warning,"The Florida governor received cheers from the crowd as Trump zeroes in on 2024, with a focus on a particular state's voting bloc.",Nick Mordowanec,2023-01-23 16:33:20+00:00,https://www.newsweek.com/bannon-points-desantis-great-reception-nfl-game-amid-trump-warning-1775833,1.0,0.166,0.552,0.283,0.4019
Newsweek,More Oath Keepers Convicted on Same Charge Spells Danger for Trump,The growing number of seditious conspiracy convictions might help special counsel Jack Smith decide to charge Trump for his role in the January 6 Capitol riot.,Katherine Fung,2023-01-24 17:59:53+00:00,https://www.newsweek.com/more-oath-keepers-convicted-same-charge-spells-danger-trump-1776213,-1.0,0.298,0.702,0.0,-0.5267
Newsweek,Marjorie Taylor Greene Won't Be Trump VP for Shallow Reason: Ex-Pence Aide,"Greene is reportedly keen on being Trump's next running mate, and is being considered alongside the likes of Kristi Noem and Elise Stefanik.",Thomas Kika,2023-01-29 21:03:15+00:00,https://www.newsweek.com/marjorie-taylor-greene-wont-trump-vp-shallow-reason-ex-pence-aide-1777364,0.0,0.0,1.0,0.0,0.0
Newsweek,John Durham Under Pressure to Disclose Details of Trump Criminal Probe,Durham received a tip from Italian officials in 2019 about suspicious financial dealings involving the former president.,Darragh Roche,2023-01-28 16:10:49+00:00,https://www.newsweek.com/john-durham-under-pressure-disclose-details-donald-trump-criminal-probe-1777269,-1.0,0.444,0.556,0.0,-0.6808
Newsweek,"Trump Demands DirecTV Drop CNN, MSNBC in Rant Against Newsmax Removal","DirecTV and AT&T ""should be ashamed of themselves"" for deciding to drop Newsmax, the former president said.",Meghan Roos,2023-01-27 00:15:54+00:00,https://www.newsweek.com/donald-trump-demands-directv-drop-cnn-msnbc-after-newsmax-removal-truth-social-1776957,-1.0,0.36,0.64,0.0,-0.5423
Newsweek,Georgia's Former Lt. Gov. Says There's Enough Evidence to Indict Trump,Geoff Duncan came to the conclusion after District Attorney Fani Willis requested to keep a special report private until potential charges were filed.,Anna Skinner,2023-01-25 20:25:59+00:00,https://www.newsweek.com/georgia-former-lieutenant-governor-geoff-duncan-says-theres-enough-evidence-indict-donald-trump-1776624,0.0,0.0,1.0,0.0,0.0
Newsweek,Russia Agrees With Trump's Perspective on Sending Tanks to Ukraine,"""Trump, deliberately or not, is helping Russia rattle the nuclear sabre,"" said Maria Popova, associate professor of political science at McGill University.",Nick Mordowanec,2023-01-27 16:00:24+00:00,https://www.newsweek.com/russia-agrees-trumps-perspective-sending-tanks-ukraine-1777141,1.0,0.0,0.795,0.205,0.2023
Newsweek,"Trump's Reinstated Facebook, Instagram Accounts Come With 'New Guardrails'","Trump will face ""heightened penalties for repeat offenses"" on his reinstated Facebook and Instagram accounts, Meta President of Global Affairs Nick Clegg said.",Aila Slisco,2023-01-26 00:05:29+00:00,https://www.newsweek.com/trumps-reinstated-facebook-instagram-accounts-come-new-guardrails-1776652,0.0,0.0,1.0,0.0,0.0
Newsweek,Trump Wastes No Time Attacking Facebook After He's Unbanned From Meta,"Meta, which owns Facebook and Instagram, announced Wednesday that the former president will be reinstated to its platforms in the coming weeks.",Kaitlin Lewis,2023-01-26 00:37:25+00:00,https://www.newsweek.com/trump-wastes-no-time-attacking-facebook-after-hes-unbanned-meta-1776660,-1.0,0.366,0.634,0.0,-0.6369
Newsweek,Trump Warns of Nuclear War Over West Sending Tanks to Ukraine,The U.S. and Germany recently announced they would be sending tanks to Ukraine as the war with Russia reaches 11 months.,Zoe Strozewski,2023-01-26 16:10:27+00:00,https://www.newsweek.com/trump-warns-nuclear-war-over-west-sending-tanks-ukraine-1776855,-1.0,0.431,0.569,0.0,-0.6486
Newsweek,"Edward Snowden Lumps Pence in With Biden, Trump as 'Unindicted Criminals'",Snowden still faces espionage charges from 2013 when he leaked classified documents about the National Security Agency.,Anna Skinner,2023-01-24 20:12:21+00:00,https://www.newsweek.com/edward-snowden-calls-pence-biden-trump-unindicted-criminals-1776245,-1.0,0.316,0.684,0.0,-0.5719
Newsweek,Trump Wants 'Ultimate Form of Local Control' in His Plan for Schools,"The former president released a video Thursday about his idea, which includes condemning schools that teach critical race theory and gender ideology.",Kaitlin Lewis,2023-01-27 22:40:01+00:00,https://www.newsweek.com/trump-wants-ultimate-form-local-control-his-plan-schools-1777229,0.0,0.0,1.0,0.0,0.0
Newsweek,Trump's South Carolina Rally Tests Limits Of His Influence,"Intended to solidify support in the early primary state, Trump's Saturday event only demonstrates the 2024 presidential race is wide open.",Nick Reynolds,2023-01-28 23:24:44+00:00,https://www.newsweek.com/trumps-south-carolina-rally-tests-limits-his-influence-1777235,0.0,0.0,1.0,0.0,0.0
Newsweek,Kari Lake Turns to Discredited Trump Ploy as Lawsuit Rumbles,"The Arizona hopeful is offering to match, by a factor of 10, the donations of supporters in her legal battle to overturn the state governor results.",Giulia Carbonaro,2023-01-27 09:35:41+00:00,https://www.newsweek.com/kari-lake-turns-discredited-trump-ploy-lawsuit-rumbles-1776974,-1.0,0.444,0.556,0.0,-0.5859
Newsweek,Joe Biden Faces New Test With Trump Ally Jair Bolsonaro,Biden must choose whether to extend Bolsonaro's visa or deny it following the Jan. 8 attempt by his supporters to overthrow the government.,Nick Reynolds,2023-01-30 21:29:54+00:00,https://www.newsweek.com/joe-biden-faces-new-test-trump-ally-jair-bolsonaro-1777667,0.0,0.0,1.0,0.0,0.0
Newsweek,Fulton County Grand Jury Could Be Necessary Ammo in Prosecuting Trump,Grand juries are seen as essential tools to lend checks and balances to the justice system. But some also see them as tools of the prosecution.,Nick Reynolds,2023-01-24 21:36:20+00:00,https://www.newsweek.com/fulton-county-grand-jury-could-necessary-ammo-prosecuting-trump-1776268,1.0,0.0,0.75,0.25,0.4588
Newsweek,Mike Pence 'Almost Bragged' About Classified Documents—Tucker Carlson,The Fox News host questioned why the former VP was so willing to reveal that he had sensitive materials at his Indiana home.,Ewan Palmer,2023-01-25 09:25:01+00:00,https://www.newsweek.com/mike-pence-classified-documents-home-tucker-carlson-1776350,0.0,0.0,1.0,0.0,0.0
Newsweek,ACLU Backing Trump's Reinstatement to Facebook Sparks Debate,"One Twitter user said that reinstating Trump's Facebook and Instagram accounts could result in the former president ""stirring up more political violence.""",Fatma Khaled,2023-01-26 18:28:52+00:00,https://www.newsweek.com/aclu-backs-donald-trump-facebook-instagram-reinstatement-sparks-debate-social-media-comments-1776911,1.0,0.0,0.845,0.155,0.0258
Newsweek,Trump Lays Out Long List of Questions He Wants Congress to ask the FBI,A new House subcommittee is expected to investigate government agencies such as the FBI and Justice Department.,Zoe Strozewski,2023-01-25 22:03:41+00:00,https://www.newsweek.com/trump-list-questions-congress-fbi-1776646,0.0,0.0,1.0,0.0,0.0
Newsweek,"Trump Already Struggling in South Carolina and New Hampshire, Polls Show","Former national security adviser John Bolton recently said that Trump's 2024 campaign was ""going downhill and I think it'll continue to go downhill.""",Fatma Khaled,2023-01-28 21:01:09+00:00,https://www.newsweek.com/trump-already-struggling-south-carolina-new-hampshire-polls-show-1777301,-1.0,0.259,0.741,0.0,-0.4215
Newsweek,Mike Lindell Backed by More Republicans Than McDaniel to Lead RNC: Poll,"A candidate needs a simple majority, or 85 of 168 votes, to win. Members will convene on Friday for the secret-ballot election.",Katherine Fung,2023-01-26 19:05:19+00:00,https://www.newsweek.com/mike-lindell-backed-more-republicans-mcdaniel-lead-rnc-poll-1776914,1.0,0.0,0.891,0.109,0.0258
Newsweek,Kevin McCarthy Fact Checked With Trump's Massive Addition to National Debt,The former president added nearly 25 percent to the national debt during his four years in office.,Anna Commander,2023-01-29 19:19:19+00:00,https://www.newsweek.com/kevin-mccarthy-fact-checked-trumps-massive-addition-national-debt-1777363,-1.0,0.217,0.783,0.0,-0.3612
Newsweek,Marjorie Taylor Greene Won't Be Trump's VP Nominee for This Reason: Conway,Greene's ascent within the GOP may be a stepping stone to bigger aspirations in the years to come.,Nick Mordowanec,2023-01-26 16:54:08+00:00,https://www.newsweek.com/marjorie-taylor-greene-wont-trump-vp-conway-1776887,0.0,0.0,1.0,0.0,0.0
Newsweek,What Is Sedition? Four More Oath Keepers Convicted in January 6 Attack,"Oath Keepers Joseph Hackett, David Moerschel, Roberto Minuta and Edward Vallejo on Monday were found guilty of seditious conspiracy.",Aila Slisco,2023-01-24 01:54:01+00:00,https://www.newsweek.com/what-sedition-four-more-oath-keepers-convicted-january-6-attack-1775942,-1.0,0.424,0.576,0.0,-0.7096
Newsweek,McCarthy Facing Backlash on MAGA Subcommittee Selections,"Representative Marjorie Taylor Greene, who was previously suspended on Twitter for spreading COVID-19 misinformation, was appointed to a panel on the virus.",Aila Slisco,2023-01-25 03:28:08+00:00,https://www.newsweek.com/mccarthy-facing-backlash-maga-subcommittee-selections-1776295,0.0,0.0,1.0,0.0,0.0
Newsweek,Mike Pence Denied Taking Documents Months Before Classified Items Found,"Since the discovery of the documents last week, the FBI and the Department of Justice have started a review into their contents.",Anna Skinner,2023-01-24 18:06:07+00:00,https://www.newsweek.com/mike-pence-denied-taking-documents-months-before-classified-items-found-1776227,-1.0,0.244,0.756,0.0,-0.4404
Newsweek,"Biden, Pence Classified Documents Put Spotlight on Obama","As more classified materials have been found, some members of Congress are questioning what might be found in other presidents' possession.","Nick Reynolds, Alex J. Rouhandeh",2023-01-26 22:17:40+00:00,https://www.newsweek.com/biden-pence-classified-documents-spotlight-obama-1776947,0.0,0.0,1.0,0.0,0.0
Newsweek,Paul Pelosi Attack Video Release Leaves Democrats Fearing the Worst,"The hammer assault has led to unfounded conspiracy theories about former Speaker Nancy Pelosi's husband, and any footage may in time be manipulated.",Darragh Roche,2023-01-26 09:18:51+00:00,https://www.newsweek.com/paul-pelosi-attack-video-release-leaves-democrats-fearing-worst-1776678,-1.0,0.645,0.355,0.0,-0.8979
Newsweek,Backlash as University Swaps Religious Names Like Easter for Spring Term,"""These new names use more accessible and widely recognized terminology,"" an LSE spokesperson told Newsweek.",Alice Gibbs,2023-01-30 13:40:17+00:00,https://www.newsweek.com/backlash-university-swaps-religious-names-easter-spring-term-1777488,1.0,0.0,0.762,0.238,0.3612
Newsweek,Steve Bannon Teases 'Plan' That Will Make RNC Critics Happy,"Last week, Ronna McDaniel was reelected to her fourth term as chairwoman of the Republican National Committee.",Matthew Impelli,2023-01-30 21:42:15+00:00,https://www.newsweek.com/steve-bannon-teases-plan-that-will-make-rnc-critics-happy-1777672,-1.0,0.291,0.464,0.245,0.0772
Newsweek,Pence's Classified Documents Put Merrick Garland in the Hot Seat Again,Pence's lawyer reportedly told the National Archives in a letter that documents with classified markings were discovered in his Indiana home last week.,Zoe Strozewski,2023-01-24 20:00:41+00:00,https://www.newsweek.com/pences-classified-documents-puts-merrick-garland-hot-seat-again-1776249,0.0,0.0,1.0,0.0,0.0
Newsweek,"Kari Lake Lost Election Because Republicans Voted for Others, Report Claims","Nearly 40,000 GOP-leaning voters in Arizona's Maricopa County backed Democrat Katie Hobbs for governor, wrote down another candidate, or didn't vote at all.",Ewan Palmer,2023-01-23 10:51:40+00:00,https://www.newsweek.com/kari-lake-lost-arizona-governor-election-republican-voters-1775682,-1.0,0.204,0.796,0.0,-0.3182
Newsweek,Steve Bannon Claims 'Judas Pence' Is Covering for Biden,"The ""War Room"" podcast host responded to news that classified documents were found at Mike Pence's Indiana home.",Jon Jackson,2023-01-24 21:30:54+00:00,https://www.newsweek.com/steve-bannon-claims-judas-pence-covering-joe-biden-classified-documents-1776247,0.0,0.0,1.0,0.0,0.0
Newsweek,Kari Lake Mocked as 'Save Arizona' Rally Poster Draws Nicolas Cage Comparisons,"Kari Lake lost the Arizona gubernatorial election to Democratic candidate Katie Hobbs, who was sworn into office on January 2.",James Bickerton,2023-01-24 11:46:16+00:00,https://www.newsweek.com/kari-lake-mocked-save-arizona-rally-poster-draws-nicolas-cage-comparisons-1776017,1.0,0.159,0.621,0.221,0.2263
Newsweek,Marjorie Taylor Greene Believes She Can Be President: Steve Bannon,"""This is no shrinking violet, she's ambitious. She's not shy about that, nor should she be,"" Bannon said of the Georgia congresswoman.",Katherine Fung,2023-01-25 16:05:16+00:00,https://www.newsweek.com/marjorie-taylor-greene-believes-she-can-president-steve-bannon-1776527,0.0,0.0,1.0,0.0,0.0
Newsweek,Ted Cruz Slams Biden Admin for Funding 'Both Sides' of Ukraine War,The State Department announced earlier this month that the United States will send an additional $3.75 billion in military assistance to Ukraine.,Fatma Khaled,2023-01-28 22:43:56+00:00,https://www.newsweek.com/ted-cruz-slams-biden-admin-funding-both-sides-ukraine-war-1777307,-1.0,0.302,0.698,0.0,-0.5994
Newsweek,Adam Schiff's Chances of Winning Feinstein's Senate Seat in 2024 Run,"The race to replace the oldest sitting senator just got even more competitive, and Feinstein could still be in the running for a sixth full term.",Katherine Fung,2023-01-26 21:57:32+00:00,https://www.newsweek.com/adam-schiff-chances-winning-dianne-feinstein-senate-seat-2024-run-california-1776903,1.0,0.0,0.574,0.426,0.6369
Newsweek,Biden's Classified Documents Aren't Chipping Away at His Popularity: Poll,Republicans attacks about the files found at Biden's Delaware home aren't translating to a downtick in support for the Democratic president.,Andrew Stanton,2023-01-24 15:57:45+00:00,https://www.newsweek.com/bidens-classified-documents-arent-chipping-away-his-popularity-poll-1776170,1.0,0.0,0.721,0.279,0.4767
Newsweek,"Tucker Carlson Makes Wild Claim in Deaths of Tyre Nichols, Ashli Babbitt","Carlson denounced those who were ""weeping"" about the death of Nichols, who was killed in a police beating this month, while arguing Babbitt was ""murdered.""",Aila Slisco,2023-01-28 04:41:06+00:00,https://www.newsweek.com/tucker-carlson-makes-wild-claim-deaths-tyre-nichols-ashli-babbitt-1777248,0.0,0.0,1.0,0.0,0.0
Newsweek,Lindsey Graham Defends Joe Biden Against 'Sinister' Accusations,"Biden's former Senate colleague said classified documents in Biden's home might not be as sinister as some claim, even after he pushed for a special counsel.",Nick Reynolds,2023-01-24 18:35:03+00:00,https://www.newsweek.com/lindsey-graham-defends-joe-biden-sinister-accusations-classified-documents-1776233,-1.0,0.508,0.492,0.0,-0.7351
Newsweek,Mike Lindell May Run a New RNC Election Committee if He Loses Chair Vote,"Lindell told Newsweek that he hopes to rebrand the GOP as the party of ""common sense"" and was feeling ""really good"" about his bid to lead the RNC.",Aila Slisco,2023-01-26 03:34:31+00:00,https://www.newsweek.com/mike-lindell-may-run-new-rnc-election-committee-if-he-loses-chair-vote-1776663,-1.0,0.173,0.827,0.0,-0.3182
Reuters,Donald Trump ends another legal challenge to N.Y. attorney general ... - Reuters,Donald Trump has ended his appeal of a court ruling that let New York state's attorney general investigate his real estate business and eventually file a $250 million civil fraud lawsuit against the former U.S. president.,,2023-01-24 19:02:00+00:00,https://www.reuters.com/world/us/donald-trump-ends-another-legal-challenge-ny-attorney-general-probe-2023-01-24/,1.0,0.0,0.741,0.259,0.2023
Reuters,Trump seeks to shift his idling White House campaign back into gear - Reuters,"Donald Trump will seek to kick his campaign for the 2024 Republican nomination into gear this weekend, with a pair of campaign stops in key early-voting states more than two months after he announced his intention to run.",,2023-01-26 11:03:00+00:00,https://www.reuters.com/world/us/trump-seeks-shift-his-idling-white-house-campaign-back-into-gear-2023-01-26/,0.0,0.0,1.0,0.0,0.0
Reuters,"Trump heads to New Hampshire, South Carolina in bid to jump-start ... - Reuters",Former U.S. President Donald Trump will swing through New Hampshire and South Carolina on Saturday in the first two stops of a presidential campaign that has largely idled since he launched his new White House bid in November.,,2023-01-28 11:01:00+00:00,https://www.reuters.com/world/us/trump-heads-new-hampshire-south-carolina-bid-jump-start-campaign-2023-01-28/,0.0,0.0,1.0,0.0,0.0
Reuters,Meta advertisers brush off Trump's potential return - Reuters,"Former U.S. President Donald Trump's potential return to Meta Platform's <a href=""https://www.reuters.com/companies/META.O"" target=""_blank"">(META.O)</a> Facebook and Instagram is unlikely to change how advertisers spend money with the world's second-largest d…",,2023-01-26 02:12:00+00:00,https://www.reuters.com/technology/meta-advertisers-brush-off-trumps-potential-return-2023-01-26/,0.0,0.0,1.0,0.0,0.0
