source,title,description,author,publishedAt,url,sentimentScore,neg,neu,pos,compound
Business Insider,C-SPAN captured a tense exchange between George Santos and Mitt Romney at the State of the Union,"Romney, once the party's 2012 presidential nominee, reportedly told the scandal-plagued Long Island congressman: 'You don't belong here.'",bmetzger@insider.com (Bryan Metzger),2023-02-08 03:16:02+00:00,https://www.businessinsider.com/george-santos-mitt-romney-you-dont-belong-here-2023-2,-1.0,0.211,0.789,0.0,-0.34
Business Insider,George Santos grabbed an aisle seat at the State of the Union. Not everyone was eager to shake his hand.,"Seated beside GOP Rep. Thomas Massie of Kentucky, Santos soon discovered that not everyone, including some Republicans, was interested in seeing him.","ngaudiano@insider.com (Nicole Gaudiano,Bryan Metzger,Warren Rojas)",2023-02-08 02:15:12+00:00,https://www.businessinsider.com/george-santos-aisle-seat-state-of-the-union-mitt-romney-2023-2,1.0,0.133,0.569,0.298,0.3834
CBS News,Swifties vs. Ticketmaster,"Even before the recent Taylor Swift ticket snafu, Ticketmaster and its parent company, the concert promoter Live Nation Entertainment, have been criticized for controlling 70% of the big concert ticket market, leaving fans and artists nowhere else to go. Live…",CBS News,2023-02-05 14:37:23+00:00,https://www.cbsnews.com/video/swifties-vs-ticketmaster/,0.0,0.0,1.0,0.0,0.0
CBS News,"Taylor Swift fans, and Congress, take on Ticketmaster","Disappointed Swifties have filed a lawsuit against the ticket seller and its parent company, Live Nation Entertainment, who control 70% of the market, while Congress and the Justice Dept. are looking into their business.",Rita Braver,2023-02-05 14:21:03+00:00,https://www.cbsnews.com/news/taylor-swift-fans-and-congress-take-on-ticketmaster/,1.0,0.0,0.735,0.265,0.2023
CBS News,A look at some of the symbols worn by members of Congress at the SOTU,"President Biden was the only speaker during the State of the Union address, but many lawmakers made silent statements while in the audience.",Caitlin O'Kane,2023-02-08 05:28:58+00:00,https://www.cbsnews.com/news/state-of-the-union-pins-crayons-1870-buttons-symbols-worn-by-congress/,-1.0,0.306,0.694,0.0,-0.296
Fox News,"Fetterman hears voices like the teachers in 'Peanuts' after stroke, struggles to adjust to Senate life: report","Senator John Fetterman's stroke caused severe auditory processing issues that are effecting him as he adjusts to life in the Senate,",Aubrie Spady,2023-02-10 12:41:30+00:00,https://www.foxnews.com/politics/fetterman-hears-voices-teachers-peanuts-after-stroke-struggles-adjust-senate-life-report,0.0,0.167,0.667,0.167,0.0
The Hill,Dem Rep. assaulted in DC apartment building...,,the hill,2023-02-09 19:00:04+00:00,https://thehill.com/homenews/house/3851365-angie-craig-assaulted-in-dc-apartment-building/,-1.0,0.405,0.595,0.0,-0.5267
Time,Biden Calls for Antitrust Laws to Rein in Big Tech After Schumer Blocked Last Effort,Biden urged Congress to pass antitrust measures that have bipartisan support and might have passed last year if Schumer had allowed votes on them.,Eric Cortellessa,2023-02-08 03:15:41+00:00,https://time.com/6253755/biden-big-tech-state-of-the-union-2023/,-1.0,0.16,0.84,0.0,-0.2732
