source,title,description,author,publishedAt,url,sentimentScore,neg,neu,pos,compound
ABC News,Migrant apprehensions at southern border hit lowest point in 2 years,Migrant apprehensions along the southwest border last month hit the lowest level since February 2021.,Quinn Owen,2023-02-10 23:08:54+00:00,https://abcnews.go.com/Politics/migrant-apprehensions-southern-border-hit-lowest-point-2/story?id=97043533,-1.0,0.429,0.571,0.0,-0.5423
ABC News,Biden says America needs to 'finish the job on police reform' in State of the Union,President Joe Biden addressed police reform during his State of the Union address on Tuesday night.,Meredith Deliso,2023-02-08 03:57:40+00:00,https://abcnews.go.com/Politics/biden-america-finish-job-police-reform-state-union/story?id=96848754,0.0,0.0,1.0,0.0,0.0
ABC News,What's on Biden's health agenda in 2023 following the State of the Union,"After delivering his State of the Union address on Tuesday night, here's what's on President Joe Biden's health agenda in 2023.",Mary Kekatos,2023-02-08 19:33:43+00:00,https://abcnews.go.com/Health/bidens-health-agenda-2023-state-union/story?id=96976059,0.0,0.0,1.0,0.0,0.0
ABC News,5 takeaways from Biden's State of the Union and Republican response,"President Joe Biden delivered his second State of the Union address Tuesday, balancing a push for bipartisanship in a divided Washington and advocacy for his policies.",Tal Axelrod,2023-02-08 05:18:20+00:00,https://abcnews.go.com/Politics/5-takeaways-bidens-state-union-republican-response/story?id=96848378,0.0,0.0,1.0,0.0,0.0
ABC News,US VP's husband urges global action against antisemitism,"Doug Emhoff, the husband of U.S. Vice President Kamala Harris, took his campaign against antisemitism to the United Nations, urging diplomats from many nations to speak out against the rising global hatred of Jews",EDITH M. LEDERER Associated Press,2023-02-09 23:53:39+00:00,https://abcnews.go.com/International/wireStory/us-vps-husband-urges-global-action-antisemitism-97019771,0.0,0.0,1.0,0.0,0.0
ABC News,Biden makes Wisconsin his 1st stop after State of the Union,President Joe Biden is making Wisconsin his first stop after his State of the Union address,DARLENE SUPERVILLE Associated Press,2023-02-08 10:24:06+00:00,https://abcnews.go.com/Politics/wireStory/biden-makes-wisconsin-1st-stop-after-state-union-96973618,-1.0,0.268,0.732,0.0,-0.296
ABC News,Toll of police brutality to be visible at State of the Union,The toll of police brutality in America will be on painful display as family members of Black men and women killed in custody sit alongside lawmakers in the House to hear the president’s State of the Union address,FARNOUSH AMIRI Associated Press,2023-02-08 02:09:23+00:00,https://abcnews.go.com/Politics/wireStory/toll-police-brutality-visible-state-union-96965722,-1.0,0.444,0.556,0.0,-0.6124
ABC News,Biden's State of the Union to tout policy wins on economy,"President Joe Biden will use his second State of the Union address on Tuesday to remind Americans of how their lives have been improved over his first two years in office, as he tries to navigate the tricky politics of a newly divided Washington",ZEKE MILLER and SEUNG MIN KIM Associated Press,2023-02-05 17:24:03+00:00,https://abcnews.go.com/Politics/wireStory/bidens-state-union-tout-policy-wins-economy-96905561,1.0,0.147,0.49,0.363,0.4939
ABC News,Biden makes progress on 'unity agenda' outlined in 2022,"A year ago, President Joe Biden used his first State of the Union address to push top Democratic priorities that were sure to face a battle in the narrowly divided Congress — tough asks like an assault weapons ban",DARLENE SUPERVILLE Associated Press,2023-02-04 05:25:28+00:00,https://abcnews.go.com/Politics/wireStory/biden-makes-progress-unity-agenda-outlined-2022-96891681,1.0,0.0,0.682,0.318,0.4215
ABC News,Proenza Schouler debut effortlessly cool looks at NYFW,"Known for notoriously dressing the It Girl, it came as no surprise when actor and fashion muse Chloe Sevigny opened the show for Proenza Schouler Saturday to a room packed with her celeb peers",BEATRICE DUPUY Associated Press,2023-02-11 23:39:33+00:00,https://abcnews.go.com/Health/wireStory/proenza-schouler-debut-effortlessly-cool-nyfw-97059690,1.0,0.0,0.723,0.277,0.3182
ABC News,NY Fashion Week: Siriano channels Audrey Hepburn in a garden,Christian Siriano has lined his New York Fashion Week runway Thursday with thousands of multicolored flowers,LEANNE ITALIE Associated Press,2023-02-10 02:24:51+00:00,https://abcnews.go.com/Health/wireStory/ny-fashion-week-siriano-channels-audrey-hepburn-garden-97023184,0.0,0.0,1.0,0.0,0.0
ABC News,Proenza Schouler debut effortlessly cool looks at NYFW,"Known for notoriously dressing the It Girl, it came as no surprise when actor and fashion muse Chloe Sevigny opened the show for Proenza Schouler Saturday to a room packed with her celeb peers",BEATRICE DUPUY Associated Press,2023-02-11 23:54:11+00:00,https://abcnews.go.com/US/wireStory/proenza-schouler-debut-effortlessly-cool-nyfw-97059688,1.0,0.0,0.723,0.277,0.3182
ABC News,"Tyre Nichols' mom, chief: Women on two sides of a tragedy",Tyre Nichols’ mother and Memphis police chief Cerelyn “CJ” Davis are two women caught on different sides of a tragedy,ADRIAN SAINZ Associated Press,2023-02-05 14:39:29+00:00,https://abcnews.go.com/US/wireStory/tyre-nichols-mom-chief-women-sides-tragedy-96903406,-1.0,0.386,0.614,0.0,-0.6597
ABC News,Proenza Schouler debut effortlessly cool looks at NYFW,"Known for notoriously dressing the It Girl, it came as no surprise when actor and fashion muse Chloe Sevigny opened the show for Proenza Schouler Saturday to a room packed with her celeb peers",BEATRICE DUPUY Associated Press,2023-02-11 23:39:41+00:00,https://abcnews.go.com/Entertainment/wireStory/proenza-schouler-debut-effortlessly-cool-nyfw-97059691,1.0,0.0,0.723,0.277,0.3182
ABC News,NY Fashion Week: Siriano channels Audrey Hepburn in a garden,Christian Siriano has lined his New York Fashion Week runway Thursday with thousands of multicolored flowers,LEANNE ITALIE Associated Press,2023-02-10 02:24:58+00:00,https://abcnews.go.com/Entertainment/wireStory/ny-fashion-week-siriano-channels-audrey-hepburn-garden-97023189,0.0,0.0,1.0,0.0,0.0
ABC News,Biden makes Wisconsin his 1st stop after State of the Union,President Joe Biden is making Wisconsin his first stop after his State of the Union address,DARLENE SUPERVILLE Associated Press,2023-02-08 10:09:33+00:00,https://abcnews.go.com/Business/wireStory/biden-makes-wisconsin-1st-stop-after-state-union-96973620,-1.0,0.268,0.732,0.0,-0.296
ABC News,Biden's State of the Union to tout policy wins on economy,"President Joe Biden will use his second State of the Union address on Tuesday to remind Americans of how their lives have been improved over his first two years in office, as he tries to navigate the tricky politics of a newly divided Washington",ZEKE MILLER and SEUNG MIN KIM Associated Press,2023-02-05 17:09:28+00:00,https://abcnews.go.com/Business/wireStory/bidens-state-union-tout-policy-wins-economy-96905564,1.0,0.147,0.49,0.363,0.4939
ABC News,Harris says Biden showed bipartisanship despite GOP heckling,Harris says Biden showed bipartisanship despite GOP hecklinggo.com,Libby Cathey,2023-02-08 13:21:07+00:00,https://abcnews.go.com/Politics/harris-biden-showed-bipartisanship-despite-gop-heckling/story?id=96974586,0.0,0.0,1.0,0.0,0.0
ABC News,Memorable moments from recent State of the Union addresses,From Pelosi tearing up Trump's speech to President Ford's bold statement.,Isabella Murray,2023-02-07 10:08:00+00:00,https://abcnews.go.com/Politics/memorable-moments-recent-state-union-addresses/story?id=96848317,0.0,0.0,1.0,0.0,0.0
Al Jazeera English,Sixth US police officer fired over beating death of Tyre Nichols,Five other officers had already been fired and charged with murder over Tyre Nichols' death.,Al Jazeera,2023-02-04 07:31:26+00:00,https://www.aljazeera.com/news/2023/2/4/sixth-memphis-police-officer-fired-over-tyre-nichols-death,-1.0,0.636,0.364,0.0,-0.8885
Al Jazeera English,"Russia-Ukraine war: List of key events, day 349","As the Russia-Ukraine war enters its 349th day, we take a look at the main developments.",Al Jazeera,2023-02-07 08:43:31+00:00,https://www.aljazeera.com/news/2023/2/7/russia-ukraine-war-list-of-key-events-day-349,-1.0,0.394,0.606,0.0,-0.5994
Al Jazeera English,Florida passes bill backing DeSantis push to relocate migrants,"Republican lawmakers create $10m programme to fund governor's push, which critics say treats people as 'chess pieces'.",Al Jazeera,2023-02-10 19:12:00+00:00,https://www.aljazeera.com/news/2023/2/10/florida-passes-bill-backing-desantis-push-to-relocate-migrants,1.0,0.0,0.864,0.136,0.0258
Al Jazeera English,"Family of Amir Locke, shot in no-knock police raid, files lawsuit",The 22-year-old was killed in a police shooting after officers entered the Minneapolis apartment where he was sleeping.,Al Jazeera,2023-02-04 02:05:54+00:00,https://www.aljazeera.com/news/2023/2/4/family-of-amir-locke-shot-in-no-knock-police-raid-files-lawsuit,-1.0,0.192,0.808,0.0,-0.2263
BBC News,Tyre Nichols: Sixth police officer fired,"Preston Hemphill violated multiple rules, including stun gun deployment regulations, police say.",https://www.facebook.com/bbcnews,2023-02-04 10:37:20+00:00,https://www.bbc.co.uk/news/world-us-canada-64521857,-1.0,0.419,0.581,0.0,-0.5574
BBC News,State of the Union: Who is on the guest list?,"Bono, Paul Pelosi and the family of Tyre Nichols are among the notable guests at this year's address.",https://www.facebook.com/bbcnews,2023-02-07 17:19:06+00:00,https://www.bbc.co.uk/news/world-us-canada-64503876,0.0,0.0,1.0,0.0,0.0
Bloomberg,Biden Calling for Billionaire Minimum Tax...,President Joe Biden will call for quadrupling the levy on corporate stock buybacks and renew his calls for a minimum tax on billionaires during his State of the Union address Tuesday.,,2023-02-06 21:58:38+00:00,https://www.bloomberg.com/news/articles/2023-02-06/biden-to-call-for-billionaire-tax-bigger-levy-on-stock-buybacks,0.0,0.0,1.0,0.0,0.0
Breitbart News,Poll: Trump Takes Lead over Biden on Eve of State of the Union Address,"Former President Donald Trump, a Republican, has taken a lead over current President Joe Biden, a Democrat, on the eve of the latter’s planned State of the Union address this week in Congress, a poll shows.","Matthew Boyle, Matthew Boyle",2023-02-05 17:49:43+00:00,https://www.breitbart.com/politics/2023/02/05/poll-trump-takes-lead-biden-eve-state-union-address/,0.0,0.0,1.0,0.0,0.0
Breitbart News,Poll: Less than 4/10 Approve of Election Denier Hakeem Jeffries After One Month as House Minority Leader,"Infamous election denier Hakeem Jeffries (D-NY) approval rating among Americans is unfavorable after just one month as House minority leader, a Rasmussen poll found on Tuesday.","Wendell Husebø, Wendell Husebø",2023-02-08 15:54:55+00:00,https://www.breitbart.com/politics/2023/02/08/poll-less-than-4-10-approve-election-denier-hakeem-jeffries-after-1-month-house-minority-leader/,-1.0,0.161,0.839,0.0,-0.3612
Breitbart News,"Joe Biden Calls to Codify Roe, Bemoans National Abortion Ban in SOTU Speech: 'I Will Veto It'","President Joe Biden accused the Supreme Court during his 2023 State of the Union speech of taking away a woman's ""right"" to end the life of her unborn child and said he would veto pro-life legislation should it reach his desk.","Katherine Hamilton, Katherine Hamilton",2023-02-08 03:43:56+00:00,https://www.breitbart.com/politics/2023/02/07/joe-biden-calls-codify-roe-bemoans-national-abortion-ban-sotu-speech-will-veto/,-1.0,0.217,0.783,0.0,-0.5574
Breitbart News,Fact Check: Biden Says in State of the Union 'Democracies Have Become Stronger',"President Joe Biden alleged in his annual State of the Union speech on Tuesday that ""democracies have become stronger"" -- and authoritarian states ""weaker, not stronger"" -- in the two years since he took office.","Frances Martel, Frances Martel",2023-02-08 04:43:00+00:00,https://www.breitbart.com/politics/2023/02/07/fact-check-biden-state-ofthe-union-democracies-become-stronger/,1.0,0.0,0.776,0.224,0.3818
Breitbart News,Poll: Only 39% Want Kamala Harris to Be Joe Biden's Running Mate in 2024,"Only 39 percent of likely voters in the United States want Vice President Kamala Harris to remain as President Joe Biden's running mate in 2024, a Rasmussen Reports poll found.","Jacob Bliss, Jacob Bliss",2023-02-05 23:45:50+00:00,https://www.breitbart.com/politics/2023/02/05/poll-only-39-want-kamala-harris-joe-bidens-running-mate-2024/,1.0,0.0,0.894,0.106,0.0772
Breitbart News,Kamala Harris Avoids Addressing Her Husband's Kiss with Jill Biden: They're Working 'Against Antisemitism',"Vice President Kamala Harris said she has not seen the video of her husband, second gentleman Doug Emhoff, sharing a smooch with first lady Jill Biden moments ahead of Tuesday's State of the Union address.","Hannah Bleau, Hannah Bleau",2023-02-10 16:27:47+00:00,https://www.breitbart.com/politics/2023/02/10/kamala-harris-avoids-addressing-her-husbands-kiss-jill-biden-theyre-working-against-antisemitism/,1.0,0.11,0.71,0.181,0.2732
Breitbart News,Poll: Majority Do Not Want Joe Biden to Run for Reelection in 2024,"The majority of likely voters in the United States do not want President Joe Biden to run for reelection in 2024, a poll found on the eve of his State of the Union address.","Jacob Bliss, Jacob Bliss",2023-02-05 23:56:40+00:00,https://www.breitbart.com/politics/2023/02/05/poll-majority-do-not-want-joe-biden-run-reelection-2024/,-1.0,0.12,0.88,0.0,-0.0572
Breitbart News,Watch Live: President Joe Biden Delivers His State of the Union Address,President Joe Biden delivers his State of the Union address on Tuesday as both houses of Congress and the president’s cabinet gather in the Capitol building for the event.,"Jacob Bliss, Jacob Bliss",2023-02-08 02:05:15+00:00,https://www.breitbart.com/politics/2023/02/07/watch-live-president-joe-biden-delivers-his-state-of-the-union-address-2/,0.0,0.0,1.0,0.0,0.0
Breitbart News,*** SOTU Livewire *** Joe Biden Gives Second State of the Union Address,Democrat President Joe Biden is set to give his second State of the Union address as Commander in Chief of the United States on Tuesday evening before a joint session of Congress.,"Matthew Boyle, Matthew Boyle",2023-02-08 01:00:52+00:00,https://www.breitbart.com/politics/2023/02/07/sotu-livewire-joe-biden-gives-second-state-of-the-union-address/,0.0,0.0,1.0,0.0,0.0
Breitbart News,"FNC's Carlson on SOTU: Biden Mental Condition Either Scary and Depressing, Deeply Alarming or Absolutely Hilarious","Wednesday, FNC host Tucker Carlson opened his program by reacting to the State of the Union address a night earlier given by President Joe Biden. | Clips","Jeff Poor, Jeff Poor",2023-02-09 18:59:47+00:00,https://www.breitbart.com/clips/2023/02/09/fncs-carlson-on-sotu-biden-mental-condition-either-scary-and-depressing-deeply-alarming-or-absolutely-hilarious/,-1.0,0.383,0.453,0.164,-0.5165
Breitbart News,Joe Biden: Government Replacing Lead Pipes so Children Avoid Brain Damage,"The government is replacing lead pipes so children's brains will not be damaged, President Joe Biden (D) said Tuesday.",Amy Furr,2023-02-08 04:47:57+00:00,https://www.breitbart.com/health/2023/02/07/joe-biden-government-replacing-lead-pipes-so-children-avoid-permanent-damage-to-their-brain/,-1.0,0.403,0.597,0.0,-0.6597
Business Insider,Kamala Harris' aides needed to buy her new desk chairs because they weren't the right size for a 5-foot-2-inch woman,"The desk chairs that previous vice presidents used were all calibrated for taller men, according to the New York Times.",rcohen@insider.com (Rebecca Cohen),2023-02-06 19:40:56+00:00,https://www.businessinsider.com/kamala-harris-vice-president-aides-desk-chairs-too-big-2023-2,0.0,0.0,1.0,0.0,0.0
Business Insider,"John Fetterman's picture-taking, buddy-making, convention-breaking first month on Capitol Hill","John Fetterman has taken DC by storm, drawing awestruck colleagues to his side and garnering praise from Democratic leaders who suspect he'll go far.",wrojas@insider.com (Warren Rojas),2023-02-04 12:15:00+00:00,https://www.businessinsider.com/john-fetterman-freshman-pennsylvania-senator-first-month-on-capitol-hill-2023-2,0.0,0.0,1.0,0.0,0.0
Business Insider,Democrats sent by Kamala Harris' advisors to praise her actually confided to the New York Times that they'd 'lost hope in her',The New York Times reported that dozens of Democrats within the vice president's circle have lost faith in her ability to lead the party.,ggoodwin@businessinsider.com (Grace Eliza Goodwin),2023-02-06 19:58:05+00:00,https://www.businessinsider.com/kamala-harris-democrats-told-nyt-theyve-lost-hope-in-her-2023-2,1.0,0.116,0.556,0.328,0.6369
Business Insider,George Santos grabbed an aisle seat at the State of the Union. Not everyone was eager to shake his hand.,"Seated beside GOP Rep. Thomas Massie of Kentucky, Santos soon discovered that not everyone, including some Republicans, was interested in seeing him.","ngaudiano@insider.com (Nicole Gaudiano,Bryan Metzger,Warren Rojas)",2023-02-08 02:15:12+00:00,https://www.businessinsider.com/george-santos-aisle-seat-state-of-the-union-mitt-romney-2023-2,1.0,0.133,0.569,0.298,0.3834
CBS News,Vice President Kamala Harris on Biden's State of the Union address,"Vice President Kamala Harris joins “CBS Mornings” to discuss President Biden's State of the Union address, including the Biden administration's economic policy, relationship with China and approach to policing reform.",CBS News,2023-02-08 13:39:01+00:00,https://www.cbsnews.com/video/vice-president-kamala-harris-on-bidens-state-of-the-union-address/,0.0,0.0,1.0,0.0,0.0
CBS News,"Harris: Biden ""in command"" at State of the Union despite GOP ""gamesmanship""","The vice president told ""CBS Mornings"" there has been a growing ""theatrical element"" to joint sessions of Congress for the State of the Union.",Melissa Quinn,2023-02-08 15:55:31+00:00,https://www.cbsnews.com/news/state-of-the-union-2023-kamala-harris-biden-republicans/,0.0,0.0,1.0,0.0,0.0
CBS News,Biden heads to Wisconsin for first trip after State of the Union,The president is visiting a training center as he continues to promote his plans to boost manufacturing.,,2023-02-08 14:02:18+00:00,https://www.cbsnews.com/news/biden-wisconsin-state-of-the-union/,0.0,0.0,1.0,0.0,0.0
CBS News,How to watch Biden's 2023 State of the Union address,"CBS News will air the State of the Union as a special report at 9 p.m. ET on Tuesday, anchored by ""CBS Evening News"" anchor and managing editor Norah O'Donnell.",Caroline Linton,2023-02-06 19:38:00+00:00,https://www.cbsnews.com/live-updates/state-of-the-union-2023-joe-biden-how-to-watch/,0.0,0.0,1.0,0.0,0.0
CBS News,Marty Walsh is State of the Union designated survivor,The designated survivor is the person who takes over if there is a mass casualty event.,Caroline Linton,2023-02-08 02:34:56+00:00,https://www.cbsnews.com/news/marty-walsh-designated-survivor-state-of-the-union-2023/,1.0,0.0,0.667,0.333,0.3612
CBS News,"Booker sees ""pathway forward"" on police reform after Tyre Nichols' death","""There is a pathway forward, and I'm going to be tireless and not stop until we do significant things to make Americans safer,"" the Democratic senator said on ""Face the Nation.""",Emily Mae Czachor,2023-02-05 15:55:37+00:00,https://www.cbsnews.com/news/cory-booker-tyre-nichols-police-reform-senate-face-the-nation/,-1.0,0.328,0.672,0.0,-0.5994
CBS News,Some of the notable guests coming to Biden's State of the Union address,The White House announced Tuesday who will be joining first lady Dr. Jill Biden in her viewing box.,"Kathryn Watson, Melissa Quinn",2023-02-07 14:09:33+00:00,https://www.cbsnews.com/news/state-of-the-union-guests-biden-2023-tyre-nichols-family-bono-paul-pelosi/,0.0,0.0,1.0,0.0,0.0
CNN,Harris' mission to tackle migration root causes scores big money support but border crossings remain high,"Vice President Kamala Harris' effort to tackle root causes of migration from Central America has yielded more than $4.2 billion in private sector commitments, but border crossings remain high amid mass migration in the Western Hemisphere.",Priscilla Alvarez,2023-02-06 16:27:24+00:00,https://www.cnn.com/2023/02/06/politics/kamala-harris-migration/index.html,1.0,0.0,0.828,0.172,0.4019
CNN,Congressional Asian Pacific American Caucus calls on Biden to tap Julie Su to replace Walsh as Labor secretary,"The Congressional Asian Pacific American Caucus is throwing its support behind Julie Su, the deputy Labor secretary, to replace Labor Secretary Marty Walsh who is soon departing the Biden administration -- a significant public display of support for an Asian …",MJ Lee,2023-02-08 22:29:13+00:00,https://www.cnn.com/2023/02/08/politics/julie-su-labor-department/index.html,0.0,0.0,1.0,0.0,0.0
CNN,Who sits where at the State of the Union: A visual guide,"Your guide to who attends the president's State of the Union speech, who sits on the stage and in the chamber.","Jack Forrest, Will Mullery",2023-02-07 20:45:15+00:00,https://www.cnn.com/2023/02/07/politics/seating-guide-state-of-the-union-dg/index.html,0.0,0.0,1.0,0.0,0.0
CNN,Biden gears up to hear from the nation's governors in Washington,"A long roster of governors who have swarmed Washington this week for their annual winter meeting are set to gather at the White House on Friday, giving President Joe Biden a chance to get the temperature on how he's being perceived around the country ahead of…","Maegan Vazquez, Veronica Stracqualursi",2023-02-10 12:00:30+00:00,https://www.cnn.com/2023/02/10/politics/president-biden-governors-winter-meeting/index.html,0.0,0.0,1.0,0.0,0.0
CNN,Democratic party leaders like Biden even if they don't love him -- and that may just be enough,"The merchandise stand at the Democratic National Committee meeting where Joe Biden delivered his reelection soft launch this weekend had three tote bag options, two T-shirts, two sweatshirts and a donkey baseball cap, but nothing with any reference to the pre…",Edward-Isaac Dovere,2023-02-05 21:20:21+00:00,https://www.cnn.com/2023/02/05/politics/democrats-joe-biden-2024/index.html,1.0,0.216,0.45,0.334,0.21
CNN,Opinion: Biden doesn't throw away his shot,"At first, the enormous balloon, carrying a smaller substructure roughly the length of three city buses, seemed to symbolize America's wide-open vulnerability to what the Pentagon described as surveillance from a rising power. But it also gave President Joe Bi…",Richard Galant,2023-02-05 13:26:59+00:00,https://www.cnn.com/2023/02/05/opinions/chinese-balloon-opinion-column-galant/index.html,0.0,0.0,1.0,0.0,0.0
CNN,Biden rallies Democrats around accomplishments and against 'extreme' GOP ahead of possible 2024 bid,"President Joe Biden rallied Democrats ahead of a possible reelection bid Friday evening, leaning into the accomplishments of his first two years in office and revving up his attacks on ""extreme MAGA Republicans.""","Arlette Saenz, Sam Fossum",2023-02-04 01:32:49+00:00,https://www.cnn.com/2023/02/03/politics/biden-harris-democrats-2024/index.html,0.0,0.0,1.0,0.0,0.0
CNN,How to watch President Joe Biden's State of the Union address,President Joe Biden is scheduled to deliver his second State of the Union address Tuesday night at the US Capitol.,Sonnet Swire,2023-02-07 11:00:19+00:00,https://www.cnn.com/2023/02/07/politics/state-of-the-union-time-where-to-watch/index.html,0.0,0.0,1.0,0.0,0.0
CNN,Biden to visit Poland around Ukraine war anniversary,"President Joe Biden will visit Poland this month to mark the one-year anniversary of Russia's invasion of Ukraine, returning to the region as the war enters a volatile new phase without a clear path to peace.",Kevin Liptak,2023-02-10 19:22:52+00:00,https://www.cnn.com/2023/02/10/politics/biden-poland-trip/index.html,-1.0,0.394,0.606,0.0,-0.5994
CNN,How one question from Joe Biden explains his feud with Rick Scott,"As Marine One lifted off from the South Lawn of the White House, President Joe Biden had a last-minute question for his aides seated nearby.",Phil Mattingly,2023-02-10 05:00:59+00:00,https://www.cnn.com/2023/02/10/politics/biden-florida-rick-scott/index.html,-1.0,0.231,0.769,0.0,-0.34
Fortune,"Joe Biden's State of the Union guest list includes a rock star, a hero, and a 3-year-old cancer survivor","The guests were invited “because they personify issues or themes"" Biden will address in the speech, the White House said.",The Associated Press,2023-02-07 18:35:46+00:00,https://fortune.com/2023/02/07/joe-biden-state-of-the-union-sotu-guests-bono-monerey-park-shooting-hero/,1.0,0.215,0.488,0.298,0.1779
Fox News,Will There Be Another Abortion Showdown In The Supreme Court?,"During Tuesday night’s State of the Union address, President Biden maintained that he and Vice President Kamala Harris are working to protect reproductive rights, urging Congress to restore the protections established under Roe v. Wade. While some abortion op…",Jonah Blocker,2023-02-09 10:00:25+00:00,https://radio.foxnews.com/2023/02/09/will-there-be-another-abortion-showdown-in-the-supreme-court/,1.0,0.0,0.714,0.286,0.5574
Fox News,Border hawks dismiss Kamala Harris' immigration announcement: 'Political stunt',Border experts said Vice President Kamala Harris' latest immigration announcement on investments to Central America is a distraction to the crisis at the border.,Patrick Hauf,2023-02-06 21:36:23+00:00,https://www.foxnews.com/politics/border-hawks-dismiss-kamala-harris-immigration-announcement-political-stunt,0.0,0.0,1.0,0.0,0.0
