source,title,description,author,publishedAt,url,sentimentScore,neg,neu,pos,compound
Reuters,U.S. Justice Dept. to review Memphis police after Tyre Nichols' killing,"The U.S. Justice Department will participate in a review of the Memphis Police Department after the death of Tyre Nichols, a 29-year-old Black man <a href=""/world/us/sequence-events-memphis-police-beating-tyre-nichols-2023-01-28/"">fatally beaten</a> by office…",,2023-02-05 14:38:53+00:00,https://www.reuters.com/world/us/us-justice-dept-review-memphis-police-after-tyre-nichols-killing-2023-02-05/,-1.0,0.297,0.473,0.23,-0.25
Reuters,Biden declares 'unanimity' after Republicans boo idea of Social Security cuts,"Democratic President Joe Biden got into a spirited exchange with congressional Republicans on Tuesday, drawing boos by asserting that some hardline conservatives want to end Social Security and Medicare in exchange for raising the debt ceiling, and then takin…",,2023-02-08 03:41:30+00:00,https://www.reuters.com/world/us/biden-declares-unanimity-after-republicans-boo-idea-social-security-cuts-2023-02-08/,1.0,0.19,0.603,0.207,0.0516
Reuters,"Tyre Nichols' killing is disturbingly familiar, 'special forces' included","The brutal killing of Tyre Nichols by Memphis police officers is tragic and shocking, but also entirely unsurprising.",,2023-02-06 17:58:37+00:00,https://www.reuters.com/legal/government/tyre-nichols-killing-is-disturbingly-familiar-special-forces-included-2023-02-06/,-1.0,0.5,0.325,0.175,-0.7184
RT,Kamala Harris hid from reporters for a year – NYT,US Vice President Kamala Harris’ lackluster performance reportedly has Democrats questioning her fitness to serve Read Full Article at RT.com,RT,2023-02-07 17:23:40+00:00,https://www.rt.com/news/571130-kamala-avoids-reporters-border-biden/,-1.0,0.219,0.781,0.0,-0.1027
RT,Firearm discharged at US base hosting president’s plane,"An intruder has been taken into custody at Joint Base Andrews, the home of Air Force One and other US government aircraft Read Full Article at RT.com",RT,2023-02-07 14:14:23+00:00,https://www.rt.com/news/571112-andrews-air-base-intruder/,0.0,0.0,1.0,0.0,0.0
RT,Trump trails a popular governor in 2024 Republican race,Poll shows Florida Governor Ron DeSantis leading former US President Donald Trump in race for the 2024 Republican presidential nomination Read Full Article at RT.com,RT,2023-02-08 22:38:06+00:00,https://www.rt.com/news/571202-desantis-leads-trump-2024-poll/,1.0,0.0,0.682,0.318,0.4215
The American Conservative,Drinking in the Midst of Decline,"State of the Union: Drinking domestics to get through another Biden SOTU.
The post Drinking in the Midst of Decline appeared first on The American Conservative.",Bradley Devlin,2023-02-08 20:30:00+00:00,https://www.theamericanconservative.com/drinking-in-the-midst-of-decline/,0.0,0.0,1.0,0.0,0.0
The Washington Post,"If not Biden, then who?",Democrats are even less sold on Biden running again than Republicans are on Trump. But it matters that the party lacks any potential rival akin to DeSantis.,Aaron Blake,2023-02-08 19:58:44+00:00,https://www.washingtonpost.com/politics/2023/02/08/democrats-biden-alternatives-2024/,0.0,0.0,1.0,0.0,0.0
The Washington Post,Less is more from the vice president,Kamala Harris should focus on what matters most to her.,Jennifer Rubin,2023-02-07 12:45:36+00:00,https://www.washingtonpost.com/opinions/2023/02/07/kamala-harris-revive-vice-president/,0.0,0.0,1.0,0.0,0.0
The Washington Post,Boebert suggests God used her to stand up to McCarthy,Rep. Lauren Boebert (R-Colo.) indirectly referred to House Speaker Kevin McCarthy (R-Calif.) as one of her “demons” while speaking at a women’s conference at a Dallas church over the weekend.,Amy B Wang,2023-02-07 15:49:52+00:00,https://www.washingtonpost.com/politics/2023/02/07/boebert-mccarthy-biden/,1.0,0.0,0.704,0.296,0.2732
The Washington Post,Microsoft’s new AI-powered Bing brings a chatbot to the search box,Microsoft’s new AI-powered Bing brings a chatbot to the search boxwashingtonpost.com,Geoffrey A. Fowler,2023-02-08 00:39:43+00:00,https://www.washingtonpost.com/technology/2023/02/07/microsoft-bing-chatgpt/,0.0,0.0,1.0,0.0,0.0
Time,A Brief History of the State of the Union’s Designated Survivor,The 2023 designated survivor hasn't been announced yet. Here's why the U.S. has a designated survivor for the State of the Union.,Olivia B. Waxman,2023-02-07 21:04:23+00:00,https://time.com/6253618/designated-survivor-2023-state-of-the-union/,1.0,0.0,0.667,0.333,0.3612
USA Today,Here's the biggest news you missed this weekend,A suspected Chinese spy balloon was shot down. And Beyoncé is on the cusp of Grammys history. It's this weekend's news.,Editors,2023-02-06 03:33:25+00:00,https://www.usatoday.com/story/news/2023/02/05/spy-balloon-shot-down-grammys-record-cold-temps-weekends-news/11191134002/,-1.0,0.355,0.645,0.0,-0.296
USA Today,Pivot point: Joe Biden faced a different chapter of his presidency in his State of the Union,"As President Joe Biden delivered the State of the Union address, there was more defense than offense ahead, and more campaigning than legislating","Susan Page, USA TODAY",2023-02-08 04:17:54+00:00,https://www.usatoday.com/story/news/politics/2023/02/07/biden-state-of-the-union-pivot/11195224002/,0.0,0.0,1.0,0.0,0.0
USA Today,"Biden should go Dark Brandon in State of the Union speech: 'America is SUPER WOKE, tbh'","No matter what Joe Biden says in Tuesday night's State of the Union address, Fox News and Co. will hate it. Why not just give them what they want?","USA TODAY, Rex Huppke, USA TODAY",2023-02-06 13:40:25+00:00,https://www.usatoday.com/story/opinion/columnist/2023/02/06/biden-tuesday-state-of-union-address-should-be-wokest-ever/11194018002/,1.0,0.0,0.683,0.317,0.6841
USA Today,'Four more years': Biden hints at 2024 as he rallies Democratic Party leaders in Philadelphia,"President Joe Biden has not announced a 2024 bid for the presidency, but his message to Democratic Party activists in Philadelphia was unmistakable.","USA TODAY, Francesca Chambers, USA TODAY",2023-02-04 00:10:48+00:00,https://www.usatoday.com/story/news/politics/2023/02/03/biden-2024-white-house-democrats/11180143002/,1.0,0.0,0.769,0.231,0.4019
USA Today,OnPolitics: Catch up on what you missed from Biden's State of the Union,"President Joe Biden set the stage for his expected 2024 election bid, touting his economic successes and laying out his agenda for the next two years.","USA TODAY, Sarah Elbeshbishi, USA TODAY",2023-02-08 11:33:51+00:00,https://www.usatoday.com/story/news/politics/2023/02/08/onpolitics-biden-bipartisanship-state-union-address/11207267002/,-1.0,0.306,0.694,0.0,-0.296
USA Today,Joe Biden touts economic agenda after State of the Union speech: live updates,"The country is at an inflection point, as Biden likes to say. So, too, is Biden's presidency, as he prepares to compete for a second term in office.","USA TODAY, Sarah Elbeshbishi, Bart Jansen, Josh Meyer, Francesca Chambers, Joey Garrison, Maureen Groppe, Susan Page and David Jackson, USA TODAY",2023-02-08 10:00:13+00:00,https://www.usatoday.com/story/news/politics/2023/02/08/gop-probe-biden-hunter-trump/11205133002/,-1.0,0.109,0.891,0.0,-0.0258
USA Today,The State of the Union is Tuesday: Here's what you can expect from Joe Biden's speech,"President Joe Biden expected to adress Russia's invasion of Ukraine, the economy, crime and bipartisanship during the State of the Union on Tuesday.","USA TODAY, Maureen Groppe and Michael Collins, USA TODAY",2023-02-06 10:00:28+00:00,https://www.usatoday.com/story/news/politics/2023/02/06/state-of-the-union-biden-inflation-war-immigration-economy/11154261002/,0.0,0.0,1.0,0.0,0.0
