source,title,description,author,publishedAt,url,sentimentScore,neg,neu,pos,compound
Fox News,"McCarthy, Harris spotted laughing in friendly exchange before Biden State of the Union",Republican House Speaker Kevin McCarthy and Vice President Kamala Harris were spotted chatting and laughing before President Biden's State of the Union address.,Jessica Chasmar,2023-02-08 02:57:16+00:00,https://www.foxnews.com/politics/mccarthy-harris-spotted-laughing-friendly-exchange-biden-state-union,1.0,0.0,0.522,0.478,0.7506
Fox News,"Biden, Harris will hit the 2024 swing states after State of the Union",President Biden and Vice President Kamala Harris will travel to swing states to tout their policy agenda and accomplishments after Tuesday's State of the Union Address.,Patrick Hauf,2023-02-06 15:04:50+00:00,https://www.foxnews.com/politics/biden-harris-will-hit-2024-swing-states-state-union,0.0,0.0,1.0,0.0,0.0
Fox News,Hillary Clinton privately thinks Kamala Harris lacks 'political instincts' to win a primary: Report,A Monday article from The New York Times claimed two Democrats recalled hearing Hillary Clinton doubting Kamala Harris' ability to 'clear a primary field.',Taylor Penley,2023-02-06 16:00:14+00:00,https://www.foxnews.com/media/hillary-clinton-privately-thinks-kamala-harris-lacks-political-instincts-win-primary-report,1.0,0.0,0.743,0.257,0.5859
Fox News,Kamala Harris dodges when asked about kiss between Jill Biden and her husband: 'Haven't watched the video',Vice President Kamala Harris avoided giving her reaction to the viral clip of her husband smooching First Lady Jill Biden during Tuesday's state of the Union address.,Kristine Parks,2023-02-09 18:54:37+00:00,https://www.foxnews.com/media/kamala-harris-dodges-asked-kiss-jill-biden-husband-havent-watched-video,1.0,0.0,0.781,0.219,0.4215
Fox News,"Kamala Harris pressed by ABC, CBS over poor Biden poll numbers: Biden making American 'lives worse'",CBS and ABC anchors pressed Vice President Kamala Harris Wednesday on the polling showing that many Americans feel that Biden administration policies are hurting the country.,Gabriel Hays,2023-02-08 17:10:25+00:00,https://www.foxnews.com/media/kamala-harris-pressed-abc-cbs-poor-biden-poll-numbers-biden-making-american-lives-worse,-1.0,0.341,0.659,0.0,-0.7351
Fox News,"Republican demands Joe Biden, Kamala Harris resign after 'catastrophic Chinese spy balloon spectacle'","Rep. Joe Wilson, R-S.C., demanded Saturday that both president Biden and Vice President Kamala Harris should resign after allowing a Chinese spy balloon to fly over America.",Thomas Catenacci,2023-02-05 01:31:22+00:00,https://www.foxnews.com/politics/republican-demands-joe-biden-kamala-harris-resign-catastrophic-chinese-spy-balloon-spectacle,-1.0,0.359,0.641,0.0,-0.6808
Fox News,Democrats admit they've lost hope in Kamala Harris: 'Can't think of one thing she's done',"Several Democrats are anxious that Kamala Harris will hurt the their party's chances in 2024, especially as questions continue to swirl around President Biden's age.",Jeffrey Clark,2023-02-06 17:30:29+00:00,https://www.foxnews.com/media/democrats-admit-theyve-lost-hope-kamala-harris-cant-think-one-thing-shes-done,1.0,0.135,0.588,0.276,0.34
Fox News,VP Kamala Harris touts successes as 'border czar' as she returns to immigration beat with overseas investments,Vice President Kamala Harris returned to her focus on targeting root causes of the migration crisis that has engulfed the southern border -- including new funding.,Adam Shaw,2023-02-11 20:30:58+00:00,https://www.foxnews.com/politics/vp-kamala-harris-touts-successes-border-czar-returns-immigration-beat-overseas-investments,1.0,0.075,0.68,0.245,0.5423
Fox News,Kamala Harris dodged interviews for a year after 'disastrous' border comments to NBC News' Lester Holt: Report,"Vice President Kamala Harris dodged the media for roughly a full a year after a ""disastrous"" 2021 interview with NBC about securing the border, according to The New York Times.",Brian Flood,2023-02-07 12:00:03+00:00,https://www.foxnews.com/media/kamala-harris-dodged-interviews-year-after-disastrous-border-comments-nbc-news-lester-holt-report,-1.0,0.245,0.755,0.0,-0.5994
Fox News,"Kamala Harris, wizard of word salad, is struggling to keep her job",Democrats are speaking off the record with major media outlets about Vice President Kamala Harris. They don't feel that she's distinguished herself and may not be ready for 2024,Jimmy Failla,2023-02-09 09:00:39+00:00,https://www.foxnews.com/opinion/kamala-harris-wizard-word-salad-struggling-keep-job,-1.0,0.286,0.714,0.0,-0.4215
Fox News,"Ted Cruz says Biden will not be nominee in 2024, says knives out 'from every direction' for Kamala Harris","Sen. Ted Cruz joined ""Jesse Watters Primetime"" to discuss Biden and Kamala facing criticism from Democrats and why the China spy flight should have been shot down sooner.",Elizabeth Heckman,2023-02-07 14:58:55+00:00,https://www.foxnews.com/media/ted-cruz-biden-not-nominee-2024-knives-every-direction-kamala-harris,0.0,0.0,1.0,0.0,0.0
Fox News,Mayor blasts 'leading white Democrats' reportedly trying to oust Harris after NYT casts doubts on 2024 hopes,Mayor Eric Johnson came to Vice President Kamala Harris' defense after a New York Times article suggested the Democratic Party is seeking to separate themselves from her as 2024 nears.,Aubrie Spady,2023-02-07 12:33:39+00:00,https://www.foxnews.com/politics/mayor-blasts-leading-white-democrats-oust-harris-nyt-casts-doubts-2024-hopes,1.0,0.129,0.706,0.165,0.1531
Fox News,New York Times Kamala Harris whispers cause fits for days. It looks grim for VP if she's lost the Times,The New York Times is getting slammed by liberals for its reporting on Vice President Kamala Harris. It recently reported that some key Democrats have lost confidence in her.,Tim Graham,2023-02-10 13:00:48+00:00,https://www.foxnews.com/opinion/new-york-times-kamala-harris-whispers-cause-fits-days-grim-vp-lost-times,-1.0,0.3,0.7,0.0,-0.7184
Fox News,"Lawmakers head to Texas to expose dangers of Biden’s ‘open borders’ agenda, fentanyl crisis","Republicans will host members of Rep. Cathy McMorris Rodgers' committee at two locations in Texas as she works to focus attention on the administration's ""open border agenda.""",Kelly Laco,2023-02-07 13:00:44+00:00,https://www.foxnews.com/politics/lawmakers-head-texas-expose-dangers-bidens-open-borders-agenda-fentanyl-crisis,-1.0,0.527,0.473,0.0,-0.836
Fox News,Biden stumbles over word in Philadelphia speech: 'Recalibration',"President Joe Biden verbally stumbled to pronounce, ""recalibration"" during an event on the economy and jobs in Philadelphia.",Sarah Rumpf,2023-02-04 02:06:34+00:00,https://www.foxnews.com/politics/biden-stumbles-word-philadelphia-speech-recalibration,0.0,0.0,1.0,0.0,0.0
Fox News,Biden opens SOTU speech with gaffe calling Schumer 'minority leader',"President Biden opened his State of the Union address with a gaffe, incorrectly calling Senate Majority Leader Chuck Schumer the ""minority leader.""",Patrick Hauf,2023-02-08 03:20:13+00:00,https://www.foxnews.com/politics/biden-opens-sotu-speech-gaffe-schumer-minority-leader,0.0,0.0,1.0,0.0,0.0
Fox News,"Biden admin's closed-door briefing on Chinese spying blasted by top Republican as 'unspecific, insufficient'","Rep. Darrell Issa, R-Calif., blasted the Biden administration for its response to the Chinese spy flight after receiving a classified briefing about the crisis Monday.","Thomas Catenacci, Peter Hasson",2023-02-06 23:26:13+00:00,https://www.foxnews.com/politics/biden-admins-closed-door-briefing-chinese-spying-blasted-republican-unspecific-insufficient,1.0,0.0,0.847,0.153,0.2023
Fox News,"Biden gaffes: The president bats .500 in January, a slip up every other day",President Biden averaged just under a half a gaffe per workday in January as he dodged questions from the press on his possession of classified documents.,"Patrick Hauf, Mitch Picasso",2023-02-04 12:00:29+00:00,https://www.foxnews.com/politics/biden-gaffes-president-bats-500-january-slip-up-every-other-day,0.0,0.0,1.0,0.0,0.0
Fox News,Boebert introduces ELON Act to require DOJ report on money going to social media companies,"Colorado Rep. Lauren Boebert introduced the ELON Act, requiring the U.S. comptroller general to submit a congressional report on the DOJ's spending with social media firms.",Houston Keene,2023-02-08 20:09:52+00:00,https://www.foxnews.com/politics/boebert-introduces-elon-act-require-doj-report-money-going-social-media-companies,0.0,0.0,1.0,0.0,0.0
Fox News,"Xi will drive a truck through Biden's weakness, Jill not Joe for president and more Fox News Opinion","Read the latest Fox News Opinion columns and watch videos from Tucker Carlson, Sean Hannity, Laura Ingraham and more.",Fox News Staff,2023-02-07 15:47:25+00:00,https://www.foxnews.com/opinion/xi-drive-truck-bidens-weakness-jill-joe-president,-1.0,0.219,0.781,0.0,-0.4215
Fox News,Swimming star Riley Gaines and Rep. LaMalfa warn of growing 'gender ideology propaganda',"Swimmer Riley Gaines and Rep. Doug LaMalfa, questioned whether Biden would speak up for women or dress men in female sports during his State of the Union speech on Tuesday.",Aubrie Spady,2023-02-08 13:12:32+00:00,https://www.foxnews.com/politics/swimming-star-riley-gaines-rep-lamalfa-warn-growing-gender-ideology-propaganda,-1.0,0.26,0.611,0.13,-0.1779
Fox News,State of the Union has Americans demanding answers from President Biden on top concerns,Americans across the country told Fox News what they want to hear from the commander-in-chief when he delivers the State of the Union to Congress on Tuesday night.,"Hannah Ray Lambert, Matt Leach, Megan Myers, Gabrielle Reyes, Teny Sahakian",2023-02-07 07:00:42+00:00,https://www.foxnews.com/politics/state-union-americans-demanding-answers-president-biden-top-concerns,-1.0,0.178,0.654,0.168,-0.0258
Fox News,"George Santos, Mitt Romney share tense exchange ahead of President Biden's 2023 State of the Union address","A tense exchange took place between Rep. George Santos and Sen. Mitt Romney, both Republican lawmakers, ahead of President Joe Biden's State of the Union address.",Lawrence Richard,2023-02-08 05:58:30+00:00,https://www.foxnews.com/politics/george-santos-mitt-romney-share-tense-exchange-ahead-president-bidens-2023-state-union-address,-1.0,0.145,0.723,0.133,-0.0516
Fox News,Pete Buttigieg says Biden handled Chinese spy balloon 'appropriately' amid backlash from Republicans,"Transportation Secretary Pete Buttigieg came to President Biden's defense on Sunday when asked about the Chinese spy balloon, saying it was ""handled appropriately.""",Cameron Cawthorne,2023-02-05 16:32:46+00:00,https://www.foxnews.com/politics/pete-buttigieg-says-biden-handled-chinese-spy-balloon-appropriately-backlash-republicans,0.0,0.0,1.0,0.0,0.0
Fox News,"NYT slams Republicans when they block Democrat judges, praise Democrats when they block GOP judges","The NYT editorial board published various op-eds over the past eight years taking different positions on ""blue slips"", a Senate procedure that empowers the minority party to block nominees.",Joe Silverstein,2023-02-07 00:30:33+00:00,https://www.foxnews.com/media/nyt-slams-republicans-block-democrat-judges-praise-democrats-block-gop-judges,-1.0,0.333,0.46,0.207,-0.296
Fox News,Expert reveals biggest under-the-radar takeaway from Chinese spy flight crisis,The Chinese spy flight crisis subtly revealed that a backchannel exists enabling officials in the highest levels of the U.S. and Chinese governments to speak during emergencies.,Thomas Catenacci,2023-02-06 18:26:17+00:00,https://www.foxnews.com/politics/expert-reveals-biggest-under-radar-takeaway-chinese-spy-flight-crisis,-1.0,0.339,0.661,0.0,-0.6249
Fox News,McCarthy says he won't repeat Pelosi 'theatrics' and rip up Biden’s SOTU speech,House Speaker Kevin McCarthy said Tuesday he won't rip up President Biden's State of the Union address the way Nancy Pelosi ripped up President Trump's in 2020.,Peter Kasperowicz,2023-02-07 14:41:52+00:00,https://www.foxnews.com/politics/mccarthy-wont-rip-up-bidens-sotu-speech-repeat-pelosis-theatrics-trump,0.0,0.0,1.0,0.0,0.0
Fox News,NBC's Chuck Todd asks Pete Buttigieg why Biden's accomplishments aren't being celebrated by the public,'Meet the Press' anchor Chuck Todd asked Pete Buttigieg why President Biden's achievements in office haven't been 'penetrating' the American public.,Yael Halon,2023-02-05 22:00:18+00:00,https://www.foxnews.com/media/nbcs-chuck-todd-pete-buttigieg-bidens-accomplishments-celebrated-public,-1.0,0.231,0.769,0.0,-0.4585
Fox News,"Hinting at 2024 re-election, Biden tells Democrats ‘we’re just getting started’",President Biden was serenaded with chants of “four more years” as he addressed a partisan audience of Democratic officials and activists and hinted at a 2024 re-election campaign,Paul Steinhauser,2023-02-04 01:44:33+00:00,https://www.foxnews.com/politics/hinting-2024-re-election-biden-tells-democrats-just-getting-started,0.0,0.0,1.0,0.0,0.0
Fox News,Biden's 2024 re-election announcement could come after his State of the Union speech. But how soon?,The big question coming out of this week’s State of the Union address is when will President Biden declare he’s seeking a second term in the White House?,Paul Steinhauser,2023-02-06 07:00:17+00:00,https://www.foxnews.com/politics/bidens-2024-re-election-announcement-could-come-after-state-union-speech-how-soon,0.0,0.0,1.0,0.0,0.0
Fox News,Biden's State of the Union had one obvious takeaway and his speech sailed right past it,President Joe Biden gave his second State of the Union address on Tuesday evening. The president's tone-deaf speech had a major optics problem that was impossible to miss.,David Bossie,2023-02-08 06:04:36+00:00,https://www.foxnews.com/opinion/bidens-state-of-the-union-one-obvious-takeaway-speech-sailed-past,0.0,0.0,1.0,0.0,0.0
Fox News,Biden’s state of the Union address: Top 5 moments,Here are Fox News Digital's top five moments from President Biden's second State of the Union address Tuesday night.,Jessica Chasmar,2023-02-08 07:00:51+00:00,https://www.foxnews.com/politics/bidens-state-union-address-top-5-moments,1.0,0.0,0.735,0.265,0.2023
Fox News,"Biden’s stumbling, bumbling SOTU didn’t change voters’ minds about his many failures","Biden’s stumbling, bumbling State of the Union didn’t change voters’ minds about his many failures to defeat inflation, fix the border and contain China.",Kellyanne Conway,2023-02-08 18:08:35+00:00,https://www.foxnews.com/opinion/bidens-stumbling-bumbling-sotu-didnt-change-voters-minds-about-his-many-failures,-1.0,0.25,0.75,0.0,-0.4588
Fox News,Matt Gaetz calls for Biden to 'blow up TikTok' after US military shoots down suspected Chinese spy balloon,Republican Matt Gaetz is calling on President Joe Biden to take action on TikTok after he authorized the U.S. military to shoot down a suspected Chinese spy balloon.,Lawrence Richard,2023-02-05 09:06:20+00:00,https://www.foxnews.com/politics/matt-gaetz-calls-biden-blow-up-tiktok-us-military-shoots-down-suspected-chinese-spy-balloon,-1.0,0.137,0.863,0.0,-0.2263
Fox News,China accuses the US of lying to the world about spy surveillance aircraft,Beijing has ramped up its rhetoric toward the United States in the wake of the U.S. Air Force shooting down a Chinese aircraft capable of surveillance.,Lawrence Richard,2023-02-11 05:25:49+00:00,https://www.foxnews.com/world/china-accuses-us-lying-world-about-spy-surveillance-aircraft,-1.0,0.492,0.508,0.0,-0.7003
Fox News,Biden battered by crises since last State of the Union,President Biden has faced a series of domestic and foreign policy crises from his mishandling of classified documents to stubbornly high inflation since his last State of the Union.,Thomas Catenacci,2023-02-06 10:00:50+00:00,https://www.foxnews.com/politics/biden-battered-crises-since-last-state-union,0.0,0.0,1.0,0.0,0.0
Fox News,"TUCKER CARLSON: America's problems are fixable, but profound",Fox News host Tucker Carlson takes a closer look at America's problems ahead of President Biden's State of the Union address on 'Tucker Carlson Tonight.',Tucker Carlson,2023-02-08 03:51:08+00:00,https://www.foxnews.com/opinion/tucker-carlson-americas-problems-fixable-profound,-1.0,0.351,0.649,0.0,-0.4019
MSNBC,"Pentagon shoots down Chinese balloon, GOP claims on the same day","Republicans saw the Chinese surveillance balloon as a political winner, right up until Donald Trump's record got in the way.",Steve Benen,2023-02-06 13:00:22+00:00,https://www.msnbc.com/rachel-maddow-show/maddowblog/pentagon-shoots-chinese-balloon-gop-claims-day-rcna69273,0.0,0.0,1.0,0.0,0.0
MSNBC,"State of the Union live updates: Biden address focuses on economy, health care","Follow along for live updates, latest coverage and expert analysis of President Joe Biden’s second State of the Union address.",Msnbc,2023-02-07 19:42:35+00:00,https://www.msnbc.com/white-house/state-of-the-union/live-blog/biden-sotu-address-live-updates-2023-rcna66996,1.0,0.0,0.738,0.262,0.4939
NBC News,"Another intruder breaches Joint Base Andrews, prompting a resident to open fire","Another intruder has breached the home of Air Force One, one of the nation’s most sensitive military bases, and this time a resident opened fire on the trespasser, Joint Base Andrews said in a statement late Monday.",The Associated Press,2023-02-07 19:13:39+00:00,https://www.nbcnews.com/news/military/another-intruder-breaches-joint-base-andrews-prompting-resident-open-f-rcna69547,-1.0,0.211,0.789,0.0,-0.34
NBC News,Biden or bust: Democratic insiders are all in for Biden 2024,PHILADELPHIA — President Joe Biden had one question for Democratic power brokers at a campaign-style rally Friday: “Are you with me?” The roars of approval and chants of “four more years!” at the Democratic National Committee’s Winter Meeting indicated they w…,Alex Seitz-Wald,2023-02-05 19:54:16+00:00,https://www.nbcnews.com/politics/2024-election/biden-bust-democratic-insiders-are-biden-2024-rcna68917,0.0,0.0,1.0,0.0,0.0
NBC News,DeSantis skips White House event as he and Biden draw 2024 battle lines,Florida Gov. Ron DeSantis skipped an event at the White House Friday as he and President Joe Biden draw battle lines ahead of the 2024 presidential election.,Peter Nicholas and Mike Memoli and Carol E. Lee and Ali Vitali,2023-02-10 22:08:07+00:00,https://www.nbcnews.com/politics/2024-election/desantis-skips-white-house-event-biden-draw-2024-battle-lines-rcna70181,-1.0,0.224,0.776,0.0,-0.3818
NBC News,Koch network draws early battle lines against Trump in 2024,"The conservative political network founded by the billionaire Koch brothers, has already picked a side for '24, and it's a candidate other than Trump.","Chuck Todd, Mark Murray, Ben Kamisar, Bridget Bowman, Alexandra Marquez",2023-02-06 13:37:45+00:00,https://www.nbcnews.com/meet-the-press/first-read/koch-network-draws-early-battle-lines-trump-2024-rcna69279,-1.0,0.271,0.729,0.0,-0.3818
Newsweek,Jill Biden Kissing Kamala Harris' Husband at SOTU Leaves Internet Confused,A clip of Jill Biden kissing Second Gentleman of the United States Douglas Emhoff at the State of the Union address has gone viral.,Jamie Burton,2023-02-08 09:52:14+00:00,https://www.newsweek.com/jill-biden-kissing-kamala-harris-husband-doug-emhoff-state-union-1779728,1.0,0.164,0.571,0.264,0.34
Newsweek,Joe Biden's 2023 State of the Union Speech Time and How to Watch,"The president is expected to address the nation's relationship with China and the police killing of Tyre Nichols, among other topics.",James Bickerton,2023-02-07 14:48:12+00:00,https://www.newsweek.com/joe-bidens-2023-state-union-speech-time-how-watch-1779519,0.0,0.0,1.0,0.0,0.0
Newsweek,Biden Earns Bipartisan SOTU Applause for Medicare and Social Security,Republicans and Democrats showed support for Biden's promise not to cut Medicare or Social Security while debating the nation's debt ceiling.,Kaitlin Lewis,2023-02-08 03:46:14+00:00,https://www.newsweek.com/joe-biden-earns-bipartisan-state-union-applause-medicare-social-security-1779657,1.0,0.0,0.536,0.464,0.6369
Newsweek,Even Donald Trump Admits Joe Biden's State of the Union Speech Was Great,"President Biden ended his speech ""far stronger than he began,"" Trump said following the address.",Ellie Cook,2023-02-08 09:08:56+00:00,https://www.newsweek.com/donald-trump-joe-biden-state-union-speech-1779680,1.0,0.0,0.588,0.412,0.743
Newsweek,Lauren Boebert Sparks Fury After Praying Biden's 'Days Be Few',"One Twitter account labeled Boebert a ""threat to democracy"" after her controversial comments at a church event in Dallas.",James Bickerton,2023-02-07 12:29:18+00:00,https://www.newsweek.com/lauren-boebert-prays-joe-biden-days-few-backlash-1779467,-1.0,0.261,0.563,0.176,-0.296
Newsweek,Biden Blasted After Opening State of the Union With 'Minority Leader' Gaffe,"Former President Donald Trump admonished Biden for his ""big stumble on Schumer.""",Aila Slisco,2023-02-08 03:06:42+00:00,https://www.newsweek.com/biden-criticized-state-union-minority-leader-gaffe-1779652,0.0,0.0,1.0,0.0,0.0
Newsweek,Taylor Swift's Reaction to Jill Biden's Grammy Appearance Goes Viral,Taylor Swift's indifferent reaction to the appearance of the first lady of the United States at the 2023 Grammy Awards was discussed on social media.,Jamie Burton,2023-02-06 09:20:20+00:00,https://www.newsweek.com/taylor-swift-reaction-jill-biden-grammy-appearance-goes-viral-1779103,0.0,0.0,1.0,0.0,0.0
Newsweek,Trump Envisions What 'Joe Biden's America' Looked Like From Spy Balloon,"In his latest political ad, the former president speculated what America could have looked like from the Chinese spy device that passed over the U.S. last week.",Kaitlin Lewis,2023-02-07 05:55:06+00:00,https://www.newsweek.com/trump-envisions-what-joe-bidens-america-looked-like-spy-balloon-1779368,1.0,0.0,0.8,0.2,0.3612
Newsweek,Trump Responds to Meme Saying He's the 'Savior of Western Civilization',"The former president thanked the person who posted the meme and wrote that ""we have a long way to go.""",Darragh Roche,2023-02-10 12:31:40+00:00,https://www.newsweek.com/trump-meme-savior-western-civilization-1780370,0.0,0.0,1.0,0.0,0.0
Newsweek,Donald Trump Says Jill Biden 'Looking Lovely' During State of the Union,"The former president said the first lady was ""looking lovely"" in her ""beautiful"" purple dress as he struck an uncharacteristically conciliatory tone.",Aleks Phillips,2023-02-08 10:25:52+00:00,https://www.newsweek.com/donald-trump-jill-biden-state-union-dress-1779723,1.0,0.0,0.703,0.297,0.5859
Newsweek,Biden's Call to 'Finish the Job' Ignites Enthusiasm for 2024 Run,President Joe Biden repeated the potential campaign slogan throughout his State of the Union address Tuesday night.,Kaitlin Lewis,2023-02-08 06:35:13+00:00,https://www.newsweek.com/bidens-call-finish-job-ignites-enthusiasm-2024-run-1779669,1.0,0.0,0.707,0.293,0.4404
Newsweek,Joe Biden's State of the Union Highlights—Three Surprising Moments,Biden clashed with some Republicans after the president accused the GOP of wanting to cut Social Security and Medicare.,Darragh Roche,2023-02-08 09:20:48+00:00,https://www.newsweek.com/joe-biden-state-union-highlights-three-surprising-moments-1779677,1.0,0.0,0.741,0.259,0.2732
Newsweek,McCarthy to Be 'Respectful' at State of the Union Amid Pelosi Payback Calls,Some have suggested that GOP lawmakers should bring balloons to the address to mock Biden and retaliate against Pelosi for tearing up Trump's speech in 2020.,Aila Slisco,2023-02-07 02:52:59+00:00,https://www.newsweek.com/mccarthy-respectful-state-union-amid-pelosi-payback-calls-1779361,1.0,0.0,0.727,0.273,0.4588
Newsweek,Mr. President: Americans Don't Need Good Vibes. We Need an America First Agenda | Opinion,"Americans need a native-born labor sourcing plan, not a promise of jobs we can see from our backyards but will never hold.",Pamela Denise Long,2023-02-08 18:12:05+00:00,https://www.newsweek.com/mr-president-americans-dont-need-good-vibes-we-need-america-first-agenda-opinion-1779930,-1.0,0.167,0.833,0.0,-0.3412
Newsweek,"As Border Debate Brews, DOJ Leaves Visas for Afghan Legal Allies in Limbo","""It's either I escape or risk dying,"" a former Afghan official who worked in the DOJ program told Newsweek. ""I'm running out of time.""","Tom O'Connor, Naveed Jamali",2023-02-07 16:21:13+00:00,https://www.newsweek.com/border-debate-brews-doj-leaves-visas-afghan-legal-allies-limbo-1778922,1.0,0.0,0.87,0.13,0.128
Reuters,Explainer-Biden’s State of the Union address and what to expect,"Published by Reuters By Trevor Hunnicutt and Nandita Bose WASHINGTON (Reuters) -U.S. President Joe Biden will on Tuesday deliver his State of the Union address three months after Republicans took control of the House of Representatives, a speech that may mark…",Towleroad,2023-02-07 16:42:04+00:00,"http://rmb.reuters.com/rmd/rss/item/tag:reuters.com,2023:newsml_KBN2UH036:3?channel=FES376",0.0,0.0,1.0,0.0,0.0
Reuters,U.S. VP Harris to map out next steps to aid Ukraine at Munich meeting,"U.S. Vice President Kamala Harris is expected to discuss Washington's future support for Ukraine when she travels to a major European security conference in Germany next week, as Russia's invasion nears the one-year mark.",,2023-02-06 23:06:45+00:00,https://www.reuters.com/world/europe/us-vp-harris-map-out-next-steps-aid-ukraine-munich-meeting-2023-02-06/,0.0,0.0,1.0,0.0,0.0
Reuters,U.S. VP Harris touts $4.2b private sector investment in Central America,"Private companies have committed to invest $4.2 billion in northern Central America as part of an effort by U.S. Vice President Kamala Harris to reduce migration, the White House said on Monday.",,2023-02-06 16:08:28+00:00,https://www.reuters.com/world/americas/us-vp-harris-touts-42b-private-sector-investment-central-america-2023-02-06/,-1.0,0.109,0.891,0.0,-0.0258
