source,title,description,author,publishedAt,url,sentimentScore,neg,neu,pos,compound
ABC News,DeSantis pushes ban on diversity programs in state colleges,"Florida Gov. Ron DeSantis has announced plans to block state colleges from having programs on diversity, equity and inclusion, and critical race theory",ANTHONY IZAGUIRRE Associated Press,2023-01-31 21:13:47+00:00,https://abcnews.go.com/US/wireStory/desantis-pushes-ban-diversity-programs-state-colleges-96798781,-1.0,0.375,0.625,0.0,-0.5574
ABC News,Revised AP African American studies courses announced following Florida rejection,"College Board's AP African American studies framework has officially been released. The pilot was criticized by conservatives, including Florida Gov. Ron DeSantis.",Kiara Alfonseca,2023-02-01 22:20:23+00:00,https://abcnews.go.com/US/ap-african-american-studies-official-framework-released-after/story?id=96818517,-1.0,0.28,0.72,0.0,-0.5423
ABC News,Florida GOP leaders want to get rid of gun permits,"Saying gun owners don’t need a government permission slip to protect their God-given rights, Florida House Speaker Paul Renner proposed legislation to eliminate concealed weapons permits",BRENDAN FARRINGTON Associated Press,2023-01-30 21:42:15+00:00,https://abcnews.go.com/Politics/wireStory/florida-gop-leaders-rid-gun-permits-96773328,-1.0,0.247,0.619,0.134,-0.2732
ABC News,Florida schools directed to hide classroom books that are not vetted,The state board of education said a law restricting school libraries from displaying or lending books that have not been vetted applies to books displayed in classrooms.,"Tesfaye Negussie, Rahma Ahmed",2023-02-04 03:44:31+00:00,https://abcnews.go.com/Politics/florida-schools-directed-cover-remove-classroom-books-vetted/story?id=96884323,-1.0,0.221,0.779,0.0,-0.1779
ABC News,Trump kicks off 2024 bid with events in early voting states,Former President Donald Trump is set to kick off his 2024 White House bid with visits to a pair of early voting states,MEG KINNARD and JILL COLVIN Associated Press,2023-01-28 05:53:47+00:00,https://abcnews.go.com/Politics/wireStory/trump-kicks-off-2024-bid-events-early-voting-96736372,0.0,0.0,1.0,0.0,0.0
ABC News,DeSantis eyes 2024 from afar as GOP rivals move toward runs,"Florida Gov. Ron DeSantis may be months away from publicly declaring his presidential intentions, but his potential rivals aren’t holding back","STEVE PEOPLES, THOMAS BEAUMONT and ANTHONY IZAGUIRRE Associated Press",2023-02-03 05:54:21+00:00,https://abcnews.go.com/Politics/wireStory/desantis-eyes-2024-afar-gop-rivals-move-runs-96868349,0.0,0.0,1.0,0.0,0.0
ABC News,"Florida lawmakers to meet next week on Disney, immigration",Florida lawmakers will meet next week to complete a state takeover of Walt Disney World’s self-governing district and debate proposals on immigration and election crimes,ANTHONY IZAGUIRRE Associated Press,2023-02-04 00:54:26+00:00,https://abcnews.go.com/Politics/wireStory/florida-lawmakers-meet-week-disney-immigration-96888520,0.0,0.0,1.0,0.0,0.0
ABC News,Biden to promote administration wins in speech to Democrats,"President Joe Biden hasn’t announced a reelection campaign, but some of the themes of his likely bid should be on display when he addresses a national Democratic Party meeting",WILL WEISSERT Associated Press,2023-02-03 05:39:23+00:00,https://abcnews.go.com/Politics/wireStory/biden-promote-administration-wins-speech-democrats-96868169,1.0,0.0,0.388,0.612,0.743
ABC News,"Florida lawmakers to meet next week on Disney, immigration",Florida lawmakers will meet next week to complete a state takeover of Walt Disney World’s self-governing district and debate proposals on immigration and election crimes,ANTHONY IZAGUIRRE Associated Press,2023-02-04 00:54:19+00:00,https://abcnews.go.com/US/wireStory/florida-lawmakers-meet-week-disney-immigration-96888519,0.0,0.0,1.0,0.0,0.0
ABC News,"Disney World unions vote down offer covering 45,000 workers","Union members voted down a contract proposal covering tens of thousands of Walt Disney World service workers, saying it didn’t go far enough toward helping employees face cost-of-living hikes in housing and other expenses in central Florida",MIKE SCHNEIDER Associated Press,2023-02-04 15:54:08+00:00,https://abcnews.go.com/Entertainment/wireStory/disney-world-unions-vote-offer-covering-45000-workers-96894498,0.0,0.0,1.0,0.0,0.0
ABC News,"Florida lawmakers to meet next week on Disney, immigration",Florida lawmakers will meet next week to complete a state takeover of Walt Disney World’s self-governing district and debate proposals on immigration and election crimes,ANTHONY IZAGUIRRE Associated Press,2023-02-04 00:54:34+00:00,https://abcnews.go.com/Business/wireStory/florida-lawmakers-meet-week-disney-immigration-96888522,0.0,0.0,1.0,0.0,0.0
ABC News,"Disney World unions vote down offer covering 45,000 workers","Union members voted down a contract proposal covering tens of thousands of Walt Disney World service workers, saying it didn’t go far enough toward helping employees face cost-of-living hikes in housing and other expenses in central Florida",MIKE SCHNEIDER Associated Press,2023-02-04 15:54:15+00:00,https://abcnews.go.com/Business/wireStory/disney-world-unions-vote-offer-covering-45000-workers-96894500,0.0,0.0,1.0,0.0,0.0
ABC News,The external campaign grows for a DeSantis 2024 bid,"Although the Florida governor has stayed quiet on 2024, his supporters have not.",Hannah Demissie,2023-02-02 19:06:00+00:00,https://abcnews.go.com/Politics/external-campaign-grows-desantis-2024-bid/story?id=96798856,0.0,0.0,1.0,0.0,0.0
ABC News,"Trump kicks off presidential campaign in New Hampshire, South Carolina","South Carolina is taking a ""wait and see"" approach with Trump, observers say.",Mariam Khan,2023-01-28 10:12:53+00:00,https://abcnews.go.com/Politics/trump-kicks-off-presidential-campaign-new-hampshire-south/story?id=96700894,0.0,0.0,1.0,0.0,0.0
ABC News,A new scientific method for bail reform,Could this end the cash-bail system? Critics are skeptical.,"Tesfaye Negussie, Brittany Gaddy",2023-02-02 20:16:38+00:00,https://abcnews.go.com/Technology/new-scientific-method-bail-reform/story?id=96662667,0.0,0.0,1.0,0.0,0.0
Al Jazeera English,Florida governor backs ban on diversity lessons in state colleges,"Republican Ron DeSantis, a possible US presidential candidate, says diversity programmes serve as a 'political filter'.",Al Jazeera,2023-01-31 22:02:47+00:00,https://www.aljazeera.com/news/2023/1/31/florida-governor-backs-ban-on-diversity-lessons-in-state-colleges,-1.0,0.444,0.556,0.0,-0.5859
Al Jazeera English,Black history class revised in US after criticism from right,The revised course for high-school students rolls back references to racial justice movements and LGBTQ issues.,Al Jazeera,2023-02-01 18:23:15+00:00,https://www.aljazeera.com/news/2023/2/1/black-history-class-revised-in-us-after-criticism-from-right,-1.0,0.326,0.674,0.0,-0.4404
Associated Press,Trump kicks off 2024 run with stops in early-voting states...,"COLUMBIA, S.C. (AP) — Former President Donald Trump  is set to kick off his 2024 White House bid on Saturday with visits to a pair of early-voting states, his first campaign events since announcing his latest run  more than two months ago.",Meg Kinnard,2023-01-28 14:28:37+00:00,https://apnews.com/article/abortion-politics-new-hampshire-state-government-south-carolina-2022-midterm-elections-7624d58296aa9b808032e2edbcd166c3,-1.0,0.211,0.789,0.0,-0.1531
Associated Press,Trump kicking off 2024 run with stops in early-voting states - The Associated Press,"<ol><li>Trump kicking off 2024 run with stops in early-voting states  The Associated Press
</li><li>Trump Tries a New Campaign Tack: Small-Scale  The New York Times
</li><li>Former President Donald Trump to visit South Carolina on Saturday  News 19 WLTX
</…","Meg Kinnard, Holly Ramer",2023-01-28 13:07:30+00:00,https://apnews.com/7624d58296aa9b808032e2edbcd166c3,-1.0,0.151,0.849,0.0,-0.1531
Associated Press,Trustees picked by DeSantis may change progressive college - The Associated Press,"<ol><li>Trustees picked by DeSantis may change progressive college  The Associated Press
</li><li>‘Hostile takeover’: the tiny Florida university targeted by Ron DeSantis  The Guardian US
</li><li>New college: Effort to overhaul top officers may be in the w…",Curt Anderson,2023-01-29 15:32:18+00:00,https://apnews.com/87ba3fc93a281188ac6b4acf254421b8,1.0,0.0,0.874,0.126,0.0772
Associated Press,DeSantis pushes ban on diversity programs in state colleges - The Associated Press - en Español,"<ol><li>DeSantis pushes ban on diversity programs in state colleges  The Associated Press - en Español
</li><li>DeSantis proposes banning diversity and inclusion initiatives at Florida universities  CNN
</li><li>Gov. DeSantis pushes ban on diversity program…",Anthony Izaguirre,2023-02-01 01:33:32+00:00,https://apnews.com/article/ron-desantis-florida-state-government-race-and-ethnicity-b1d847ddc5e1f136b17f254f71fd15dc,-1.0,0.247,0.753,0.0,-0.5574
Associated Press,DeSantis pushes ban on diversity programs in state colleges,"Florida Gov. Ron DeSantis has announced plans to block state colleges from having programs on diversity, equity and inclusion, and critical race theory. It's the Republican's latest step onto the front lines of the nation's culture wars as he considers…",By ANTHONY IZAGUIRRE - Associated Press,2023-02-01 15:55:48+00:00,https://apnews.com/b1d847ddc5e1f136b17f254f71fd15dc,-1.0,0.375,0.625,0.0,-0.5574
Associated Press,College Board revises AP Black history class after criticism,"The official curriculum for a new Advanced Placement course on African American studies was released Wednesday downplays some components that had drawn criticism from conservatives including Florida Gov. Ron DeSantis, who said the class would be outlawed in h…",By CHEYANNE MUMPHREY and SHARON LURYE - Associated Press,2023-02-01 15:40:34+00:00,https://apnews.com/722fb29dbaa13dd5c42d70c5129df48e,-1.0,0.293,0.707,0.0,-0.4404
Associated Press,"In Iowa, potential 2024 GOP Trump challengers quiet for now","The presidential campaign landscape in Iowa is markedly different this year compared with four years ago. In 2019, at least a dozen Democratic hopefuls eager to make their case against the Republican incumbent, Donald Trump, had either visited Iowa or…",By THOMAS BEAUMONT - Associated Press,2023-01-31 05:39:46+00:00,https://apnews.com/aa8f72fb2aa39553dc05ad9e778f74a3,1.0,0.0,0.833,0.167,0.1027
BBC News,US black history syllabus changed after Florida 'woke' claims,Topics including Black Lives Matter and reparations for slavery are now listed as optional.,https://www.facebook.com/bbcnews,2023-02-02 03:03:50+00:00,https://www.bbc.co.uk/news/world-us-canada-64493289,0.0,0.0,1.0,0.0,0.0
Bloomberg,"Debt Talks, Nikki Haley in 2024, Gas Stove Wars (Radio)",Bloomberg Washington Correspondent Joe Mathieu delivers insight and analysis on the latest headlines from the White House and Capitol Hill.,,2023-02-01 23:45:37+00:00,https://www.bloomberg.com/news/audio/2023-02-01/debt-talks-nikki-haley-in-2024-gas-stove-wars-radio,-1.0,0.466,0.534,0.0,-0.7269
Bloomberg,"DeSantis Proposes Tax Exemption for Gas Stoves, Ridicules Talk of Ban","Florida Governor Ron DeSantis waded into the debate over gas stoves and government regulation on Thursday, proposing a permanent tax exemption for the appliances.",Michael Smith,2023-02-02 19:01:38+00:00,https://www.bloomberg.com/news/articles/2023-02-02/gas-stoves-in-florida-would-be-tax-exempt-with-desantis-proposal,-1.0,0.478,0.522,0.0,-0.7506
Bloomberg,"DeSantis Seeks Tax Cuts, State Pay Hikes in $115 Billion Budget",Florida Governor Ron DeSantis is pushing for permanent tax cuts and pay increases for state employees in the coming year’s budget as revenue surpasses forecasts.,"Danielle Moran, Nic Querolo",2023-02-01 23:09:43+00:00,https://www.bloomberg.com/news/articles/2023-02-01/desantis-seeks-tax-cuts-state-pay-hikes-in-115-billion-budget,-1.0,0.31,0.69,0.0,-0.3818
Bloomberg,Nikki Haley Plans to Challenge Trump With 2024 White House Bid,"Nikki Haley, a former South Carolina Governor and Donald Trump’s ambassador to the United Nations, plans to announce that she’s running for president.",Mario Parker,2023-02-01 05:00:48+00:00,https://www.bloomberg.com/news/articles/2023-02-01/nikki-haley-plans-to-challenge-trump-with-2024-white-house-bid,1.0,0.0,0.874,0.126,0.0772
Bloomberg,"Trump Raises Under $10 Million, Ensuring GOP Race Is Wide Open","Donald Trump raised less than $10 million after he announced his third White House campaign, a disappointing haul for the former president already facing an uphill battle in his comeback.","Bill Allison, Mark Niquette",2023-02-01 02:48:35+00:00,https://www.bloomberg.com/news/articles/2023-02-01/trump-fundraising-under-10-million-for-2024-presidential-campaign,1.0,0.0,0.826,0.174,0.2732
Bloomberg,Adani Woes Seep Into Indian Politics for Modi,"Indian billionaire Gautam Adani likens his conglomerate’s accounting travails to an attack on the country, creating a political element as concern rises about the outlook for a business empire that owns some of India’s key infrastructure and employs thousands.",Rosalind Mathieson,2023-02-01 11:11:23+00:00,https://www.bloomberg.com/news/newsletters/2023-02-01/adani-woes-seep-into-indian-politics-for-modi,-1.0,0.326,0.674,0.0,-0.4404
Bloomberg,Donald Trump 2024 Latest: New Hampshire Governor Sees Disappointment,Donald Trump ran headlong into some of the biggest challenges he’ll face in his comeback bid — fading enthusiasm among Republicans looking to move on from the former president and rising rivals for the GOP nomination — as he hit the 2024 campaign trail for th…,Christian Hall,2023-01-29 21:08:52+00:00,https://www.bloomberg.com/news/articles/2023-01-29/donald-trump-2024-latest-new-hampshire-governor-sees-disappointment,-1.0,0.292,0.708,0.0,-0.5106
Breitbart News,Ron DeSantis: We Will Work with Legislature to Stop Sex Changes on Minors,Florida Gov. Ron DeSantis (R) on Tuesday said his administration will work with the legislature to bring forth accountability to those performing sex change procedures on minors.,"Hannah Bleau, Hannah Bleau",2023-02-01 19:35:26+00:00,https://www.breitbart.com/politics/2023/02/01/ron-desantis-we-will-work-legislature-stop-sex-changes-minors/,-1.0,0.196,0.804,0.0,-0.296
Breitbart News,Ron DeSantis Responds to Latest Trump Critiques: 'I Have People Attacking Me from All Angles',"Florida Gov. Ron DeSantis (R) on Tuesday responded to a question about former President Trump's latest critiques, but the governor refused to criticize the former commander-in-chief, maintaining that attacks are coming ""from all angles"" and noting that his la…","Hannah Bleau, Hannah Bleau",2023-02-01 17:54:41+00:00,https://www.breitbart.com/politics/2023/02/01/ron-desantis-responds-latest-trump-critiques-i-have-people-attacking-me-from-all-angles/,-1.0,0.214,0.786,0.0,-0.4588
Breitbart News,"OpenAI's ChatGPT Gushes About Joe Biden, Refuses to Praise Trump or DeSantis","ChatGPT, the AI chatbot created by Microsoft-funded Open AI, is once again displaying its political bias, responding to prompts asking it to praise Joe Biden but refusing to do so for former president Donald Trump and Florida Governor Ron DeSantis.","Allum Bokhari, Allum Bokhari",2023-02-01 19:25:35+00:00,https://www.breitbart.com/tech/2023/02/01/openais-chatgpt-gushes-about-joe-biden-refuses-to-praise-trump-or-desantis/,1.0,0.0,0.714,0.286,0.5574
Breitbart News,Florida Democrat Official Agrees: The Rejected African American AP Course Is 'Trash',Florida Gov. Ron DeSantis's (R) administration is seeing bipartisan support after the Florida Department of Education (FDOE) rejected an AP (Advanced Placement) African American Studies course due to its woke content.,"Hannah Bleau, Hannah Bleau",2023-02-01 17:31:20+00:00,https://www.breitbart.com/politics/2023/02/01/florida-democrat-official-agrees-rejected-african-american-ap-course-trash/,-1.0,0.219,0.662,0.119,-0.3612
Breitbart News,Sununu: 'The Government Is Not the Solution to Cultural Issues',"Governor Chris Sununu (R-NH) said Sunday on CNN's ""State of the Union"" that it was not the government's job to address cultural issues. | Clips","Pam Key, Pam Key",2023-01-29 15:42:57+00:00,https://www.breitbart.com/clips/2023/01/29/sununu-the-government-is-not-the-solution-to-cultural-issues/,-1.0,0.219,0.781,0.0,-0.2411
Breitbart News,"Watch: Bill Maher Spars with Actor Bryan Cranston, Who Claims Critical Race Theory Must Be Taught in U.S. Schools","During Maher's recent Club Random podcast, Cranston went off on states such as Florida for working to limit or ban woke Critical Race Theory maintaining that America's founding is inherently racist.","Warner Todd Huston, Warner Todd Huston",2023-01-30 15:36:22+00:00,https://www.breitbart.com/entertainment/2023/01/30/watch-bill-maher-spars-with-actor-bryan-cranston-who-claims-critical-race-theory-must-be-taught-in-u-s-schools/,-1.0,0.126,0.874,0.0,-0.3182
Breitbart News,Donald Trump: Ron DeSantis and His Donors Are Globalists,"Former President Donald Trump made waves shortly after midnight Monday by criticizing the Club for Growth, deeming it a ""globalist group"" and asserting that Florida Gov. Ron DeSantis (R) and his donors are also globalists.","Hannah Bleau, Hannah Bleau",2023-01-30 16:41:19+00:00,https://www.breitbart.com/politics/2023/01/30/donald-trump-ron-desantis-his-donors-are-globalists/,0.0,0.0,1.0,0.0,0.0
Breitbart News,"Ron DeSantis Budget Includes $2 Billion in Tax Relief: Permanent Sales Tax Exemptions for Baby Necessities, Gas Stoves","Florida Gov. Ron DeSantis administration's ""Framework for Freedom Budget"" includes $2 billion in tax relief, including both permanent and temporary sales tax holidays on a variety of items.","Hannah Bleau, Hannah Bleau",2023-02-02 17:42:21+00:00,https://www.breitbart.com/politics/2023/02/02/desantis-budget-includes-2-billion-tax-relief-permanent-sales-tax-exemptions-baby-necessities-gas-stoves/,1.0,0.0,0.819,0.181,0.4767
Breitbart News,MSNBC's Reid: DeSantis' Florida a 'Right-Wing Fantasy Land – Like Disney World But in Hell',"MSNBC host Joy Reid said Tuesday on her show ""The ReidOut"" that Gov. Ron DeSantis (R-FL) is turning Florida into a ""right-wing fantasy land"" in hell. | Clips","Pam Key, Pam Key",2023-02-01 04:17:50+00:00,https://www.breitbart.com/clips/2023/01/31/msnbcs-reid-desantis-florida-a-right-wing-fantasy-land-like-disney-work-but-in-hell/,-1.0,0.353,0.551,0.096,-0.7684
Breitbart News,Michael Eric Dyson: DeSantis 'Essentially' George Wallace Stopping Black Education,"Vanderbilt University professor Michael Eric Dyson said Thursday on ""MSNBC Reports"" that Gov. Ron DeSantis (R-FL) is ""essentially"" segregationist George Wallace because he instructed the Florida Department of Education to reject the official curriculum for a …","Pam Key, Pam Key",2023-02-02 18:46:07+00:00,https://www.breitbart.com/clips/2023/02/02/michael-eric-dyson-desantis-essentially-george-wallace-stopping-black-education/,-1.0,0.151,0.849,0.0,-0.1531
Breitbart News,Ron DeSantis Announces Proposal to Eliminate DEI/CRT Bureaucracies in Higher Education,"Florida Gov. Ron DeSantis (R) announced a series of proposals in relation to higher education in the Sunshine State, including eliminating Diversity, Equity, and Inclusion (DEI) and Critical Race Theory (CRT) bureaucracies, as part of the administration's des…","Hannah Bleau, Hannah Bleau",2023-01-31 19:25:26+00:00,https://www.breitbart.com/politics/2023/01/31/ron-desantis-announces-proposal-to-eliminate-dei-crt-bureaucracies-in-higher-education/,0.0,0.0,1.0,0.0,0.0
Breitbart News,Trump: DeSantis 'Begged Me for an Endorsement' – 'There Were Tears Coming Down from His Eyes',"During an interview that aired on Thursday's broadcast of Hugh Hewitt's nationally syndicated radio show, former President Donald Trump, now a candidate for the 2024 Republican presidential nomination, took a shot at his possible rival in the contest, Gov. Ro…","Jeff Poor, Jeff Poor",2023-02-02 18:33:51+00:00,https://www.breitbart.com/clips/2023/02/02/trump-desantis-begged-me-for-an-endorsement-there-were-tears-coming-down-from-his-eyes/,1.0,0.134,0.704,0.162,0.1027
Breitbart News,"Exclusive -- Vice Chair of FL GOP Christian Ziegler: Only 17,000 of the Net 1 Million Moving to the State Registered Democrat","Christian Ziegler, the vice chair of the Republican Party of Florida, who is running for the chairmanship, told Breitbart News Saturday about the successes the Sunshine State has seen over the past four years, noting that Republicans are in a strong position …","Hannah Bleau, Hannah Bleau",2023-02-04 19:40:44+00:00,https://www.breitbart.com/radio/2023/02/04/vice-chair-of-fl-gop-christian-ziegler-17000-net-1-million-moving-state-registered-democrat/,1.0,0.0,0.903,0.097,0.128
Breitbart News,Poll: Trump Leads by Double Digits in South Carolina,"Former President Donald Trump is leading his potential challengers in South Carolina by double-digits, a recent Trafalgar Group survey found.","Hannah Bleau, Hannah Bleau",2023-01-30 17:18:52+00:00,https://www.breitbart.com/2024-election/2023/01/30/poll-trump-leads-double-digits-south-carolina/,0.0,0.0,1.0,0.0,0.0
Breitbart News,Poll: Donald Trump Leads in New Hampshire,Former President Donald Trump leads the hypothetical 2024 Republican primary field in the latest New Hampshire Journal/Coefficient poll.,"Jacob Bliss, Jacob Bliss",2023-01-30 18:16:28+00:00,https://www.breitbart.com/politics/2023/01/30/poll-trump-leads-new-hampshire/,0.0,0.0,1.0,0.0,0.0
Breitbart News,Report: Democrat Committee to Target State Legislature Races with Pro-Abortion Ad Campaign,A Democrat political committee centered on state legislatures is creating an affiliated non-profit to launch a pro-abortion ad campaign.,"Katherine Hamilton, Katherine Hamilton",2023-01-30 23:29:19+00:00,https://www.breitbart.com/politics/2023/01/30/report-democrat-committee-target-state-legislature-races-pro-abortion-ad-campaign/,0.0,0.0,1.0,0.0,0.0
Breitbart News,Blue State Blues: My African-American Education,"Students should be encouraged to learn more about African-American history, but they need to grasp basic U.S. history first.","Joel B. Pollak, Joel B. Pollak",2023-02-03 08:00:42+00:00,https://www.breitbart.com/politics/2023/02/03/blue-state-blues-my-african-american-education/,0.0,0.0,1.0,0.0,0.0
Breitbart News,Exclusive: Chinese Spy Balloon Renews GOP Push for Foreign Land Purchase Ban,Rep. Mary Miller (R-IL) is proposing a foreign land purchase moratorium to protect U.S. food security and stabilize housing prices.,"Katherine Hamilton, Katherine Hamilton",2023-02-03 21:47:36+00:00,https://www.breitbart.com/politics/2023/02/03/exclusive-chinese-spy-balloon-renews-gop-push-foreign-land-purchases-ban/,-1.0,0.255,0.638,0.106,-0.4767
Business Insider,"Trump's new label for Ron DeSantis, 'RINO globalist,' has roots in a far-right conspiracy theory about an insidious global network of powerful people","Trump has been calling the Florida governor names like ""Ron DeSanctimonious."" His latest move was to brand DeSantis a ""Republican in name only.""",insider@insider.com (Cheryl Teh),2023-02-02 05:23:00+00:00,https://www.businessinsider.com/donald-trump-ron-desantis-rino-globalist-ron-desanctimonious-2023-2,-1.0,0.168,0.693,0.139,-0.1531
Business Insider,Trump says it's 'very disloyal' of Ron DeSantis to even consider running against him in 2024,"""To me it is, it's always about loyalty,"" Trump said. ""But for a lot of people, it's not about that.""",insider@insider.com (Cheryl Teh),2023-01-30 03:46:47+00:00,https://www.businessinsider.com/donald-trump-ron-desantis-very-disloyal-2024-president-2023-1,0.0,0.0,1.0,0.0,0.0
Business Insider,Trump claims Ron DeSantis cried in front of him while asking for his endorsement back in 2018,"""There were tears coming down from his eyes. He said: 'If you endorse me, I'll win,'"" Trump said of DeSantis.",insider@insider.com (Cheryl Teh),2023-02-03 05:34:01+00:00,https://www.businessinsider.com/ron-desantis-cried-donald-trump-endorsement-florida-governor-2023-2,-1.0,0.202,0.62,0.178,-0.0772
Business Insider,Ron DeSantis has a 12-point lead over Donald Trump in a potential 2024 New Hampshire primary matchup: poll,"In the UNH poll, a little under half (46%) of GOP voters felt Trump should run for president again, while roughly 50% thought he should forgo a bid.",insider@insider.com (John L. Dorman),2023-01-28 17:29:39+00:00,https://www.businessinsider.com/desantis-leads-trump-new-hampshire-2024-republican-presidential-primary-poll-2023-1,0.0,0.0,1.0,0.0,0.0
Business Insider,GOP Gov. Chris Sununu says Trump isn't 'bringing that fire' people saw in 2016 and predicts he won't win New Hampshire's primary,New Hampshire's governor Chris Sununu is the latest Republican to cast doubt on Trump's 2024 bid for the presidency.,"cpanella@insider.com (Chris Panella,Brent D. Griffiths)",2023-01-30 16:10:30+00:00,https://www.businessinsider.com/republican-governor-sununu-donald-trump-campaign-criticism-2023-1,-1.0,0.146,0.758,0.096,-0.2584
Business Insider,Lindsey Graham says there is 'only one Donald Trump' and the GOP can't have 'Trump policies' without him,"Graham said on Saturday that there are ""many, many talented people"" in the GOP, but there is ""only one Donald Trump.""",insider@insider.com (Cheryl Teh),2023-01-30 08:36:49+00:00,https://www.businessinsider.com/lindsey-graham-donald-trump-gop-only-one-trump-2023-1,0.0,0.0,1.0,0.0,0.0
