source,title,description,author,publishedAt,url,sentimentScore,neg,neu,pos,compound
Fox News,‘Socialist’ teacher admits she wants to ‘abolish the police’ amid school curriculum battle with DeSantis,"One of the teacher's behind the proposed AP African-American studies course in Florida is accused of being a ""socialist"" in a recent National Review op-ed.",Jeffrey Clark,2023-01-30 11:19:51+00:00,https://www.foxnews.com/media/socialist-teacher-admits-she-wants-abolish-police-amid-school-curriculum-battle-with-desantis,-1.0,0.188,0.652,0.159,-0.1027
Fox News,"'Latinx' and other woke 'inclusive language' has 'gone overboard,' warn liberal pundits: 'It's a joke'","Liberal CNN guests said Thursday that the left has gone too far with supposedly ""inclusive language"" like ""Latinx"" that ""nobody has even heard of six months ago.""",Jeffrey Clark,2023-02-03 12:04:51+00:00,https://www.foxnews.com/media/latinx-other-woke-inclusive-language-gone-overboard-warn-liberal-pundits-joke,1.0,0.111,0.714,0.175,0.2023
Fox News,Florida lawmakers introduce bill to eliminate unanimous jury requirement for death penalty,Florida lawmakers introduced legislation this week that would end the requirement for juries to be unanimous in order to sentence a prisoner to death.,Paul Best,2023-02-01 20:29:25+00:00,https://www.foxnews.com/politics/florida-lawmakers-introduce-bill-eliminate-unanimous-jury-requirement-death-penalty,-1.0,0.463,0.537,0.0,-0.7845
Fox News,American colleges offer classes on 'Zombie studies': 'Apocalypse has arrived',"American colleges and universities are offering courses on how to survive the ""zombie apocalypse,"" according to a report from the College Fix.",Adam Sabes,2023-02-02 21:23:57+00:00,https://www.foxnews.com/us/american-colleges-offer-classes-zombie-studies-apocalypse-arrived,0.0,0.0,1.0,0.0,0.0
Fox News,MSNBC's Joy Reid regains her crown as Queen of Kook,MSNBC host Joy Reid has regained her status as the person who says the craziest things after host Tiffany Cross was canned.,Dan Gainor,2023-02-02 09:00:56+00:00,https://www.foxnews.com/opinion/msnbc-joy-reid-regains-crown-queen-kook,1.0,0.0,0.612,0.388,0.5859
Fox News,"Trump appears to take aim at potential 2024 GOP rivals, says he doesn't have much 'competition'",Former President Donald Trump jabs at potential rivals for the Republican presidential nomination during a stop in the first primary state of New Hampshire,Paul Steinhauser,2023-01-28 21:25:41+00:00,https://www.foxnews.com/politics/trump-appears-take-aim-potential-2024-gop-rivals-doesnt-have-much-competition,0.0,0.0,1.0,0.0,0.0
Fox News,He's running: Outgoing White House chief of staff promises to work on Biden's 2024 presidential campaign,"Though President Biden has teased a potential second run for the White House for months, sources tell Fox News that an announcement is expected after the State of the Union.","Thomas Phippen, Sophia Slacik",2023-02-02 14:10:42+00:00,https://www.foxnews.com/politics/outgoing-white-house-chief-staff-promises-work-biden-2024-presidential-campaign,1.0,0.0,0.696,0.304,0.5859
Fox News,Pro-life activists look to 2024 presidential election hoping to influence GOP,Anti-abortion activists in the pro-life movement turn to the 2024 presidential election in hopes to sway Republicans and protect the rights of the unborn.,Associated Press,2023-02-01 13:43:10+00:00,https://www.foxnews.com/politics/pro-life-activists-look-2024-presidential-election-hoping-influence-gop,1.0,0.0,0.741,0.259,0.4215
Fox News,Father of child killed in Parkland shooting spars with Gavin Newsom over gun rights: 'Sit this one out',"A father whose daughter was killed at Marjory Stoneman Douglas High School in Parkland, Florida, called out California Gov. Newsom on Twitter over gun rights.",Jeffrey Clark,2023-02-01 20:30:35+00:00,https://www.foxnews.com/media/father-child-killed-parkland-shooting-spars-gavin-newsom-over-gun-rights-sit-this-one-out,-1.0,0.408,0.592,0.0,-0.7845
Fox News,EXCLUSIVE: Former CIA spy and GOP Congressman Will Hurd addresses rumors of 2024 presidential run,"Former GOP Republican Rep. Will Hurd of Texas heads to the first primary state of New Hampshire, sparking speculation the one-time CIA officer is mulling a 2024 bid",Paul Steinhauser,2023-01-28 11:00:23+00:00,https://www.foxnews.com/politics/exclusive-former-cia-spy-gop-congressman-will-hurd-addresses-rumored-2024-presidential-run,1.0,0.0,0.843,0.157,0.3034
Fox News,CDC says an eye drop brand may be connected to drug-resistant bacterial infections,The CDC is warning that a brand of eye drops may be linked to a bacterial infection that has affected at least 50 people in 11 states. One person died from the infection.,Landon Mion,2023-02-01 06:18:53+00:00,https://www.foxnews.com/health/cdc-says-eye-drop-brand-may-be-connected-drug-resistant-bacterial-infections,-1.0,0.189,0.811,0.0,-0.2732
Fox News,Democrat freshman rep deletes tweet calling Tyre Nichols' killing the ‘result of white supremacy’,"A freshman Democratic congressman has deleted a tweet that described the death of Tyre Nichols as being a result of ""white supremacy"" — even though the officers are Black.",Adam Shaw,2023-01-28 16:44:34+00:00,https://www.foxnews.com/politics/democrat-freshman-rep-deletes-tweet-calling-tyre-nichols-killing-result-white-supremacy,-1.0,0.282,0.641,0.077,-0.6369
Fox News,Chris Hayes annihilated on Twitter for stating he doesn't care about Chinese spy balloon,Twitter users blasted MSNBC anchor Chris Hayes after he tweeted that he didn't care much about a Chinese spy balloon floating in U.S. airspace.,Gabriel Hays,2023-02-04 20:05:19+00:00,https://www.foxnews.com/media/chris-hayes-annihilated-twitter-stating-doesnt-care-about-chinese-spy-balloon,-1.0,0.226,0.774,0.0,-0.3875
Fox News,NYC Mayor Eric Adams pleads with White House for more help on migrant crisis,"New York Mayor Eric Adams has called the city's migrant crisis ""very frustrating"" after migrants faced off with New York City Police over the weekend.",Matteo Cina,2023-02-01 00:51:02+00:00,https://www.foxnews.com/us/nyc-mayor-eric-adams-pleads-white-house-more-help-migrant-crisis,-1.0,0.277,0.541,0.182,-0.34
Fox News,These senators have the largest war chests heading into the 2024 election cycle,"While incumbent Independents and Democrat senators topped the list for the most cash on hand, GOP incumbents Sens. Rick Scott and Ted Cruz raised the most cash during the year-end quarter.",Sophia Slacik,2023-02-01 17:45:53+00:00,https://www.foxnews.com/politics/these-senators-have-largest-war-chests-2024-re-election-campaigns,-1.0,0.328,0.672,0.0,-0.5994
Fox News,Nikki Haley plans 'big announcement' about 2024 presidential bid,"Former South Carolina Gov. Nikki Haley on Wednesday teased a ""big announcement"" on Feb. 15, which is expected to be the formal launch of her 2024 presidential bid.",Sarah Rumpf,2023-02-02 00:43:56+00:00,https://www.foxnews.com/politics/nikki-haley-plans-big-announcement-2024-presidential-bid,0.0,0.0,1.0,0.0,0.0
Fox News,Missouri AG demands schools ban drag shows with new resolution: 'Education not indoctrination',"Missouri Attorney General Andrew Bailey, R., explains in an interview why he's demanding schools prohibit drag queens from engaging with school-age children.",Nikolas Lanum,2023-02-02 09:00:07+00:00,https://www.foxnews.com/media/missouri-ag-demands-schools-ban-drag-shows-new-resolution-education-not-indoctrination,-1.0,0.379,0.621,0.0,-0.6705
Fox News,Tyre Nichols death: Liberals blame racism for Memphis man's brutal beating despite officers being Black,Liberals said the police beating of Tyre Nichols is an example of racism despite the fact that all five officers are Black.,Adam Sabes,2023-01-28 19:58:15+00:00,https://www.foxnews.com/politics/tyre-nichols-death-liberals-blame-racism-memphis-mans-brutal-beating-officers-being-black,-1.0,0.686,0.314,0.0,-0.9552
Fox News,This is the biggest threat to Black America. Hint: it’s not the police,"The biggest threat to Black America isn’t police, it’s the American left that founded KKK and Planned Parenthood and runs city where Tyre Nichols was killed.",C.J. Pearson,2023-02-03 07:00:06+00:00,https://www.foxnews.com/opinion/this-is-biggest-threat-black-america-hint-its-not-police,-1.0,0.362,0.638,0.0,-0.5267
Fox News,Former DOE official called 'hypocrite' after pushing public schools despite sending her kids to private school,"Former Department of Education official Diane Ravitch was called a ""hypocrite"" after pushing public schools when she sent her own kids to private school.",Joshua Nelson,2023-02-01 09:30:14+00:00,https://www.foxnews.com/media/former-doe-official-called-hypocrite-pushing-public-schools-despite-sending-kids-private-school,0.0,0.0,1.0,0.0,0.0
Fox News,Longshot potential 2024 presidential candidate Asa Hutchinson gets help from Super PAC,"As he seriously considers a presidential run in 2024, former Republican Gov. of Arkansas Asa Hutchinson will get a helping hand from a super PAC backed by a $1 million contribution",Paul Steinhauser,2023-02-02 10:00:56+00:00,https://www.foxnews.com/politics/longshot-potential-2024-presidential-candidate-asa-hutchinson-gets-help-super-pac,1.0,0.0,0.577,0.423,0.765
Fox News,"Republicans privately gripe about Trump, but don’t dare take him on","The only thing that may stop former President Donald Trump from earning the GOP nomination in 2024 may be his untimely demise, no matter what naysayers might want to believe.",Howard Kurtz,2023-02-01 08:06:18+00:00,https://www.foxnews.com/shows/media-buzz/republicans-privately-gripe-about-trump-dont-dare-take-him-on,0.0,0.0,1.0,0.0,0.0
Fox News,"Corporate wokeness: Big Tech, major banks rated 'high risk' of canceling people, orgs for ideological reasons","Many of America's most prominent corporations pose a ""high risk"" of canceling a contract or denying services for purely ideological reasons, according to a new report.",Aaron Kliegman,2023-02-01 02:13:31+00:00,https://www.foxnews.com/politics/big-tech-major-banks-high-risk-cancel-people-orgs,-1.0,0.139,0.861,0.0,-0.2732
Fox News,"South Carolina's Nikki Haley to launch 2024 presidential campaign, joining Trump in nomination hunt","Nikki Haley of South Carolina, who served as United Nations ambassador during former President Donald Trump’s administration, will soon declare her candidacy for president.",Paul Steinhauser | Fox News,2023-02-01 03:49:06+00:00,https://www.foxnews.com/politics/south-carolinas-nikki-haley-launch-2024-presidential-campaign-joining-trump-nomination-hunt,0.0,0.0,1.0,0.0,0.0
Fox News,"Florida bill could hand gun owners huge win, make the US a constitutional carry majority country","Florida Republicans introduced a constitutional carry bill on Monday, which could tip the U.S. to having a majority of states with permitless carry if the bill is signed into law.",Emma Colton | Fox News,2023-01-30 18:05:37+00:00,https://www.foxnews.com/us/florida-bill-could-gun-owners-huge-win-us-constitutional-carry-majority-country,1.0,0.111,0.461,0.429,0.7845
MSNBC,"Black History, Uncensored: Why DeSantis wants bell hooks' work banned","This Black History Month is unlike others in recent memory, so The ReidOut Blog is highlighting authors targeted by Ron DeSantis and other conservatives.",Ja'han Jones,2023-02-01 21:49:38+00:00,https://www.msnbc.com/the-reidout/reidout-blog/black-history-uncensored-bell-hooks-rcna68695,-1.0,0.25,0.75,0.0,-0.4588
MSNBC,Trump shows us how the MAGA right wants to weaponize schools,Donald Trump's education policy rollout targeting doubles as an attempt to out-MAGA Florida Gov. Ron DeSantis on issues like critical race theory.,Zeeshan Aleem,2023-01-28 11:00:00+00:00,https://www.msnbc.com/opinion/msnbc-opinion/trump-education-policy-desantis-2024-rcna67534,0.0,0.0,1.0,0.0,0.0
MSNBC,Polls reveal the real reason Ron DeSantis is fighting the teaching of Black history,The backlash is rightfully growing to Florida Gov.,Dean Obeidallah,2023-01-30 22:34:21+00:00,https://www.msnbc.com/opinion/msnbc-opinion/desantis-black-history-course-ban-part-2024-plan-rcna68266,-1.0,0.217,0.783,0.0,-0.3612
MSNBC,Lauren Boebert's quest to arm more Americans just got even more absurd,"Florida Gov. DeSantis and Colorado Rep. Lauren Boebert are leading the charge to arm more Republicans, even when weaker gun laws end up hurting GOP voters.",Wajahat Ali,2023-02-03 11:30:00+00:00,https://www.msnbc.com/opinion/msnbc-opinion/florida-gov-ron-desantis-pushes-guns-state-rcna68938,0.0,0.0,1.0,0.0,0.0
MSNBC,"With Ronna McDaniel, GOP doubles down on the same losing message","The Republican National Committee reappointed Ronna McDaniel to a fourth term, making her likely to become the longest serving GOP chair since the 19th century.",Hayes Brown,2023-01-30 19:40:37+00:00,https://www.msnbc.com/opinion/msnbc-opinion/ronna-mcdaniel-led-rnc-one-failure-another-rcna67968,-1.0,0.302,0.698,0.0,-0.3818
MSNBC,Trump's 2024 litmus test is worse than cruelty,Donald Trump's 2024 campaign for president pits him against Republican primary rivals like Florida's Ron DeSantis. And violence is the test.,Charlie Sykes,2023-01-29 11:00:00+00:00,https://www.msnbc.com/opinion/msnbc-opinion/trump-vs-desantis-2024-republican-litmus-test-brutality-rcna67979,-1.0,0.636,0.364,0.0,-0.7906
MSNBC,The AP’s African American History course still has a lot to teach students,"The College Board announced a revised curriculum for its Advanced Placement African American Studies course, after objections from Florida Gov. Ron DeSantis.",Nayyera Haq,2023-02-01 23:16:57+00:00,https://www.msnbc.com/opinion/msnbc-opinion/ron-desantis-wins-fight-ap-african-american-history-course-rcna68636,0.0,0.0,1.0,0.0,0.0
MSNBC,Bolsonaro wants to stay in Florida longer after riot in Brazil,"Former Brazilian President Jair Bolsonaro reportedly is seeking a visa so he can remain in Florida, which deserves a new slogan with all of its wannabe despots.",Ja'han Jones,2023-01-31 22:26:24+00:00,https://www.msnbc.com/the-reidout/reidout-blog/bolsonaro-brazil-florida-visa-desantis-rcna68412,-1.0,0.375,0.625,0.0,-0.5574
MSNBC,RNC throws Ye under the bus with resolution ‘condemning’ antisemitism,"It seems that Republicans are officially done using the artist formerly known as Kanye West, and they’re throwing him to the trash heap.",Ja'han Jones,2023-01-30 22:40:39+00:00,https://www.msnbc.com/the-reidout/reidout-blog/rnc-antisemitism-ye-fuentes-gop-rcna68182,0.0,0.0,1.0,0.0,0.0
MSNBC,Why Kimberlé Crenshaw makes Republicans so nervous,"On Day 2 of our “Black History, Uncensored” series highlighting creators targeted by GOP bans, let's look at critical race theory pioneer Kimberlé Crenshaw.",Ja'han Jones,2023-02-02 22:34:18+00:00,https://www.msnbc.com/the-reidout/reidout-blog/kimberle-crenshaw-black-history-uncensored-rcna68880,-1.0,0.296,0.704,0.0,-0.2732
MSNBC,Is post-pandemic homeschooling undergoing an extremism crisis?,"An Ohio couple used homeschooling to indoctrinate children into white supremacy. The strategy is is nothing new, but the pandemic has made the problem worse.",Cynthia Miller-Idriss,2023-02-03 22:47:11+00:00,https://www.msnbc.com/opinion/msnbc-opinion/ohio-couple-used-homeschooling-spread-nazi-ideaoly-rcna68406,-1.0,0.451,0.549,0.0,-0.6249
MSNBC,The GOP's 2024 race to the bottom has already begun,"Donald Trump and Ron DeSantis are leading the Republican Party ahead of the 2024 election on education, critical race theory, and transgender youth, sadly.",Hayes Brown,2023-02-04 11:00:00+00:00,https://www.msnbc.com/opinion/msnbc-opinion/trump-desantis-compete-lead-rights-culture-wars-rcna69015,0.0,0.0,1.0,0.0,0.0
MSNBC,"Wednesday's Mini-Report, 2.1.23",Today's edition of quick hits.,Steve Benen,2023-02-01 22:30:31+00:00,https://www.msnbc.com/rachel-maddow-show/maddowblog/wednesdays-mini-report-2123-rcna68708,0.0,0.0,1.0,0.0,0.0
NBC News,Academics revising the AP African American studies course insist they won't cave to pressure from Ron DeSantis,Academics revising the AP African American studies course framework say they won't cave to pressure from Florida Gov. Ron DeSantis' administration.,Adam Edelman and Rose Horowitch,2023-01-31 18:08:25+00:00,https://www.nbcnews.com/politics/politics-news/academics-revising-ap-african-american-studies-course-insist-wont-cave-rcna68207,1.0,0.0,0.864,0.136,0.2235
NBC News,Florida to consider expanding DeSantis' migrant flight program in special session,The Florida Legislature is set to consider expanding Gov. Ron DeSantis' program that was used to fly dozens of migrants from Texas to Martha’s Vineyard.,Zoë Richards,2023-02-04 00:31:30+00:00,https://www.nbcnews.com/politics/immigration/florida-consider-expanding-desantis-migrant-flight-program-rcna69100,1.0,0.0,0.748,0.252,0.4019
NBC News,Governors' legislative agendas offer clues to possible 2024 presidential campaigns,"As the 2024 GOP presidential field forms, some of the candidates are likely to be governors. Their state-level agendas hold clues about their potential runs.",Adam Edelman,2023-01-30 19:40:06+00:00,https://www.nbcnews.com/politics/2024-election/governors-state-agendas-point-possible-presidential-runs-rcna66985,0.0,0.0,1.0,0.0,0.0
NBC News,AP African American studies course is watered down after GOP pressure,"The College Board has revised its framework for an AP African American studies course, cutting material that Republicans objected to.",Rose Horowitch and Adam Edelman,2023-02-01 15:42:57+00:00,https://www.nbcnews.com/politics/politics-news/ap-african-american-studies-course-watered-gop-pressure-rcna68454,-1.0,0.239,0.761,0.0,-0.296
NBC News,Afro Latino scholars and activists slam Gov. DeSantis' dissection of AP African American studies,Afro Latino educators say.Florida's rejection of AP African American studies undermines student learning in a multicultural world and the history of Black Latinos.,Suzanne Gamboa,2023-02-04 11:00:00+00:00,https://www.nbcnews.com/news/latino/afro-latinos-desantis-black-ap-studies-rcna69036,-1.0,0.191,0.809,0.0,-0.3818
NBC News,Trump kicks off his 2024 campaign: 'We are at the brink of World War III',"Donald Trump took aim at Joe Biden, Hunter Biden and undocumented immigrants Saturday as he kicked off his bid for a return to the White House.",Jonathan Allen,2023-01-28 23:53:03+00:00,https://www.nbcnews.com/politics/donald-trump/trump-are-brink-world-war-iii-rcna68008,-1.0,0.328,0.672,0.0,-0.5994
NBC News,Michigan Republicans are in turmoil as their leaders navigate tricky Trump terrain,"After a shellacking that wiped them out of power in state government for the first time in 40 years, Michigan Republicans are wrestling with an uncertain future.",Henry J. Gomez,2023-02-01 17:03:35+00:00,https://www.nbcnews.com/politics/politics-news/michigan-gop-turmoil-leaders-navigate-tricky-trump-terrain-rcna68276,-1.0,0.406,0.594,0.0,-0.4767
NBC News,RNC promises to be independent from Trump in 2024. Can it succeed?,"For years, the RNC has been closely tied to Donald Trump. But with other candidates likely to run against him in 2024, the party is pledging neutrality.",Allan Smith,2023-01-29 12:00:00+00:00,https://www.nbcnews.com/politics/2024-election/rnc-independent-trump-2024-rcna68039,1.0,0.0,0.463,0.537,0.7003
NBC News,Eyes on 2024: GOP primary kicks off with Trump trips and sniping,Former President Trump visited New Hampshire and South Carolina this past weekend.,Ben Kamisar,2023-01-30 15:44:04+00:00,https://www.nbcnews.com/meet-the-press/meetthepressblog/eyes-2024-gop-primary-kicks-trump-trips-sniping-rcna68135,0.0,0.0,1.0,0.0,0.0
NBC News,Poll finds 71% of Americans believe country is on wrong track,71% of Americans in a new NBC News poll say the country is headed in the wrong direction — the eighth time that level has been hit in the last nine NBC polls.,Chuck Todd,2023-01-30 14:04:05+00:00,https://www.nbcnews.com/meet-the-press/first-read/poll-finds-71-americans-believe-country-wrong-track-rcna68138,-1.0,0.307,0.693,0.0,-0.4767
NBC News,Eyes on 2024: Trump’s slow fundraising start — plus other baggage,"Trump’s campaign continues to ramp up, although NBC News’ Jonathan Allen and Marc Caputo report that the former president is struggling to fundraise.",Ben Kamisar,2023-01-31 17:12:33+00:00,https://www.nbcnews.com/meet-the-press/meetthepressblog/eyes-2024-trumps-slow-fundraising-start-baggage-rcna68332,0.0,0.0,1.0,0.0,0.0
NBC News,"After expected '24 campaign launch, Haley plans travel to N.H. and Iowa",Former South Carolina Governor and U.N. Ambassador Nikki Haley plans to hit the road after announcing her presidential bid later this month.,"Ali Vitali, Julia Jester",2023-02-03 16:24:59+00:00,https://www.nbcnews.com/meet-the-press/meetthepressblog/expected-launch-haley-plans-travel-nh-iowa-rcna68996,1.0,0.0,0.696,0.304,0.6037
NBC News,Gloves off: Conservatives fight the NHL in a culture war clash,The National Hockey League finds itself on thin ice with some conservatives as a new target in the U.S. culture war.,Allan Smith,2023-02-04 15:05:21+00:00,https://www.nbcnews.com/politics/politics-news/nhl-conservatives-face-culture-war-clash-rcna67087,-1.0,0.565,0.435,0.0,-0.7579
Newsweek,"Ron DeSantis, Defender of Black History | Opinion","Far-left activist academics have anointed themselves with the authority to define ""Black.""",Max Eden,2023-01-31 11:30:01+00:00,https://www.newsweek.com/ron-desantis-defender-black-history-opinion-1777585,1.0,0.0,0.781,0.219,0.1027
Newsweek,MAGA Republican Issues Stark Warning to Ron DeSantis,"During the first few months of his third presidential campaign, Donald Trump has grown increasingly sour toward the Florida governor.",Anna Skinner,2023-01-30 21:01:04+00:00,https://www.newsweek.com/maga-republican-issues-stark-warning-ron-desantis-1777660,-1.0,0.286,0.714,0.0,-0.34
Newsweek,Ron DeSantis' 'Scary' Actions Will 'Exacerbate' Teacher Shortage: Educator,"""Teachers want to teach with autonomy and authenticity, and so they want to be able to teach real and true factual history,"" Karla Hernández said on Sunday.",Fatma Khaled,2023-01-29 22:03:29+00:00,https://www.newsweek.com/ron-desantis-scary-actions-will-exacerbate-teacher-shortage-educator-1777365,-1.0,0.426,0.574,0.0,-0.6369
Newsweek,Lakeland Mass Shooting Shines Spotlight on Ron DeSantis' Gun Views,Florida's legislature introduced a bill that would allow carrying a concealed gun without a permit the same day 10 people were injured in a drive-by shooting.,Kaitlin Lewis,2023-01-31 02:49:49+00:00,https://www.newsweek.com/lakeland-mass-shooting-shines-spotlight-ron-desantis-gun-views-1777695,-1.0,0.231,0.769,0.0,-0.34
Newsweek,Ron DeSantis' Harmeet Dhillon RNC Endorsement Proves Futile,"RNC Chairwoman Ronna McDaniel, reportedly privately backed by former President Donald Trump, won a new term on Friday. DeSantis endorsed her rival on Thursday.",Aila Slisco,2023-01-28 01:18:50+00:00,https://www.newsweek.com/ron-desantis-harmeet-dhillon-rnc-endorsement-proves-futile-1777238,-1.0,0.259,0.536,0.205,-0.1531
Newsweek,Donald Trump Blasts Republican Rivals as MAGA Dissent Breaks Out,The former president spoke about Ron DeSantis and Nikki Haley's White House ambitions as GOP 2024 primary heats up.,Ewan Palmer,2023-01-30 11:18:24+00:00,https://www.newsweek.com/trump-2024-desantis-nikki-haley-maga-1777436,0.0,0.0,1.0,0.0,0.0
Newsweek,DeSantis Video Critiquing Trump's Approach to Putin Resurfaces,"In the clip from 2017, DeSantis suggests that attempting to work with Putin might be a fruitless endeavor.",Thomas Kika,2023-01-31 19:15:49+00:00,https://www.newsweek.com/ron-desantis-video-critiquing-donald-trump-approach-vladimir-putin-russia-resurfaces-1777972,0.0,0.0,1.0,0.0,0.0
Newsweek,"Top GOP Strategist Rips Trump For Attacking Nikki Haley, DeSantis: 'Loser'","So far, Trump is the only notable candidate in the 2024 presidential election. He has recently taken some verbal shots at his potential contenders.",Anna Skinner,2023-02-02 20:41:38+00:00,https://www.newsweek.com/top-gop-strategist-rips-trump-nikki-haley-desantis-1778652,-1.0,0.395,0.494,0.111,-0.6808
Newsweek,DeSantis Ripped for Proposing Tax Break on Gas Stoves 'They' Want to Take,"""They want to go after the gas stoves,"" DeSantis said while announcing that Florida's budget would include $7 million for a gas stove sales tax exemption.",Aila Slisco,2023-02-02 00:23:00+00:00,https://www.newsweek.com/desantis-ripped-proposing-tax-break-gas-stoves-they-want-take-1778365,1.0,0.0,0.874,0.126,0.0772
Newsweek,"Trump, DeSantis Battle Turns Into a COVID War","""Trump is trying to rewrite that narrative,"" said Adam Cayton, government professor at the University of West Florida.",Nick Mordowanec,2023-01-31 21:57:44+00:00,https://www.newsweek.com/trump-desantis-battle-covid-war-1777999,-1.0,0.565,0.435,0.0,-0.7579
Newsweek,Video of Florida Classroom Stripped of Books After DeSantis Ban Goes Viral,School districts in the state are reportedly scrambling to comply with the new law championed by the Republican governor.,Giulia Carbonaro,2023-01-31 13:05:34+00:00,https://www.newsweek.com/video-florida-classroom-books-desantis-ban-1777793,-1.0,0.286,0.714,0.0,-0.5574
Newsweek,Donald Trump's Gathering His Troops for 2024 Election,"Trump is racking up endorsements and appears to be seeking more, as several Republicans consider jumping into the 2024 presidential race.",Nick Reynolds,2023-02-01 19:39:05+00:00,https://www.newsweek.com/donald-trump-gathering-troops-2024-election-1778334,0.0,0.0,1.0,0.0,0.0
Newsweek,Donald Trump's 2024 Chances Slashed by Bookmaker After South Carolina Rally,"The former president held his first official 2024 rally in Columbia over the weekend, which has given his campaign a much needed boost.",Ewan Palmer,2023-01-31 14:42:11+00:00,https://www.newsweek.com/trump-odds-2024-election-rally-1777841,-1.0,0.162,0.684,0.154,-0.0258
