source,title,description,author,publishedAt,url,sentimentScore,neg,neu,pos,compound
Business Insider,Learning about the Black Lives Matter movement will now be optional in a new AP Black history class after Florida Gov. DeSantis publicly rejected the course,The new framework for the course makes content on topics like Black Lives Matter and queer studies optional for classrooms nationwide.,cpanella@insider.com (Chris Panella),2023-02-01 18:14:20+00:00,https://www.businessinsider.com/college-board-black-history-course-desantis-florida-blocked-content-optional-2023-2,-1.0,0.17,0.773,0.057,-0.4939
Business Insider,"Trump may be the front runner, but his rivals clearly sense blood in the water as they move to recruit at Trump's own speeches","The good news for the former president is that, for now, the rest of the 2024 GOP field remains frozen.",bgriffiths@insider.com (Brent D. Griffiths),2023-01-31 20:41:02+00:00,https://www.businessinsider.com/trump-2024-gop-new-hampshire-south-carolina-poll-desantis-2023-1,1.0,0.0,0.816,0.184,0.4019
Business Insider,Trump's political ascent was fueled by Southern Republicans. Now they're his main 2024 opponents,"In the 2016 GOP presidential primaries, Trump cleaned up in the South in advance of capturing the party's nomination. But 2024 will likely be tougher.",insider@insider.com (John L. Dorman),2023-01-28 14:00:00+00:00,https://www.businessinsider.com/trump-southern-republicans-potential-desantis-haley-2024-presidential-campaigns-2023-1,0.0,0.0,1.0,0.0,0.0
Business Insider,Trump says he is 'more angry' than ever as he kicks off his 2024 presidential campaign,Donald Trump spoke at events in New Hampshire and South Carolina on Saturday in an attempt to energize his 2024 campaign.,ashoaib@insider.com (Alia Shoaib),2023-01-29 10:57:58+00:00,https://www.businessinsider.com/trump-more-angry-committed-2024-campaign-2023-1,-1.0,0.32,0.68,0.0,-0.5106
Business Insider,Chris Christie says Donald Trump 'can't win a general election' and GOP is finally recognizing harm of 'loser' candidates after 2022,"As Donald Trump claims he is ""more committed now than I ever was,"" Chris Christie said the GOP is realizing the consequences of ""loser"" candidates.",kbalevic@insider.com (Katie Balevic),2023-01-29 20:09:18+00:00,https://www.businessinsider.com/chris-christie-says-donald-trump-cant-win-a-general-election-2023-1,-1.0,0.434,0.566,0.0,-0.8742
Business Insider,"Trump shares old video of Nikki Haley, who is running against him, promising not to run against him","""Nikki has to follow her heart, not her honor,"" Trump wrote alongside the footage. Haley will launch her campaign on Feb 15, reports claim.",tporter@businessinsider.com (Tom Porter),2023-02-02 11:46:57+00:00,https://www.businessinsider.com/donald-trump-shares-video-2024-presidential-rival-nikki-haley-run-2023-2,1.0,0.0,0.588,0.412,0.5994
Business Insider,"Trump brushes off polls showing Ron DeSantis ahead of him in critical states ahead of 2024: 'He won't be leading, I got him elected'","While former President Trump has led in most national polls for the GOP presidential nomination, Gov. DeSantis has taken polling leads in key states.",insider@insider.com (John L. Dorman),2023-01-29 15:58:44+00:00,https://www.businessinsider.com/trump-dismisses-desantis-polling-leads-2024-republican-presidential-nomination-2023-1,-1.0,0.133,0.867,0.0,-0.3182
Business Insider,First-time homebuyers face a lose-lose scenario,"In Insider Weekly: Wall Street's most powerful man, Ken Griffin of Citadel, on why he moved to Miami. Plus, why first-time homebuyers are screwed.","mturner@businessinsider.com (Matt Turner,Dave Smith)",2023-01-29 12:49:00+00:00,https://www.businessinsider.com/citadel-sundance-ketamine-tech-layoffs-ken-griffin-2023-1,0.0,0.0,1.0,0.0,0.0
CBS News,College Board releases revised AP curriculum for African American studies,The College Board on Wednesday released its new Advanced Placement course on African American studies. The board made revisions to the course after Florida Gov. Ron DeSantis said he would ban it unless changes were made. Wall Street Journal reporter Doug Belk…,CBS News,2023-02-02 02:56:06+00:00,https://www.cbsnews.com/video/college-board-releases-revised-ap-curriculum-african-american-studies/,0.0,0.0,1.0,0.0,0.0
CBS News,Trump kicks off 2024 presidential campaign in New Hampshire and South Carolina,"Trump focused on the Biden administration's handling of foreign policy issues such as the war in Ukraine, the U.S. military withdrawal from Afghanistan and immigration at the U.S.-Mexico border.","Cristina Corujo, Jacob Rosen",2023-01-29 03:28:34+00:00,https://www.cbsnews.com/news/trump-2024-presidential-campaign-new-hampshire-south-carolina/,0.0,0.0,1.0,0.0,0.0
CBS News,A look at the new AP curriculum for African American Studies,The course was first announced last August but the final framework was released on Wednesday.,Analisa Novak,2023-02-01 17:39:59+00:00,https://www.cbsnews.com/news/college-board-new-ap-curriculum-african-american-studies-ron-desantis/,0.0,0.0,1.0,0.0,0.0
CBS News,Nikki Haley to announce 2024 presidential run on Feb. 15,Haley will become the first Republican to get in the 2024 presidential race since former President Donald Trump launched his bid.,"Aaron Navarro, Fin Gómez",2023-02-01 04:42:36+00:00,https://www.cbsnews.com/news/nikki-haley-to-announce-2024-presidential-run-on-feb-15/,0.0,0.0,1.0,0.0,0.0
CNN,College Board unveils official framework for new AP African American studies course,"The College Board released Wednesday the official framework of a new Advanced Placement course on African American Studies that Florida Gov. Ron DeSantis earlier denounced for imposing a ""political agenda.""",Nicole Chavez,2023-02-01 14:00:10+00:00,https://www.cnn.com/2023/02/01/us/college-board-ap-african-american-studies/index.html,0.0,0.0,1.0,0.0,0.0
CNN,Opinion: What's really behind Florida's attack on African American Studies,"As a student growing up in Florida, I vividly recall my International Baccalaureate English teacher inviting students to read ""Their Eyes Were Watching God"" in their best voice impressions of a formerly enslaved Black woman. She smirked as they giggled out ph…",Leslie Kay Jones,2023-02-03 20:07:03+00:00,https://www.cnn.com/2023/02/03/opinions/ap-african-american-studies-florida-desantis-jones-ctrp/index.html,-1.0,0.296,0.704,0.0,-0.5209
CNN,Opinion: Sarah Huckabee Sanders is Trumpism repackaged,"Republicans announced Thursday that Arkansas Gov. Sarah Huckabee Sanders will deliver the party's response to President Joe Biden's State of the Union address next week. Sanders, the former White House press secretary and daughter of former Arkansas Gov. Mike…",Julian Zelizer,2023-02-03 20:34:03+00:00,https://www.cnn.com/2023/02/03/opinions/sarah-huckabee-sanders-sotu-rebuttal-zelizer/index.html,0.0,0.0,1.0,0.0,0.0
CNN,Opinion: DeSantis is backing down from a fight with Trump,"Donald Trump has repeatedly opened fire on Florida Gov. Ron DeSantis, who has failed to respond to the former President's attacks, writes Dean Obeidallah. If DeSantis runs and wants to win in 2024, he can't keep ducking Trump's barbs, he says.",Dean Obeidallah,2023-01-30 02:10:39+00:00,https://www.cnn.com/2023/01/29/opinions/trump-ron-desantis-rocky-iii-obeidallah/index.html,-1.0,0.388,0.448,0.164,-0.3612
CNN,"Trump takes aim at DeSantis in first major campaign swing, says he's trying to 'rewrite history' on his Covid-19 record","Former President Donald Trump took aim at Ron DeSantis Saturday, claiming the Florida governor and his team are ""trying to rewrite history"" regarding their Covid-19 pandemic response, and called the potential presidential run by his GOP rival ""very disloyal.""",Kristen Holmes,2023-01-29 00:48:00+00:00,https://www.cnn.com/2023/01/28/politics/desantis-trump-disloyal-covid-record/index.html,0.0,0.0,1.0,0.0,0.0
CNN,"5 things to know for January 30: Police reform, inflation, weather, immigration, NFL",Here's what else you need to know to Get Up to Speed and On with Your Day.,Alexandra Meeks,2023-01-30 12:08:39+00:00,https://www.cnn.com/2023/01/30/us/five-things-january-30-trnd/index.html,0.0,0.0,1.0,0.0,0.0
CNN,DeSantis proposes banning diversity and inclusion initiatives at Florida universities,"Florida Gov. Ron DeSantis said Tuesday that he intends to ban state universities from spending money on diversity, equity and inclusion initiatives in hopes that they will ""wither on the vine"" without funding.","Steve Contorno, Kit Maher",2023-01-31 23:51:42+00:00,https://www.cnn.com/2023/01/31/politics/desantis-diversity-inclusion-florida-universities/index.html,0.0,0.0,1.0,0.0,0.0
CNN,Trump takes early aim at the only 2024 GOP rival he cares about,Ex-President Donald Trump's bid to keep Ron DeSantis out of the 2024 White House race reveals as much about his own mindset and the challenges his campaign faces as it does about Florida's fast-rising Republican governor.,Stephen Collinson,2023-01-30 05:07:45+00:00,https://www.cnn.com/2023/01/30/politics/donald-trump-ron-desantis-2024-analysis/index.html,1.0,0.0,0.7,0.3,0.4588
CNN,Republicans elevate 'parental rights' as top issue while looking to outflank each other heading into 2024,"Republican presidential hopefuls have begun casting themselves as impassioned defenders of ""parental rights,"" turning schoolbooks and curricula, doctors' offices, and sports leagues into a new political battleground as they work to distinguish themselves ahea…","Gabby Orr, Steve Contorno",2023-02-04 14:09:30+00:00,https://www.cnn.com/2023/02/04/politics/republicans-2024-parental-rights-trump-desantis/index.html,1.0,0.0,0.833,0.167,0.2023
CNN,New Hampshire GOP governor says he's considering 2024 White House bid,"Republican Gov. Chris Sununu of New Hampshire said Sunday he is considering a White House bid in 2024, citing the Granite State's ""live free or die"" spirit as a model for the Republican party.","Paul LeBlanc, Kit Maher",2023-01-29 18:01:33+00:00,https://www.cnn.com/2023/01/29/politics/chris-sununu-2024-president-cnntv/index.html,0.0,0.0,1.0,0.0,0.0
CNN,Biden's approval drops as he takes the spotlight from Trump,President Joe Biden's political standing has benefited greatly over the past couple of years from his predecessor Donald Trump's inability to cede the limelight. It's part of the reason that Biden's Democratic Party had one of the best midterms last fall for …,Harry Enten,2023-01-29 13:09:11+00:00,https://www.cnn.com/2023/01/29/politics/joe-biden-donald-trump-approval-president/index.html,1.0,0.0,0.617,0.383,0.4767
CNN,Nikki Haley is about to answer the first big question of the 2024 White House race,Donald Trump so far isn't scaring anyone off.,Stephen Collinson,2023-02-02 05:04:00+00:00,https://www.cnn.com/2023/02/02/politics/nikki-haley-2024-republican-primary-trump/index.html,0.0,0.0,1.0,0.0,0.0
CNN,Trump allies cheer more traditional campaign debut even as some wonder if it will last,"Six months into his 2016 presidential campaign, Donald Trump made a telling admission.","Gabby Orr, Kristen Holmes, Kaitlan Collins, Kate Sullivan",2023-02-01 10:02:06+00:00,https://www.cnn.com/2023/02/01/politics/trump-2024-campaign/index.html,1.0,0.0,0.708,0.292,0.5106
CNN,"Start your week smart: Tyre Nichols, Iran quake, bus crash, Trump, Australian Open",Here's what you need to know to Start Your Week Smart.,Andrew Torgan,2023-01-29 13:57:59+00:00,https://www.cnn.com/2023/01/29/us/five-things-january-29-trnd/index.html,0.0,0.175,0.649,0.175,0.0
CNN,Florida lawmakers to meet for special session next week to address Disney's special governing powers | CNN Politics,"Florida lawmakers will return to the state Capitol next week to finalize their efforts to strip the Walt Disney Company of its special governing powers, the latest round of the yearlong feud between Republican Gov. Ron DeSantis and the entertainment giant.",Steve Contorno,2023-02-03 19:33:27+00:00,https://www.cnn.com/2023/02/03/politics/ron-desantis-disney-special-session-florida/index.html,1.0,0.0,0.69,0.31,0.6597
Fortune,Donald Trump kicks off 2024 presidential run in New Hampshire and South Carolina amid Republican uncertainty,"“I’m more angry now and I’m more committed now than I ever was,"" Trump said amid questions over his   commitment to run again.","Meg Kinnard, Holly Ramer, Jill Colvin, The Associated Press",2023-01-29 00:23:36+00:00,https://fortune.com/2023/01/28/trump-starts-2024-presidential-run-new-hampshire-south-carolina-amid-republican-doubts/,-1.0,0.167,0.833,0.0,-0.34
Fox News,"White House Claims Economic Progress, Voter’s Don’t Seem To Be Buying It","This week, it was revealed former South Carolina Governor Nikki Haley has plans to formally announce her presidential campaign later this month, despite previously stating she would not run against Trump. The former President has taken to social media to reta…",Jonah Blocker,2023-02-03 10:00:53+00:00,https://radio.foxnews.com/2023/02/03/white-house-claims-economic-progress-voters-dont-seem-to-be-buying-it/,1.0,0.0,0.797,0.203,0.4215
Fox News,GOP Senators come to DeSantis' defense after Trump called him 'disloyal',"Republicans are rushing to defend Florida Governor and rumored 2024 contender Ron DeSantis, after Trump's most recent attacks.",Aubrie Spady,2023-02-01 16:41:31+00:00,https://www.foxnews.com/politics/gop-senators-desantis-defense-trump-disloyal,1.0,0.0,0.824,0.176,0.128
Fox News,DeSantis praised after Florida high school course forced to cut all woke content: ‘Win after win',"Twitter users hailed Gov. Ron DeSantis, R-Fla., as the political victor after the College Board cut all woke content from its proposed course for Florida high schools.",Gabriel Hays,2023-02-02 17:05:46+00:00,https://www.foxnews.com/media/desantis-praised-after-florida-high-school-course-forced-cut-all-woke-content-win-after-win,1.0,0.223,0.306,0.472,0.7717
Fox News,MSNBC host compares Gov. DeSantis to Barack Obama: 'Sometimes it's lightning in a bottle',Joe Scarborough seemed to draw a comparison between former president Barack Obama and Gov. Ron DeSantis as he prepares for a potential matchup with Donald Trump.,Hanna Panreck,2023-02-02 16:21:49+00:00,https://www.foxnews.com/media/msnbc-host-compares-gov-desantis-barack-obama-sometimes-lightning-bottle,0.0,0.0,1.0,0.0,0.0
Fox News,Courting DeSantis: These groups are trying to convince Florida’s governor to run for president,Outside political groups trying to convince Ron DeSantis to campaign for president in 2024 are a sign of the Florida GOP governor's sizable grassroots support should he run.,Paul Steinhauser,2023-01-30 16:45:25+00:00,https://www.foxnews.com/politics/courting-desantis-these-groups-trying-convince-floridas-governor-run-president,1.0,0.0,0.818,0.182,0.25
Fox News,Trump calls DeSantis a 'RINO GLOBALIST' as verbal attacks heat up ahead of potential 2024 campaign showdown,The war of words between former President Donald Trump and Florida Gov. Ron DeSantis heats up ahead of a likely clash for the 2024 Republican presidential nomination,Paul Steinhauser,2023-02-01 15:51:44+00:00,https://www.foxnews.com/politics/trump-calls-desantis-rino-globalist-verbal-attacks-heat-up-ahead-potential-2024-campaign-showdown,-1.0,0.195,0.805,0.0,-0.4404
Fox News,Controversial AP African American studies course stripped of ‘woke’ content after criticism from Florida’s DOE,"Following rejection from the Florida Department of Education and criticism from Gov. Ron DeSantis, R-Fla., The College Board purged its AP African studies course of woke content.",Gabriel Hays,2023-02-01 16:49:45+00:00,https://www.foxnews.com/media/controversial-ap-african-american-studies-course-stripped-woke-content-criticism-floridas-doe,-1.0,0.32,0.68,0.0,-0.5719
Fox News,"DeSantis school policies have taken us back to slave era, ‘1865 all over again’: MSNBC guest","MSNBC guest panelist John Hope Bryant claimed that Gov. Ron DeSantis, R-Fla., has brought ""1865"" back with his public school curriculum policies.",Gabriel Hays,2023-02-04 17:32:24+00:00,https://www.foxnews.com/media/desantis-school-policies-have-taken-back-slave-era-1865-over-again-msnbc-guest,0.0,0.0,1.0,0.0,0.0
Fox News,Former Education Secretary blames DeSantis' 'White nationalist agenda' after CRT removed from AP course,"Former Education Secretary Arne Duncan claimed Governor Ron DeSantis had a racist agenda in criticizing ""woke"" lessons in a college prep course.",Kristine Parks,2023-02-01 21:45:24+00:00,https://www.foxnews.com/media/former-education-secretary-blames-desantis-white-nationalist-agenda-after-crt-removed-ap-course,-1.0,0.197,0.803,0.0,-0.4019
Fox News,California Gov. Gavin Newsom dubs head of College Board ‘puppet' of DeSantis: 'I call bulls---',"California Gov. Newsom called College Board CEO David Coleman a ""puppet of Ron DeSantis"" after the Board revised an AP African American studies program.",Bradford Betz,2023-02-02 01:13:59+00:00,https://www.foxnews.com/politics/california-gov-gavin-newsom-dubs-head-college-board-puppet-ron-desantis,0.0,0.0,1.0,0.0,0.0
Fox News,Florida Democrat agrees with DeSantis on AP African American history course: 'I think it's trash',"Bill Proctor, a Democrat politician from Florida who is African American, agreed with Gov. Ron DeSantis that a proposed AP African American history course was not good.",Joe Silverstein,2023-02-01 02:30:52+00:00,https://www.foxnews.com/media/florida-democrat-agrees-desantis-ap-african-american-history-course-i-think-its-trash,1.0,0.0,0.847,0.153,0.2023
Fox News,"DeSantis says Florida will cut funding to all CRT, DEI programs: ‘wither on the vine’","Florida Gov. Ron DeSantis proposed new legislation on Tuesday to cut funding to state college programs that include diversity, equity, and inclusion, and critical race theory",Bradford Betz,2023-01-31 20:39:23+00:00,https://www.foxnews.com/politics/desantis-florida-cut-funding-crt-dei-programs-wither-vine,-1.0,0.189,0.811,0.0,-0.2732
Fox News,"DeSantis proposes permanent sales tax holiday on baby formula, gas stoves",Florida Republican Gov. Ron DeSantis unveiled his budget proposal Wednesday that would include a permanent sales tax holiday on items like baby formula and gas stoves.,Jessica Chasmar,2023-02-01 18:30:10+00:00,https://www.foxnews.com/politics/desantis-proposes-permanent-sales-tax-holiday-baby-formula-gas-stoves,1.0,0.0,0.769,0.231,0.4019
Fox News,Randi Weingarten lambasts DeSantis over AP African-American Studies course ban: 'Stop the race baiting',"American Federation of Teachers President Randi Weingarten lashed out at Ron DeSantis, accusing him of ""race baiting"" over an African American studies course.",Taylor Penley,2023-02-02 18:30:27+00:00,https://www.foxnews.com/media/randi-weingarten-lambasts-desantis-ap-african-american-studies-ban-stop-race-baiting,-1.0,0.367,0.633,0.0,-0.7003
Fox News,'FASCISM': Florida Dem lashes out at DeSantis for targeting group that hosted 'Drag Queen Christmas' with kids,"Florida Democrat Rep. Maxwell Frost takes aim at Florida Gov. Ron Desantis over his complaint against the insitution that hosted a ""Drag Queen Christmas"" event and invited children.",Kyle Morris,2023-02-04 15:08:32+00:00,https://www.foxnews.com/politics/fascism-florida-dem-lashes-desantis-targeting-group-hosted-drag-queen-christmas-kids,-1.0,0.147,0.853,0.0,-0.2263
Fox News,"Cruz, Rubio, Paul, Cotton, Hawley, and Cotton — most GOP Senators stay on the 2024 sidelines","Other than Sen. Tim Scott, the Republican senators viewed as potential 2024 presidential contenders are sitting on the sidelines as Donald Trump and Ron DeSantis grab outsized attention",Paul Steinhauser,2023-02-02 13:30:07+00:00,https://www.foxnews.com/politics/cruz-rubio-paul-cotton-hawley-cotton-most-gop-senators-stay-2024-sidelines,0.0,0.0,1.0,0.0,0.0
Fox News,"DeSantis responds to Trump criticism, says 'verdict has been rendered by' Florida voters","Florida Gov. Ron DeSantis responded to former President Trump's latest series of complaints about his governorship, pointing to his own landslide re-election.",Timothy Nerozzi,2023-01-31 18:21:27+00:00,https://www.foxnews.com/politics/desantis-responds-trump-criticism-says-verdict-has-been-rendered-florida-voters,-1.0,0.252,0.609,0.139,-0.3182
Fox News,Chris Rufo responds to Harvard intellectual who says his methods of fighting indoctrination are wrong,Academic Steven Pinker slammed Gov. Ron DeSantis and Chris Rufo for working to stop critical race theory indoctrination at a college in Florida.,Alexander Hall,2023-01-31 02:56:56+00:00,https://www.foxnews.com/media/pinker-slams-anti-crt-efforts-chris-rufo-desantis-gets-shredded-twitter-users,-1.0,0.352,0.44,0.208,-0.3182
Fox News,College Board fires back at NYT: 'Gross misrepresentation' to say it bowed to political pressure from DeSantis,The College Board ripped a New York Times report that said an AP African American Studies course was stripped 'after heavy criticism from Ron DeSantis.',Kristine Parks,2023-02-02 22:30:57+00:00,https://www.foxnews.com/media/college-board-fires-back-nyt-gross-misrepresentation-say-bowed-political-pressure-desantis,-1.0,0.48,0.52,0.0,-0.8074
Fox News,"Mark Levin calls on GOP governors to protect children's education: 'Teach history, not Marxist propaganda'",Fox News host Mark Levin praises Florida Gov. Ron DeSantis for standing up to 'woke' educators in the state in his opening monologue on 'Life Liberty & Levin.',Ashley Carnahan,2023-01-30 03:00:23+00:00,https://www.foxnews.com/media/mark-levin-calls-gop-governors-protect-childrens-education-teach-history-not-marxist-propaganda,1.0,0.137,0.685,0.178,0.1531
Fox News,"Critics accuse DeSantis of erasing ‘all of Black history,’ harming students by blocking AP course","NPR published a report of all the critics blasting Gov. Ron DeSantis, R-Fla., for opposing an AP African Studies course proposed for Florida high schools.",Gabriel Hays,2023-01-28 00:30:21+00:00,https://www.foxnews.com/media/critics-accuse-desantis-erasing-black-history-harming-students-blocking-ap-course-npr,-1.0,0.593,0.407,0.0,-0.8481
Fox News,Ron DeSantis files legal complaint against Orlando foundation for allegedly sexualizing kids with drag show,"The DeSantis administration filed a formal legal complaint against an Orlando venue for illegally exposing young children to ""lewd activity"" during a Christmas drag show.",Gabriel Hays,2023-02-04 00:00:55+00:00,https://www.foxnews.com/media/ron-desantis-files-legal-complaint-against-orlando-foundation-allegedly-sexualizing-kids-drag-show,-1.0,0.281,0.616,0.103,-0.3818
Fox News,"Haley, DeSantis or Trump vs Biden? Here's where Americans stand on rumored 2024 presidential contenders","President Biden's support in the polls has trended down since last summer, while support for for former President Trump and Florida Gov. Ron DeSantis remains strong relative to GOP rivals.",Sophia Slacik,2023-02-03 18:50:27+00:00,https://www.foxnews.com/politics/heres-where-americans-stand-on-announced-and-rumored-presidential-contenders,0.0,0.0,1.0,0.0,0.0
Fox News,Conservatives light up Dan Rather for comparing DeSantis policy to Jim Crow: ‘Now a full blown caricature’,"Disgraced ""CBS Evening News"" anchor Dan Rather was berated for suggesting Gov. Ron DeSantis, R-Fla., objecting to CRT in Florida schools was a modern version of Jim Crow.",Gabriel Hays,2023-02-02 19:30:06+00:00,https://www.foxnews.com/media/conservatives-light-up-dan-rather-comparing-desantis-policy-jim-crow-now-full-blown-caricature,0.0,0.0,1.0,0.0,0.0
Fox News,Trump ramps attacks on 'overly ambitious' Haley and other potential 2024 GOP rivals,"Former President Trump attacked his rumored GOP contenders, taking credit for their elections and discussing how he feels about a packed primary.",Aubrie Spady,2023-02-02 18:50:18+00:00,https://www.foxnews.com/politics/trump-ramps-attacks-overly-ambitious-haley-potential-2024-gop-rivals,1.0,0.207,0.571,0.221,0.0516
Fox News,CNN commentator ripped for tying DeSantis’ rejection of African Studies course to Memphis police killing,"CNN commentator and former Rep. Mondaire Jones, D-N.Y., was criticized for linking racism and DeSantis-endorsed public school policy to the killing of Tyre Nichols.",Gabriel Hays,2023-01-28 23:30:21+00:00,https://www.foxnews.com/media/cnn-commentator-ripped-tying-desantis-rejection-african-studies-course-memphis-police-killing,-1.0,0.441,0.559,0.0,-0.836
Fox News,Ron DeSantis is 'happy to see Black people killed' MSNBC analyst claims after CRT removed from AP course,"Professor Jason Johnson related the the death of Tyre Nichols to critical race theory saying those opposed to CRT in school are ""happy to see Black people be killed.""","Alexander Hall, Alexa Moutevelis",2023-02-02 22:38:12+00:00,https://www.foxnews.com/media/ron-desantis-happy-see-black-people-killed-msnbc-analyst-claims-crt-removed-ap-course,-1.0,0.223,0.594,0.183,-0.2023
Fox News,University of Florida protesters demand new president Ben Sasse disavow DeSantis' anti-woke 'attacks',Incoming University of Florida President Ben Sasse will be greeted at his new workplace by protesters who have already put forth a list of demands.,Alexander Hall,2023-02-03 22:46:54+00:00,https://www.foxnews.com/media/university-florida-protesters-demand-president-ben-sasse-disavow-desantis-anti-woke-attacks,-1.0,0.412,0.588,0.0,-0.6486
Fox News,"WaPo fearmongers about 'felony charges' for teachers under DeSantis' rules, later clarifies report",The Washington Post clarified its report on Tuesday that claimed that teachers could face felony charges under Gov. DeSantis’ new guidelines for displaying unapproved books.,Lindsay Kornick,2023-02-01 00:30:55+00:00,https://www.foxnews.com/media/wapo-fearmongers-felony-charges-teachers-desantis-rules-later-clarifies-report,-1.0,0.386,0.483,0.131,-0.5719
