source,title,description,author,publishedAt,url,sentimentScore,neg,neu,pos,compound
NBC News,Haley jumps into W.H. race earlier than her 2024 competition. There’s a benefit to that,"If you’re not Donald Trump or Ron DeSantis in 2024, it helps to be the first true non-frontrunner to get into the race.",Chuck Todd and Mark Murray and Ben Kamisar and Bridget Bowman and Alexandra Marquez,2023-02-15 13:31:59+00:00,https://www.nbcnews.com/meet-the-press/first-read/haley-jumps-wh-race-earlier-others-benefit-rcna70750,1.0,0.0,0.727,0.273,0.4588
NBC News,Mike Pence says he'll 'fight' Jan. 6 subpoena from DOJ,"Former Vice President Mike Pence said Wednesday that he plans to ""fight"" a subpoena from the special counsel investigating Donald Trump's actions surrounding Jan.",Vaughn Hillyard and Dareh Gregorian,2023-02-15 19:56:47+00:00,https://www.nbcnews.com/politics/justice-department/mike-pence-says-fight-jan-6-subpoena-doj-rcna70854,-1.0,0.545,0.455,0.0,-0.802
NBC News,Pence plans to resist special counsel subpoena in Jan. 6 probe,"Mike Pence plans to challenge special counsel Jack Smith's subpoena in the probe of Donald Trump’s role in the Jan. 6 riot at the Capitol, a source tells NBC.",Garrett Haake and Summer Concepcion,2023-02-14 15:30:09+00:00,https://www.nbcnews.com/politics/justice-department/pence-plans-resist-special-counsel-subpoena-jan-6-probe-rcna70569,1.0,0.0,0.722,0.278,0.4019
NBC News,New FBI search of Pence's office yields three documents but none with classified markings,"In a new search of Pence's office, agents removed three ""previously redacted documents"" but none with classified markings.",Jonathan Allen,2023-02-17 19:58:09+00:00,https://www.nbcnews.com/politics/justice-department/new-fbi-search-pences-office-yields-three-documents-none-classified-ma-rcna71257,0.0,0.0,1.0,0.0,0.0
NBC News,Scott Walker says Ron DeSantis is in a 'better' spot to take on Trump than he was,"Florida Gov. Ron DeSantis is in a strong position to run against Donald Trump, according to former Wisconsin Gov. Scott Walker, who ran in the 2016 cycle.",Henry J. Gomez,2023-02-17 19:33:59+00:00,https://www.nbcnews.com/politics/2024-election/ron-desantis-scott-walker-trump-rcna70899,1.0,0.0,0.734,0.266,0.4404
NBC News,Nikki Haley jumps into the presidential race with a call for generational change,Nikki Haley kicked off her presidential campaign on Wednesday with a speech calling for the country to back away from elderly politicians.,Allan Smith,2023-02-15 18:34:14+00:00,https://www.nbcnews.com/politics/2024-election/nikki-haley-runs-president-calls-generational-change-rcna70183,0.0,0.0,1.0,0.0,0.0
NBC News,Eyes on 2024: GOP lawmakers take sides in presidential primary,"Now that there's another GOP presidential hopeful in the race, and a handful of others clearly signaling their intentions, Republican lawmakers are continuing to pick their favorites for their party's nomination.","Ben Kamisar, Bridget Bowman",2023-02-16 15:51:00+00:00,https://www.nbcnews.com/meet-the-press/meetthepressblog/eyes-2024-gop-lawmakers-take-sides-presidential-primary-rcna70959,0.0,0.0,1.0,0.0,0.0
Newsweek,Mike Pence Drops Strongest Hint Yet About Joining 2024 Race,The former vice president praised Nikki Haley during an event in Iowa while suggesting he may also challenge Donald Trump for the GOP nomination.,Jon Jackson,2023-02-16 18:28:58+00:00,https://www.newsweek.com/mike-pence-drops-strongest-hint-yet-about-joining-2024-presidential-race-1781831,1.0,0.0,0.756,0.244,0.4404
Newsweek,Mike Pence's Futile Effort to Appease Trump Supporters,The former vice president is refusing to testify against his one-time ally in the January 6 investigation amid reports of his own 2024 presidential run.,Ewan Palmer,2023-02-17 11:20:09+00:00,https://www.newsweek.com/mike-pence-subpoena-trump-jan6-2024-1781959,1.0,0.244,0.336,0.42,0.2732
Newsweek,Mike Pence Has Stronger Case Than Trump to Defy Subpoenas: Law Professor,Former Vice President Mike Pence was subpoenaed this week to testify before the January 6 Select Committee.,Matthew Impelli,2023-02-14 19:45:50+00:00,https://www.newsweek.com/mike-pence-has-stronger-case-trump-defy-subpoenas-law-professor-1781255,1.0,0.0,0.794,0.206,0.3818
Newsweek,DOJ 'Seriously Considering' Charges Against Donald Trump: Legal Analyst,Barbara McQuade speaks to Newsweek after Trump's former VP Mike Pence was subpoenaed as part of January 6 investigation.,Ewan Palmer,2023-02-13 12:31:38+00:00,https://www.newsweek.com/doj-considering-charges-against-donald-trump-mike-pence-1780795,-1.0,0.336,0.531,0.133,-0.3182
Newsweek,Donald Trump's Attempt to Stop Mike Pence Testifying is Doomed to Fail,"""The smart money says he [Trump] will be unsuccessful here. Executive privilege won't be enough to keep Mike Pence from testifying,"" said former federal prosecutor Joyce Vance.",Ewan Palmer,2023-02-14 09:12:06+00:00,https://www.newsweek.com/trump-executive-privilege-mike-pence-jan6-subpoena-1780979,-1.0,0.623,0.377,0.0,-0.872
Newsweek,Mike Pence Subpoena Could Be the 2024 Boost He's Looking For,"Amid reports Pence plans to challenge the DOJ's subpoena, GOP strategists told Newsweek the move could ""boost his standing among Republican insiders.""",Katherine Fung,2023-02-14 19:49:34+00:00,https://www.newsweek.com/mike-pence-subpoena-could-2024-boost-1781223,1.0,0.0,0.769,0.231,0.4019
Newsweek,Republicans Are on a Crash Course With Trump With No Off-Ramp | Opinion,"Nikki Haley's entrance into the 2024 race this week gives Donald Trump his first, but likely not last, opponent. And she, along with likely candidates Ron DeSantis, Mike Pence, Mike Pompeo, Tim Scott, and the elite donor class within the Republican Party, wan…",Doug Gordon,2023-02-15 16:32:33+00:00,https://www.newsweek.com/republicans-are-crash-course-trump-no-off-ramp-opinion-1781484,-1.0,0.38,0.62,0.0,-0.5994
Newsweek,"Trump Top Pick Among GOP for 2024, Holds Wide Lead Over DeSantis: Poll","The former President remains a favorite among GOP voters with a clear lead over DeSantis, the Harvard CAPS-Harris polls finds.",Alex Backus,2023-02-20 00:02:44+00:00,https://www.newsweek.com/trump-top-pick-among-gop-2024-holds-wide-lead-over-desantis-poll-1782275,1.0,0.0,0.859,0.141,0.2023
Newsweek,Jack Smith Tightens the Screws on Donald Trump,The special counsel is ramping up classified documents probe by seeking further testimony from former president's lawyer.,Ewan Palmer,2023-02-15 10:01:54+00:00,https://www.newsweek.com/trump-classified-documents-jack-smith-lawyer-1781323,-1.0,0.286,0.714,0.0,-0.25
Newsweek,Nikki Haley's Chances of Beating Trump After Jumping Into 2024 Race,"Haley is hoping to defeat Trump during the Republican primary, but polls show the former United Nations ambassador facing an uphill battle.",Andrew Stanton,2023-02-14 15:59:58+00:00,https://www.newsweek.com/nikki-haleys-chances-beating-trump-after-jumping-2024-race-1781150,-1.0,0.234,0.625,0.141,-0.296
Newsweek,Trump Brags About Poll Numbers as Nikki Haley Steps Into 2024 Race,"""Doing great in poll numbers. Leading all Republicans by a lot, also leading Biden by a very wide margin,"" Trump posted on Truth Social.",Anna Skinner,2023-02-14 16:11:24+00:00,https://www.newsweek.com/trump-brags-about-poll-numbers-nikki-haley-steps-2024-race-1781181,0.0,0.0,1.0,0.0,0.0
Newsweek,Ex-RNC Chair Tells Republicans Not to 'Wallow in the Mud' With Kari Lake,"""The party needs to get serious about its future,"" Michael Steele said.",Khaleda Rahman,2023-02-13 16:21:15+00:00,https://www.newsweek.com/ex-rnc-chair-republicans-not-wallow-mud-kari-lake-1780838,0.0,0.0,1.0,0.0,0.0
Newsweek,How Trump and DeSantis Would Fare in 2024 Match-Ups,"The former president and the Florida governor are the two favorites for the next GOP primaries, leading to possible face-off against Joe Biden.",Ewan Palmer,2023-02-15 12:11:46+00:00,https://www.newsweek.com/trump-desantis-2024-polls-joe-biden-1781365,0.0,0.0,1.0,0.0,0.0
Newsweek,Marjorie Taylor Greene Slams Nikki Haley as 'Bush in Heels',"Haley, a Republican and former Trump official, announced her candidacy for 2024 on Tuesday.",Kaitlin Lewis,2023-02-16 05:09:50+00:00,https://www.newsweek.com/marjorie-taylor-greene-slams-nikki-haley-bush-heels-1781579,0.0,0.0,1.0,0.0,0.0
Newsweek,Pressure Mounts for Trump Amid Report Jack Smith Subpoenas Mark Meadows,"Trump denounced Smith as ""Radical Left"" shortly before the emergence of news that he had reportedly subpoenaed Meadows over the January 6 attack.",Aila Slisco,2023-02-16 05:31:45+00:00,https://www.newsweek.com/pressure-mounts-trump-amid-report-jack-smith-subpoenas-mark-meadows-1781578,-1.0,0.196,0.804,0.0,-0.296
Newsweek,Trump Special Counsel Gives Him Another Thing to Worry About,"Manhattan DA Alvin Bragg's efforts to investigate Trump is ""a zigzag-like path,"" but he may need to zoom in soon, a former federal prosecutor says.",Katherine Fung,2023-02-15 20:21:23+00:00,https://www.newsweek.com/trump-special-counsel-gives-him-another-thing-worry-about-1781542,-1.0,0.23,0.556,0.214,-0.0516
Newsweek,Donald Trump Rages at Jack Smith as FBI Investigations Close In,The special counsel has made recent aggressive progress into the January 6 and classified documents probes into the former president.,Ewan Palmer,2023-02-16 09:09:19+00:00,https://www.newsweek.com/trump-special-counsel-jack-smith-fbi-investigations-1781592,-1.0,0.279,0.721,0.0,-0.4767
Newsweek,Donald Trump Loses Top Ally to Nikki Haley,"""It's time for a reset and a new chapter in national Republican politics,"" Representative Ralph Norman said in his endorsement of Trump's 2024 opponent.",Katherine Fung,2023-02-15 15:26:09+00:00,https://www.newsweek.com/donald-trump-loses-top-ally-nikki-haley-1781435,-1.0,0.253,0.549,0.198,-0.128
Newsweek,Supreme Court Reconsiders Case to Reinstate Trump,The lawsuit by Utah man Raland Brunson is challenging the 2020 presidential election results and calling for the reinstatement of Donald Trump.,Fatma Khaled,2023-02-17 23:18:11+00:00,https://www.newsweek.com/supreme-court-reconsiders-case-reinstate-trump-1782150,1.0,0.0,0.581,0.419,0.5574
Newsweek,Republicans 'Need a Woman' on 2024 Ticket: GOP Rep.,"Former President Donald Trump told Newsweek he wishes Haley ""luck.""",Nick Mordowanec,2023-02-14 21:56:18+00:00,https://www.newsweek.com/republicans-need-woman-2024-ticket-gop-rep-1781275,0.0,0.0,1.0,0.0,0.0
Newsweek,Misguided Attacks on Ron DeSantis Are Actually the Ultimate Compliment | Opinion,Some on the possible 2024 list already seem to be taking specific aim at DeSantis.,Mark Davis,2023-02-13 11:30:01+00:00,https://www.newsweek.com/misguided-attacks-ron-desantis-are-actually-ultimate-compliment-opinion-1780518,1.0,0.223,0.538,0.238,0.0516
Newsweek,Savior—or Spoiler? How Nikki Haley Could Hand the Presidency Back to the Democrats in 2024 | Opinion,"Though the path to the GOP nomination remains murky for Trump and DeSantis, the Republicans have a much deeper bench of candidates than their Democratic rivals.",Ari Hoffman,2023-02-14 21:04:05+00:00,https://www.newsweek.com/savior-spoiler-how-nikki-haley-could-hand-presidency-back-democrats-2024-opinion-1781258,1.0,0.0,0.775,0.225,0.4939
Newsweek,What Nikki Haley Believes,"Haley confirmed she is running for president in 2024 in a video calling for a ""new generation."" Newsweek explores her beliefs and her chances of success.",Ewan Palmer,2023-02-14 17:17:58+00:00,https://www.newsweek.com/nikki-haley-beliefs-opinion-republican-2024-1781155,0.0,0.0,1.0,0.0,0.0
Newsweek,List of Trump Witnesses Who Spoke to Georgia Grand Jury,"The grand jury heard from 75 witnesses, including top Trump advisers and Georgia election officials.",Lauren Giella,2023-02-16 19:23:20+00:00,https://www.newsweek.com/list-trump-witnesses-who-spoke-georgia-grand-jury-1781845,1.0,0.0,0.7,0.3,0.4588
Newsweek,El Paso Walmart Shooting Survivor Caught Up in Shopping Mall Shooting,"Former homeland security adviser Olivia Troye detailed how one of her family members was again caught in the middle of a mass shooting in El Paso, Texas.",Gerrard Kaonga,2023-02-16 12:15:09+00:00,https://www.newsweek.com/el-paso-walmart-shooting-survivor-caught-latest-mall-texas-1781658,1.0,0.0,0.783,0.217,0.3612
Newsweek,Pastor Nikki Haley Idolizes Is Covered in Controversy,"He formerly made questionable comments towards Jews related to Adolf Hitler, as well as same-sex marriage.",Nick Mordowanec,2023-02-15 22:02:06+00:00,https://www.newsweek.com/pastor-nikki-haley-idolizes-covered-controversy-1781561,0.0,0.0,1.0,0.0,0.0
Newsweek,"Please, Republicans: Rally Around a National Abortion Ban. Signed, a Pro-Choice Advocate | Opinion",Who would ever have imagined a Republican Party allowing the one branch of government it controls to be branded by the likes of George Santos?,Tom Rogers,2023-02-13 10:00:01+00:00,https://www.newsweek.com/please-republicans-rally-around-national-abortion-ban-signed-pro-choice-advocate-opinion-1780404,-1.0,0.242,0.604,0.154,-0.3182
Newsweek,Nikki Haley Comes Out Swinging for Trump,Haley officially launched her 2024 bid for President on Wednesday with a call to reject ideas and candidates that have kept the GOP away from the White House.,Nick Reynolds,2023-02-15 18:22:43+00:00,https://www.newsweek.com/nikki-haley-comes-swinging-trump-1781530,0.0,0.0,1.0,0.0,0.0
Reuters,Pence to fight special counsel subpoena on Trump's 2020 election denial - Politico,"Former U.S. Vice President Mike Pence is preparing to resist a grand jury subpoena for testimony about Donald Trump's push to overturn the 2020 election, Politico <a href=""https://www.politico.com/news/2023/02/14/pence-subpoena-trump-election-00082637"" target…",,2023-02-14 10:58:17+00:00,https://www.reuters.com/world/us/pence-fight-special-counsel-subpoena-trumps-2020-election-denial-politico-2023-02-14/,1.0,0.195,0.602,0.203,0.0258
Reuters,Darktrace hires EY for independent review of finances,"British cyber security company Darktrace <a href=""https://www.reuters.com/companies/DARK.L"" target=""_blank"">(DARK.L)</a> said on Monday it had commissioned a third-party review of its finances by EY, weeks after a short-seller questioned its results.",,2023-02-20 07:47:31+00:00,https://www.reuters.com/technology/darktrace-hires-ey-independent-review-finances-2023-02-20/,0.0,0.0,1.0,0.0,0.0
RT,FBI searched Biden’s alma mater in hunt for classified docs,The FBI performed searches at the University of Delaware as part of its probe into President Joe Biden’s handling of classified documents Read Full Article at RT.com,RT,2023-02-16 04:01:28+00:00,https://www.rt.com/news/571556-university-delaware-biden-documents/,0.0,0.0,1.0,0.0,0.0
The Hill,Ranking the GOP’s top 10 presidential candidates,"Former United Nations Ambassador Nikki Haley this week became the second major Republican candidate for president in 2024, joining former President Trump in ...",Niall Stanage,2023-02-18 11:00:00+00:00,https://thehill.com/homenews/campaign/3863222-ranking-the-gops-top-10-presidential-candidates/,1.0,0.0,0.735,0.265,0.2023
The Hill,Nikki Haley announces presidential run,"Former South Carolina Gov. Nikki Haley (R) jumped into the presidential race early Tuesday, becoming the first Republican to officially challenge former...",Max Greenwood,2023-02-14 12:26:18+00:00,https://thehill.com/homenews/campaign/3857039-nikki-haley-announces-presidential-campaign-strikes-optimistic-tone-in-launch-video/,0.0,0.0,1.0,0.0,0.0
The Hill,Special counsel ramping up investigation...,,the hill,2023-02-19 14:00:04+00:00,https://thehill.com/policy/national-security/3864012-special-counsel-shows-signs-of-ramping-up-trump-investigation/,1.0,0.0,0.526,0.474,0.4019
The Washington Post,Nonstop worship service at Kentucky college set to end after attracting thousands...,"The last public evening service at Asbury University will be Sunday night, after an almost 12-day revival that sparked national and international attention through social media.",,2023-02-20 02:16:37+00:00,https://www.washingtonpost.com/religion/2023/02/18/asbury-university-revival-kentucky/,1.0,0.0,0.569,0.431,0.6486
The Washington Post,Mike Pence’s craven effort to appease MAGA points to a deeper conflict,Pence can't outrun his tortured relationship with MAGA and Jan. 6.,Greg Sargent,2023-02-16 18:13:05+00:00,https://www.washingtonpost.com/opinions/2023/02/16/mike-pence-subpoena-jan-6-investigation-trump/,-1.0,0.202,0.614,0.184,-0.0516
The Washington Post,What it means for Pence to fight his subpoena — politically and legally,Pence's decision wasn't as simple as it was for other Trump allies who have resisted subpoenas. But it's significant both for him and for our legal system.,Aaron Blake,2023-02-14 19:00:14+00:00,https://www.washingtonpost.com/politics/2023/02/14/pence-subpoena-legislative-privilege/,-1.0,0.289,0.556,0.156,-0.296
The Washington Post,"Pence search gives Biden cover, puts Trump in worse shape",Pence and Biden did what Trump refused to do.,Jennifer Rubin,2023-02-13 15:00:00+00:00,https://www.washingtonpost.com/opinions/2023/02/13/pence-document-search-biden-trump-implications/,-1.0,0.279,0.721,0.0,-0.4767
The Washington Post,Republicans are doubling down on abortion. They’ll regret it.,Did they pay attention to anything that voters told them in November?,Jennifer Rubin,2023-02-15 12:41:56+00:00,https://www.washingtonpost.com/opinions/2023/02/15/republicans-abortion-double-down/,-1.0,0.412,0.588,0.0,-0.4215
The Washington Post,Pence to fight special counsel subpoena on Trump’s 2020 election denial,The former vice president will argue that he is protected by the Constitution’s “speech and debate clause” in his role as president of the Senate.,Josh Dawsey,2023-02-14 18:14:33+00:00,https://www.washingtonpost.com/national-security/2023/02/14/mike-pence-fight-subpoena-jack-smith/,1.0,0.211,0.569,0.22,0.0258
The Washington Post,"Justice Dept. searched Pence’s office; no classified items found, aide says","Officials removed one binder containing three redacted documents from the office of Pence’s political advocacy group, Advancing American Freedom, an aide said.",Perry Stein,2023-02-17 21:43:53+00:00,https://www.washingtonpost.com/national-security/2023/02/17/pence-doj-classified-search/,1.0,0.0,0.726,0.274,0.5267
The Washington Post,"With an eye on 2024, Trump once again tries to whitewash Jan. 6, 2021",Now it's Twitter's fault.,Philip Bump,2023-02-15 16:17:40+00:00,https://www.washingtonpost.com/politics/2023/02/15/trump-jan-6-insurrection-capitol/,1.0,0.0,0.864,0.136,0.0258
The Washington Post,Tracking presidential candidates for the 2024 election,We are tracking the Democrats and Republicans who have announced they are running for president in the 2024 election and who might announce they're running next.,Hannah Knowles,2023-02-14 21:15:47+00:00,https://www.washingtonpost.com/politics/interactive/presidential-candidates-2024/,0.0,0.0,1.0,0.0,0.0
The Washington Post,FBI searched University of Delaware for Biden documents,The action follows searches at the president’s homes in Wilmington and Rehoboth Beach,Tyler Pager,2023-02-16 15:33:10+00:00,https://www.washingtonpost.com/politics/2023/02/16/fbi-searched-university-delaware-biden-documents/,0.0,0.0,1.0,0.0,0.0
The Washington Post,Nikki Haley announces that she is running for president,"Haley released a video Tuesday saying, “It’s time for a new generation of leadership.” She added, “I’m Nikki Haley, and I’m running for president.”",Dylan Wells,2023-02-14 12:05:34+00:00,https://www.washingtonpost.com/politics/2023/02/14/nikki-haley-president-campaign-2024/,0.0,0.0,1.0,0.0,0.0
The Washington Post,"Feeling ‘overwhelmed’ and ‘fatigue,’ some GOP voters look beyond Trump","In recent focus groups of persuadable Republican primary voters from key early states, most stood by their past support for Trump, but the future was a different issue.",Michael Scherer,2023-02-20 14:00:00+00:00,https://www.washingtonpost.com/politics/2023/02/20/trump-voters-focus-group-2024/,1.0,0.206,0.515,0.278,-0.0772
The Washington Post,Inside the collapse of the Trump-DeSantis ‘alliance of convenience’,"Behind an apparent close alliance, the two Republicans have racked up years of mutual suspicions fueling a 2024 grudge match.",Isaac Arnsdorf,2023-02-18 10:00:00+00:00,https://www.washingtonpost.com/politics/2023/02/18/trump-desantis-relationship-2024-election/,-1.0,0.444,0.556,0.0,-0.4939
Time,Who Has Announced They’re Running for President in 2024?,"Donald Trump and Nikki Haley have officially launched 2024 campaigns, but many other candidates are waiting in the wings.",Mini Racker,2023-02-17 15:10:52+00:00,https://time.com/6256382/who-is-running-for-president-2024/,0.0,0.0,1.0,0.0,0.0
Time,How My Work For Trump and Giuliani Sought to Make Ukraine Defenseless,"'Now that I am paying my debt to society, I think it is important to tell my side of the story,' writes Lev Parnas.",Lev Parnas,2023-02-13 19:36:44+00:00,https://time.com/6255090/lev-parnas-giuliani-trump-ukraine/,-1.0,0.211,0.789,0.0,-0.34
USA Today,Former Vice President Mike Pence expected to challenge DOJ special counsel subpoena,Former VP Mike Pence plans to challenge a subpoena from a Justice Department special counsel probing Trump's efforts to overturn the 2020 election.,"USA TODAY, David Jackson and Kevin Johnson, USA TODAY",2023-02-14 14:33:04+00:00,https://www.usatoday.com/story/news/politics/2023/02/14/pence-challenge-justice-subpoena/11253980002/,1.0,0.0,0.692,0.308,0.4588
USA Today,Nikki Haley not 'in her prime'? Don Lemon's comments spotlight a political reality for women candidates,"At an age men are seen as authoritative, women are seen as just old, CNN's Don Lemon showed in dismissing GOP 2024 presidential hopeful Nikki Haley.","USA TODAY, Susan Page, USA TODAY",2023-02-17 17:39:22+00:00,https://www.usatoday.com/story/news/politics/2023/02/17/nikki-haley-don-lemon-women-politics/11279882002/,0.0,0.0,1.0,0.0,0.0
USA Today,"In Iowa, Mike Pence vows to resist special counsel's subpoena in Trump 2020 investigation","In Iowa, former VP Pence vowed to resist special counsel Jack Smith’s subpoena in an investigation into Trump’s efforts to subvert the 2020 election.","Brianne Pfannenstiel, Des Moines Register",2023-02-15 23:26:17+00:00,https://www.usatoday.com/story/news/politics/2023/02/15/mike-pence-subpoena-resist/11267215002/,1.0,0.0,0.803,0.197,0.4019
USA Today,"How do you challenge Trump for the nomination? With Nikki Haley in, let's count the ways.","There's the Anti-Trump, the Next-Generation Trump, the Trump-Without-The-Baggage. Like him or not, former President Donald Trump defines the field.","Susan Page, USA TODAY",2023-02-15 11:00:05+00:00,https://www.usatoday.com/story/news/politics/2023/02/15/nikki-haley-republicans-trump-2024/11253920002/,1.0,0.0,0.874,0.126,0.0772
USA Today,"1 dead, 3 injured in shooting at El Paso, Texas, shopping mall, police say; suspect in custody","A person was killed and three others were injured Wednesday in a shooting inside a mall in El Paso, Texas, authorities said.","USA TODAY NETWORK, Daniel Borunda and Aaron Martinez, USA TODAY NETWORK",2023-02-16 04:06:21+00:00,https://www.usatoday.com/story/news/nation/2023/02/15/el-paso-texas-shopping-mall-shooting-victims-suspects-police/11268633002/,-1.0,0.505,0.495,0.0,-0.8481
USA Today,"WH: UFOs likely research or commercial, Haley kicks off presidential run: 5 Things podcast","The White House says that unidentified flying objects might have been research or commercial balloons, plus Nikki Haley runs for president: 5 Things podcast","USA TODAY, Taylor Wilson, USA TODAY",2023-02-15 12:07:33+00:00,https://www.usatoday.com/story/news/nation/2023/02/15/wh-ufos-likely-commercial-haley-begins-wh-bid-5-things-podcast/11262077002/,0.0,0.0,1.0,0.0,0.0
USA Today,Medicaid expansion is a compassion test many 2024 Republican presidential hopefuls fail,"Trump, DeSantis and Haley are leading resisters but hardly alone in a 2024 GOP field that rejects expanded health coverage or makes it hard to get.","USA TODAY, Jill Lawrence, USA TODAY",2023-02-20 13:00:06+00:00,https://www.usatoday.com/story/opinion/columnists/2023/02/20/medicaid-expansion-trump-desantis-haley-pence-2024/11281341002/,-1.0,0.241,0.552,0.207,-0.128
USA Today,FBI searches Mike Pence office and finds no more classified documents,"The FBI on Friday searched an office linked to Mike Pence, yielding no additional classified records, an adviser to the former vice president said.","USA TODAY, Kevin Johnson, USA TODAY",2023-02-17 20:39:07+00:00,https://www.usatoday.com/story/news/politics/2023/02/17/mike-pence-office-fbi-search/11282204002/,0.0,0.0,1.0,0.0,0.0
USA Today,"As GOP starting gate for 2024 presidential race, Iowa sees surge of announced and potential candidates","Former Vice President Mike Pence is returning to Iowa this week, kicking off a surge of presidential caucus activity after a quiet start to the year.","USA TODAY, Brianne Pfannenstiel",2023-02-14 17:44:41+00:00,https://www.usatoday.com/story/news/politics/elections/2023/02/14/iowa-republican-presidential-caucus-visits-2024-haley-trump/11255385002/,0.0,0.0,1.0,0.0,0.0
USA Today,"Ex-Trump chief of staff Mark Meadows subpoenaed by DOJ special counsel, reports say",Mark Meadows is a central figure in Donald Trump's campaign to cling to power after losing the 2020 election.,"USA TODAY, Kevin Johnson, USA TODAY",2023-02-16 13:59:51+00:00,https://www.usatoday.com/story/news/politics/2023/02/16/mark-meadows-subpoenaed-justice-department/11268128002/,1.0,0.0,0.787,0.213,0.4019
