source,title,description,author,publishedAt,url,sentimentScore,neg,neu,pos,compound
USA Today,Partial release of Georgia Trump grand jury report set for Thursday; Haley in New Hampshire: live updates,"Fulton County DA Fani Willis has been investigating efforts to overturn the 2020 election results in Georgia. And, Nikki Haley campaigns in N.H.","USA TODAY, Sarah Elbeshbishi, USA TODAY",2023-02-16 10:00:10+00:00,https://www.usatoday.com/story/news/politics/2023/02/16/washington-congress-news-live-updates/11266601002/,1.0,0.0,0.812,0.188,0.4588
USA Today,Clock ticking on debt ceiling as CBO to weigh in on timeframe for reaching spending deal: live updates,"The former vice president will be in Cedar Rapids Wednesday to rally conservatives around a ""parents' rights"" agenda.","USA TODAY, Sarah Elbeshbishi, USA TODAY",2023-02-15 10:00:15+00:00,https://www.usatoday.com/story/news/politics/2023/02/15/washington-congress-news-live-updates/11255886002/,-1.0,0.175,0.699,0.126,-0.1779
USA Today,"When is the next presidential election? What you need to know about 2024 election, candidates.",When is the next presidential election in the United States? Here's everything you need to know about the 2024 contest.,"USA TODAY, Anna Kaufman, USA TODAY",2023-02-19 14:00:05+00:00,https://www.usatoday.com/story/news/politics/2023/02/19/when-is-next-presidential-election/11017443002/,0.0,0.0,1.0,0.0,0.0
USA Today,Nikki Haley announces 2024 presidential bid in first major GOP challenge to Donald Trump,"Nikki Haley, a former U.N. ambassador and South Carolina governor, is the first major Republican to challenge Donald Trump in 2024 presidential race.","USA TODAY, David Jackson and Mabinty Quarshie, USA TODAY",2023-02-14 13:26:48+00:00,https://www.usatoday.com/story/news/politics/2023/02/14/nikki-haley-2024-presidential-bid-announcement-video/11253771002/,1.0,0.0,0.894,0.106,0.0772
USA Today,"For Nikki Haley, New Hampshire presents challenges and opportunities as she seeks 2024 GOP nomination","Former S.C. Gov. Nikki Haley takes her campaign to New Hampshire, a state rife with opportunity for the ""underestimated"" candidate.","USA TODAY, Ken Tran, USA TODAY",2023-02-16 10:00:08+00:00,https://www.usatoday.com/story/news/politics/elections/2023/02/16/nikki-haley-republican-2024-president-new-hampshire/11230348002/,1.0,0.0,0.719,0.281,0.4404
Vice News,Trump Is Closer Than Ever to Being Charged With a Crime,Three sets of prosecutors are closing in on the former president. Here’s where each probe stands.,"Greg Walters, Josh Visser",2023-02-16 10:15:00+00:00,https://www.vice.com/en/article/93ax4z/trump-investigations-indictments,-1.0,0.431,0.569,0.0,-0.6486
Vice News,Mike Pence Could Help Bring the Coup Plotters to Justice,But he’s choosing not to.,"Todd Zwillich, chloe angyal",2023-02-17 14:56:40+00:00,https://www.vice.com/en/article/n7z8jz/jan-6-mike-pence-subpoena-grand-jury,1.0,0.0,0.496,0.504,0.7269
